      1 0.000000       1.1.1                 host                  USB      66     URB_INTERRUPT in

Frame 1: 66 bytes on wire (528 bits), 66 bytes captured (528 bits) on interface 0
    Interface id: 0 (usbmon0)
        Interface name: usbmon0
    Encapsulation type: USB packets with Linux header and padding (115)
    Arrival Time: Jan  8, 2018 23:48:55.906680000 CET
    [Time shift for this packet: 0.000000000 seconds]
    Epoch Time: 1515451735.906680000 seconds
    [Time delta from previous captured frame: 0.000000000 seconds]
    [Time delta from previous displayed frame: 0.000000000 seconds]
    [Time since reference or first frame: 0.000000000 seconds]
    Frame Number: 1
    Frame Length: 66 bytes (528 bits)
    Capture Length: 66 bytes (528 bits)
    [Frame is marked: False]
    [Frame is ignored: False]
    [Protocols in frame: usb]
USB URB
    [Source: 1.1.1]
    [Destination: host]
    URB id: 0xffff993ea0ac1000
    URB type: URB_COMPLETE ('C')
    URB transfer type: URB_INTERRUPT (0x01)
    Endpoint: 0x81, Direction: IN
        1... .... = Direction: IN (1)
        .... 0001 = Endpoint number: 1
    Device: 1
    URB bus id: 1
    Device setup request: not relevant ('-')
    Data: present (0)
    URB sec: 1515451735
    URB usec: 906680
    URB status: Success (0)
    URB length [bytes]: 2
    Data length [bytes]: 2
    [bInterfaceClass: Unknown (0xffff)]
    Unused Setup Header
    Interval: 2048
    Start frame: 0
    Copy of Transfer Flags: 0x00000200
    Number of ISO descriptors: 0
Leftover Capture Data: 1000

0000  00 10 ac a0 3e 99 ff ff 43 01 81 01 01 00 2d 00   ....>...C.....-.
0010  57 f5 53 5a 00 00 00 00 b8 d5 0d 00 00 00 00 00   W.SZ............
0020  02 00 00 00 02 00 00 00 00 00 00 00 00 00 00 00   ................
0030  00 08 00 00 00 00 00 00 00 02 00 00 00 00 00 00   ................
0040  10 00                                             ..

      2 0.000035       host                  1.1.1                 USB      64     URB_INTERRUPT in

Frame 2: 64 bytes on wire (512 bits), 64 bytes captured (512 bits) on interface 0
    Interface id: 0 (usbmon0)
        Interface name: usbmon0
    Encapsulation type: USB packets with Linux header and padding (115)
    Arrival Time: Jan  8, 2018 23:48:55.906715000 CET
    [Time shift for this packet: 0.000000000 seconds]
    Epoch Time: 1515451735.906715000 seconds
    [Time delta from previous captured frame: 0.000035000 seconds]
    [Time delta from previous displayed frame: 0.000035000 seconds]
    [Time since reference or first frame: 0.000035000 seconds]
    Frame Number: 2
    Frame Length: 64 bytes (512 bits)
    Capture Length: 64 bytes (512 bits)
    [Frame is marked: False]
    [Frame is ignored: False]
    [Protocols in frame: usb]
USB URB
    [Source: host]
    [Destination: 1.1.1]
    URB id: 0xffff993ea0ac1000
    URB type: URB_SUBMIT ('S')
    URB transfer type: URB_INTERRUPT (0x01)
    Endpoint: 0x81, Direction: IN
        1... .... = Direction: IN (1)
        .... 0001 = Endpoint number: 1
    Device: 1
    URB bus id: 1
    Device setup request: not relevant ('-')
    Data: not present ('<')
    URB sec: 1515451735
    URB usec: 906715
    URB status: Operation now in progress (-EINPROGRESS) (-115)
    URB length [bytes]: 4
    Data length [bytes]: 0
    [bInterfaceClass: Unknown (0xffff)]
    Unused Setup Header
    Interval: 2048
    Start frame: 0
    Copy of Transfer Flags: 0x00000200
    Number of ISO descriptors: 0

0000  00 10 ac a0 3e 99 ff ff 53 01 81 01 01 00 2d 3c   ....>...S.....-<
0010  57 f5 53 5a 00 00 00 00 db d5 0d 00 8d ff ff ff   W.SZ............
0020  04 00 00 00 00 00 00 00 00 00 00 00 00 00 00 00   ................
0030  00 08 00 00 00 00 00 00 00 02 00 00 00 00 00 00   ................

      3 0.000076       host                  1.1.0                 USBHUB   64     GET_STATUS Request     [Port 4]

Frame 3: 64 bytes on wire (512 bits), 64 bytes captured (512 bits) on interface 0
    Interface id: 0 (usbmon0)
        Interface name: usbmon0
    Encapsulation type: USB packets with Linux header and padding (115)
    Arrival Time: Jan  8, 2018 23:48:55.906756000 CET
    [Time shift for this packet: 0.000000000 seconds]
    Epoch Time: 1515451735.906756000 seconds
    [Time delta from previous captured frame: 0.000041000 seconds]
    [Time delta from previous displayed frame: 0.000041000 seconds]
    [Time since reference or first frame: 0.000076000 seconds]
    Frame Number: 3
    Frame Length: 64 bytes (512 bits)
    Capture Length: 64 bytes (512 bits)
    [Frame is marked: False]
    [Frame is ignored: False]
    [Protocols in frame: usb:usbhub]
USB URB
    [Source: host]
    [Destination: 1.1.0]
    URB id: 0xffff993e827d5900
    URB type: URB_SUBMIT ('S')
    URB transfer type: URB_CONTROL (0x02)
    Endpoint: 0x80, Direction: IN
        1... .... = Direction: IN (1)
        .... 0000 = Endpoint number: 0
    Device: 1
    URB bus id: 1
    Device setup request: relevant (0)
    Data: not present ('<')
    URB sec: 1515451735
    URB usec: 906756
    URB status: Operation now in progress (-EINPROGRESS) (-115)
    URB length [bytes]: 4
    Data length [bytes]: 0
    [Response in: 4]
    Interval: 0
    Start frame: 0
    Copy of Transfer Flags: 0x00000200
    Number of ISO descriptors: 0
    [bInterfaceClass: Unknown (0xffff)]
URB setup
    bmRequestType: 0xa3
        1... .... = Direction: Device-to-host
        .01. .... = Type: Class (0x1)
        ...0 0011 = Recipient: Other (0x03)
bRequest: GET_STATUS (0x00)
wValue: 0x0000
    (zero): 0
wIndex: 4
    Port: 4
wLength: 4

0000  00 59 7d 82 3e 99 ff ff 53 02 80 01 01 00 00 3c   .Y}.>...S......<
0010  57 f5 53 5a 00 00 00 00 04 d6 0d 00 8d ff ff ff   W.SZ............
0020  04 00 00 00 00 00 00 00 a3 00 00 00 04 00 04 00   ................
0030  00 00 00 00 00 00 00 00 00 02 00 00 00 00 00 00   ................

      4 0.000100       1.1.0                 host                  USBHUB   68     GET_STATUS Response    [Port 4]

Frame 4: 68 bytes on wire (544 bits), 68 bytes captured (544 bits) on interface 0
    Interface id: 0 (usbmon0)
        Interface name: usbmon0
    Encapsulation type: USB packets with Linux header and padding (115)
    Arrival Time: Jan  8, 2018 23:48:55.906780000 CET
    [Time shift for this packet: 0.000000000 seconds]
    Epoch Time: 1515451735.906780000 seconds
    [Time delta from previous captured frame: 0.000024000 seconds]
    [Time delta from previous displayed frame: 0.000024000 seconds]
    [Time since reference or first frame: 0.000100000 seconds]
    Frame Number: 4
    Frame Length: 68 bytes (544 bits)
    Capture Length: 68 bytes (544 bits)
    [Frame is marked: False]
    [Frame is ignored: False]
    [Protocols in frame: usb:usbhub]
USB URB
    [Source: 1.1.0]
    [Destination: host]
    URB id: 0xffff993e827d5900
    URB type: URB_COMPLETE ('C')
    URB transfer type: URB_CONTROL (0x02)
    Endpoint: 0x80, Direction: IN
        1... .... = Direction: IN (1)
        .... 0000 = Endpoint number: 0
    Device: 1
    URB bus id: 1
    Device setup request: not relevant ('-')
    Data: present (0)
    URB sec: 1515451735
    URB usec: 906780
    URB status: Success (0)
    URB length [bytes]: 4
    Data length [bytes]: 4
    [Request in: 3]
    [Time from request: 0.000024000 seconds]
    Unused Setup Header
    Interval: 0
    Start frame: 0
    Copy of Transfer Flags: 0x00000200
    Number of ISO descriptors: 0
    [bInterfaceClass: Unknown (0xffff)]
Port Status: 0x0301, PORT_CONNECTION, PORT_POWER, PORT_LOW_SPEED
    .... .... .... ...1 = PORT_CONNECTION: True
    .... .... .... ..0. = PORT_ENABLE: False
    .... .... .... .0.. = PORT_SUSPEND: False
    .... .... .... 0... = PORT_OVER_CURRENT: False
    .... .... ...0 .... = PORT_RESET: False
    .... ...1 .... .... = PORT_POWER: True
    .... ..1. .... .... = PORT_LOW_SPEED: True
    .... .0.. .... .... = PORT_HIGH_SPEED: False
    .... 0... .... .... = PORT_TEST: False
    ...0 .... .... .... = PORT_INDICATOR: Default colors
Port Change: 0x0001, C_PORT_CONNECTION
    .... .... .... ...1 = C_PORT_CONNECTION: True
    .... .... .... ..0. = C_PORT_ENABLE: False
    .... .... .... .0.. = C_PORT_SUSPEND: False
    .... .... .... 0... = C_PORT_OVER_CURRENT: False
    .... .... ...0 .... = C_PORT_RESET: False

0000  00 59 7d 82 3e 99 ff ff 43 02 80 01 01 00 2d 00   .Y}.>...C.....-.
0010  57 f5 53 5a 00 00 00 00 1c d6 0d 00 00 00 00 00   W.SZ............
0020  04 00 00 00 04 00 00 00 00 00 00 00 00 00 00 00   ................
0030  00 00 00 00 00 00 00 00 00 02 00 00 00 00 00 00   ................
0040  01 03 01 00                                       ....

      5 0.000113       host                  1.1.0                 USBHUB   64     CLEAR_FEATURE Request  [Port 4: C_PORT_CONNECTION]

Frame 5: 64 bytes on wire (512 bits), 64 bytes captured (512 bits) on interface 0
    Interface id: 0 (usbmon0)
        Interface name: usbmon0
    Encapsulation type: USB packets with Linux header and padding (115)
    Arrival Time: Jan  8, 2018 23:48:55.906793000 CET
    [Time shift for this packet: 0.000000000 seconds]
    Epoch Time: 1515451735.906793000 seconds
    [Time delta from previous captured frame: 0.000013000 seconds]
    [Time delta from previous displayed frame: 0.000013000 seconds]
    [Time since reference or first frame: 0.000113000 seconds]
    Frame Number: 5
    Frame Length: 64 bytes (512 bits)
    Capture Length: 64 bytes (512 bits)
    [Frame is marked: False]
    [Frame is ignored: False]
    [Protocols in frame: usb:usbhub]
USB URB
    [Source: host]
    [Destination: 1.1.0]
    URB id: 0xffff993e827d5900
    URB type: URB_SUBMIT ('S')
    URB transfer type: URB_CONTROL (0x02)
    Endpoint: 0x00, Direction: OUT
        0... .... = Direction: OUT (0)
        .... 0000 = Endpoint number: 0
    Device: 1
    URB bus id: 1
    Device setup request: relevant (0)
    Data: present (0)
    URB sec: 1515451735
    URB usec: 906793
    URB status: Operation now in progress (-EINPROGRESS) (-115)
    URB length [bytes]: 0
    Data length [bytes]: 0
    [Response in: 6]
    Interval: 0
    Start frame: 0
    Copy of Transfer Flags: 0x00000000
    Number of ISO descriptors: 0
    [bInterfaceClass: Unknown (0xffff)]
URB setup
    bmRequestType: 0x23
        0... .... = Direction: Host-to-device
        .01. .... = Type: Class (0x1)
        ...0 0011 = Recipient: Other (0x03)
bRequest: CLEAR_FEATURE (0x01)
wValue: 0x0010
    PortFeatureSelector: C_PORT_CONNECTION (16)
wIndex: 4
    Port: 4
    PortSelector: 0
wLength: 0
    (zero): 0

0000  00 59 7d 82 3e 99 ff ff 53 02 00 01 01 00 00 00   .Y}.>...S.......
0010  57 f5 53 5a 00 00 00 00 29 d6 0d 00 8d ff ff ff   W.SZ....).......
0020  00 00 00 00 00 00 00 00 23 01 10 00 04 00 00 00   ........#.......
0030  00 00 00 00 00 00 00 00 00 00 00 00 00 00 00 00   ................

      6 0.000124       1.1.0                 host                  USBHUB   64     CLEAR_FEATURE Response [Port 4: C_PORT_CONNECTION]

Frame 6: 64 bytes on wire (512 bits), 64 bytes captured (512 bits) on interface 0
    Interface id: 0 (usbmon0)
        Interface name: usbmon0
    Encapsulation type: USB packets with Linux header and padding (115)
    Arrival Time: Jan  8, 2018 23:48:55.906804000 CET
    [Time shift for this packet: 0.000000000 seconds]
    Epoch Time: 1515451735.906804000 seconds
    [Time delta from previous captured frame: 0.000011000 seconds]
    [Time delta from previous displayed frame: 0.000011000 seconds]
    [Time since reference or first frame: 0.000124000 seconds]
    Frame Number: 6
    Frame Length: 64 bytes (512 bits)
    Capture Length: 64 bytes (512 bits)
    [Frame is marked: False]
    [Frame is ignored: False]
    [Protocols in frame: usb]
USB URB
    [Source: 1.1.0]
    [Destination: host]
    URB id: 0xffff993e827d5900
    URB type: URB_COMPLETE ('C')
    URB transfer type: URB_CONTROL (0x02)
    Endpoint: 0x00, Direction: OUT
        0... .... = Direction: OUT (0)
        .... 0000 = Endpoint number: 0
    Device: 1
    URB bus id: 1
    Device setup request: not relevant ('-')
    Data: not present ('>')
    URB sec: 1515451735
    URB usec: 906804
    URB status: Success (0)
    URB length [bytes]: 0
    Data length [bytes]: 0
    [Request in: 5]
    [Time from request: 0.000011000 seconds]
    Unused Setup Header
    Interval: 0
    Start frame: 0
    Copy of Transfer Flags: 0x00000000
    Number of ISO descriptors: 0
    [bInterfaceClass: Unknown (0xffff)]

0000  00 59 7d 82 3e 99 ff ff 43 02 00 01 01 00 2d 3e   .Y}.>...C.....->
0010  57 f5 53 5a 00 00 00 00 34 d6 0d 00 00 00 00 00   W.SZ....4.......
0020  00 00 00 00 00 00 00 00 00 00 00 00 00 00 00 00   ................
0030  00 00 00 00 00 00 00 00 00 00 00 00 00 00 00 00   ................

      7 0.000133       host                  1.1.0                 USBHUB   64     GET_STATUS Request     [Port 4]

Frame 7: 64 bytes on wire (512 bits), 64 bytes captured (512 bits) on interface 0
    Interface id: 0 (usbmon0)
        Interface name: usbmon0
    Encapsulation type: USB packets with Linux header and padding (115)
    Arrival Time: Jan  8, 2018 23:48:55.906813000 CET
    [Time shift for this packet: 0.000000000 seconds]
    Epoch Time: 1515451735.906813000 seconds
    [Time delta from previous captured frame: 0.000009000 seconds]
    [Time delta from previous displayed frame: 0.000009000 seconds]
    [Time since reference or first frame: 0.000133000 seconds]
    Frame Number: 7
    Frame Length: 64 bytes (512 bits)
    Capture Length: 64 bytes (512 bits)
    [Frame is marked: False]
    [Frame is ignored: False]
    [Protocols in frame: usb:usbhub]
USB URB
    [Source: host]
    [Destination: 1.1.0]
    URB id: 0xffff993e827d5900
    URB type: URB_SUBMIT ('S')
    URB transfer type: URB_CONTROL (0x02)
    Endpoint: 0x80, Direction: IN
        1... .... = Direction: IN (1)
        .... 0000 = Endpoint number: 0
    Device: 1
    URB bus id: 1
    Device setup request: relevant (0)
    Data: not present ('<')
    URB sec: 1515451735
    URB usec: 906813
    URB status: Operation now in progress (-EINPROGRESS) (-115)
    URB length [bytes]: 4
    Data length [bytes]: 0
    [Response in: 8]
    Interval: 0
    Start frame: 0
    Copy of Transfer Flags: 0x00000200
    Number of ISO descriptors: 0
    [bInterfaceClass: Unknown (0xffff)]
URB setup
    bmRequestType: 0xa3
        1... .... = Direction: Device-to-host
        .01. .... = Type: Class (0x1)
        ...0 0011 = Recipient: Other (0x03)
bRequest: GET_STATUS (0x00)
wValue: 0x0000
    (zero): 0
wIndex: 4
    Port: 4
wLength: 4

0000  00 59 7d 82 3e 99 ff ff 53 02 80 01 01 00 00 3c   .Y}.>...S......<
0010  57 f5 53 5a 00 00 00 00 3d d6 0d 00 8d ff ff ff   W.SZ....=.......
0020  04 00 00 00 00 00 00 00 a3 00 00 00 04 00 04 00   ................
0030  00 00 00 00 00 00 00 00 00 02 00 00 00 00 00 00   ................

      8 0.000141       1.1.0                 host                  USBHUB   68     GET_STATUS Response    [Port 4]

Frame 8: 68 bytes on wire (544 bits), 68 bytes captured (544 bits) on interface 0
    Interface id: 0 (usbmon0)
        Interface name: usbmon0
    Encapsulation type: USB packets with Linux header and padding (115)
    Arrival Time: Jan  8, 2018 23:48:55.906821000 CET
    [Time shift for this packet: 0.000000000 seconds]
    Epoch Time: 1515451735.906821000 seconds
    [Time delta from previous captured frame: 0.000008000 seconds]
    [Time delta from previous displayed frame: 0.000008000 seconds]
    [Time since reference or first frame: 0.000141000 seconds]
    Frame Number: 8
    Frame Length: 68 bytes (544 bits)
    Capture Length: 68 bytes (544 bits)
    [Frame is marked: False]
    [Frame is ignored: False]
    [Protocols in frame: usb:usbhub]
USB URB
    [Source: 1.1.0]
    [Destination: host]
    URB id: 0xffff993e827d5900
    URB type: URB_COMPLETE ('C')
    URB transfer type: URB_CONTROL (0x02)
    Endpoint: 0x80, Direction: IN
        1... .... = Direction: IN (1)
        .... 0000 = Endpoint number: 0
    Device: 1
    URB bus id: 1
    Device setup request: not relevant ('-')
    Data: present (0)
    URB sec: 1515451735
    URB usec: 906821
    URB status: Success (0)
    URB length [bytes]: 4
    Data length [bytes]: 4
    [Request in: 7]
    [Time from request: 0.000008000 seconds]
    Unused Setup Header
    Interval: 0
    Start frame: 0
    Copy of Transfer Flags: 0x00000200
    Number of ISO descriptors: 0
    [bInterfaceClass: Unknown (0xffff)]
Port Status: 0x0301, PORT_CONNECTION, PORT_POWER, PORT_LOW_SPEED
    .... .... .... ...1 = PORT_CONNECTION: True
    .... .... .... ..0. = PORT_ENABLE: False
    .... .... .... .0.. = PORT_SUSPEND: False
    .... .... .... 0... = PORT_OVER_CURRENT: False
    .... .... ...0 .... = PORT_RESET: False
    .... ...1 .... .... = PORT_POWER: True
    .... ..1. .... .... = PORT_LOW_SPEED: True
    .... .0.. .... .... = PORT_HIGH_SPEED: False
    .... 0... .... .... = PORT_TEST: False
    ...0 .... .... .... = PORT_INDICATOR: Default colors
Port Change: 0x0000
    .... .... .... ...0 = C_PORT_CONNECTION: False
    .... .... .... ..0. = C_PORT_ENABLE: False
    .... .... .... .0.. = C_PORT_SUSPEND: False
    .... .... .... 0... = C_PORT_OVER_CURRENT: False
    .... .... ...0 .... = C_PORT_RESET: False

0000  00 59 7d 82 3e 99 ff ff 43 02 80 01 01 00 2d 00   .Y}.>...C.....-.
0010  57 f5 53 5a 00 00 00 00 45 d6 0d 00 00 00 00 00   W.SZ....E.......
0020  04 00 00 00 04 00 00 00 00 00 00 00 00 00 00 00   ................
0030  00 00 00 00 00 00 00 00 00 02 00 00 00 00 00 00   ................
0040  01 03 00 00                                       ....

      9 0.026897       host                  1.1.0                 USBHUB   64     GET_STATUS Request     [Port 4]

Frame 9: 64 bytes on wire (512 bits), 64 bytes captured (512 bits) on interface 0
    Interface id: 0 (usbmon0)
        Interface name: usbmon0
    Encapsulation type: USB packets with Linux header and padding (115)
    Arrival Time: Jan  8, 2018 23:48:55.933577000 CET
    [Time shift for this packet: 0.000000000 seconds]
    Epoch Time: 1515451735.933577000 seconds
    [Time delta from previous captured frame: 0.026756000 seconds]
    [Time delta from previous displayed frame: 0.026756000 seconds]
    [Time since reference or first frame: 0.026897000 seconds]
    Frame Number: 9
    Frame Length: 64 bytes (512 bits)
    Capture Length: 64 bytes (512 bits)
    [Frame is marked: False]
    [Frame is ignored: False]
    [Protocols in frame: usb:usbhub]
USB URB
    [Source: host]
    [Destination: 1.1.0]
    URB id: 0xffff993e827d5900
    URB type: URB_SUBMIT ('S')
    URB transfer type: URB_CONTROL (0x02)
    Endpoint: 0x80, Direction: IN
        1... .... = Direction: IN (1)
        .... 0000 = Endpoint number: 0
    Device: 1
    URB bus id: 1
    Device setup request: relevant (0)
    Data: not present ('<')
    URB sec: 1515451735
    URB usec: 933577
    URB status: Operation now in progress (-EINPROGRESS) (-115)
    URB length [bytes]: 4
    Data length [bytes]: 0
    [Response in: 10]
    Interval: 0
    Start frame: 0
    Copy of Transfer Flags: 0x00000200
    Number of ISO descriptors: 0
    [bInterfaceClass: Unknown (0xffff)]
URB setup
    bmRequestType: 0xa3
        1... .... = Direction: Device-to-host
        .01. .... = Type: Class (0x1)
        ...0 0011 = Recipient: Other (0x03)
bRequest: GET_STATUS (0x00)
wValue: 0x0000
    (zero): 0
wIndex: 4
    Port: 4
wLength: 4

0000  00 59 7d 82 3e 99 ff ff 53 02 80 01 01 00 00 3c   .Y}.>...S......<
0010  57 f5 53 5a 00 00 00 00 c9 3e 0e 00 8d ff ff ff   W.SZ.....>......
0020  04 00 00 00 00 00 00 00 a3 00 00 00 04 00 04 00   ................
0030  00 00 00 00 00 00 00 00 00 02 00 00 00 00 00 00   ................

     10 0.026971       1.1.0                 host                  USBHUB   68     GET_STATUS Response    [Port 4]

Frame 10: 68 bytes on wire (544 bits), 68 bytes captured (544 bits) on interface 0
    Interface id: 0 (usbmon0)
        Interface name: usbmon0
    Encapsulation type: USB packets with Linux header and padding (115)
    Arrival Time: Jan  8, 2018 23:48:55.933651000 CET
    [Time shift for this packet: 0.000000000 seconds]
    Epoch Time: 1515451735.933651000 seconds
    [Time delta from previous captured frame: 0.000074000 seconds]
    [Time delta from previous displayed frame: 0.000074000 seconds]
    [Time since reference or first frame: 0.026971000 seconds]
    Frame Number: 10
    Frame Length: 68 bytes (544 bits)
    Capture Length: 68 bytes (544 bits)
    [Frame is marked: False]
    [Frame is ignored: False]
    [Protocols in frame: usb:usbhub]
USB URB
    [Source: 1.1.0]
    [Destination: host]
    URB id: 0xffff993e827d5900
    URB type: URB_COMPLETE ('C')
    URB transfer type: URB_CONTROL (0x02)
    Endpoint: 0x80, Direction: IN
        1... .... = Direction: IN (1)
        .... 0000 = Endpoint number: 0
    Device: 1
    URB bus id: 1
    Device setup request: not relevant ('-')
    Data: present (0)
    URB sec: 1515451735
    URB usec: 933651
    URB status: Success (0)
    URB length [bytes]: 4
    Data length [bytes]: 4
    [Request in: 9]
    [Time from request: 0.000074000 seconds]
    Unused Setup Header
    Interval: 0
    Start frame: 0
    Copy of Transfer Flags: 0x00000200
    Number of ISO descriptors: 0
    [bInterfaceClass: Unknown (0xffff)]
Port Status: 0x0301, PORT_CONNECTION, PORT_POWER, PORT_LOW_SPEED
    .... .... .... ...1 = PORT_CONNECTION: True
    .... .... .... ..0. = PORT_ENABLE: False
    .... .... .... .0.. = PORT_SUSPEND: False
    .... .... .... 0... = PORT_OVER_CURRENT: False
    .... .... ...0 .... = PORT_RESET: False
    .... ...1 .... .... = PORT_POWER: True
    .... ..1. .... .... = PORT_LOW_SPEED: True
    .... .0.. .... .... = PORT_HIGH_SPEED: False
    .... 0... .... .... = PORT_TEST: False
    ...0 .... .... .... = PORT_INDICATOR: Default colors
Port Change: 0x0000
    .... .... .... ...0 = C_PORT_CONNECTION: False
    .... .... .... ..0. = C_PORT_ENABLE: False
    .... .... .... .0.. = C_PORT_SUSPEND: False
    .... .... .... 0... = C_PORT_OVER_CURRENT: False
    .... .... ...0 .... = C_PORT_RESET: False

0000  00 59 7d 82 3e 99 ff ff 43 02 80 01 01 00 2d 00   .Y}.>...C.....-.
0010  57 f5 53 5a 00 00 00 00 13 3f 0e 00 00 00 00 00   W.SZ.....?......
0020  04 00 00 00 04 00 00 00 00 00 00 00 00 00 00 00   ................
0030  00 00 00 00 00 00 00 00 00 02 00 00 00 00 00 00   ................
0040  01 03 00 00                                       ....

     11 0.053902       host                  1.1.0                 USBHUB   64     GET_STATUS Request     [Port 4]

Frame 11: 64 bytes on wire (512 bits), 64 bytes captured (512 bits) on interface 0
    Interface id: 0 (usbmon0)
        Interface name: usbmon0
    Encapsulation type: USB packets with Linux header and padding (115)
    Arrival Time: Jan  8, 2018 23:48:55.960582000 CET
    [Time shift for this packet: 0.000000000 seconds]
    Epoch Time: 1515451735.960582000 seconds
    [Time delta from previous captured frame: 0.026931000 seconds]
    [Time delta from previous displayed frame: 0.026931000 seconds]
    [Time since reference or first frame: 0.053902000 seconds]
    Frame Number: 11
    Frame Length: 64 bytes (512 bits)
    Capture Length: 64 bytes (512 bits)
    [Frame is marked: False]
    [Frame is ignored: False]
    [Protocols in frame: usb:usbhub]
USB URB
    [Source: host]
    [Destination: 1.1.0]
    URB id: 0xffff993e827d5900
    URB type: URB_SUBMIT ('S')
    URB transfer type: URB_CONTROL (0x02)
    Endpoint: 0x80, Direction: IN
        1... .... = Direction: IN (1)
        .... 0000 = Endpoint number: 0
    Device: 1
    URB bus id: 1
    Device setup request: relevant (0)
    Data: not present ('<')
    URB sec: 1515451735
    URB usec: 960582
    URB status: Operation now in progress (-EINPROGRESS) (-115)
    URB length [bytes]: 4
    Data length [bytes]: 0
    [Response in: 12]
    Interval: 0
    Start frame: 0
    Copy of Transfer Flags: 0x00000200
    Number of ISO descriptors: 0
    [bInterfaceClass: Unknown (0xffff)]
URB setup
    bmRequestType: 0xa3
        1... .... = Direction: Device-to-host
        .01. .... = Type: Class (0x1)
        ...0 0011 = Recipient: Other (0x03)
bRequest: GET_STATUS (0x00)
wValue: 0x0000
    (zero): 0
wIndex: 4
    Port: 4
wLength: 4

0000  00 59 7d 82 3e 99 ff ff 53 02 80 01 01 00 00 3c   .Y}.>...S......<
0010  57 f5 53 5a 00 00 00 00 46 a8 0e 00 8d ff ff ff   W.SZ....F.......
0020  04 00 00 00 00 00 00 00 a3 00 00 00 04 00 04 00   ................
0030  00 00 00 00 00 00 00 00 00 02 00 00 00 00 00 00   ................

     12 0.053941       1.1.0                 host                  USBHUB   68     GET_STATUS Response    [Port 4]

Frame 12: 68 bytes on wire (544 bits), 68 bytes captured (544 bits) on interface 0
    Interface id: 0 (usbmon0)
        Interface name: usbmon0
    Encapsulation type: USB packets with Linux header and padding (115)
    Arrival Time: Jan  8, 2018 23:48:55.960621000 CET
    [Time shift for this packet: 0.000000000 seconds]
    Epoch Time: 1515451735.960621000 seconds
    [Time delta from previous captured frame: 0.000039000 seconds]
    [Time delta from previous displayed frame: 0.000039000 seconds]
    [Time since reference or first frame: 0.053941000 seconds]
    Frame Number: 12
    Frame Length: 68 bytes (544 bits)
    Capture Length: 68 bytes (544 bits)
    [Frame is marked: False]
    [Frame is ignored: False]
    [Protocols in frame: usb:usbhub]
USB URB
    [Source: 1.1.0]
    [Destination: host]
    URB id: 0xffff993e827d5900
    URB type: URB_COMPLETE ('C')
    URB transfer type: URB_CONTROL (0x02)
    Endpoint: 0x80, Direction: IN
        1... .... = Direction: IN (1)
        .... 0000 = Endpoint number: 0
    Device: 1
    URB bus id: 1
    Device setup request: not relevant ('-')
    Data: present (0)
    URB sec: 1515451735
    URB usec: 960621
    URB status: Success (0)
    URB length [bytes]: 4
    Data length [bytes]: 4
    [Request in: 11]
    [Time from request: 0.000039000 seconds]
    Unused Setup Header
    Interval: 0
    Start frame: 0
    Copy of Transfer Flags: 0x00000200
    Number of ISO descriptors: 0
    [bInterfaceClass: Unknown (0xffff)]
Port Status: 0x0301, PORT_CONNECTION, PORT_POWER, PORT_LOW_SPEED
    .... .... .... ...1 = PORT_CONNECTION: True
    .... .... .... ..0. = PORT_ENABLE: False
    .... .... .... .0.. = PORT_SUSPEND: False
    .... .... .... 0... = PORT_OVER_CURRENT: False
    .... .... ...0 .... = PORT_RESET: False
    .... ...1 .... .... = PORT_POWER: True
    .... ..1. .... .... = PORT_LOW_SPEED: True
    .... .0.. .... .... = PORT_HIGH_SPEED: False
    .... 0... .... .... = PORT_TEST: False
    ...0 .... .... .... = PORT_INDICATOR: Default colors
Port Change: 0x0000
    .... .... .... ...0 = C_PORT_CONNECTION: False
    .... .... .... ..0. = C_PORT_ENABLE: False
    .... .... .... .0.. = C_PORT_SUSPEND: False
    .... .... .... 0... = C_PORT_OVER_CURRENT: False
    .... .... ...0 .... = C_PORT_RESET: False

0000  00 59 7d 82 3e 99 ff ff 43 02 80 01 01 00 2d 00   .Y}.>...C.....-.
0010  57 f5 53 5a 00 00 00 00 6d a8 0e 00 00 00 00 00   W.SZ....m.......
0020  04 00 00 00 04 00 00 00 00 00 00 00 00 00 00 00   ................
0030  00 00 00 00 00 00 00 00 00 02 00 00 00 00 00 00   ................
0040  01 03 00 00                                       ....

     13 0.080877       host                  1.1.0                 USBHUB   64     GET_STATUS Request     [Port 4]

Frame 13: 64 bytes on wire (512 bits), 64 bytes captured (512 bits) on interface 0
    Interface id: 0 (usbmon0)
        Interface name: usbmon0
    Encapsulation type: USB packets with Linux header and padding (115)
    Arrival Time: Jan  8, 2018 23:48:55.987557000 CET
    [Time shift for this packet: 0.000000000 seconds]
    Epoch Time: 1515451735.987557000 seconds
    [Time delta from previous captured frame: 0.026936000 seconds]
    [Time delta from previous displayed frame: 0.026936000 seconds]
    [Time since reference or first frame: 0.080877000 seconds]
    Frame Number: 13
    Frame Length: 64 bytes (512 bits)
    Capture Length: 64 bytes (512 bits)
    [Frame is marked: False]
    [Frame is ignored: False]
    [Protocols in frame: usb:usbhub]
USB URB
    [Source: host]
    [Destination: 1.1.0]
    URB id: 0xffff993e827d5900
    URB type: URB_SUBMIT ('S')
    URB transfer type: URB_CONTROL (0x02)
    Endpoint: 0x80, Direction: IN
        1... .... = Direction: IN (1)
        .... 0000 = Endpoint number: 0
    Device: 1
    URB bus id: 1
    Device setup request: relevant (0)
    Data: not present ('<')
    URB sec: 1515451735
    URB usec: 987557
    URB status: Operation now in progress (-EINPROGRESS) (-115)
    URB length [bytes]: 4
    Data length [bytes]: 0
    [Response in: 14]
    Interval: 0
    Start frame: 0
    Copy of Transfer Flags: 0x00000200
    Number of ISO descriptors: 0
    [bInterfaceClass: Unknown (0xffff)]
URB setup
    bmRequestType: 0xa3
        1... .... = Direction: Device-to-host
        .01. .... = Type: Class (0x1)
        ...0 0011 = Recipient: Other (0x03)
bRequest: GET_STATUS (0x00)
wValue: 0x0000
    (zero): 0
wIndex: 4
    Port: 4
wLength: 4

0000  00 59 7d 82 3e 99 ff ff 53 02 80 01 01 00 00 3c   .Y}.>...S......<
0010  57 f5 53 5a 00 00 00 00 a5 11 0f 00 8d ff ff ff   W.SZ............
0020  04 00 00 00 00 00 00 00 a3 00 00 00 04 00 04 00   ................
0030  00 00 00 00 00 00 00 00 00 02 00 00 00 00 00 00   ................

     14 0.080912       1.1.0                 host                  USBHUB   68     GET_STATUS Response    [Port 4]

Frame 14: 68 bytes on wire (544 bits), 68 bytes captured (544 bits) on interface 0
    Interface id: 0 (usbmon0)
        Interface name: usbmon0
    Encapsulation type: USB packets with Linux header and padding (115)
    Arrival Time: Jan  8, 2018 23:48:55.987592000 CET
    [Time shift for this packet: 0.000000000 seconds]
    Epoch Time: 1515451735.987592000 seconds
    [Time delta from previous captured frame: 0.000035000 seconds]
    [Time delta from previous displayed frame: 0.000035000 seconds]
    [Time since reference or first frame: 0.080912000 seconds]
    Frame Number: 14
    Frame Length: 68 bytes (544 bits)
    Capture Length: 68 bytes (544 bits)
    [Frame is marked: False]
    [Frame is ignored: False]
    [Protocols in frame: usb:usbhub]
USB URB
    [Source: 1.1.0]
    [Destination: host]
    URB id: 0xffff993e827d5900
    URB type: URB_COMPLETE ('C')
    URB transfer type: URB_CONTROL (0x02)
    Endpoint: 0x80, Direction: IN
        1... .... = Direction: IN (1)
        .... 0000 = Endpoint number: 0
    Device: 1
    URB bus id: 1
    Device setup request: not relevant ('-')
    Data: present (0)
    URB sec: 1515451735
    URB usec: 987592
    URB status: Success (0)
    URB length [bytes]: 4
    Data length [bytes]: 4
    [Request in: 13]
    [Time from request: 0.000035000 seconds]
    Unused Setup Header
    Interval: 0
    Start frame: 0
    Copy of Transfer Flags: 0x00000200
    Number of ISO descriptors: 0
    [bInterfaceClass: Unknown (0xffff)]
Port Status: 0x0301, PORT_CONNECTION, PORT_POWER, PORT_LOW_SPEED
    .... .... .... ...1 = PORT_CONNECTION: True
    .... .... .... ..0. = PORT_ENABLE: False
    .... .... .... .0.. = PORT_SUSPEND: False
    .... .... .... 0... = PORT_OVER_CURRENT: False
    .... .... ...0 .... = PORT_RESET: False
    .... ...1 .... .... = PORT_POWER: True
    .... ..1. .... .... = PORT_LOW_SPEED: True
    .... .0.. .... .... = PORT_HIGH_SPEED: False
    .... 0... .... .... = PORT_TEST: False
    ...0 .... .... .... = PORT_INDICATOR: Default colors
Port Change: 0x0000
    .... .... .... ...0 = C_PORT_CONNECTION: False
    .... .... .... ..0. = C_PORT_ENABLE: False
    .... .... .... .0.. = C_PORT_SUSPEND: False
    .... .... .... 0... = C_PORT_OVER_CURRENT: False
    .... .... ...0 .... = C_PORT_RESET: False

0000  00 59 7d 82 3e 99 ff ff 43 02 80 01 01 00 2d 00   .Y}.>...C.....-.
0010  57 f5 53 5a 00 00 00 00 c8 11 0f 00 00 00 00 00   W.SZ............
0020  04 00 00 00 04 00 00 00 00 00 00 00 00 00 00 00   ................
0030  00 00 00 00 00 00 00 00 00 02 00 00 00 00 00 00   ................
0040  01 03 00 00                                       ....

     15 0.107881       host                  1.1.0                 USBHUB   64     GET_STATUS Request     [Port 4]

Frame 15: 64 bytes on wire (512 bits), 64 bytes captured (512 bits) on interface 0
    Interface id: 0 (usbmon0)
        Interface name: usbmon0
    Encapsulation type: USB packets with Linux header and padding (115)
    Arrival Time: Jan  8, 2018 23:48:56.014561000 CET
    [Time shift for this packet: 0.000000000 seconds]
    Epoch Time: 1515451736.014561000 seconds
    [Time delta from previous captured frame: 0.026969000 seconds]
    [Time delta from previous displayed frame: 0.026969000 seconds]
    [Time since reference or first frame: 0.107881000 seconds]
    Frame Number: 15
    Frame Length: 64 bytes (512 bits)
    Capture Length: 64 bytes (512 bits)
    [Frame is marked: False]
    [Frame is ignored: False]
    [Protocols in frame: usb:usbhub]
USB URB
    [Source: host]
    [Destination: 1.1.0]
    URB id: 0xffff993e827d5900
    URB type: URB_SUBMIT ('S')
    URB transfer type: URB_CONTROL (0x02)
    Endpoint: 0x80, Direction: IN
        1... .... = Direction: IN (1)
        .... 0000 = Endpoint number: 0
    Device: 1
    URB bus id: 1
    Device setup request: relevant (0)
    Data: not present ('<')
    URB sec: 1515451736
    URB usec: 14561
    URB status: Operation now in progress (-EINPROGRESS) (-115)
    URB length [bytes]: 4
    Data length [bytes]: 0
    [Response in: 16]
    Interval: 0
    Start frame: 0
    Copy of Transfer Flags: 0x00000200
    Number of ISO descriptors: 0
    [bInterfaceClass: Unknown (0xffff)]
URB setup
    bmRequestType: 0xa3
        1... .... = Direction: Device-to-host
        .01. .... = Type: Class (0x1)
        ...0 0011 = Recipient: Other (0x03)
bRequest: GET_STATUS (0x00)
wValue: 0x0000
    (zero): 0
wIndex: 4
    Port: 4
wLength: 4

0000  00 59 7d 82 3e 99 ff ff 53 02 80 01 01 00 00 3c   .Y}.>...S......<
0010  58 f5 53 5a 00 00 00 00 e1 38 00 00 8d ff ff ff   X.SZ.....8......
0020  04 00 00 00 00 00 00 00 a3 00 00 00 04 00 04 00   ................
0030  00 00 00 00 00 00 00 00 00 02 00 00 00 00 00 00   ................

     16 0.107932       1.1.0                 host                  USBHUB   68     GET_STATUS Response    [Port 4]

Frame 16: 68 bytes on wire (544 bits), 68 bytes captured (544 bits) on interface 0
    Interface id: 0 (usbmon0)
        Interface name: usbmon0
    Encapsulation type: USB packets with Linux header and padding (115)
    Arrival Time: Jan  8, 2018 23:48:56.014612000 CET
    [Time shift for this packet: 0.000000000 seconds]
    Epoch Time: 1515451736.014612000 seconds
    [Time delta from previous captured frame: 0.000051000 seconds]
    [Time delta from previous displayed frame: 0.000051000 seconds]
    [Time since reference or first frame: 0.107932000 seconds]
    Frame Number: 16
    Frame Length: 68 bytes (544 bits)
    Capture Length: 68 bytes (544 bits)
    [Frame is marked: False]
    [Frame is ignored: False]
    [Protocols in frame: usb:usbhub]
USB URB
    [Source: 1.1.0]
    [Destination: host]
    URB id: 0xffff993e827d5900
    URB type: URB_COMPLETE ('C')
    URB transfer type: URB_CONTROL (0x02)
    Endpoint: 0x80, Direction: IN
        1... .... = Direction: IN (1)
        .... 0000 = Endpoint number: 0
    Device: 1
    URB bus id: 1
    Device setup request: not relevant ('-')
    Data: present (0)
    URB sec: 1515451736
    URB usec: 14612
    URB status: Success (0)
    URB length [bytes]: 4
    Data length [bytes]: 4
    [Request in: 15]
    [Time from request: 0.000051000 seconds]
    Unused Setup Header
    Interval: 0
    Start frame: 0
    Copy of Transfer Flags: 0x00000200
    Number of ISO descriptors: 0
    [bInterfaceClass: Unknown (0xffff)]
Port Status: 0x0301, PORT_CONNECTION, PORT_POWER, PORT_LOW_SPEED
    .... .... .... ...1 = PORT_CONNECTION: True
    .... .... .... ..0. = PORT_ENABLE: False
    .... .... .... .0.. = PORT_SUSPEND: False
    .... .... .... 0... = PORT_OVER_CURRENT: False
    .... .... ...0 .... = PORT_RESET: False
    .... ...1 .... .... = PORT_POWER: True
    .... ..1. .... .... = PORT_LOW_SPEED: True
    .... .0.. .... .... = PORT_HIGH_SPEED: False
    .... 0... .... .... = PORT_TEST: False
    ...0 .... .... .... = PORT_INDICATOR: Default colors
Port Change: 0x0000
    .... .... .... ...0 = C_PORT_CONNECTION: False
    .... .... .... ..0. = C_PORT_ENABLE: False
    .... .... .... .0.. = C_PORT_SUSPEND: False
    .... .... .... 0... = C_PORT_OVER_CURRENT: False
    .... .... ...0 .... = C_PORT_RESET: False

0000  00 59 7d 82 3e 99 ff ff 43 02 80 01 01 00 2d 00   .Y}.>...C.....-.
0010  58 f5 53 5a 00 00 00 00 14 39 00 00 00 00 00 00   X.SZ.....9......
0020  04 00 00 00 04 00 00 00 00 00 00 00 00 00 00 00   ................
0030  00 00 00 00 00 00 00 00 00 02 00 00 00 00 00 00   ................
0040  01 03 00 00                                       ....

     17 0.108021       host                  1.1.0                 USBHUB   64     SET_FEATURE Request    [Port 4: PORT_RESET]

Frame 17: 64 bytes on wire (512 bits), 64 bytes captured (512 bits) on interface 0
    Interface id: 0 (usbmon0)
        Interface name: usbmon0
    Encapsulation type: USB packets with Linux header and padding (115)
    Arrival Time: Jan  8, 2018 23:48:56.014701000 CET
    [Time shift for this packet: 0.000000000 seconds]
    Epoch Time: 1515451736.014701000 seconds
    [Time delta from previous captured frame: 0.000089000 seconds]
    [Time delta from previous displayed frame: 0.000089000 seconds]
    [Time since reference or first frame: 0.108021000 seconds]
    Frame Number: 17
    Frame Length: 64 bytes (512 bits)
    Capture Length: 64 bytes (512 bits)
    [Frame is marked: False]
    [Frame is ignored: False]
    [Protocols in frame: usb:usbhub]
USB URB
    [Source: host]
    [Destination: 1.1.0]
    URB id: 0xffff993e827d5900
    URB type: URB_SUBMIT ('S')
    URB transfer type: URB_CONTROL (0x02)
    Endpoint: 0x00, Direction: OUT
        0... .... = Direction: OUT (0)
        .... 0000 = Endpoint number: 0
    Device: 1
    URB bus id: 1
    Device setup request: relevant (0)
    Data: present (0)
    URB sec: 1515451736
    URB usec: 14701
    URB status: Operation now in progress (-EINPROGRESS) (-115)
    URB length [bytes]: 0
    Data length [bytes]: 0
    [Response in: 18]
    Interval: 0
    Start frame: 0
    Copy of Transfer Flags: 0x00000000
    Number of ISO descriptors: 0
    [bInterfaceClass: Unknown (0xffff)]
URB setup
    bmRequestType: 0x23
        0... .... = Direction: Host-to-device
        .01. .... = Type: Class (0x1)
        ...0 0011 = Recipient: Other (0x03)
bRequest: SET_FEATURE (0x03)
wValue: 0x0004
    PortFeatureSelector: PORT_RESET (4)
wIndex: 4
    Port: 4
    PortSelector: 0
wLength: 0
    (zero): 0

0000  00 59 7d 82 3e 99 ff ff 53 02 00 01 01 00 00 00   .Y}.>...S.......
0010  58 f5 53 5a 00 00 00 00 6d 39 00 00 8d ff ff ff   X.SZ....m9......
0020  00 00 00 00 00 00 00 00 23 03 04 00 04 00 00 00   ........#.......
0030  00 00 00 00 00 00 00 00 00 00 00 00 00 00 00 00   ................

     18 0.108041       1.1.0                 host                  USBHUB   64     SET_FEATURE Response   [Port 4: PORT_RESET]

Frame 18: 64 bytes on wire (512 bits), 64 bytes captured (512 bits) on interface 0
    Interface id: 0 (usbmon0)
        Interface name: usbmon0
    Encapsulation type: USB packets with Linux header and padding (115)
    Arrival Time: Jan  8, 2018 23:48:56.014721000 CET
    [Time shift for this packet: 0.000000000 seconds]
    Epoch Time: 1515451736.014721000 seconds
    [Time delta from previous captured frame: 0.000020000 seconds]
    [Time delta from previous displayed frame: 0.000020000 seconds]
    [Time since reference or first frame: 0.108041000 seconds]
    Frame Number: 18
    Frame Length: 64 bytes (512 bits)
    Capture Length: 64 bytes (512 bits)
    [Frame is marked: False]
    [Frame is ignored: False]
    [Protocols in frame: usb]
USB URB
    [Source: 1.1.0]
    [Destination: host]
    URB id: 0xffff993e827d5900
    URB type: URB_COMPLETE ('C')
    URB transfer type: URB_CONTROL (0x02)
    Endpoint: 0x00, Direction: OUT
        0... .... = Direction: OUT (0)
        .... 0000 = Endpoint number: 0
    Device: 1
    URB bus id: 1
    Device setup request: not relevant ('-')
    Data: not present ('>')
    URB sec: 1515451736
    URB usec: 14721
    URB status: Success (0)
    URB length [bytes]: 0
    Data length [bytes]: 0
    [Request in: 17]
    [Time from request: 0.000020000 seconds]
    Unused Setup Header
    Interval: 0
    Start frame: 0
    Copy of Transfer Flags: 0x00000000
    Number of ISO descriptors: 0
    [bInterfaceClass: Unknown (0xffff)]

0000  00 59 7d 82 3e 99 ff ff 43 02 00 01 01 00 2d 3e   .Y}.>...C.....->
0010  58 f5 53 5a 00 00 00 00 81 39 00 00 00 00 00 00   X.SZ.....9......
0020  00 00 00 00 00 00 00 00 00 00 00 00 00 00 00 00   ................
0030  00 00 00 00 00 00 00 00 00 00 00 00 00 00 00 00   ................

     19 0.169880       host                  1.1.0                 USBHUB   64     GET_STATUS Request     [Port 4]

Frame 19: 64 bytes on wire (512 bits), 64 bytes captured (512 bits) on interface 0
    Interface id: 0 (usbmon0)
        Interface name: usbmon0
    Encapsulation type: USB packets with Linux header and padding (115)
    Arrival Time: Jan  8, 2018 23:48:56.076560000 CET
    [Time shift for this packet: 0.000000000 seconds]
    Epoch Time: 1515451736.076560000 seconds
    [Time delta from previous captured frame: 0.061839000 seconds]
    [Time delta from previous displayed frame: 0.061839000 seconds]
    [Time since reference or first frame: 0.169880000 seconds]
    Frame Number: 19
    Frame Length: 64 bytes (512 bits)
    Capture Length: 64 bytes (512 bits)
    [Frame is marked: False]
    [Frame is ignored: False]
    [Protocols in frame: usb:usbhub]
USB URB
    [Source: host]
    [Destination: 1.1.0]
    URB id: 0xffff993e827d5900
    URB type: URB_SUBMIT ('S')
    URB transfer type: URB_CONTROL (0x02)
    Endpoint: 0x80, Direction: IN
        1... .... = Direction: IN (1)
        .... 0000 = Endpoint number: 0
    Device: 1
    URB bus id: 1
    Device setup request: relevant (0)
    Data: not present ('<')
    URB sec: 1515451736
    URB usec: 76560
    URB status: Operation now in progress (-EINPROGRESS) (-115)
    URB length [bytes]: 4
    Data length [bytes]: 0
    [Response in: 20]
    Interval: 0
    Start frame: 0
    Copy of Transfer Flags: 0x00000200
    Number of ISO descriptors: 0
    [bInterfaceClass: Unknown (0xffff)]
URB setup
    bmRequestType: 0xa3
        1... .... = Direction: Device-to-host
        .01. .... = Type: Class (0x1)
        ...0 0011 = Recipient: Other (0x03)
bRequest: GET_STATUS (0x00)
wValue: 0x0000
    (zero): 0
wIndex: 4
    Port: 4
wLength: 4

0000  00 59 7d 82 3e 99 ff ff 53 02 80 01 01 00 00 3c   .Y}.>...S......<
0010  58 f5 53 5a 00 00 00 00 10 2b 01 00 8d ff ff ff   X.SZ.....+......
0020  04 00 00 00 00 00 00 00 a3 00 00 00 04 00 04 00   ................
0030  00 00 00 00 00 00 00 00 00 02 00 00 00 00 00 00   ................

     20 0.169940       1.1.0                 host                  USBHUB   68     GET_STATUS Response    [Port 4]

Frame 20: 68 bytes on wire (544 bits), 68 bytes captured (544 bits) on interface 0
    Interface id: 0 (usbmon0)
        Interface name: usbmon0
    Encapsulation type: USB packets with Linux header and padding (115)
    Arrival Time: Jan  8, 2018 23:48:56.076620000 CET
    [Time shift for this packet: 0.000000000 seconds]
    Epoch Time: 1515451736.076620000 seconds
    [Time delta from previous captured frame: 0.000060000 seconds]
    [Time delta from previous displayed frame: 0.000060000 seconds]
    [Time since reference or first frame: 0.169940000 seconds]
    Frame Number: 20
    Frame Length: 68 bytes (544 bits)
    Capture Length: 68 bytes (544 bits)
    [Frame is marked: False]
    [Frame is ignored: False]
    [Protocols in frame: usb:usbhub]
USB URB
    [Source: 1.1.0]
    [Destination: host]
    URB id: 0xffff993e827d5900
    URB type: URB_COMPLETE ('C')
    URB transfer type: URB_CONTROL (0x02)
    Endpoint: 0x80, Direction: IN
        1... .... = Direction: IN (1)
        .... 0000 = Endpoint number: 0
    Device: 1
    URB bus id: 1
    Device setup request: not relevant ('-')
    Data: present (0)
    URB sec: 1515451736
    URB usec: 76620
    URB status: Success (0)
    URB length [bytes]: 4
    Data length [bytes]: 4
    [Request in: 19]
    [Time from request: 0.000060000 seconds]
    Unused Setup Header
    Interval: 0
    Start frame: 0
    Copy of Transfer Flags: 0x00000200
    Number of ISO descriptors: 0
    [bInterfaceClass: Unknown (0xffff)]
Port Status: 0x0303, PORT_CONNECTION, PORT_ENABLE, PORT_POWER, PORT_LOW_SPEED
    .... .... .... ...1 = PORT_CONNECTION: True
    .... .... .... ..1. = PORT_ENABLE: True
    .... .... .... .0.. = PORT_SUSPEND: False
    .... .... .... 0... = PORT_OVER_CURRENT: False
    .... .... ...0 .... = PORT_RESET: False
    .... ...1 .... .... = PORT_POWER: True
    .... ..1. .... .... = PORT_LOW_SPEED: True
    .... .0.. .... .... = PORT_HIGH_SPEED: False
    .... 0... .... .... = PORT_TEST: False
    ...0 .... .... .... = PORT_INDICATOR: Default colors
Port Change: 0x0010, C_PORT_RESET
    .... .... .... ...0 = C_PORT_CONNECTION: False
    .... .... .... ..0. = C_PORT_ENABLE: False
    .... .... .... .0.. = C_PORT_SUSPEND: False
    .... .... .... 0... = C_PORT_OVER_CURRENT: False
    .... .... ...1 .... = C_PORT_RESET: True

0000  00 59 7d 82 3e 99 ff ff 43 02 80 01 01 00 2d 00   .Y}.>...C.....-.
0010  58 f5 53 5a 00 00 00 00 4c 2b 01 00 00 00 00 00   X.SZ....L+......
0020  04 00 00 00 04 00 00 00 00 00 00 00 00 00 00 00   ................
0030  00 00 00 00 00 00 00 00 00 02 00 00 00 00 00 00   ................
0040  03 03 10 00                                       ....

     21 0.169953       host                  1.1.0                 USBHUB   64     CLEAR_FEATURE Request  [Port 4: C_PORT_RESET]

Frame 21: 64 bytes on wire (512 bits), 64 bytes captured (512 bits) on interface 0
    Interface id: 0 (usbmon0)
        Interface name: usbmon0
    Encapsulation type: USB packets with Linux header and padding (115)
    Arrival Time: Jan  8, 2018 23:48:56.076633000 CET
    [Time shift for this packet: 0.000000000 seconds]
    Epoch Time: 1515451736.076633000 seconds
    [Time delta from previous captured frame: 0.000013000 seconds]
    [Time delta from previous displayed frame: 0.000013000 seconds]
    [Time since reference or first frame: 0.169953000 seconds]
    Frame Number: 21
    Frame Length: 64 bytes (512 bits)
    Capture Length: 64 bytes (512 bits)
    [Frame is marked: False]
    [Frame is ignored: False]
    [Protocols in frame: usb:usbhub]
USB URB
    [Source: host]
    [Destination: 1.1.0]
    URB id: 0xffff993e827d5900
    URB type: URB_SUBMIT ('S')
    URB transfer type: URB_CONTROL (0x02)
    Endpoint: 0x00, Direction: OUT
        0... .... = Direction: OUT (0)
        .... 0000 = Endpoint number: 0
    Device: 1
    URB bus id: 1
    Device setup request: relevant (0)
    Data: present (0)
    URB sec: 1515451736
    URB usec: 76633
    URB status: Operation now in progress (-EINPROGRESS) (-115)
    URB length [bytes]: 0
    Data length [bytes]: 0
    [Response in: 22]
    Interval: 0
    Start frame: 0
    Copy of Transfer Flags: 0x00000000
    Number of ISO descriptors: 0
    [bInterfaceClass: Unknown (0xffff)]
URB setup
    bmRequestType: 0x23
        0... .... = Direction: Host-to-device
        .01. .... = Type: Class (0x1)
        ...0 0011 = Recipient: Other (0x03)
bRequest: CLEAR_FEATURE (0x01)
wValue: 0x0014
    PortFeatureSelector: C_PORT_RESET (20)
wIndex: 4
    Port: 4
    PortSelector: 0
wLength: 0
    (zero): 0

0000  00 59 7d 82 3e 99 ff ff 53 02 00 01 01 00 00 00   .Y}.>...S.......
0010  58 f5 53 5a 00 00 00 00 59 2b 01 00 8d ff ff ff   X.SZ....Y+......
0020  00 00 00 00 00 00 00 00 23 01 14 00 04 00 00 00   ........#.......
0030  00 00 00 00 00 00 00 00 00 00 00 00 00 00 00 00   ................

     22 0.169962       1.1.0                 host                  USBHUB   64     CLEAR_FEATURE Response [Port 4: C_PORT_RESET]

Frame 22: 64 bytes on wire (512 bits), 64 bytes captured (512 bits) on interface 0
    Interface id: 0 (usbmon0)
        Interface name: usbmon0
    Encapsulation type: USB packets with Linux header and padding (115)
    Arrival Time: Jan  8, 2018 23:48:56.076642000 CET
    [Time shift for this packet: 0.000000000 seconds]
    Epoch Time: 1515451736.076642000 seconds
    [Time delta from previous captured frame: 0.000009000 seconds]
    [Time delta from previous displayed frame: 0.000009000 seconds]
    [Time since reference or first frame: 0.169962000 seconds]
    Frame Number: 22
    Frame Length: 64 bytes (512 bits)
    Capture Length: 64 bytes (512 bits)
    [Frame is marked: False]
    [Frame is ignored: False]
    [Protocols in frame: usb]
USB URB
    [Source: 1.1.0]
    [Destination: host]
    URB id: 0xffff993e827d5900
    URB type: URB_COMPLETE ('C')
    URB transfer type: URB_CONTROL (0x02)
    Endpoint: 0x00, Direction: OUT
        0... .... = Direction: OUT (0)
        .... 0000 = Endpoint number: 0
    Device: 1
    URB bus id: 1
    Device setup request: not relevant ('-')
    Data: not present ('>')
    URB sec: 1515451736
    URB usec: 76642
    URB status: Success (0)
    URB length [bytes]: 0
    Data length [bytes]: 0
    [Request in: 21]
    [Time from request: 0.000009000 seconds]
    Unused Setup Header
    Interval: 0
    Start frame: 0
    Copy of Transfer Flags: 0x00000000
    Number of ISO descriptors: 0
    [bInterfaceClass: Unknown (0xffff)]

0000  00 59 7d 82 3e 99 ff ff 43 02 00 01 01 00 2d 3e   .Y}.>...C.....->
0010  58 f5 53 5a 00 00 00 00 62 2b 01 00 00 00 00 00   X.SZ....b+......
0020  00 00 00 00 00 00 00 00 00 00 00 00 00 00 00 00   ................
0030  00 00 00 00 00 00 00 00 00 00 00 00 00 00 00 00   ................

     23 0.221615       host                  1.0.0                 USB      64     GET DESCRIPTOR Request DEVICE

Frame 23: 64 bytes on wire (512 bits), 64 bytes captured (512 bits) on interface 0
    Interface id: 0 (usbmon0)
        Interface name: usbmon0
    Encapsulation type: USB packets with Linux header and padding (115)
    Arrival Time: Jan  8, 2018 23:48:56.128295000 CET
    [Time shift for this packet: 0.000000000 seconds]
    Epoch Time: 1515451736.128295000 seconds
    [Time delta from previous captured frame: 0.051653000 seconds]
    [Time delta from previous displayed frame: 0.051653000 seconds]
    [Time since reference or first frame: 0.221615000 seconds]
    Frame Number: 23
    Frame Length: 64 bytes (512 bits)
    Capture Length: 64 bytes (512 bits)
    [Frame is marked: False]
    [Frame is ignored: False]
    [Protocols in frame: usb]
USB URB
    [Source: host]
    [Destination: 1.0.0]
    URB id: 0xffff993e827d5900
    URB type: URB_SUBMIT ('S')
    URB transfer type: URB_CONTROL (0x02)
    Endpoint: 0x80, Direction: IN
        1... .... = Direction: IN (1)
        .... 0000 = Endpoint number: 0
    Device: 0
    URB bus id: 1
    Device setup request: relevant (0)
    Data: not present ('<')
    URB sec: 1515451736
    URB usec: 128295
    URB status: Operation now in progress (-EINPROGRESS) (-115)
    URB length [bytes]: 64
    Data length [bytes]: 0
    [Response in: 24]
    Interval: 0
    Start frame: 0
    Copy of Transfer Flags: 0x00000200
    Number of ISO descriptors: 0
URB setup
    bmRequestType: 0x80
        1... .... = Direction: Device-to-host
        .00. .... = Type: Standard (0x0)
        ...0 0000 = Recipient: Device (0x00)
    bRequest: GET DESCRIPTOR (6)
    Descriptor Index: 0x00
    bDescriptorType: 0x01
    Language Id: no language specified (0x0000)
    wLength: 64

0000  00 59 7d 82 3e 99 ff ff 53 02 80 00 01 00 00 3c   .Y}.>...S......<
0010  58 f5 53 5a 00 00 00 00 27 f5 01 00 8d ff ff ff   X.SZ....'.......
0020  40 00 00 00 00 00 00 00 80 06 00 01 00 00 40 00   @.............@.
0030  00 00 00 00 00 00 00 00 00 02 00 00 00 00 00 00   ................

     24 0.222849       1.0.0                 host                  USB      82     GET DESCRIPTOR Response DEVICE

Frame 24: 82 bytes on wire (656 bits), 82 bytes captured (656 bits) on interface 0
    Interface id: 0 (usbmon0)
        Interface name: usbmon0
    Encapsulation type: USB packets with Linux header and padding (115)
    Arrival Time: Jan  8, 2018 23:48:56.129529000 CET
    [Time shift for this packet: 0.000000000 seconds]
    Epoch Time: 1515451736.129529000 seconds
    [Time delta from previous captured frame: 0.001234000 seconds]
    [Time delta from previous displayed frame: 0.001234000 seconds]
    [Time since reference or first frame: 0.222849000 seconds]
    Frame Number: 24
    Frame Length: 82 bytes (656 bits)
    Capture Length: 82 bytes (656 bits)
    [Frame is marked: False]
    [Frame is ignored: False]
    [Protocols in frame: usb]
USB URB
    [Source: 1.0.0]
    [Destination: host]
    URB id: 0xffff993e827d5900
    URB type: URB_COMPLETE ('C')
    URB transfer type: URB_CONTROL (0x02)
    Endpoint: 0x80, Direction: IN
        1... .... = Direction: IN (1)
        .... 0000 = Endpoint number: 0
    Device: 0
    URB bus id: 1
    Device setup request: not relevant ('-')
    Data: present (0)
    URB sec: 1515451736
    URB usec: 129529
    URB status: Success (0)
    URB length [bytes]: 18
    Data length [bytes]: 18
    [Request in: 23]
    [Time from request: 0.001234000 seconds]
    Unused Setup Header
    Interval: 0
    Start frame: 0
    Copy of Transfer Flags: 0x00000200
    Number of ISO descriptors: 0
DEVICE DESCRIPTOR
    bLength: 18
    bDescriptorType: 0x01 (DEVICE)
    bcdUSB: 0x0110
    bDeviceClass: Device (0x00)
    bDeviceSubClass: 0
    bDeviceProtocol: 0 (Use class code info from Interface Descriptors)
    bMaxPacketSize0: 8
    idVendor: Chesen Electronics Corp. (0x0a81)
    idProduct: Keyboard (0x0101)
    bcdDevice: 0x0110
    iManufacturer: 1
    iProduct: 2
    iSerialNumber: 0
    bNumConfigurations: 1

0000  00 59 7d 82 3e 99 ff ff 43 02 80 00 01 00 2d 00   .Y}.>...C.....-.
0010  58 f5 53 5a 00 00 00 00 f9 f9 01 00 00 00 00 00   X.SZ............
0020  12 00 00 00 12 00 00 00 00 00 00 00 00 00 00 00   ................
0030  00 00 00 00 00 00 00 00 00 02 00 00 00 00 00 00   ................
0040  12 01 10 01 00 00 00 08 81 0a 01 01 10 01 01 02   ................
0050  00 01                                             ..

     25 0.223482       host                  1.1.0                 USBHUB   64     SET_FEATURE Request    [Port 4: PORT_RESET]

Frame 25: 64 bytes on wire (512 bits), 64 bytes captured (512 bits) on interface 0
    Interface id: 0 (usbmon0)
        Interface name: usbmon0
    Encapsulation type: USB packets with Linux header and padding (115)
    Arrival Time: Jan  8, 2018 23:48:56.130162000 CET
    [Time shift for this packet: 0.000000000 seconds]
    Epoch Time: 1515451736.130162000 seconds
    [Time delta from previous captured frame: 0.000633000 seconds]
    [Time delta from previous displayed frame: 0.000633000 seconds]
    [Time since reference or first frame: 0.223482000 seconds]
    Frame Number: 25
    Frame Length: 64 bytes (512 bits)
    Capture Length: 64 bytes (512 bits)
    [Frame is marked: False]
    [Frame is ignored: False]
    [Protocols in frame: usb:usbhub]
USB URB
    [Source: host]
    [Destination: 1.1.0]
    URB id: 0xffff993e827d5900
    URB type: URB_SUBMIT ('S')
    URB transfer type: URB_CONTROL (0x02)
    Endpoint: 0x00, Direction: OUT
        0... .... = Direction: OUT (0)
        .... 0000 = Endpoint number: 0
    Device: 1
    URB bus id: 1
    Device setup request: relevant (0)
    Data: present (0)
    URB sec: 1515451736
    URB usec: 130162
    URB status: Operation now in progress (-EINPROGRESS) (-115)
    URB length [bytes]: 0
    Data length [bytes]: 0
    [Response in: 26]
    Interval: 0
    Start frame: 0
    Copy of Transfer Flags: 0x00000000
    Number of ISO descriptors: 0
    [bInterfaceClass: Unknown (0xffff)]
URB setup
    bmRequestType: 0x23
        0... .... = Direction: Host-to-device
        .01. .... = Type: Class (0x1)
        ...0 0011 = Recipient: Other (0x03)
bRequest: SET_FEATURE (0x03)
wValue: 0x0004
    PortFeatureSelector: PORT_RESET (4)
wIndex: 4
    Port: 4
    PortSelector: 0
wLength: 0
    (zero): 0

0000  00 59 7d 82 3e 99 ff ff 53 02 00 01 01 00 00 00   .Y}.>...S.......
0010  58 f5 53 5a 00 00 00 00 72 fc 01 00 8d ff ff ff   X.SZ....r.......
0020  00 00 00 00 00 00 00 00 23 03 04 00 04 00 00 00   ........#.......
0030  00 00 00 00 00 00 00 00 00 00 00 00 00 00 00 00   ................

     26 0.223520       1.1.0                 host                  USBHUB   64     SET_FEATURE Response   [Port 4: PORT_RESET]

Frame 26: 64 bytes on wire (512 bits), 64 bytes captured (512 bits) on interface 0
    Interface id: 0 (usbmon0)
        Interface name: usbmon0
    Encapsulation type: USB packets with Linux header and padding (115)
    Arrival Time: Jan  8, 2018 23:48:56.130200000 CET
    [Time shift for this packet: 0.000000000 seconds]
    Epoch Time: 1515451736.130200000 seconds
    [Time delta from previous captured frame: 0.000038000 seconds]
    [Time delta from previous displayed frame: 0.000038000 seconds]
    [Time since reference or first frame: 0.223520000 seconds]
    Frame Number: 26
    Frame Length: 64 bytes (512 bits)
    Capture Length: 64 bytes (512 bits)
    [Frame is marked: False]
    [Frame is ignored: False]
    [Protocols in frame: usb]
USB URB
    [Source: 1.1.0]
    [Destination: host]
    URB id: 0xffff993e827d5900
    URB type: URB_COMPLETE ('C')
    URB transfer type: URB_CONTROL (0x02)
    Endpoint: 0x00, Direction: OUT
        0... .... = Direction: OUT (0)
        .... 0000 = Endpoint number: 0
    Device: 1
    URB bus id: 1
    Device setup request: not relevant ('-')
    Data: not present ('>')
    URB sec: 1515451736
    URB usec: 130200
    URB status: Success (0)
    URB length [bytes]: 0
    Data length [bytes]: 0
    [Request in: 25]
    [Time from request: 0.000038000 seconds]
    Unused Setup Header
    Interval: 0
    Start frame: 0
    Copy of Transfer Flags: 0x00000000
    Number of ISO descriptors: 0
    [bInterfaceClass: Unknown (0xffff)]

0000  00 59 7d 82 3e 99 ff ff 43 02 00 01 01 00 2d 3e   .Y}.>...C.....->
0010  58 f5 53 5a 00 00 00 00 98 fc 01 00 00 00 00 00   X.SZ............
0020  00 00 00 00 00 00 00 00 00 00 00 00 00 00 00 00   ................
0030  00 00 00 00 00 00 00 00 00 00 00 00 00 00 00 00   ................

     27 0.285883       host                  1.1.0                 USBHUB   64     GET_STATUS Request     [Port 4]

Frame 27: 64 bytes on wire (512 bits), 64 bytes captured (512 bits) on interface 0
    Interface id: 0 (usbmon0)
        Interface name: usbmon0
    Encapsulation type: USB packets with Linux header and padding (115)
    Arrival Time: Jan  8, 2018 23:48:56.192563000 CET
    [Time shift for this packet: 0.000000000 seconds]
    Epoch Time: 1515451736.192563000 seconds
    [Time delta from previous captured frame: 0.062363000 seconds]
    [Time delta from previous displayed frame: 0.062363000 seconds]
    [Time since reference or first frame: 0.285883000 seconds]
    Frame Number: 27
    Frame Length: 64 bytes (512 bits)
    Capture Length: 64 bytes (512 bits)
    [Frame is marked: False]
    [Frame is ignored: False]
    [Protocols in frame: usb:usbhub]
USB URB
    [Source: host]
    [Destination: 1.1.0]
    URB id: 0xffff993e827d5900
    URB type: URB_SUBMIT ('S')
    URB transfer type: URB_CONTROL (0x02)
    Endpoint: 0x80, Direction: IN
        1... .... = Direction: IN (1)
        .... 0000 = Endpoint number: 0
    Device: 1
    URB bus id: 1
    Device setup request: relevant (0)
    Data: not present ('<')
    URB sec: 1515451736
    URB usec: 192563
    URB status: Operation now in progress (-EINPROGRESS) (-115)
    URB length [bytes]: 4
    Data length [bytes]: 0
    [Response in: 28]
    Interval: 0
    Start frame: 0
    Copy of Transfer Flags: 0x00000200
    Number of ISO descriptors: 0
    [bInterfaceClass: Unknown (0xffff)]
URB setup
    bmRequestType: 0xa3
        1... .... = Direction: Device-to-host
        .01. .... = Type: Class (0x1)
        ...0 0011 = Recipient: Other (0x03)
bRequest: GET_STATUS (0x00)
wValue: 0x0000
    (zero): 0
wIndex: 4
    Port: 4
wLength: 4

0000  00 59 7d 82 3e 99 ff ff 53 02 80 01 01 00 00 3c   .Y}.>...S......<
0010  58 f5 53 5a 00 00 00 00 33 f0 02 00 8d ff ff ff   X.SZ....3.......
0020  04 00 00 00 00 00 00 00 a3 00 00 00 04 00 04 00   ................
0030  00 00 00 00 00 00 00 00 00 02 00 00 00 00 00 00   ................

     28 0.285943       1.1.0                 host                  USBHUB   68     GET_STATUS Response    [Port 4]

Frame 28: 68 bytes on wire (544 bits), 68 bytes captured (544 bits) on interface 0
    Interface id: 0 (usbmon0)
        Interface name: usbmon0
    Encapsulation type: USB packets with Linux header and padding (115)
    Arrival Time: Jan  8, 2018 23:48:56.192623000 CET
    [Time shift for this packet: 0.000000000 seconds]
    Epoch Time: 1515451736.192623000 seconds
    [Time delta from previous captured frame: 0.000060000 seconds]
    [Time delta from previous displayed frame: 0.000060000 seconds]
    [Time since reference or first frame: 0.285943000 seconds]
    Frame Number: 28
    Frame Length: 68 bytes (544 bits)
    Capture Length: 68 bytes (544 bits)
    [Frame is marked: False]
    [Frame is ignored: False]
    [Protocols in frame: usb:usbhub]
USB URB
    [Source: 1.1.0]
    [Destination: host]
    URB id: 0xffff993e827d5900
    URB type: URB_COMPLETE ('C')
    URB transfer type: URB_CONTROL (0x02)
    Endpoint: 0x80, Direction: IN
        1... .... = Direction: IN (1)
        .... 0000 = Endpoint number: 0
    Device: 1
    URB bus id: 1
    Device setup request: not relevant ('-')
    Data: present (0)
    URB sec: 1515451736
    URB usec: 192623
    URB status: Success (0)
    URB length [bytes]: 4
    Data length [bytes]: 4
    [Request in: 27]
    [Time from request: 0.000060000 seconds]
    Unused Setup Header
    Interval: 0
    Start frame: 0
    Copy of Transfer Flags: 0x00000200
    Number of ISO descriptors: 0
    [bInterfaceClass: Unknown (0xffff)]
Port Status: 0x0303, PORT_CONNECTION, PORT_ENABLE, PORT_POWER, PORT_LOW_SPEED
    .... .... .... ...1 = PORT_CONNECTION: True
    .... .... .... ..1. = PORT_ENABLE: True
    .... .... .... .0.. = PORT_SUSPEND: False
    .... .... .... 0... = PORT_OVER_CURRENT: False
    .... .... ...0 .... = PORT_RESET: False
    .... ...1 .... .... = PORT_POWER: True
    .... ..1. .... .... = PORT_LOW_SPEED: True
    .... .0.. .... .... = PORT_HIGH_SPEED: False
    .... 0... .... .... = PORT_TEST: False
    ...0 .... .... .... = PORT_INDICATOR: Default colors
Port Change: 0x0010, C_PORT_RESET
    .... .... .... ...0 = C_PORT_CONNECTION: False
    .... .... .... ..0. = C_PORT_ENABLE: False
    .... .... .... .0.. = C_PORT_SUSPEND: False
    .... .... .... 0... = C_PORT_OVER_CURRENT: False
    .... .... ...1 .... = C_PORT_RESET: True

0000  00 59 7d 82 3e 99 ff ff 43 02 80 01 01 00 2d 00   .Y}.>...C.....-.
0010  58 f5 53 5a 00 00 00 00 6f f0 02 00 00 00 00 00   X.SZ....o.......
0020  04 00 00 00 04 00 00 00 00 00 00 00 00 00 00 00   ................
0030  00 00 00 00 00 00 00 00 00 02 00 00 00 00 00 00   ................
0040  03 03 10 00                                       ....

     29 0.285957       host                  1.1.0                 USBHUB   64     CLEAR_FEATURE Request  [Port 4: C_PORT_RESET]

Frame 29: 64 bytes on wire (512 bits), 64 bytes captured (512 bits) on interface 0
    Interface id: 0 (usbmon0)
        Interface name: usbmon0
    Encapsulation type: USB packets with Linux header and padding (115)
    Arrival Time: Jan  8, 2018 23:48:56.192637000 CET
    [Time shift for this packet: 0.000000000 seconds]
    Epoch Time: 1515451736.192637000 seconds
    [Time delta from previous captured frame: 0.000014000 seconds]
    [Time delta from previous displayed frame: 0.000014000 seconds]
    [Time since reference or first frame: 0.285957000 seconds]
    Frame Number: 29
    Frame Length: 64 bytes (512 bits)
    Capture Length: 64 bytes (512 bits)
    [Frame is marked: False]
    [Frame is ignored: False]
    [Protocols in frame: usb:usbhub]
USB URB
    [Source: host]
    [Destination: 1.1.0]
    URB id: 0xffff993e827d5900
    URB type: URB_SUBMIT ('S')
    URB transfer type: URB_CONTROL (0x02)
    Endpoint: 0x00, Direction: OUT
        0... .... = Direction: OUT (0)
        .... 0000 = Endpoint number: 0
    Device: 1
    URB bus id: 1
    Device setup request: relevant (0)
    Data: present (0)
    URB sec: 1515451736
    URB usec: 192637
    URB status: Operation now in progress (-EINPROGRESS) (-115)
    URB length [bytes]: 0
    Data length [bytes]: 0
    [Response in: 30]
    Interval: 0
    Start frame: 0
    Copy of Transfer Flags: 0x00000000
    Number of ISO descriptors: 0
    [bInterfaceClass: Unknown (0xffff)]
URB setup
    bmRequestType: 0x23
        0... .... = Direction: Host-to-device
        .01. .... = Type: Class (0x1)
        ...0 0011 = Recipient: Other (0x03)
bRequest: CLEAR_FEATURE (0x01)
wValue: 0x0014
    PortFeatureSelector: C_PORT_RESET (20)
wIndex: 4
    Port: 4
    PortSelector: 0
wLength: 0
    (zero): 0

0000  00 59 7d 82 3e 99 ff ff 53 02 00 01 01 00 00 00   .Y}.>...S.......
0010  58 f5 53 5a 00 00 00 00 7d f0 02 00 8d ff ff ff   X.SZ....}.......
0020  00 00 00 00 00 00 00 00 23 01 14 00 04 00 00 00   ........#.......
0030  00 00 00 00 00 00 00 00 00 00 00 00 00 00 00 00   ................

     30 0.285965       1.1.0                 host                  USBHUB   64     CLEAR_FEATURE Response [Port 4: C_PORT_RESET]

Frame 30: 64 bytes on wire (512 bits), 64 bytes captured (512 bits) on interface 0
    Interface id: 0 (usbmon0)
        Interface name: usbmon0
    Encapsulation type: USB packets with Linux header and padding (115)
    Arrival Time: Jan  8, 2018 23:48:56.192645000 CET
    [Time shift for this packet: 0.000000000 seconds]
    Epoch Time: 1515451736.192645000 seconds
    [Time delta from previous captured frame: 0.000008000 seconds]
    [Time delta from previous displayed frame: 0.000008000 seconds]
    [Time since reference or first frame: 0.285965000 seconds]
    Frame Number: 30
    Frame Length: 64 bytes (512 bits)
    Capture Length: 64 bytes (512 bits)
    [Frame is marked: False]
    [Frame is ignored: False]
    [Protocols in frame: usb]
USB URB
    [Source: 1.1.0]
    [Destination: host]
    URB id: 0xffff993e827d5900
    URB type: URB_COMPLETE ('C')
    URB transfer type: URB_CONTROL (0x02)
    Endpoint: 0x00, Direction: OUT
        0... .... = Direction: OUT (0)
        .... 0000 = Endpoint number: 0
    Device: 1
    URB bus id: 1
    Device setup request: not relevant ('-')
    Data: not present ('>')
    URB sec: 1515451736
    URB usec: 192645
    URB status: Success (0)
    URB length [bytes]: 0
    Data length [bytes]: 0
    [Request in: 29]
    [Time from request: 0.000008000 seconds]
    Unused Setup Header
    Interval: 0
    Start frame: 0
    Copy of Transfer Flags: 0x00000000
    Number of ISO descriptors: 0
    [bInterfaceClass: Unknown (0xffff)]

0000  00 59 7d 82 3e 99 ff ff 43 02 00 01 01 00 2d 3e   .Y}.>...C.....->
0010  58 f5 53 5a 00 00 00 00 85 f0 02 00 00 00 00 00   X.SZ............
0020  00 00 00 00 00 00 00 00 00 00 00 00 00 00 00 00   ................
0030  00 00 00 00 00 00 00 00 00 00 00 00 00 00 00 00   ................

     31 0.349874       host                  1.18.0                USB      64     GET DESCRIPTOR Request DEVICE

Frame 31: 64 bytes on wire (512 bits), 64 bytes captured (512 bits) on interface 0
    Interface id: 0 (usbmon0)
        Interface name: usbmon0
    Encapsulation type: USB packets with Linux header and padding (115)
    Arrival Time: Jan  8, 2018 23:48:56.256554000 CET
    [Time shift for this packet: 0.000000000 seconds]
    Epoch Time: 1515451736.256554000 seconds
    [Time delta from previous captured frame: 0.063909000 seconds]
    [Time delta from previous displayed frame: 0.063909000 seconds]
    [Time since reference or first frame: 0.349874000 seconds]
    Frame Number: 31
    Frame Length: 64 bytes (512 bits)
    Capture Length: 64 bytes (512 bits)
    [Frame is marked: False]
    [Frame is ignored: False]
    [Protocols in frame: usb]
USB URB
    [Source: host]
    [Destination: 1.18.0]
    URB id: 0xffff993e827d5900
    URB type: URB_SUBMIT ('S')
    URB transfer type: URB_CONTROL (0x02)
    Endpoint: 0x80, Direction: IN
        1... .... = Direction: IN (1)
        .... 0000 = Endpoint number: 0
    Device: 18
    URB bus id: 1
    Device setup request: relevant (0)
    Data: not present ('<')
    URB sec: 1515451736
    URB usec: 256554
    URB status: Operation now in progress (-EINPROGRESS) (-115)
    URB length [bytes]: 18
    Data length [bytes]: 0
    [Response in: 32]
    Interval: 0
    Start frame: 0
    Copy of Transfer Flags: 0x00000200
    Number of ISO descriptors: 0
URB setup
    bmRequestType: 0x80
        1... .... = Direction: Device-to-host
        .00. .... = Type: Standard (0x0)
        ...0 0000 = Recipient: Device (0x00)
    bRequest: GET DESCRIPTOR (6)
    Descriptor Index: 0x00
    bDescriptorType: 0x01
    Language Id: no language specified (0x0000)
    wLength: 18

0000  00 59 7d 82 3e 99 ff ff 53 02 80 12 01 00 00 3c   .Y}.>...S......<
0010  58 f5 53 5a 00 00 00 00 2a ea 03 00 8d ff ff ff   X.SZ....*.......
0020  12 00 00 00 00 00 00 00 80 06 00 01 00 00 12 00   ................
0030  00 00 00 00 00 00 00 00 00 02 00 00 00 00 00 00   ................

     32 0.351188       1.18.0                host                  USB      82     GET DESCRIPTOR Response DEVICE

Frame 32: 82 bytes on wire (656 bits), 82 bytes captured (656 bits) on interface 0
    Interface id: 0 (usbmon0)
        Interface name: usbmon0
    Encapsulation type: USB packets with Linux header and padding (115)
    Arrival Time: Jan  8, 2018 23:48:56.257868000 CET
    [Time shift for this packet: 0.000000000 seconds]
    Epoch Time: 1515451736.257868000 seconds
    [Time delta from previous captured frame: 0.001314000 seconds]
    [Time delta from previous displayed frame: 0.001314000 seconds]
    [Time since reference or first frame: 0.351188000 seconds]
    Frame Number: 32
    Frame Length: 82 bytes (656 bits)
    Capture Length: 82 bytes (656 bits)
    [Frame is marked: False]
    [Frame is ignored: False]
    [Protocols in frame: usb]
USB URB
    [Source: 1.18.0]
    [Destination: host]
    URB id: 0xffff993e827d5900
    URB type: URB_COMPLETE ('C')
    URB transfer type: URB_CONTROL (0x02)
    Endpoint: 0x80, Direction: IN
        1... .... = Direction: IN (1)
        .... 0000 = Endpoint number: 0
    Device: 18
    URB bus id: 1
    Device setup request: not relevant ('-')
    Data: present (0)
    URB sec: 1515451736
    URB usec: 257868
    URB status: Success (0)
    URB length [bytes]: 18
    Data length [bytes]: 18
    [Request in: 31]
    [Time from request: 0.001314000 seconds]
    Unused Setup Header
    Interval: 0
    Start frame: 0
    Copy of Transfer Flags: 0x00000200
    Number of ISO descriptors: 0
DEVICE DESCRIPTOR
    bLength: 18
    bDescriptorType: 0x01 (DEVICE)
    bcdUSB: 0x0110
    bDeviceClass: Device (0x00)
    bDeviceSubClass: 0
    bDeviceProtocol: 0 (Use class code info from Interface Descriptors)
    bMaxPacketSize0: 8
    idVendor: Chesen Electronics Corp. (0x0a81)
    idProduct: Keyboard (0x0101)
    bcdDevice: 0x0110
    iManufacturer: 1
    iProduct: 2
    iSerialNumber: 0
    bNumConfigurations: 1

0000  00 59 7d 82 3e 99 ff ff 43 02 80 12 01 00 2d 00   .Y}.>...C.....-.
0010  58 f5 53 5a 00 00 00 00 4c ef 03 00 00 00 00 00   X.SZ....L.......
0020  12 00 00 00 12 00 00 00 00 00 00 00 00 00 00 00   ................
0030  00 00 00 00 00 00 00 00 00 02 00 00 00 00 00 00   ................
0040  12 01 10 01 00 00 00 08 81 0a 01 01 10 01 01 02   ................
0050  00 01                                             ..

     33 0.351267       host                  1.18.0                USB      64     GET DESCRIPTOR Request CONFIGURATION

Frame 33: 64 bytes on wire (512 bits), 64 bytes captured (512 bits) on interface 0
    Interface id: 0 (usbmon0)
        Interface name: usbmon0
    Encapsulation type: USB packets with Linux header and padding (115)
    Arrival Time: Jan  8, 2018 23:48:56.257947000 CET
    [Time shift for this packet: 0.000000000 seconds]
    Epoch Time: 1515451736.257947000 seconds
    [Time delta from previous captured frame: 0.000079000 seconds]
    [Time delta from previous displayed frame: 0.000079000 seconds]
    [Time since reference or first frame: 0.351267000 seconds]
    Frame Number: 33
    Frame Length: 64 bytes (512 bits)
    Capture Length: 64 bytes (512 bits)
    [Frame is marked: False]
    [Frame is ignored: False]
    [Protocols in frame: usb]
USB URB
    [Source: host]
    [Destination: 1.18.0]
    URB id: 0xffff993e827d5900
    URB type: URB_SUBMIT ('S')
    URB transfer type: URB_CONTROL (0x02)
    Endpoint: 0x80, Direction: IN
        1... .... = Direction: IN (1)
        .... 0000 = Endpoint number: 0
    Device: 18
    URB bus id: 1
    Device setup request: relevant (0)
    Data: not present ('<')
    URB sec: 1515451736
    URB usec: 257947
    URB status: Operation now in progress (-EINPROGRESS) (-115)
    URB length [bytes]: 9
    Data length [bytes]: 0
    [Response in: 34]
    Interval: 0
    Start frame: 0
    Copy of Transfer Flags: 0x00000200
    Number of ISO descriptors: 0
URB setup
    bmRequestType: 0x80
        1... .... = Direction: Device-to-host
        .00. .... = Type: Standard (0x0)
        ...0 0000 = Recipient: Device (0x00)
    bRequest: GET DESCRIPTOR (6)
    Descriptor Index: 0x00
    bDescriptorType: 0x02
    Language Id: no language specified (0x0000)
    wLength: 9

0000  00 59 7d 82 3e 99 ff ff 53 02 80 12 01 00 00 3c   .Y}.>...S......<
0010  58 f5 53 5a 00 00 00 00 9b ef 03 00 8d ff ff ff   X.SZ............
0020  09 00 00 00 00 00 00 00 80 06 00 02 00 00 09 00   ................
0030  00 00 00 00 00 00 00 00 00 02 00 00 00 00 00 00   ................

     34 0.352218       1.18.0                host                  USB      73     GET DESCRIPTOR Response CONFIGURATION

Frame 34: 73 bytes on wire (584 bits), 73 bytes captured (584 bits) on interface 0
    Interface id: 0 (usbmon0)
        Interface name: usbmon0
    Encapsulation type: USB packets with Linux header and padding (115)
    Arrival Time: Jan  8, 2018 23:48:56.258898000 CET
    [Time shift for this packet: 0.000000000 seconds]
    Epoch Time: 1515451736.258898000 seconds
    [Time delta from previous captured frame: 0.000951000 seconds]
    [Time delta from previous displayed frame: 0.000951000 seconds]
    [Time since reference or first frame: 0.352218000 seconds]
    Frame Number: 34
    Frame Length: 73 bytes (584 bits)
    Capture Length: 73 bytes (584 bits)
    [Frame is marked: False]
    [Frame is ignored: False]
    [Protocols in frame: usb]
USB URB
    [Source: 1.18.0]
    [Destination: host]
    URB id: 0xffff993e827d5900
    URB type: URB_COMPLETE ('C')
    URB transfer type: URB_CONTROL (0x02)
    Endpoint: 0x80, Direction: IN
        1... .... = Direction: IN (1)
        .... 0000 = Endpoint number: 0
    Device: 18
    URB bus id: 1
    Device setup request: not relevant ('-')
    Data: present (0)
    URB sec: 1515451736
    URB usec: 258898
    URB status: Success (0)
    URB length [bytes]: 9
    Data length [bytes]: 9
    [Request in: 33]
    [Time from request: 0.000951000 seconds]
    Unused Setup Header
    Interval: 0
    Start frame: 0
    Copy of Transfer Flags: 0x00000200
    Number of ISO descriptors: 0
CONFIGURATION DESCRIPTOR
    bLength: 9
    bDescriptorType: 0x02 (CONFIGURATION)
    wTotalLength: 59
    bNumInterfaces: 2
    bConfigurationValue: 1
    iConfiguration: 0
    Configuration bmAttributes: 0xa0  NOT SELF-POWERED  REMOTE-WAKEUP
        1... .... = Must be 1: Must be 1 for USB 1.1 and higher
        .0.. .... = Self-Powered: This device is powered from the USB bus
        ..1. .... = Remote Wakeup: This device supports REMOTE WAKEUP
    bMaxPower: 50  (100mA)

0000  00 59 7d 82 3e 99 ff ff 43 02 80 12 01 00 2d 00   .Y}.>...C.....-.
0010  58 f5 53 5a 00 00 00 00 52 f3 03 00 00 00 00 00   X.SZ....R.......
0020  09 00 00 00 09 00 00 00 00 00 00 00 00 00 00 00   ................
0030  00 00 00 00 00 00 00 00 00 02 00 00 00 00 00 00   ................
0040  09 02 3b 00 02 01 00 a0 32                        ..;.....2

     35 0.352280       host                  1.18.0                USB      64     GET DESCRIPTOR Request CONFIGURATION

Frame 35: 64 bytes on wire (512 bits), 64 bytes captured (512 bits) on interface 0
    Interface id: 0 (usbmon0)
        Interface name: usbmon0
    Encapsulation type: USB packets with Linux header and padding (115)
    Arrival Time: Jan  8, 2018 23:48:56.258960000 CET
    [Time shift for this packet: 0.000000000 seconds]
    Epoch Time: 1515451736.258960000 seconds
    [Time delta from previous captured frame: 0.000062000 seconds]
    [Time delta from previous displayed frame: 0.000062000 seconds]
    [Time since reference or first frame: 0.352280000 seconds]
    Frame Number: 35
    Frame Length: 64 bytes (512 bits)
    Capture Length: 64 bytes (512 bits)
    [Frame is marked: False]
    [Frame is ignored: False]
    [Protocols in frame: usb]
USB URB
    [Source: host]
    [Destination: 1.18.0]
    URB id: 0xffff993e827d5900
    URB type: URB_SUBMIT ('S')
    URB transfer type: URB_CONTROL (0x02)
    Endpoint: 0x80, Direction: IN
        1... .... = Direction: IN (1)
        .... 0000 = Endpoint number: 0
    Device: 18
    URB bus id: 1
    Device setup request: relevant (0)
    Data: not present ('<')
    URB sec: 1515451736
    URB usec: 258960
    URB status: Operation now in progress (-EINPROGRESS) (-115)
    URB length [bytes]: 59
    Data length [bytes]: 0
    [Response in: 36]
    Interval: 0
    Start frame: 0
    Copy of Transfer Flags: 0x00000200
    Number of ISO descriptors: 0
URB setup
    bmRequestType: 0x80
        1... .... = Direction: Device-to-host
        .00. .... = Type: Standard (0x0)
        ...0 0000 = Recipient: Device (0x00)
    bRequest: GET DESCRIPTOR (6)
    Descriptor Index: 0x00
    bDescriptorType: 0x02
    Language Id: no language specified (0x0000)
    wLength: 59

0000  00 59 7d 82 3e 99 ff ff 53 02 80 12 01 00 00 3c   .Y}.>...S......<
0010  58 f5 53 5a 00 00 00 00 90 f3 03 00 8d ff ff ff   X.SZ............
0020  3b 00 00 00 00 00 00 00 80 06 00 02 00 00 3b 00   ;.............;.
0030  00 00 00 00 00 00 00 00 00 02 00 00 00 00 00 00   ................

     36 0.355609       1.18.0                host                  USB      123    GET DESCRIPTOR Response CONFIGURATION

Frame 36: 123 bytes on wire (984 bits), 123 bytes captured (984 bits) on interface 0
    Interface id: 0 (usbmon0)
        Interface name: usbmon0
    Encapsulation type: USB packets with Linux header and padding (115)
    Arrival Time: Jan  8, 2018 23:48:56.262289000 CET
    [Time shift for this packet: 0.000000000 seconds]
    Epoch Time: 1515451736.262289000 seconds
    [Time delta from previous captured frame: 0.003329000 seconds]
    [Time delta from previous displayed frame: 0.003329000 seconds]
    [Time since reference or first frame: 0.355609000 seconds]
    Frame Number: 36
    Frame Length: 123 bytes (984 bits)
    Capture Length: 123 bytes (984 bits)
    [Frame is marked: False]
    [Frame is ignored: False]
    [Protocols in frame: usb:usbhid:usbhid]
USB URB
    [Source: 1.18.0]
    [Destination: host]
    URB id: 0xffff993e827d5900
    URB type: URB_COMPLETE ('C')
    URB transfer type: URB_CONTROL (0x02)
    Endpoint: 0x80, Direction: IN
        1... .... = Direction: IN (1)
        .... 0000 = Endpoint number: 0
    Device: 18
    URB bus id: 1
    Device setup request: not relevant ('-')
    Data: present (0)
    URB sec: 1515451736
    URB usec: 262289
    URB status: Success (0)
    URB length [bytes]: 59
    Data length [bytes]: 59
    [Request in: 35]
    [Time from request: 0.003329000 seconds]
    Unused Setup Header
    Interval: 0
    Start frame: 0
    Copy of Transfer Flags: 0x00000200
    Number of ISO descriptors: 0
CONFIGURATION DESCRIPTOR
    bLength: 9
    bDescriptorType: 0x02 (CONFIGURATION)
    wTotalLength: 59
    bNumInterfaces: 2
    bConfigurationValue: 1
    iConfiguration: 0
    Configuration bmAttributes: 0xa0  NOT SELF-POWERED  REMOTE-WAKEUP
        1... .... = Must be 1: Must be 1 for USB 1.1 and higher
        .0.. .... = Self-Powered: This device is powered from the USB bus
        ..1. .... = Remote Wakeup: This device supports REMOTE WAKEUP
    bMaxPower: 50  (100mA)
INTERFACE DESCRIPTOR (0.0): class HID
    bLength: 9
    bDescriptorType: 0x04 (INTERFACE)
    bInterfaceNumber: 0
    bAlternateSetting: 0
    bNumEndpoints: 1
    bInterfaceClass: HID (0x03)
    bInterfaceSubClass: Boot Interface (0x01)
    bInterfaceProtocol: Keyboard (0x01)
    iInterface: 0
HID DESCRIPTOR
    bLength: 9
    bDescriptorType: 0x21 (HID)
    bcdHID: 0x0110
    bCountryCode: US (0x21)
    bNumDescriptors: 1
    bDescriptorType: HID Report (0x22)
    wDescriptorLength: 65
ENDPOINT DESCRIPTOR
    bLength: 7
    bDescriptorType: 0x05 (ENDPOINT)
    bEndpointAddress: 0x81  IN  Endpoint:1
        1... .... = Direction: IN Endpoint
        .... 0001 = Endpoint Number: 0x1
    bmAttributes: 0x03
        .... ..11 = Transfertype: Interrupt-Transfer (0x3)
    wMaxPacketSize: 8
        ...0 0... .... .... = Transactions per microframe: 1 (0)
        .... ..00 0000 1000 = Maximum Packet Size: 8
    bInterval: 10
INTERFACE DESCRIPTOR (1.0): class HID
    bLength: 9
    bDescriptorType: 0x04 (INTERFACE)
    bInterfaceNumber: 1
    bAlternateSetting: 0
    bNumEndpoints: 1
    bInterfaceClass: HID (0x03)
    bInterfaceSubClass: No Subclass (0x00)
    bInterfaceProtocol: 0x00
    iInterface: 0
HID DESCRIPTOR
    bLength: 9
    bDescriptorType: 0x21 (HID)
    bcdHID: 0x0110
    bCountryCode: US (0x21)
    bNumDescriptors: 1
    bDescriptorType: HID Report (0x22)
    wDescriptorLength: 102
ENDPOINT DESCRIPTOR
    bLength: 7
    bDescriptorType: 0x05 (ENDPOINT)
    bEndpointAddress: 0x82  IN  Endpoint:2
        1... .... = Direction: IN Endpoint
        .... 0010 = Endpoint Number: 0x2
    bmAttributes: 0x03
        .... ..11 = Transfertype: Interrupt-Transfer (0x3)
    wMaxPacketSize: 8
        ...0 0... .... .... = Transactions per microframe: 1 (0)
        .... ..00 0000 1000 = Maximum Packet Size: 8
    bInterval: 10

0000  00 59 7d 82 3e 99 ff ff 43 02 80 12 01 00 2d 00   .Y}.>...C.....-.
0010  58 f5 53 5a 00 00 00 00 91 00 04 00 00 00 00 00   X.SZ............
0020  3b 00 00 00 3b 00 00 00 00 00 00 00 00 00 00 00   ;...;...........
0030  00 00 00 00 00 00 00 00 00 02 00 00 00 00 00 00   ................
0040  09 02 3b 00 02 01 00 a0 32 09 04 00 00 01 03 01   ..;.....2.......
0050  01 00 09 21 10 01 21 01 22 41 00 07 05 81 03 08   ...!..!."A......
0060  00 0a 09 04 01 00 01 03 00 00 00 09 21 10 01 21   ............!..!
0070  01 22 66 00 07 05 82 03 08 00 0a                  ."f........

     37 0.355679       host                  1.18.0                USB      64     GET DESCRIPTOR Request STRING

Frame 37: 64 bytes on wire (512 bits), 64 bytes captured (512 bits) on interface 0
    Interface id: 0 (usbmon0)
        Interface name: usbmon0
    Encapsulation type: USB packets with Linux header and padding (115)
    Arrival Time: Jan  8, 2018 23:48:56.262359000 CET
    [Time shift for this packet: 0.000000000 seconds]
    Epoch Time: 1515451736.262359000 seconds
    [Time delta from previous captured frame: 0.000070000 seconds]
    [Time delta from previous displayed frame: 0.000070000 seconds]
    [Time since reference or first frame: 0.355679000 seconds]
    Frame Number: 37
    Frame Length: 64 bytes (512 bits)
    Capture Length: 64 bytes (512 bits)
    [Frame is marked: False]
    [Frame is ignored: False]
    [Protocols in frame: usb]
USB URB
    [Source: host]
    [Destination: 1.18.0]
    URB id: 0xffff993e827d5900
    URB type: URB_SUBMIT ('S')
    URB transfer type: URB_CONTROL (0x02)
    Endpoint: 0x80, Direction: IN
        1... .... = Direction: IN (1)
        .... 0000 = Endpoint number: 0
    Device: 18
    URB bus id: 1
    Device setup request: relevant (0)
    Data: not present ('<')
    URB sec: 1515451736
    URB usec: 262359
    URB status: Operation now in progress (-EINPROGRESS) (-115)
    URB length [bytes]: 255
    Data length [bytes]: 0
    [Response in: 38]
    Interval: 0
    Start frame: 0
    Copy of Transfer Flags: 0x00000200
    Number of ISO descriptors: 0
URB setup
    bmRequestType: 0x80
        1... .... = Direction: Device-to-host
        .00. .... = Type: Standard (0x0)
        ...0 0000 = Recipient: Device (0x00)
    bRequest: GET DESCRIPTOR (6)
    Descriptor Index: 0x00
    bDescriptorType: 0x03
    Language Id: no language specified (0x0000)
    wLength: 255

0000  00 59 7d 82 3e 99 ff ff 53 02 80 12 01 00 00 3c   .Y}.>...S......<
0010  58 f5 53 5a 00 00 00 00 d7 00 04 00 8d ff ff ff   X.SZ............
0020  ff 00 00 00 00 00 00 00 80 06 00 03 00 00 ff 00   ................
0030  00 00 00 00 00 00 00 00 00 02 00 00 00 00 00 00   ................

     38 0.356285       1.18.0                host                  USB      68     GET DESCRIPTOR Response STRING

Frame 38: 68 bytes on wire (544 bits), 68 bytes captured (544 bits) on interface 0
    Interface id: 0 (usbmon0)
        Interface name: usbmon0
    Encapsulation type: USB packets with Linux header and padding (115)
    Arrival Time: Jan  8, 2018 23:48:56.262965000 CET
    [Time shift for this packet: 0.000000000 seconds]
    Epoch Time: 1515451736.262965000 seconds
    [Time delta from previous captured frame: 0.000606000 seconds]
    [Time delta from previous displayed frame: 0.000606000 seconds]
    [Time since reference or first frame: 0.356285000 seconds]
    Frame Number: 38
    Frame Length: 68 bytes (544 bits)
    Capture Length: 68 bytes (544 bits)
    [Frame is marked: False]
    [Frame is ignored: False]
    [Protocols in frame: usb]
USB URB
    [Source: 1.18.0]
    [Destination: host]
    URB id: 0xffff993e827d5900
    URB type: URB_COMPLETE ('C')
    URB transfer type: URB_CONTROL (0x02)
    Endpoint: 0x80, Direction: IN
        1... .... = Direction: IN (1)
        .... 0000 = Endpoint number: 0
    Device: 18
    URB bus id: 1
    Device setup request: not relevant ('-')
    Data: present (0)
    URB sec: 1515451736
    URB usec: 262965
    URB status: Success (0)
    URB length [bytes]: 4
    Data length [bytes]: 4
    [Request in: 37]
    [Time from request: 0.000606000 seconds]
    Unused Setup Header
    Interval: 0
    Start frame: 0
    Copy of Transfer Flags: 0x00000200
    Number of ISO descriptors: 0
STRING DESCRIPTOR
    bLength: 4
    bDescriptorType: 0x03 (STRING)
    wLANGID: English (United States) (0x0409)

0000  00 59 7d 82 3e 99 ff ff 43 02 80 12 01 00 2d 00   .Y}.>...C.....-.
0010  58 f5 53 5a 00 00 00 00 35 03 04 00 00 00 00 00   X.SZ....5.......
0020  04 00 00 00 04 00 00 00 00 00 00 00 00 00 00 00   ................
0030  00 00 00 00 00 00 00 00 00 02 00 00 00 00 00 00   ................
0040  04 03 09 04                                       ....

     39 0.356344       host                  1.18.0                USB      64     GET DESCRIPTOR Request STRING

Frame 39: 64 bytes on wire (512 bits), 64 bytes captured (512 bits) on interface 0
    Interface id: 0 (usbmon0)
        Interface name: usbmon0
    Encapsulation type: USB packets with Linux header and padding (115)
    Arrival Time: Jan  8, 2018 23:48:56.263024000 CET
    [Time shift for this packet: 0.000000000 seconds]
    Epoch Time: 1515451736.263024000 seconds
    [Time delta from previous captured frame: 0.000059000 seconds]
    [Time delta from previous displayed frame: 0.000059000 seconds]
    [Time since reference or first frame: 0.356344000 seconds]
    Frame Number: 39
    Frame Length: 64 bytes (512 bits)
    Capture Length: 64 bytes (512 bits)
    [Frame is marked: False]
    [Frame is ignored: False]
    [Protocols in frame: usb]
USB URB
    [Source: host]
    [Destination: 1.18.0]
    URB id: 0xffff993e827d5900
    URB type: URB_SUBMIT ('S')
    URB transfer type: URB_CONTROL (0x02)
    Endpoint: 0x80, Direction: IN
        1... .... = Direction: IN (1)
        .... 0000 = Endpoint number: 0
    Device: 18
    URB bus id: 1
    Device setup request: relevant (0)
    Data: not present ('<')
    URB sec: 1515451736
    URB usec: 263024
    URB status: Operation now in progress (-EINPROGRESS) (-115)
    URB length [bytes]: 255
    Data length [bytes]: 0
    [Response in: 40]
    Interval: 0
    Start frame: 0
    Copy of Transfer Flags: 0x00000200
    Number of ISO descriptors: 0
URB setup
    bmRequestType: 0x80
        1... .... = Direction: Device-to-host
        .00. .... = Type: Standard (0x0)
        ...0 0000 = Recipient: Device (0x00)
    bRequest: GET DESCRIPTOR (6)
    Descriptor Index: 0x02
    bDescriptorType: 0x03
    Language Id: English (United States) (0x0409)
    wLength: 255

0000  00 59 7d 82 3e 99 ff ff 53 02 80 12 01 00 00 3c   .Y}.>...S......<
0010  58 f5 53 5a 00 00 00 00 70 03 04 00 8d ff ff ff   X.SZ....p.......
0020  ff 00 00 00 00 00 00 00 80 06 02 03 09 04 ff 00   ................
0030  00 00 00 00 00 00 00 00 00 02 00 00 00 00 00 00   ................

     40 0.358127       1.18.0                host                  USB      90     GET DESCRIPTOR Response STRING

Frame 40: 90 bytes on wire (720 bits), 90 bytes captured (720 bits) on interface 0
    Interface id: 0 (usbmon0)
        Interface name: usbmon0
    Encapsulation type: USB packets with Linux header and padding (115)
    Arrival Time: Jan  8, 2018 23:48:56.264807000 CET
    [Time shift for this packet: 0.000000000 seconds]
    Epoch Time: 1515451736.264807000 seconds
    [Time delta from previous captured frame: 0.001783000 seconds]
    [Time delta from previous displayed frame: 0.001783000 seconds]
    [Time since reference or first frame: 0.358127000 seconds]
    Frame Number: 40
    Frame Length: 90 bytes (720 bits)
    Capture Length: 90 bytes (720 bits)
    [Frame is marked: False]
    [Frame is ignored: False]
    [Protocols in frame: usb]
USB URB
    [Source: 1.18.0]
    [Destination: host]
    URB id: 0xffff993e827d5900
    URB type: URB_COMPLETE ('C')
    URB transfer type: URB_CONTROL (0x02)
    Endpoint: 0x80, Direction: IN
        1... .... = Direction: IN (1)
        .... 0000 = Endpoint number: 0
    Device: 18
    URB bus id: 1
    Device setup request: not relevant ('-')
    Data: present (0)
    URB sec: 1515451736
    URB usec: 264807
    URB status: Success (0)
    URB length [bytes]: 26
    Data length [bytes]: 26
    [Request in: 39]
    [Time from request: 0.001783000 seconds]
    Unused Setup Header
    Interval: 0
    Start frame: 0
    Copy of Transfer Flags: 0x00000200
    Number of ISO descriptors: 0
STRING DESCRIPTOR
    bLength: 26
    bDescriptorType: 0x03 (STRING)
    bString: USB Keyboard

0000  00 59 7d 82 3e 99 ff ff 43 02 80 12 01 00 2d 00   .Y}.>...C.....-.
0010  58 f5 53 5a 00 00 00 00 67 0a 04 00 00 00 00 00   X.SZ....g.......
0020  1a 00 00 00 1a 00 00 00 00 00 00 00 00 00 00 00   ................
0030  00 00 00 00 00 00 00 00 00 02 00 00 00 00 00 00   ................
0040  1a 03 55 00 53 00 42 00 20 00 4b 00 65 00 79 00   ..U.S.B. .K.e.y.
0050  62 00 6f 00 61 00 72 00 64 00                     b.o.a.r.d.

     41 0.358193       host                  1.18.0                USB      64     GET DESCRIPTOR Request STRING

Frame 41: 64 bytes on wire (512 bits), 64 bytes captured (512 bits) on interface 0
    Interface id: 0 (usbmon0)
        Interface name: usbmon0
    Encapsulation type: USB packets with Linux header and padding (115)
    Arrival Time: Jan  8, 2018 23:48:56.264873000 CET
    [Time shift for this packet: 0.000000000 seconds]
    Epoch Time: 1515451736.264873000 seconds
    [Time delta from previous captured frame: 0.000066000 seconds]
    [Time delta from previous displayed frame: 0.000066000 seconds]
    [Time since reference or first frame: 0.358193000 seconds]
    Frame Number: 41
    Frame Length: 64 bytes (512 bits)
    Capture Length: 64 bytes (512 bits)
    [Frame is marked: False]
    [Frame is ignored: False]
    [Protocols in frame: usb]
USB URB
    [Source: host]
    [Destination: 1.18.0]
    URB id: 0xffff993e827d5900
    URB type: URB_SUBMIT ('S')
    URB transfer type: URB_CONTROL (0x02)
    Endpoint: 0x80, Direction: IN
        1... .... = Direction: IN (1)
        .... 0000 = Endpoint number: 0
    Device: 18
    URB bus id: 1
    Device setup request: relevant (0)
    Data: not present ('<')
    URB sec: 1515451736
    URB usec: 264873
    URB status: Operation now in progress (-EINPROGRESS) (-115)
    URB length [bytes]: 255
    Data length [bytes]: 0
    [Response in: 42]
    Interval: 0
    Start frame: 0
    Copy of Transfer Flags: 0x00000200
    Number of ISO descriptors: 0
URB setup
    bmRequestType: 0x80
        1... .... = Direction: Device-to-host
        .00. .... = Type: Standard (0x0)
        ...0 0000 = Recipient: Device (0x00)
    bRequest: GET DESCRIPTOR (6)
    Descriptor Index: 0x01
    bDescriptorType: 0x03
    Language Id: English (United States) (0x0409)
    wLength: 255

0000  00 59 7d 82 3e 99 ff ff 53 02 80 12 01 00 00 3c   .Y}.>...S......<
0010  58 f5 53 5a 00 00 00 00 a9 0a 04 00 8d ff ff ff   X.SZ............
0020  ff 00 00 00 00 00 00 00 80 06 01 03 09 04 ff 00   ................
0030  00 00 00 00 00 00 00 00 00 02 00 00 00 00 00 00   ................

     42 0.359298       1.18.0                host                  USB      78     GET DESCRIPTOR Response STRING

Frame 42: 78 bytes on wire (624 bits), 78 bytes captured (624 bits) on interface 0
    Interface id: 0 (usbmon0)
        Interface name: usbmon0
    Encapsulation type: USB packets with Linux header and padding (115)
    Arrival Time: Jan  8, 2018 23:48:56.265978000 CET
    [Time shift for this packet: 0.000000000 seconds]
    Epoch Time: 1515451736.265978000 seconds
    [Time delta from previous captured frame: 0.001105000 seconds]
    [Time delta from previous displayed frame: 0.001105000 seconds]
    [Time since reference or first frame: 0.359298000 seconds]
    Frame Number: 42
    Frame Length: 78 bytes (624 bits)
    Capture Length: 78 bytes (624 bits)
    [Frame is marked: False]
    [Frame is ignored: False]
    [Protocols in frame: usb]
USB URB
    [Source: 1.18.0]
    [Destination: host]
    URB id: 0xffff993e827d5900
    URB type: URB_COMPLETE ('C')
    URB transfer type: URB_CONTROL (0x02)
    Endpoint: 0x80, Direction: IN
        1... .... = Direction: IN (1)
        .... 0000 = Endpoint number: 0
    Device: 18
    URB bus id: 1
    Device setup request: not relevant ('-')
    Data: present (0)
    URB sec: 1515451736
    URB usec: 265978
    URB status: Success (0)
    URB length [bytes]: 14
    Data length [bytes]: 14
    [Request in: 41]
    [Time from request: 0.001105000 seconds]
    Unused Setup Header
    Interval: 0
    Start frame: 0
    Copy of Transfer Flags: 0x00000200
    Number of ISO descriptors: 0
STRING DESCRIPTOR
    bLength: 14
    bDescriptorType: 0x03 (STRING)
    bString: CHESEN

0000  00 59 7d 82 3e 99 ff ff 43 02 80 12 01 00 2d 00   .Y}.>...C.....-.
0010  58 f5 53 5a 00 00 00 00 fa 0e 04 00 00 00 00 00   X.SZ............
0020  0e 00 00 00 0e 00 00 00 00 00 00 00 00 00 00 00   ................
0030  00 00 00 00 00 00 00 00 00 02 00 00 00 00 00 00   ................
0040  0e 03 43 00 48 00 45 00 53 00 45 00 4e 00         ..C.H.E.S.E.N.

     43 0.364737       host                  1.18.0                USB      64     SET CONFIGURATION Request

Frame 43: 64 bytes on wire (512 bits), 64 bytes captured (512 bits) on interface 0
    Interface id: 0 (usbmon0)
        Interface name: usbmon0
    Encapsulation type: USB packets with Linux header and padding (115)
    Arrival Time: Jan  8, 2018 23:48:56.271417000 CET
    [Time shift for this packet: 0.000000000 seconds]
    Epoch Time: 1515451736.271417000 seconds
    [Time delta from previous captured frame: 0.005439000 seconds]
    [Time delta from previous displayed frame: 0.005439000 seconds]
    [Time since reference or first frame: 0.364737000 seconds]
    Frame Number: 43
    Frame Length: 64 bytes (512 bits)
    Capture Length: 64 bytes (512 bits)
    [Frame is marked: False]
    [Frame is ignored: False]
    [Protocols in frame: usb]
USB URB
    [Source: host]
    [Destination: 1.18.0]
    URB id: 0xffff993e827d5d80
    URB type: URB_SUBMIT ('S')
    URB transfer type: URB_CONTROL (0x02)
    Endpoint: 0x00, Direction: OUT
        0... .... = Direction: OUT (0)
        .... 0000 = Endpoint number: 0
    Device: 18
    URB bus id: 1
    Device setup request: relevant (0)
    Data: present (0)
    URB sec: 1515451736
    URB usec: 271417
    URB status: Operation now in progress (-EINPROGRESS) (-115)
    URB length [bytes]: 0
    Data length [bytes]: 0
    [Response in: 44]
    Interval: 0
    Start frame: 0
    Copy of Transfer Flags: 0x00000000
    Number of ISO descriptors: 0
URB setup
    bmRequestType: 0x00
        0... .... = Direction: Host-to-device
        .00. .... = Type: Standard (0x0)
        ...0 0000 = Recipient: Device (0x00)
    bRequest: SET CONFIGURATION (9)
    bConfigurationValue: 1
    wIndex: 0 (0x0000)
    wLength: 0

0000  80 5d 7d 82 3e 99 ff ff 53 02 00 12 01 00 00 00   .]}.>...S.......
0010  58 f5 53 5a 00 00 00 00 39 24 04 00 8d ff ff ff   X.SZ....9$......
0020  00 00 00 00 00 00 00 00 00 09 01 00 00 00 00 00   ................
0030  00 00 00 00 00 00 00 00 00 00 00 00 00 00 00 00   ................

     44 0.365078       1.18.0                host                  USB      64     SET CONFIGURATION Response

Frame 44: 64 bytes on wire (512 bits), 64 bytes captured (512 bits) on interface 0
    Interface id: 0 (usbmon0)
        Interface name: usbmon0
    Encapsulation type: USB packets with Linux header and padding (115)
    Arrival Time: Jan  8, 2018 23:48:56.271758000 CET
    [Time shift for this packet: 0.000000000 seconds]
    Epoch Time: 1515451736.271758000 seconds
    [Time delta from previous captured frame: 0.000341000 seconds]
    [Time delta from previous displayed frame: 0.000341000 seconds]
    [Time since reference or first frame: 0.365078000 seconds]
    Frame Number: 44
    Frame Length: 64 bytes (512 bits)
    Capture Length: 64 bytes (512 bits)
    [Frame is marked: False]
    [Frame is ignored: False]
    [Protocols in frame: usb]
USB URB
    [Source: 1.18.0]
    [Destination: host]
    URB id: 0xffff993e827d5d80
    URB type: URB_COMPLETE ('C')
    URB transfer type: URB_CONTROL (0x02)
    Endpoint: 0x00, Direction: OUT
        0... .... = Direction: OUT (0)
        .... 0000 = Endpoint number: 0
    Device: 18
    URB bus id: 1
    Device setup request: not relevant ('-')
    Data: not present ('>')
    URB sec: 1515451736
    URB usec: 271758
    URB status: Success (0)
    URB length [bytes]: 0
    Data length [bytes]: 0
    [Request in: 43]
    [Time from request: 0.000341000 seconds]
    Unused Setup Header
    Interval: 0
    Start frame: 0
    Copy of Transfer Flags: 0x00000000
    Number of ISO descriptors: 0

0000  80 5d 7d 82 3e 99 ff ff 43 02 00 12 01 00 2d 3e   .]}.>...C.....->
0010  58 f5 53 5a 00 00 00 00 8e 25 04 00 00 00 00 00   X.SZ.....%......
0020  00 00 00 00 00 00 00 00 00 00 00 00 00 00 00 00   ................
0030  00 00 00 00 00 00 00 00 00 00 00 00 00 00 00 00   ................

     45 0.365156       host                  1.18.0                USBHID   64     SET_IDLE Request

Frame 45: 64 bytes on wire (512 bits), 64 bytes captured (512 bits) on interface 0
    Interface id: 0 (usbmon0)
        Interface name: usbmon0
    Encapsulation type: USB packets with Linux header and padding (115)
    Arrival Time: Jan  8, 2018 23:48:56.271836000 CET
    [Time shift for this packet: 0.000000000 seconds]
    Epoch Time: 1515451736.271836000 seconds
    [Time delta from previous captured frame: 0.000078000 seconds]
    [Time delta from previous displayed frame: 0.000078000 seconds]
    [Time since reference or first frame: 0.365156000 seconds]
    Frame Number: 45
    Frame Length: 64 bytes (512 bits)
    Capture Length: 64 bytes (512 bits)
    [Frame is marked: False]
    [Frame is ignored: False]
    [Protocols in frame: usb:usbhid]
USB URB
    [Source: host]
    [Destination: 1.18.0]
    URB id: 0xffff993e827d5f00
    URB type: URB_SUBMIT ('S')
    URB transfer type: URB_CONTROL (0x02)
    Endpoint: 0x00, Direction: OUT
        0... .... = Direction: OUT (0)
        .... 0000 = Endpoint number: 0
    Device: 18
    URB bus id: 1
    Device setup request: relevant (0)
    Data: present (0)
    URB sec: 1515451736
    URB usec: 271836
    URB status: Operation now in progress (-EINPROGRESS) (-115)
    URB length [bytes]: 0
    Data length [bytes]: 0
    [Response in: 46]
    Interval: 0
    Start frame: 0
    Copy of Transfer Flags: 0x00000000
    Number of ISO descriptors: 0
    [bInterfaceClass: HID (0x03)]
URB setup
    bmRequestType: 0x21
        0... .... = Direction: Host-to-device
        .01. .... = Type: Class (0x1)
        ...0 0001 = Recipient: Interface (0x01)
bRequest: SET_IDLE (0x0a)
wValue: 0x0000
    ReportID: 0
    Duration: 0
wIndex: 0
wLength: 0

0000  00 5f 7d 82 3e 99 ff ff 53 02 00 12 01 00 00 00   ._}.>...S.......
0010  58 f5 53 5a 00 00 00 00 dc 25 04 00 8d ff ff ff   X.SZ.....%......
0020  00 00 00 00 00 00 00 00 21 0a 00 00 00 00 00 00   ........!.......
0030  00 00 00 00 00 00 00 00 00 00 00 00 00 00 00 00   ................

     46 0.365476       1.18.0                host                  USBHID   64     SET_IDLE Response

Frame 46: 64 bytes on wire (512 bits), 64 bytes captured (512 bits) on interface 0
    Interface id: 0 (usbmon0)
        Interface name: usbmon0
    Encapsulation type: USB packets with Linux header and padding (115)
    Arrival Time: Jan  8, 2018 23:48:56.272156000 CET
    [Time shift for this packet: 0.000000000 seconds]
    Epoch Time: 1515451736.272156000 seconds
    [Time delta from previous captured frame: 0.000320000 seconds]
    [Time delta from previous displayed frame: 0.000320000 seconds]
    [Time since reference or first frame: 0.365476000 seconds]
    Frame Number: 46
    Frame Length: 64 bytes (512 bits)
    Capture Length: 64 bytes (512 bits)
    [Frame is marked: False]
    [Frame is ignored: False]
    [Protocols in frame: usb]
USB URB
    [Source: 1.18.0]
    [Destination: host]
    URB id: 0xffff993e827d5f00
    URB type: URB_COMPLETE ('C')
    URB transfer type: URB_CONTROL (0x02)
    Endpoint: 0x00, Direction: OUT
        0... .... = Direction: OUT (0)
        .... 0000 = Endpoint number: 0
    Device: 18
    URB bus id: 1
    Device setup request: not relevant ('-')
    Data: not present ('>')
    URB sec: 1515451736
    URB usec: 272156
    URB status: Success (0)
    URB length [bytes]: 0
    Data length [bytes]: 0
    [Request in: 45]
    [Time from request: 0.000320000 seconds]
    Unused Setup Header
    Interval: 0
    Start frame: 0
    Copy of Transfer Flags: 0x00000000
    Number of ISO descriptors: 0
    [bInterfaceClass: HID (0x03)]

0000  00 5f 7d 82 3e 99 ff ff 43 02 00 12 01 00 2d 3e   ._}.>...C.....->
0010  58 f5 53 5a 00 00 00 00 1c 27 04 00 00 00 00 00   X.SZ.....'......
0020  00 00 00 00 00 00 00 00 00 00 00 00 00 00 00 00   ................
0030  00 00 00 00 00 00 00 00 00 00 00 00 00 00 00 00   ................

     47 0.365495       host                  1.18.0                USBHID   64     GET DESCRIPTOR Request HID Report

Frame 47: 64 bytes on wire (512 bits), 64 bytes captured (512 bits) on interface 0
    Interface id: 0 (usbmon0)
        Interface name: usbmon0
    Encapsulation type: USB packets with Linux header and padding (115)
    Arrival Time: Jan  8, 2018 23:48:56.272175000 CET
    [Time shift for this packet: 0.000000000 seconds]
    Epoch Time: 1515451736.272175000 seconds
    [Time delta from previous captured frame: 0.000019000 seconds]
    [Time delta from previous displayed frame: 0.000019000 seconds]
    [Time since reference or first frame: 0.365495000 seconds]
    Frame Number: 47
    Frame Length: 64 bytes (512 bits)
    Capture Length: 64 bytes (512 bits)
    [Frame is marked: False]
    [Frame is ignored: False]
    [Protocols in frame: usb:usbhid]
USB URB
    [Source: host]
    [Destination: 1.18.0]
    URB id: 0xffff993e827d5f00
    URB type: URB_SUBMIT ('S')
    URB transfer type: URB_CONTROL (0x02)
    Endpoint: 0x80, Direction: IN
        1... .... = Direction: IN (1)
        .... 0000 = Endpoint number: 0
    Device: 18
    URB bus id: 1
    Device setup request: relevant (0)
    Data: not present ('<')
    URB sec: 1515451736
    URB usec: 272175
    URB status: Operation now in progress (-EINPROGRESS) (-115)
    URB length [bytes]: 65
    Data length [bytes]: 0
    [Response in: 48]
    Interval: 0
    Start frame: 0
    Copy of Transfer Flags: 0x00000200
    Number of ISO descriptors: 0
    [bInterfaceClass: HID (0x03)]
URB setup
    bmRequestType: 0x81
        1... .... = Direction: Device-to-host
        .00. .... = Type: Standard (0x0)
        ...0 0001 = Recipient: Interface (0x01)
bDescriptorIndex: 0x00
bDescriptorType: HID Report (0x22)
wInterfaceNumber: 0
wDescriptorLength: 65

0000  00 5f 7d 82 3e 99 ff ff 53 02 80 12 01 00 00 3c   ._}.>...S......<
0010  58 f5 53 5a 00 00 00 00 2f 27 04 00 8d ff ff ff   X.SZ..../'......
0020  41 00 00 00 00 00 00 00 81 06 00 22 00 00 41 00   A.........."..A.
0030  00 00 00 00 00 00 00 00 00 02 00 00 00 00 00 00   ................

     48 0.368837       1.18.0                host                  USBHID   129    GET DESCRIPTOR Response HID Report

Frame 48: 129 bytes on wire (1032 bits), 129 bytes captured (1032 bits) on interface 0
    Interface id: 0 (usbmon0)
        Interface name: usbmon0
    Encapsulation type: USB packets with Linux header and padding (115)
    Arrival Time: Jan  8, 2018 23:48:56.275517000 CET
    [Time shift for this packet: 0.000000000 seconds]
    Epoch Time: 1515451736.275517000 seconds
    [Time delta from previous captured frame: 0.003342000 seconds]
    [Time delta from previous displayed frame: 0.003342000 seconds]
    [Time since reference or first frame: 0.368837000 seconds]
    Frame Number: 48
    Frame Length: 129 bytes (1032 bits)
    Capture Length: 129 bytes (1032 bits)
    [Frame is marked: False]
    [Frame is ignored: False]
    [Protocols in frame: usb:usbhid]
USB URB
    [Source: 1.18.0]
    [Destination: host]
    URB id: 0xffff993e827d5f00
    URB type: URB_COMPLETE ('C')
    URB transfer type: URB_CONTROL (0x02)
    Endpoint: 0x80, Direction: IN
        1... .... = Direction: IN (1)
        .... 0000 = Endpoint number: 0
    Device: 18
    URB bus id: 1
    Device setup request: not relevant ('-')
    Data: present (0)
    URB sec: 1515451736
    URB usec: 275517
    URB status: Success (0)
    URB length [bytes]: 65
    Data length [bytes]: 65
    [Request in: 47]
    [Time from request: 0.003342000 seconds]
    Unused Setup Header
    Interval: 0
    Start frame: 0
    Copy of Transfer Flags: 0x00000200
    Number of ISO descriptors: 0
    [bInterfaceClass: HID (0x03)]
HID Report
    Global item (Usage)
        Header
            .... ..01 = bSize: 1 byte (1)
            .... 01.. = bType: Global (1)
            0000 .... = bTag: Usage (0x0)
        Usage page: Generic desktop controls (0x01)
    Local item (Usage)
        Header
            .... ..01 = bSize: 1 byte (1)
            .... 10.. = bType: Local (2)
            0000 .... = bTag: Usage (0x0)
        Usage: Generic device controls (0x06)
    Main item (Collection)
        Header
            .... ..01 = bSize: 1 byte (1)
            .... 00.. = bType: Main (0)
            1010 .... = bTag: Collection (0xa)
        Collection type: Application (0x01)
        Global item (Usage)
            Header
                .... ..01 = bSize: 1 byte (1)
                .... 01.. = bType: Global (1)
                0000 .... = bTag: Usage (0x0)
            Usage page: Keyboard/keypad (0x07)
        Local item (Usage minimum)
            Header
                .... ..01 = bSize: 1 byte (1)
                .... 10.. = bType: Local (2)
                0001 .... = bTag: Usage minimum (0x1)
            Usage minimum: 0xe0
        Local item (Usage maximum)
            Header
                .... ..01 = bSize: 1 byte (1)
                .... 10.. = bType: Local (2)
                0010 .... = bTag: Usage maximum (0x2)
            Usage: [Reserved] (0xe7)
        Global item (Logical minimum)
            Header
                .... ..01 = bSize: 1 byte (1)
                .... 01.. = bType: Global (1)
                0001 .... = bTag: Logical minimum (0x1)
            Logical minimum: 0
        Global item (Logical maximum)
            Header
                .... ..01 = bSize: 1 byte (1)
                .... 01.. = bType: Global (1)
                0010 .... = bTag: Logical maximum (0x2)
            Logical maximum: 1
        Global item (Report size)
            Header
                .... ..01 = bSize: 1 byte (1)
                .... 01.. = bType: Global (1)
                0111 .... = bTag: Report size (0x7)
            Report size: 1
        Global item (Report count)
            Header
                .... ..01 = bSize: 1 byte (1)
                .... 01.. = bType: Global (1)
                1001 .... = bTag: Report count (0x9)
            Report count: 8
        Main item (Input)
            Header
                .... ..01 = bSize: 1 byte (1)
                .... 00.. = bType: Main (0)
                1000 .... = bTag: Input (0x8)
            .... .... 0 = Data/constant: Data
            .... ...1 . = Data type: Variable
            .... ..0. . = Coordinates: Absolute
            .... .0.. . = Min/max wraparound: No Wrap
            .... 0... . = Physical relationship to data: Linear
            ...0 .... . = Preferred state: Preferred State
            ..0. .... . = Has null position: No Null position
            .0.. .... . = [Reserved]: False
            0... .... . = Bits or bytes: Buffered bytes (default, no second byte present)
        Global item (Report count)
            Header
                .... ..01 = bSize: 1 byte (1)
                .... 01.. = bType: Global (1)
                1001 .... = bTag: Report count (0x9)
            Report count: 1
        Global item (Report size)
            Header
                .... ..01 = bSize: 1 byte (1)
                .... 01.. = bType: Global (1)
                0111 .... = bTag: Report size (0x7)
            Report size: 8
        Main item (Input)
            Header
                .... ..01 = bSize: 1 byte (1)
                .... 00.. = bType: Main (0)
                1000 .... = bTag: Input (0x8)
            .... .... 1 = Data/constant: Constant
            .... ...0 . = Data type: Array
            .... ..0. . = Coordinates: Absolute
            .... .0.. . = Min/max wraparound: No Wrap
            .... 0... . = Physical relationship to data: Linear
            ...0 .... . = Preferred state: Preferred State
            ..0. .... . = Has null position: No Null position
            .0.. .... . = [Reserved]: False
            0... .... . = Bits or bytes: Buffered bytes (default, no second byte present)
        Global item (Report count)
            Header
                .... ..01 = bSize: 1 byte (1)
                .... 01.. = bType: Global (1)
                1001 .... = bTag: Report count (0x9)
            Report count: 5
        Global item (Report size)
            Header
                .... ..01 = bSize: 1 byte (1)
                .... 01.. = bType: Global (1)
                0111 .... = bTag: Report size (0x7)
            Report size: 1
        Global item (Usage)
            Header
                .... ..01 = bSize: 1 byte (1)
                .... 01.. = bType: Global (1)
                0000 .... = bTag: Usage (0x0)
            Usage page: LEDs (0x08)
        Local item (Usage minimum)
            Header
                .... ..01 = bSize: 1 byte (1)
                .... 10.. = bType: Local (2)
                0001 .... = bTag: Usage minimum (0x1)
            Usage minimum: 0x01
        Local item (Usage maximum)
            Header
                .... ..01 = bSize: 1 byte (1)
                .... 10.. = bType: Local (2)
                0010 .... = bTag: Usage maximum (0x2)
            Usage: Game controls (0x05)
        Main item (Output)
            Header
                .... ..01 = bSize: 1 byte (1)
                .... 00.. = bType: Main (0)
                1001 .... = bTag: Output (0x9)
            .... .... 0 = Data/constant: Data
            .... ...1 . = Data type: Variable
            .... ..0. . = Coordinates: Absolute
            .... .0.. . = Min/max wraparound: No Wrap
            .... 0... . = Physical relationship to data: Linear
            ...0 .... . = Preferred state: Preferred State
            ..0. .... . = Has null position: No Null position
            .0.. .... . = (Non)-volatile: Non Volatile
            0... .... . = Bits or bytes: Buffered bytes (default, no second byte present)
        Global item (Report count)
            Header
                .... ..01 = bSize: 1 byte (1)
                .... 01.. = bType: Global (1)
                1001 .... = bTag: Report count (0x9)
            Report count: 3
        Global item (Report size)
            Header
                .... ..01 = bSize: 1 byte (1)
                .... 01.. = bType: Global (1)
                0111 .... = bTag: Report size (0x7)
            Report size: 1
        Main item (Output)
            Header
                .... ..01 = bSize: 1 byte (1)
                .... 00.. = bType: Main (0)
                1001 .... = bTag: Output (0x9)
            .... .... 1 = Data/constant: Constant
            .... ...0 . = Data type: Array
            .... ..0. . = Coordinates: Absolute
            .... .0.. . = Min/max wraparound: No Wrap
            .... 0... . = Physical relationship to data: Linear
            ...0 .... . = Preferred state: Preferred State
            ..0. .... . = Has null position: No Null position
            .0.. .... . = (Non)-volatile: Non Volatile
            0... .... . = Bits or bytes: Buffered bytes (default, no second byte present)
        Global item (Report count)
            Header
                .... ..01 = bSize: 1 byte (1)
                .... 01.. = bType: Global (1)
                1001 .... = bTag: Report count (0x9)
            Report count: 6
        Global item (Report size)
            Header
                .... ..01 = bSize: 1 byte (1)
                .... 01.. = bType: Global (1)
                0111 .... = bTag: Report size (0x7)
            Report size: 8
        Global item (Logical minimum)
            Header
                .... ..01 = bSize: 1 byte (1)
                .... 01.. = bType: Global (1)
                0001 .... = bTag: Logical minimum (0x1)
            Logical minimum: 0
        Global item (Logical maximum)
            Header
                .... ..10 = bSize: 2 bytes (2)
                .... 01.. = bType: Global (1)
                0010 .... = bTag: Logical maximum (0x2)
            Logical maximum: 255
        Global item (Usage)
            Header
                .... ..01 = bSize: 1 byte (1)
                .... 01.. = bType: Global (1)
                0000 .... = bTag: Usage (0x0)
            Usage page: Keyboard/keypad (0x07)
        Local item (Usage minimum)
            Header
                .... ..01 = bSize: 1 byte (1)
                .... 10.. = bType: Local (2)
                0001 .... = bTag: Usage minimum (0x1)
            Usage minimum: 0x00
        Local item (Usage maximum)
            Header
                .... ..10 = bSize: 2 bytes (2)
                .... 10.. = bType: Local (2)
                0010 .... = bTag: Usage maximum (0x2)
            Usage: [Reserved] (0xff)
        Main item (Input)
            Header
                .... ..01 = bSize: 1 byte (1)
                .... 00.. = bType: Main (0)
                1000 .... = bTag: Input (0x8)
            .... .... 0 = Data/constant: Data
            .... ...0 . = Data type: Array
            .... ..0. . = Coordinates: Absolute
            .... .0.. . = Min/max wraparound: No Wrap
            .... 0... . = Physical relationship to data: Linear
            ...0 .... . = Preferred state: Preferred State
            ..0. .... . = Has null position: No Null position
            .0.. .... . = [Reserved]: False
            0... .... . = Bits or bytes: Buffered bytes (default, no second byte present)
        Main item (End collection)
            Header
                .... ..00 = bSize: 0 bytes (0)
                .... 00.. = bType: Main (0)
                1100 .... = bTag: End collection (0xc)

0000  00 5f 7d 82 3e 99 ff ff 43 02 80 12 01 00 2d 00   ._}.>...C.....-.
0010  58 f5 53 5a 00 00 00 00 3d 34 04 00 00 00 00 00   X.SZ....=4......
0020  41 00 00 00 41 00 00 00 00 00 00 00 00 00 00 00   A...A...........
0030  00 00 00 00 00 00 00 00 00 02 00 00 00 00 00 00   ................
0040  05 01 09 06 a1 01 05 07 19 e0 29 e7 15 00 25 01   ..........)...%.
0050  75 01 95 08 81 02 95 01 75 08 81 01 95 05 75 01   u.......u.....u.
0060  05 08 19 01 29 05 91 02 95 03 75 01 91 01 95 06   ....).....u.....
0070  75 08 15 00 26 ff 00 05 07 19 00 2a ff 00 81 00   u...&......*....
0080  c0                                                .

     49 0.369075       host                  1.18.0                USBHID   65     SET_REPORT Request

Frame 49: 65 bytes on wire (520 bits), 65 bytes captured (520 bits) on interface 0
    Interface id: 0 (usbmon0)
        Interface name: usbmon0
    Encapsulation type: USB packets with Linux header and padding (115)
    Arrival Time: Jan  8, 2018 23:48:56.275755000 CET
    [Time shift for this packet: 0.000000000 seconds]
    Epoch Time: 1515451736.275755000 seconds
    [Time delta from previous captured frame: 0.000238000 seconds]
    [Time delta from previous displayed frame: 0.000238000 seconds]
    [Time since reference or first frame: 0.369075000 seconds]
    Frame Number: 49
    Frame Length: 65 bytes (520 bits)
    Capture Length: 65 bytes (520 bits)
    [Frame is marked: False]
    [Frame is ignored: False]
    [Protocols in frame: usb:usbhid]
USB URB
    [Source: host]
    [Destination: 1.18.0]
    URB id: 0xffff993e827d5b40
    URB type: URB_SUBMIT ('S')
    URB transfer type: URB_CONTROL (0x02)
    Endpoint: 0x00, Direction: OUT
        0... .... = Direction: OUT (0)
        .... 0000 = Endpoint number: 0
    Device: 18
    URB bus id: 1
    Device setup request: relevant (0)
    Data: present (0)
    URB sec: 1515451736
    URB usec: 275755
    URB status: Operation now in progress (-EINPROGRESS) (-115)
    URB length [bytes]: 1
    Data length [bytes]: 1
    [Response in: 51]
    Interval: 0
    Start frame: 0
    Copy of Transfer Flags: 0x00000004
    Number of ISO descriptors: 0
    [bInterfaceClass: HID (0x03)]
URB setup
    bmRequestType: 0x21
        0... .... = Direction: Host-to-device
        .01. .... = Type: Class (0x1)
        ...0 0001 = Recipient: Interface (0x01)
    bRequest: 9
    wValue: 0x0200
    wIndex: 0 (0x0000)
    wLength: 1
    Data Fragment: 00
bRequest: SET_REPORT (0x09)
wValue: 0x0200
    ReportID: 0
    ReportType: Output (2)
wIndex: 0
wLength: 1

Frame (65 bytes):
0000  40 5b 7d 82 3e 99 ff ff 53 02 00 12 01 00 00 00   @[}.>...S.......
0010  58 f5 53 5a 00 00 00 00 2b 35 04 00 8d ff ff ff   X.SZ....+5......
0020  01 00 00 00 01 00 00 00 21 09 00 02 00 00 01 00   ........!.......
0030  00 00 00 00 00 00 00 00 04 00 00 00 00 00 00 00   ................
0040  00                                                .
USB Control (8 bytes):
0000  09 00 02 00 00 01 00 00                           ........

     50 0.369172       host                  1.18.1                USB      64     URB_INTERRUPT in

Frame 50: 64 bytes on wire (512 bits), 64 bytes captured (512 bits) on interface 0
    Interface id: 0 (usbmon0)
        Interface name: usbmon0
    Encapsulation type: USB packets with Linux header and padding (115)
    Arrival Time: Jan  8, 2018 23:48:56.275852000 CET
    [Time shift for this packet: 0.000000000 seconds]
    Epoch Time: 1515451736.275852000 seconds
    [Time delta from previous captured frame: 0.000097000 seconds]
    [Time delta from previous displayed frame: 0.000097000 seconds]
    [Time since reference or first frame: 0.369172000 seconds]
    Frame Number: 50
    Frame Length: 64 bytes (512 bits)
    Capture Length: 64 bytes (512 bits)
    [Frame is marked: False]
    [Frame is ignored: False]
    [Protocols in frame: usb]
USB URB
    [Source: host]
    [Destination: 1.18.1]
    URB id: 0xffff993e827d50c0
    URB type: URB_SUBMIT ('S')
    URB transfer type: URB_INTERRUPT (0x01)
    Endpoint: 0x81, Direction: IN
        1... .... = Direction: IN (1)
        .... 0001 = Endpoint number: 1
    Device: 18
    URB bus id: 1
    Device setup request: not relevant ('-')
    Data: not present ('<')
    URB sec: 1515451736
    URB usec: 275852
    URB status: Operation now in progress (-EINPROGRESS) (-115)
    URB length [bytes]: 8
    Data length [bytes]: 0
    [Response in: 59]
    [bInterfaceClass: HID (0x03)]
    Unused Setup Header
    Interval: 8
    Start frame: 0
    Copy of Transfer Flags: 0x00000204
    Number of ISO descriptors: 0

0000  c0 50 7d 82 3e 99 ff ff 53 01 81 12 01 00 2d 3c   .P}.>...S.....-<
0010  58 f5 53 5a 00 00 00 00 8c 35 04 00 8d ff ff ff   X.SZ.....5......
0020  08 00 00 00 00 00 00 00 00 00 00 00 00 00 00 00   ................
0030  08 00 00 00 00 00 00 00 04 02 00 00 00 00 00 00   ................

     51 0.369469       1.18.0                host                  USBHID   64     SET_REPORT Response

Frame 51: 64 bytes on wire (512 bits), 64 bytes captured (512 bits) on interface 0
    Interface id: 0 (usbmon0)
        Interface name: usbmon0
    Encapsulation type: USB packets with Linux header and padding (115)
    Arrival Time: Jan  8, 2018 23:48:56.276149000 CET
    [Time shift for this packet: 0.000000000 seconds]
    Epoch Time: 1515451736.276149000 seconds
    [Time delta from previous captured frame: 0.000297000 seconds]
    [Time delta from previous displayed frame: 0.000297000 seconds]
    [Time since reference or first frame: 0.369469000 seconds]
    Frame Number: 51
    Frame Length: 64 bytes (512 bits)
    Capture Length: 64 bytes (512 bits)
    [Frame is marked: False]
    [Frame is ignored: False]
    [Protocols in frame: usb]
USB URB
    [Source: 1.18.0]
    [Destination: host]
    URB id: 0xffff993e827d5b40
    URB type: URB_COMPLETE ('C')
    URB transfer type: URB_CONTROL (0x02)
    Endpoint: 0x00, Direction: OUT
        0... .... = Direction: OUT (0)
        .... 0000 = Endpoint number: 0
    Device: 18
    URB bus id: 1
    Device setup request: not relevant ('-')
    Data: not present ('>')
    URB sec: 1515451736
    URB usec: 276149
    URB status: Success (0)
    URB length [bytes]: 1
    Data length [bytes]: 0
    [Request in: 49]
    [Time from request: 0.000394000 seconds]
    Unused Setup Header
    Interval: 0
    Start frame: 0
    Copy of Transfer Flags: 0x00000004
    Number of ISO descriptors: 0
    [bInterfaceClass: HID (0x03)]

0000  40 5b 7d 82 3e 99 ff ff 43 02 00 12 01 00 2d 3e   @[}.>...C.....->
0010  58 f5 53 5a 00 00 00 00 b5 36 04 00 00 00 00 00   X.SZ.....6......
0020  01 00 00 00 00 00 00 00 00 00 00 00 00 00 00 00   ................
0030  00 00 00 00 00 00 00 00 04 00 00 00 00 00 00 00   ................

     52 0.421675       host                  1.18.0                USBHID   64     SET_IDLE Request

Frame 52: 64 bytes on wire (512 bits), 64 bytes captured (512 bits) on interface 0
    Interface id: 0 (usbmon0)
        Interface name: usbmon0
    Encapsulation type: USB packets with Linux header and padding (115)
    Arrival Time: Jan  8, 2018 23:48:56.328355000 CET
    [Time shift for this packet: 0.000000000 seconds]
    Epoch Time: 1515451736.328355000 seconds
    [Time delta from previous captured frame: 0.052206000 seconds]
    [Time delta from previous displayed frame: 0.052206000 seconds]
    [Time since reference or first frame: 0.421675000 seconds]
    Frame Number: 52
    Frame Length: 64 bytes (512 bits)
    Capture Length: 64 bytes (512 bits)
    [Frame is marked: False]
    [Frame is ignored: False]
    [Protocols in frame: usb:usbhid]
USB URB
    [Source: host]
    [Destination: 1.18.0]
    URB id: 0xffff993ea30ba780
    URB type: URB_SUBMIT ('S')
    URB transfer type: URB_CONTROL (0x02)
    Endpoint: 0x00, Direction: OUT
        0... .... = Direction: OUT (0)
        .... 0000 = Endpoint number: 0
    Device: 18
    URB bus id: 1
    Device setup request: relevant (0)
    Data: present (0)
    URB sec: 1515451736
    URB usec: 328355
    URB status: Operation now in progress (-EINPROGRESS) (-115)
    URB length [bytes]: 0
    Data length [bytes]: 0
    [Response in: 53]
    Interval: 0
    Start frame: 0
    Copy of Transfer Flags: 0x00000000
    Number of ISO descriptors: 0
    [bInterfaceClass: HID (0x03)]
URB setup
    bmRequestType: 0x21
        0... .... = Direction: Host-to-device
        .01. .... = Type: Class (0x1)
        ...0 0001 = Recipient: Interface (0x01)
bRequest: SET_IDLE (0x0a)
wValue: 0x0000
    ReportID: 0
    Duration: 0
wIndex: 1
wLength: 0

0000  80 a7 0b a3 3e 99 ff ff 53 02 00 12 01 00 00 00   ....>...S.......
0010  58 f5 53 5a 00 00 00 00 a3 02 05 00 8d ff ff ff   X.SZ............
0020  00 00 00 00 00 00 00 00 21 0a 00 00 01 00 00 00   ........!.......
0030  00 00 00 00 00 00 00 00 00 00 00 00 00 00 00 00   ................

     53 0.421985       1.18.0                host                  USBHID   64     SET_IDLE Response

Frame 53: 64 bytes on wire (512 bits), 64 bytes captured (512 bits) on interface 0
    Interface id: 0 (usbmon0)
        Interface name: usbmon0
    Encapsulation type: USB packets with Linux header and padding (115)
    Arrival Time: Jan  8, 2018 23:48:56.328665000 CET
    [Time shift for this packet: 0.000000000 seconds]
    Epoch Time: 1515451736.328665000 seconds
    [Time delta from previous captured frame: 0.000310000 seconds]
    [Time delta from previous displayed frame: 0.000310000 seconds]
    [Time since reference or first frame: 0.421985000 seconds]
    Frame Number: 53
    Frame Length: 64 bytes (512 bits)
    Capture Length: 64 bytes (512 bits)
    [Frame is marked: False]
    [Frame is ignored: False]
    [Protocols in frame: usb]
USB URB
    [Source: 1.18.0]
    [Destination: host]
    URB id: 0xffff993ea30ba780
    URB type: URB_COMPLETE ('C')
    URB transfer type: URB_CONTROL (0x02)
    Endpoint: 0x00, Direction: OUT
        0... .... = Direction: OUT (0)
        .... 0000 = Endpoint number: 0
    Device: 18
    URB bus id: 1
    Device setup request: not relevant ('-')
    Data: not present ('>')
    URB sec: 1515451736
    URB usec: 328665
    URB status: Success (0)
    URB length [bytes]: 0
    Data length [bytes]: 0
    [Request in: 52]
    [Time from request: 0.000310000 seconds]
    Unused Setup Header
    Interval: 0
    Start frame: 0
    Copy of Transfer Flags: 0x00000000
    Number of ISO descriptors: 0
    [bInterfaceClass: HID (0x03)]

0000  80 a7 0b a3 3e 99 ff ff 43 02 00 12 01 00 2d 3e   ....>...C.....->
0010  58 f5 53 5a 00 00 00 00 d9 03 05 00 00 00 00 00   X.SZ............
0020  00 00 00 00 00 00 00 00 00 00 00 00 00 00 00 00   ................
0030  00 00 00 00 00 00 00 00 00 00 00 00 00 00 00 00   ................

     54 0.421997       host                  1.18.0                USBHID   64     GET DESCRIPTOR Request HID Report

Frame 54: 64 bytes on wire (512 bits), 64 bytes captured (512 bits) on interface 0
    Interface id: 0 (usbmon0)
        Interface name: usbmon0
    Encapsulation type: USB packets with Linux header and padding (115)
    Arrival Time: Jan  8, 2018 23:48:56.328677000 CET
    [Time shift for this packet: 0.000000000 seconds]
    Epoch Time: 1515451736.328677000 seconds
    [Time delta from previous captured frame: 0.000012000 seconds]
    [Time delta from previous displayed frame: 0.000012000 seconds]
    [Time since reference or first frame: 0.421997000 seconds]
    Frame Number: 54
    Frame Length: 64 bytes (512 bits)
    Capture Length: 64 bytes (512 bits)
    [Frame is marked: False]
    [Frame is ignored: False]
    [Protocols in frame: usb:usbhid]
USB URB
    [Source: host]
    [Destination: 1.18.0]
    URB id: 0xffff993ea30ba780
    URB type: URB_SUBMIT ('S')
    URB transfer type: URB_CONTROL (0x02)
    Endpoint: 0x80, Direction: IN
        1... .... = Direction: IN (1)
        .... 0000 = Endpoint number: 0
    Device: 18
    URB bus id: 1
    Device setup request: relevant (0)
    Data: not present ('<')
    URB sec: 1515451736
    URB usec: 328677
    URB status: Operation now in progress (-EINPROGRESS) (-115)
    URB length [bytes]: 102
    Data length [bytes]: 0
    [Response in: 55]
    Interval: 0
    Start frame: 0
    Copy of Transfer Flags: 0x00000200
    Number of ISO descriptors: 0
    [bInterfaceClass: HID (0x03)]
URB setup
    bmRequestType: 0x81
        1... .... = Direction: Device-to-host
        .00. .... = Type: Standard (0x0)
        ...0 0001 = Recipient: Interface (0x01)
bDescriptorIndex: 0x00
bDescriptorType: HID Report (0x22)
wInterfaceNumber: 1
wDescriptorLength: 102

0000  80 a7 0b a3 3e 99 ff ff 53 02 80 12 01 00 00 3c   ....>...S......<
0010  58 f5 53 5a 00 00 00 00 e5 03 05 00 8d ff ff ff   X.SZ............
0020  66 00 00 00 00 00 00 00 81 06 00 22 01 00 66 00   f.........."..f.
0030  00 00 00 00 00 00 00 00 00 02 00 00 00 00 00 00   ................

     55 0.426982       1.18.0                host                  USBHID   166    GET DESCRIPTOR Response HID Report

Frame 55: 166 bytes on wire (1328 bits), 166 bytes captured (1328 bits) on interface 0
    Interface id: 0 (usbmon0)
        Interface name: usbmon0
    Encapsulation type: USB packets with Linux header and padding (115)
    Arrival Time: Jan  8, 2018 23:48:56.333662000 CET
    [Time shift for this packet: 0.000000000 seconds]
    Epoch Time: 1515451736.333662000 seconds
    [Time delta from previous captured frame: 0.004985000 seconds]
    [Time delta from previous displayed frame: 0.004985000 seconds]
    [Time since reference or first frame: 0.426982000 seconds]
    Frame Number: 55
    Frame Length: 166 bytes (1328 bits)
    Capture Length: 166 bytes (1328 bits)
    [Frame is marked: False]
    [Frame is ignored: False]
    [Protocols in frame: usb:usbhid]
USB URB
    [Source: 1.18.0]
    [Destination: host]
    URB id: 0xffff993ea30ba780
    URB type: URB_COMPLETE ('C')
    URB transfer type: URB_CONTROL (0x02)
    Endpoint: 0x80, Direction: IN
        1... .... = Direction: IN (1)
        .... 0000 = Endpoint number: 0
    Device: 18
    URB bus id: 1
    Device setup request: not relevant ('-')
    Data: present (0)
    URB sec: 1515451736
    URB usec: 333662
    URB status: Success (0)
    URB length [bytes]: 102
    Data length [bytes]: 102
    [Request in: 54]
    [Time from request: 0.004985000 seconds]
    Unused Setup Header
    Interval: 0
    Start frame: 0
    Copy of Transfer Flags: 0x00000200
    Number of ISO descriptors: 0
    [bInterfaceClass: HID (0x03)]
HID Report
    Global item (Usage)
        Header
            .... ..01 = bSize: 1 byte (1)
            .... 01.. = bType: Global (1)
            0000 .... = bTag: Usage (0x0)
        Usage page: Generic desktop controls (0x01)
    Local item (Usage)
        Header
            .... ..01 = bSize: 1 byte (1)
            .... 10.. = bType: Local (2)
            0000 .... = bTag: Usage (0x0)
        Usage: Monitor page (0x80)
    Main item (Collection)
        Header
            .... ..01 = bSize: 1 byte (1)
            .... 00.. = bType: Main (0)
            1010 .... = bTag: Collection (0xa)
        Collection type: Application (0x01)
        Global item (Report ID)
            Header
                .... ..01 = bSize: 1 byte (1)
                .... 01.. = bType: Global (1)
                1000 .... = bTag: Report ID (0x8)
            Report ID: 0x02
        Local item (Usage)
            Header
                .... ..01 = bSize: 1 byte (1)
                .... 10.. = bType: Local (2)
                0000 .... = bTag: Usage (0x0)
            Usage: Monitor page (0x81)
        Local item (Usage)
            Header
                .... ..01 = bSize: 1 byte (1)
                .... 10.. = bType: Local (2)
                0000 .... = bTag: Usage (0x0)
            Usage: Monitor page (0x82)
        Local item (Usage)
            Header
                .... ..01 = bSize: 1 byte (1)
                .... 10.. = bType: Local (2)
                0000 .... = bTag: Usage (0x0)
            Usage: Monitor page (0x83)
        Global item (Logical maximum)
            Header
                .... ..01 = bSize: 1 byte (1)
                .... 01.. = bType: Global (1)
                0010 .... = bTag: Logical maximum (0x2)
            Logical maximum: 1
        Global item (Logical minimum)
            Header
                .... ..01 = bSize: 1 byte (1)
                .... 01.. = bType: Global (1)
                0001 .... = bTag: Logical minimum (0x1)
            Logical minimum: 0
        Global item (Report size)
            Header
                .... ..01 = bSize: 1 byte (1)
                .... 01.. = bType: Global (1)
                0111 .... = bTag: Report size (0x7)
            Report size: 1
        Global item (Report count)
            Header
                .... ..01 = bSize: 1 byte (1)
                .... 01.. = bType: Global (1)
                1001 .... = bTag: Report count (0x9)
            Report count: 3
        Main item (Input)
            Header
                .... ..01 = bSize: 1 byte (1)
                .... 00.. = bType: Main (0)
                1000 .... = bTag: Input (0x8)
            .... .... 0 = Data/constant: Data
            .... ...1 . = Data type: Variable
            .... ..1. . = Coordinates: Relative
            .... .0.. . = Min/max wraparound: No Wrap
            .... 0... . = Physical relationship to data: Linear
            ...0 .... . = Preferred state: Preferred State
            ..0. .... . = Has null position: No Null position
            .0.. .... . = [Reserved]: False
            0... .... . = Bits or bytes: Buffered bytes (default, no second byte present)
        Global item (Report size)
            Header
                .... ..01 = bSize: 1 byte (1)
                .... 01.. = bType: Global (1)
                0111 .... = bTag: Report size (0x7)
            Report size: 5
        Global item (Report count)
            Header
                .... ..01 = bSize: 1 byte (1)
                .... 01.. = bType: Global (1)
                1001 .... = bTag: Report count (0x9)
            Report count: 1
        Main item (Input)
            Header
                .... ..01 = bSize: 1 byte (1)
                .... 00.. = bType: Main (0)
                1000 .... = bTag: Input (0x8)
            .... .... 1 = Data/constant: Constant
            .... ...0 . = Data type: Array
            .... ..0. . = Coordinates: Absolute
            .... .0.. . = Min/max wraparound: No Wrap
            .... 0... . = Physical relationship to data: Linear
            ...0 .... . = Preferred state: Preferred State
            ..0. .... . = Has null position: No Null position
            .0.. .... . = [Reserved]: False
            0... .... . = Bits or bytes: Buffered bytes (default, no second byte present)
        Main item (End collection)
            Header
                .... ..00 = bSize: 0 bytes (0)
                .... 00.. = bType: Main (0)
                1100 .... = bTag: End collection (0xc)
    Global item (Usage)
        Header
            .... ..01 = bSize: 1 byte (1)
            .... 01.. = bType: Global (1)
            0000 .... = bTag: Usage (0x0)
        Usage page: Consumer (0x0c)
    Local item (Usage)
        Header
            .... ..01 = bSize: 1 byte (1)
            .... 10.. = bType: Local (2)
            0000 .... = bTag: Usage (0x0)
        Usage: Generic desktop controls (0x01)
    Main item (Collection)
        Header
            .... ..01 = bSize: 1 byte (1)
            .... 00.. = bType: Main (0)
            1010 .... = bTag: Collection (0xa)
        Collection type: Application (0x01)
        Global item (Report ID)
            Header
                .... ..01 = bSize: 1 byte (1)
                .... 01.. = bType: Global (1)
                1000 .... = bTag: Report ID (0x8)
            Report ID: 0x03
        Global item (Logical minimum)
            Header
                .... ..01 = bSize: 1 byte (1)
                .... 01.. = bType: Global (1)
                0001 .... = bTag: Logical minimum (0x1)
            Logical minimum: 0
        Global item (Logical maximum)
            Header
                .... ..01 = bSize: 1 byte (1)
                .... 01.. = bType: Global (1)
                0010 .... = bTag: Logical maximum (0x2)
            Logical maximum: 1
        Local item (Usage minimum)
            Header
                .... ..01 = bSize: 1 byte (1)
                .... 10.. = bType: Local (2)
                0001 .... = bTag: Usage minimum (0x1)
            Usage minimum: 0xb5
        Local item (Usage maximum)
            Header
                .... ..01 = bSize: 1 byte (1)
                .... 10.. = bType: Local (2)
                0010 .... = bTag: Usage maximum (0x2)
            Usage: [Reserved] (0xb7)
        Local item (Usage)
            Header
                .... ..01 = bSize: 1 byte (1)
                .... 10.. = bType: Local (2)
                0000 .... = bTag: Usage (0x0)
            Usage: [Reserved] (0xcd)
        Local item (Usage)
            Header
                .... ..01 = bSize: 1 byte (1)
                .... 10.. = bType: Local (2)
                0000 .... = bTag: Usage (0x0)
            Usage: [Reserved] (0xe2)
        Local item (Usage)
            Header
                .... ..01 = bSize: 1 byte (1)
                .... 10.. = bType: Local (2)
                0000 .... = bTag: Usage (0x0)
            Usage: [Reserved] (0xe5)
        Local item (Usage)
            Header
                .... ..01 = bSize: 1 byte (1)
                .... 10.. = bType: Local (2)
                0000 .... = bTag: Usage (0x0)
            Usage: [Reserved] (0xe7)
        Local item (Usage)
            Header
                .... ..10 = bSize: 2 bytes (2)
                .... 10.. = bType: Local (2)
                0000 .... = bTag: Usage (0x0)
            Usage: [Reserved] (0x8301)
        Local item (Usage)
            Header
                .... ..01 = bSize: 1 byte (1)
                .... 10.. = bType: Local (2)
                0000 .... = bTag: Usage (0x0)
            Usage: [Reserved] (0xe9)
        Local item (Usage)
            Header
                .... ..01 = bSize: 1 byte (1)
                .... 10.. = bType: Local (2)
                0000 .... = bTag: Usage (0x0)
            Usage: [Reserved] (0xea)
        Local item (Usage)
            Header
                .... ..10 = bSize: 2 bytes (2)
                .... 10.. = bType: Local (2)
                0000 .... = bTag: Usage (0x0)
            Usage: [Reserved] (0x5201)
        Local item (Usage)
            Header
                .... ..10 = bSize: 2 bytes (2)
                .... 10.. = bType: Local (2)
                0000 .... = bTag: Usage (0x0)
            Usage: [Reserved] (0x5301)
        Local item (Usage)
            Header
                .... ..10 = bSize: 2 bytes (2)
                .... 10.. = bType: Local (2)
                0000 .... = bTag: Usage (0x0)
            Usage: [Reserved] (0x5401)
        Local item (Usage)
            Header
                .... ..10 = bSize: 2 bytes (2)
                .... 10.. = bType: Local (2)
                0000 .... = bTag: Usage (0x0)
            Usage: [Reserved] (0x5501)
        Local item (Usage)
            Header
                .... ..10 = bSize: 2 bytes (2)
                .... 10.. = bType: Local (2)
                0000 .... = bTag: Usage (0x0)
            Usage: [Reserved] (0x8a01)
        Local item (Usage)
            Header
                .... ..10 = bSize: 2 bytes (2)
                .... 10.. = bType: Local (2)
                0000 .... = bTag: Usage (0x0)
            Usage: [Reserved] (0x9201)
        Local item (Usage)
            Header
                .... ..10 = bSize: 2 bytes (2)
                .... 10.. = bType: Local (2)
                0000 .... = bTag: Usage (0x0)
            Usage: [Reserved] (0x9401)
        Local item (Usage)
            Header
                .... ..10 = bSize: 2 bytes (2)
                .... 10.. = bType: Local (2)
                0000 .... = bTag: Usage (0x0)
            Usage: [Reserved] (0x2102)
        Local item (Usage minimum)
            Header
                .... ..10 = bSize: 2 bytes (2)
                .... 10.. = bType: Local (2)
                0001 .... = bTag: Usage minimum (0x1)
            Usage minimum: 0x223
        Local item (Usage maximum)
            Header
                .... ..10 = bSize: 2 bytes (2)
                .... 10.. = bType: Local (2)
                0010 .... = bTag: Usage maximum (0x2)
            Usage: [Reserved] (0x227)
        Local item (Usage)
            Header
                .... ..10 = bSize: 2 bytes (2)
                .... 10.. = bType: Local (2)
                0000 .... = bTag: Usage (0x0)
            Usage: [Reserved] (0x2a02)
        Global item (Report count)
            Header
                .... ..01 = bSize: 1 byte (1)
                .... 01.. = bType: Global (1)
                1001 .... = bTag: Report count (0x9)
            Report count: 24
        Global item (Report size)
            Header
                .... ..01 = bSize: 1 byte (1)
                .... 01.. = bType: Global (1)
                0111 .... = bTag: Report size (0x7)
            Report size: 1
        Main item (Input)
            Header
                .... ..01 = bSize: 1 byte (1)
                .... 00.. = bType: Main (0)
                1000 .... = bTag: Input (0x8)
            .... .... 0 = Data/constant: Data
            .... ...1 . = Data type: Variable
            .... ..0. . = Coordinates: Absolute
            .... .0.. . = Min/max wraparound: No Wrap
            .... 0... . = Physical relationship to data: Linear
            ...0 .... . = Preferred state: Preferred State
            ..0. .... . = Has null position: No Null position
            .0.. .... . = [Reserved]: False
            0... .... . = Bits or bytes: Buffered bytes (default, no second byte present)
        Main item (End collection)
            Header
                .... ..00 = bSize: 0 bytes (0)
                .... 00.. = bType: Main (0)
                1100 .... = bTag: End collection (0xc)

0000  80 a7 0b a3 3e 99 ff ff 43 02 80 12 01 00 2d 00   ....>...C.....-.
0010  58 f5 53 5a 00 00 00 00 5e 17 05 00 00 00 00 00   X.SZ....^.......
0020  66 00 00 00 66 00 00 00 00 00 00 00 00 00 00 00   f...f...........
0030  00 00 00 00 00 00 00 00 00 02 00 00 00 00 00 00   ................
0040  05 01 09 80 a1 01 85 02 09 81 09 82 09 83 25 01   ..............%.
0050  15 00 75 01 95 03 81 06 75 05 95 01 81 01 c0 05   ..u.....u.......
0060  0c 09 01 a1 01 85 03 15 00 25 01 19 b5 29 b7 09   .........%...)..
0070  cd 09 e2 09 e5 09 e7 0a 83 01 09 e9 09 ea 0a 52   ...............R
0080  01 0a 53 01 0a 54 01 0a 55 01 0a 8a 01 0a 92 01   ..S..T..U.......
0090  0a 94 01 0a 21 02 1a 23 02 2a 27 02 0a 2a 02 95   ....!..#.*'..*..
00a0  18 75 01 81 02 c0                                 .u....

     56 0.427336       host                  1.18.2                USB      64     URB_INTERRUPT in

Frame 56: 64 bytes on wire (512 bits), 64 bytes captured (512 bits) on interface 0
    Interface id: 0 (usbmon0)
        Interface name: usbmon0
    Encapsulation type: USB packets with Linux header and padding (115)
    Arrival Time: Jan  8, 2018 23:48:56.334016000 CET
    [Time shift for this packet: 0.000000000 seconds]
    Epoch Time: 1515451736.334016000 seconds
    [Time delta from previous captured frame: 0.000354000 seconds]
    [Time delta from previous displayed frame: 0.000354000 seconds]
    [Time since reference or first frame: 0.427336000 seconds]
    Frame Number: 56
    Frame Length: 64 bytes (512 bits)
    Capture Length: 64 bytes (512 bits)
    [Frame is marked: False]
    [Frame is ignored: False]
    [Protocols in frame: usb]
USB URB
    [Source: host]
    [Destination: 1.18.2]
    URB id: 0xffff993ea30ba540
    URB type: URB_SUBMIT ('S')
    URB transfer type: URB_INTERRUPT (0x01)
    Endpoint: 0x82, Direction: IN
        1... .... = Direction: IN (1)
        .... 0010 = Endpoint number: 2
    Device: 18
    URB bus id: 1
    Device setup request: not relevant ('-')
    Data: not present ('<')
    URB sec: 1515451736
    URB usec: 334016
    URB status: Operation now in progress (-EINPROGRESS) (-115)
    URB length [bytes]: 4
    Data length [bytes]: 0
    [bInterfaceClass: HID (0x03)]
    Unused Setup Header
    Interval: 8
    Start frame: 0
    Copy of Transfer Flags: 0x00000204
    Number of ISO descriptors: 0

0000  40 a5 0b a3 3e 99 ff ff 53 01 82 12 01 00 2d 3c   @...>...S.....-<
0010  58 f5 53 5a 00 00 00 00 c0 18 05 00 8d ff ff ff   X.SZ............
0020  04 00 00 00 00 00 00 00 00 00 00 00 00 00 00 00   ................
0030  08 00 00 00 00 00 00 00 04 02 00 00 00 00 00 00   ................

     57 0.571531       host                  1.18.0                USBHID   65     SET_REPORT Request

Frame 57: 65 bytes on wire (520 bits), 65 bytes captured (520 bits) on interface 0
    Interface id: 0 (usbmon0)
        Interface name: usbmon0
    Encapsulation type: USB packets with Linux header and padding (115)
    Arrival Time: Jan  8, 2018 23:48:56.478211000 CET
    [Time shift for this packet: 0.000000000 seconds]
    Epoch Time: 1515451736.478211000 seconds
    [Time delta from previous captured frame: 0.144195000 seconds]
    [Time delta from previous displayed frame: 0.144195000 seconds]
    [Time since reference or first frame: 0.571531000 seconds]
    Frame Number: 57
    Frame Length: 65 bytes (520 bits)
    Capture Length: 65 bytes (520 bits)
    [Frame is marked: False]
    [Frame is ignored: False]
    [Protocols in frame: usb:usbhid]
USB URB
    [Source: host]
    [Destination: 1.18.0]
    URB id: 0xffff993e827d5b40
    URB type: URB_SUBMIT ('S')
    URB transfer type: URB_CONTROL (0x02)
    Endpoint: 0x00, Direction: OUT
        0... .... = Direction: OUT (0)
        .... 0000 = Endpoint number: 0
    Device: 18
    URB bus id: 1
    Device setup request: relevant (0)
    Data: present (0)
    URB sec: 1515451736
    URB usec: 478211
    URB status: Operation now in progress (-EINPROGRESS) (-115)
    URB length [bytes]: 1
    Data length [bytes]: 1
    [Response in: 58]
    Interval: 0
    Start frame: 0
    Copy of Transfer Flags: 0x00000004
    Number of ISO descriptors: 0
    [bInterfaceClass: HID (0x03)]
URB setup
    bmRequestType: 0x21
        0... .... = Direction: Host-to-device
        .01. .... = Type: Class (0x1)
        ...0 0001 = Recipient: Interface (0x01)
    bRequest: 9
    wValue: 0x0200
    wIndex: 0 (0x0000)
    wLength: 1
    Data Fragment: 01
bRequest: SET_REPORT (0x09)
wValue: 0x0200
    ReportID: 0
    ReportType: Output (2)
wIndex: 0
wLength: 1

Frame (65 bytes):
0000  40 5b 7d 82 3e 99 ff ff 53 02 00 12 01 00 00 00   @[}.>...S.......
0010  58 f5 53 5a 00 00 00 00 03 4c 07 00 8d ff ff ff   X.SZ.....L......
0020  01 00 00 00 01 00 00 00 21 09 00 02 00 00 01 00   ........!.......
0030  00 00 00 00 00 00 00 00 04 00 00 00 00 00 00 00   ................
0040  01                                                .
USB Control (8 bytes):
0000  09 00 02 00 00 01 00 01                           ........

     58 0.571946       1.18.0                host                  USBHID   64     SET_REPORT Response

Frame 58: 64 bytes on wire (512 bits), 64 bytes captured (512 bits) on interface 0
    Interface id: 0 (usbmon0)
        Interface name: usbmon0
    Encapsulation type: USB packets with Linux header and padding (115)
    Arrival Time: Jan  8, 2018 23:48:56.478626000 CET
    [Time shift for this packet: 0.000000000 seconds]
    Epoch Time: 1515451736.478626000 seconds
    [Time delta from previous captured frame: 0.000415000 seconds]
    [Time delta from previous displayed frame: 0.000415000 seconds]
    [Time since reference or first frame: 0.571946000 seconds]
    Frame Number: 58
    Frame Length: 64 bytes (512 bits)
    Capture Length: 64 bytes (512 bits)
    [Frame is marked: False]
    [Frame is ignored: False]
    [Protocols in frame: usb]
USB URB
    [Source: 1.18.0]
    [Destination: host]
    URB id: 0xffff993e827d5b40
    URB type: URB_COMPLETE ('C')
    URB transfer type: URB_CONTROL (0x02)
    Endpoint: 0x00, Direction: OUT
        0... .... = Direction: OUT (0)
        .... 0000 = Endpoint number: 0
    Device: 18
    URB bus id: 1
    Device setup request: not relevant ('-')
    Data: not present ('>')
    URB sec: 1515451736
    URB usec: 478626
    URB status: Success (0)
    URB length [bytes]: 1
    Data length [bytes]: 0
    [Request in: 57]
    [Time from request: 0.000415000 seconds]
    Unused Setup Header
    Interval: 0
    Start frame: 0
    Copy of Transfer Flags: 0x00000004
    Number of ISO descriptors: 0
    [bInterfaceClass: HID (0x03)]

0000  40 5b 7d 82 3e 99 ff ff 43 02 00 12 01 00 2d 3e   @[}.>...C.....->
0010  58 f5 53 5a 00 00 00 00 a2 4d 07 00 00 00 00 00   X.SZ.....M......
0020  01 00 00 00 00 00 00 00 00 00 00 00 00 00 00 00   ................
0030  00 00 00 00 00 00 00 00 04 00 00 00 00 00 00 00   ................

     59 8.633925       1.18.1                host                  USB      72     URB_INTERRUPT in

Frame 59: 72 bytes on wire (576 bits), 72 bytes captured (576 bits) on interface 0
    Interface id: 0 (usbmon0)
        Interface name: usbmon0
    Encapsulation type: USB packets with Linux header and padding (115)
    Arrival Time: Jan  8, 2018 23:49:04.540605000 CET
    [Time shift for this packet: 0.000000000 seconds]
    Epoch Time: 1515451744.540605000 seconds
    [Time delta from previous captured frame: 8.061979000 seconds]
    [Time delta from previous displayed frame: 8.061979000 seconds]
    [Time since reference or first frame: 8.633925000 seconds]
    Frame Number: 59
    Frame Length: 72 bytes (576 bits)
    Capture Length: 72 bytes (576 bits)
    [Frame is marked: False]
    [Frame is ignored: False]
    [Protocols in frame: usb]
USB URB
    [Source: 1.18.1]
    [Destination: host]
    URB id: 0xffff993e827d50c0
    URB type: URB_COMPLETE ('C')
    URB transfer type: URB_INTERRUPT (0x01)
    Endpoint: 0x81, Direction: IN
        1... .... = Direction: IN (1)
        .... 0001 = Endpoint number: 1
    Device: 18
    URB bus id: 1
    Device setup request: not relevant ('-')
    Data: present (0)
    URB sec: 1515451744
    URB usec: 540605
    URB status: Success (0)
    URB length [bytes]: 8
    Data length [bytes]: 8
    [Request in: 50]
    [Time from request: 8.264753000 seconds]
    [bInterfaceClass: HID (0x03)]
    Unused Setup Header
    Interval: 8
    Start frame: 0
    Copy of Transfer Flags: 0x00000204
    Number of ISO descriptors: 0
Leftover Capture Data: 0000280000000000

0000  c0 50 7d 82 3e 99 ff ff 43 01 81 12 01 00 2d 00   .P}.>...C.....-.
0010  60 f5 53 5a 00 00 00 00 bd 3f 08 00 00 00 00 00   `.SZ.....?......
0020  08 00 00 00 08 00 00 00 00 00 00 00 00 00 00 00   ................
0030  08 00 00 00 00 00 00 00 04 02 00 00 00 00 00 00   ................
0040  00 00 28 00 00 00 00 00                           ..(.....

     60 8.634032       host                  1.18.1                USB      64     URB_INTERRUPT in

Frame 60: 64 bytes on wire (512 bits), 64 bytes captured (512 bits) on interface 0
    Interface id: 0 (usbmon0)
        Interface name: usbmon0
    Encapsulation type: USB packets with Linux header and padding (115)
    Arrival Time: Jan  8, 2018 23:49:04.540712000 CET
    [Time shift for this packet: 0.000000000 seconds]
    Epoch Time: 1515451744.540712000 seconds
    [Time delta from previous captured frame: 0.000107000 seconds]
    [Time delta from previous displayed frame: 0.000107000 seconds]
    [Time since reference or first frame: 8.634032000 seconds]
    Frame Number: 60
    Frame Length: 64 bytes (512 bits)
    Capture Length: 64 bytes (512 bits)
    [Frame is marked: False]
    [Frame is ignored: False]
    [Protocols in frame: usb]
USB URB
    [Source: host]
    [Destination: 1.18.1]
    URB id: 0xffff993e827d50c0
    URB type: URB_SUBMIT ('S')
    URB transfer type: URB_INTERRUPT (0x01)
    Endpoint: 0x81, Direction: IN
        1... .... = Direction: IN (1)
        .... 0001 = Endpoint number: 1
    Device: 18
    URB bus id: 1
    Device setup request: not relevant ('-')
    Data: not present ('<')
    URB sec: 1515451744
    URB usec: 540712
    URB status: Operation now in progress (-EINPROGRESS) (-115)
    URB length [bytes]: 8
    Data length [bytes]: 0
    [Response in: 61]
    [bInterfaceClass: HID (0x03)]
    Unused Setup Header
    Interval: 8
    Start frame: 0
    Copy of Transfer Flags: 0x00000204
    Number of ISO descriptors: 0

0000  c0 50 7d 82 3e 99 ff ff 53 01 81 12 01 00 2d 3c   .P}.>...S.....-<
0010  60 f5 53 5a 00 00 00 00 28 40 08 00 8d ff ff ff   `.SZ....(@......
0020  08 00 00 00 00 00 00 00 00 00 00 00 00 00 00 00   ................
0030  08 00 00 00 00 00 00 00 04 02 00 00 00 00 00 00   ................

     61 8.866315       1.18.1                host                  USB      72     URB_INTERRUPT in

Frame 61: 72 bytes on wire (576 bits), 72 bytes captured (576 bits) on interface 0
    Interface id: 0 (usbmon0)
        Interface name: usbmon0
    Encapsulation type: USB packets with Linux header and padding (115)
    Arrival Time: Jan  8, 2018 23:49:04.772995000 CET
    [Time shift for this packet: 0.000000000 seconds]
    Epoch Time: 1515451744.772995000 seconds
    [Time delta from previous captured frame: 0.232283000 seconds]
    [Time delta from previous displayed frame: 0.232283000 seconds]
    [Time since reference or first frame: 8.866315000 seconds]
    Frame Number: 61
    Frame Length: 72 bytes (576 bits)
    Capture Length: 72 bytes (576 bits)
    [Frame is marked: False]
    [Frame is ignored: False]
    [Protocols in frame: usb]
USB URB
    [Source: 1.18.1]
    [Destination: host]
    URB id: 0xffff993e827d50c0
    URB type: URB_COMPLETE ('C')
    URB transfer type: URB_INTERRUPT (0x01)
    Endpoint: 0x81, Direction: IN
        1... .... = Direction: IN (1)
        .... 0001 = Endpoint number: 1
    Device: 18
    URB bus id: 1
    Device setup request: not relevant ('-')
    Data: present (0)
    URB sec: 1515451744
    URB usec: 772995
    URB status: Success (0)
    URB length [bytes]: 8
    Data length [bytes]: 8
    [Request in: 60]
    [Time from request: 0.232283000 seconds]
    [bInterfaceClass: HID (0x03)]
    Unused Setup Header
    Interval: 8
    Start frame: 0
    Copy of Transfer Flags: 0x00000204
    Number of ISO descriptors: 0
Leftover Capture Data: 0000000000000000

0000  c0 50 7d 82 3e 99 ff ff 43 01 81 12 01 00 2d 00   .P}.>...C.....-.
0010  60 f5 53 5a 00 00 00 00 83 cb 0b 00 00 00 00 00   `.SZ............
0020  08 00 00 00 08 00 00 00 00 00 00 00 00 00 00 00   ................
0030  08 00 00 00 00 00 00 00 04 02 00 00 00 00 00 00   ................
0040  00 00 00 00 00 00 00 00                           ........

     62 8.866421       host                  1.18.1                USB      64     URB_INTERRUPT in

Frame 62: 64 bytes on wire (512 bits), 64 bytes captured (512 bits) on interface 0
    Interface id: 0 (usbmon0)
        Interface name: usbmon0
    Encapsulation type: USB packets with Linux header and padding (115)
    Arrival Time: Jan  8, 2018 23:49:04.773101000 CET
    [Time shift for this packet: 0.000000000 seconds]
    Epoch Time: 1515451744.773101000 seconds
    [Time delta from previous captured frame: 0.000106000 seconds]
    [Time delta from previous displayed frame: 0.000106000 seconds]
    [Time since reference or first frame: 8.866421000 seconds]
    Frame Number: 62
    Frame Length: 64 bytes (512 bits)
    Capture Length: 64 bytes (512 bits)
    [Frame is marked: False]
    [Frame is ignored: False]
    [Protocols in frame: usb]
USB URB
    [Source: host]
    [Destination: 1.18.1]
    URB id: 0xffff993e827d50c0
    URB type: URB_SUBMIT ('S')
    URB transfer type: URB_INTERRUPT (0x01)
    Endpoint: 0x81, Direction: IN
        1... .... = Direction: IN (1)
        .... 0001 = Endpoint number: 1
    Device: 18
    URB bus id: 1
    Device setup request: not relevant ('-')
    Data: not present ('<')
    URB sec: 1515451744
    URB usec: 773101
    URB status: Operation now in progress (-EINPROGRESS) (-115)
    URB length [bytes]: 8
    Data length [bytes]: 0
    [Response in: 63]
    [bInterfaceClass: HID (0x03)]
    Unused Setup Header
    Interval: 8
    Start frame: 0
    Copy of Transfer Flags: 0x00000204
    Number of ISO descriptors: 0

0000  c0 50 7d 82 3e 99 ff ff 53 01 81 12 01 00 2d 3c   .P}.>...S.....-<
0010  60 f5 53 5a 00 00 00 00 ed cb 0b 00 8d ff ff ff   `.SZ............
0020  08 00 00 00 00 00 00 00 00 00 00 00 00 00 00 00   ................
0030  08 00 00 00 00 00 00 00 04 02 00 00 00 00 00 00   ................

     63 15.713980      1.18.1                host                  USB      72     URB_INTERRUPT in

Frame 63: 72 bytes on wire (576 bits), 72 bytes captured (576 bits) on interface 0
    Interface id: 0 (usbmon0)
        Interface name: usbmon0
    Encapsulation type: USB packets with Linux header and padding (115)
    Arrival Time: Jan  8, 2018 23:49:11.620660000 CET
    [Time shift for this packet: 0.000000000 seconds]
    Epoch Time: 1515451751.620660000 seconds
    [Time delta from previous captured frame: 6.847559000 seconds]
    [Time delta from previous displayed frame: 6.847559000 seconds]
    [Time since reference or first frame: 15.713980000 seconds]
    Frame Number: 63
    Frame Length: 72 bytes (576 bits)
    Capture Length: 72 bytes (576 bits)
    [Frame is marked: False]
    [Frame is ignored: False]
    [Protocols in frame: usb]
USB URB
    [Source: 1.18.1]
    [Destination: host]
    URB id: 0xffff993e827d50c0
    URB type: URB_COMPLETE ('C')
    URB transfer type: URB_INTERRUPT (0x01)
    Endpoint: 0x81, Direction: IN
        1... .... = Direction: IN (1)
        .... 0001 = Endpoint number: 1
    Device: 18
    URB bus id: 1
    Device setup request: not relevant ('-')
    Data: present (0)
    URB sec: 1515451751
    URB usec: 620660
    URB status: Success (0)
    URB length [bytes]: 8
    Data length [bytes]: 8
    [Request in: 62]
    [Time from request: 6.847559000 seconds]
    [bInterfaceClass: HID (0x03)]
    Unused Setup Header
    Interval: 8
    Start frame: 0
    Copy of Transfer Flags: 0x00000204
    Number of ISO descriptors: 0
Leftover Capture Data: 0100000000000000

0000  c0 50 7d 82 3e 99 ff ff 43 01 81 12 01 00 2d 00   .P}.>...C.....-.
0010  67 f5 53 5a 00 00 00 00 74 78 09 00 00 00 00 00   g.SZ....tx......
0020  08 00 00 00 08 00 00 00 00 00 00 00 00 00 00 00   ................
0030  08 00 00 00 00 00 00 00 04 02 00 00 00 00 00 00   ................
0040  01 00 00 00 00 00 00 00                           ........

     64 15.714087      host                  1.18.1                USB      64     URB_INTERRUPT in

Frame 64: 64 bytes on wire (512 bits), 64 bytes captured (512 bits) on interface 0
    Interface id: 0 (usbmon0)
        Interface name: usbmon0
    Encapsulation type: USB packets with Linux header and padding (115)
    Arrival Time: Jan  8, 2018 23:49:11.620767000 CET
    [Time shift for this packet: 0.000000000 seconds]
    Epoch Time: 1515451751.620767000 seconds
    [Time delta from previous captured frame: 0.000107000 seconds]
    [Time delta from previous displayed frame: 0.000107000 seconds]
    [Time since reference or first frame: 15.714087000 seconds]
    Frame Number: 64
    Frame Length: 64 bytes (512 bits)
    Capture Length: 64 bytes (512 bits)
    [Frame is marked: False]
    [Frame is ignored: False]
    [Protocols in frame: usb]
USB URB
    [Source: host]
    [Destination: 1.18.1]
    URB id: 0xffff993e827d50c0
    URB type: URB_SUBMIT ('S')
    URB transfer type: URB_INTERRUPT (0x01)
    Endpoint: 0x81, Direction: IN
        1... .... = Direction: IN (1)
        .... 0001 = Endpoint number: 1
    Device: 18
    URB bus id: 1
    Device setup request: not relevant ('-')
    Data: not present ('<')
    URB sec: 1515451751
    URB usec: 620767
    URB status: Operation now in progress (-EINPROGRESS) (-115)
    URB length [bytes]: 8
    Data length [bytes]: 0
    [Response in: 65]
    [bInterfaceClass: HID (0x03)]
    Unused Setup Header
    Interval: 8
    Start frame: 0
    Copy of Transfer Flags: 0x00000204
    Number of ISO descriptors: 0

0000  c0 50 7d 82 3e 99 ff ff 53 01 81 12 01 00 2d 3c   .P}.>...S.....-<
0010  67 f5 53 5a 00 00 00 00 df 78 09 00 8d ff ff ff   g.SZ.....x......
0020  08 00 00 00 00 00 00 00 00 00 00 00 00 00 00 00   ................
0030  08 00 00 00 00 00 00 00 04 02 00 00 00 00 00 00   ................

     65 16.033935      1.18.1                host                  USB      72     URB_INTERRUPT in

Frame 65: 72 bytes on wire (576 bits), 72 bytes captured (576 bits) on interface 0
    Interface id: 0 (usbmon0)
        Interface name: usbmon0
    Encapsulation type: USB packets with Linux header and padding (115)
    Arrival Time: Jan  8, 2018 23:49:11.940615000 CET
    [Time shift for this packet: 0.000000000 seconds]
    Epoch Time: 1515451751.940615000 seconds
    [Time delta from previous captured frame: 0.319848000 seconds]
    [Time delta from previous displayed frame: 0.319848000 seconds]
    [Time since reference or first frame: 16.033935000 seconds]
    Frame Number: 65
    Frame Length: 72 bytes (576 bits)
    Capture Length: 72 bytes (576 bits)
    [Frame is marked: False]
    [Frame is ignored: False]
    [Protocols in frame: usb]
USB URB
    [Source: 1.18.1]
    [Destination: host]
    URB id: 0xffff993e827d50c0
    URB type: URB_COMPLETE ('C')
    URB transfer type: URB_INTERRUPT (0x01)
    Endpoint: 0x81, Direction: IN
        1... .... = Direction: IN (1)
        .... 0001 = Endpoint number: 1
    Device: 18
    URB bus id: 1
    Device setup request: not relevant ('-')
    Data: present (0)
    URB sec: 1515451751
    URB usec: 940615
    URB status: Success (0)
    URB length [bytes]: 8
    Data length [bytes]: 8
    [Request in: 64]
    [Time from request: 0.319848000 seconds]
    [bInterfaceClass: HID (0x03)]
    Unused Setup Header
    Interval: 8
    Start frame: 0
    Copy of Transfer Flags: 0x00000204
    Number of ISO descriptors: 0
Leftover Capture Data: 0000000000000000

0000  c0 50 7d 82 3e 99 ff ff 43 01 81 12 01 00 2d 00   .P}.>...C.....-.
0010  67 f5 53 5a 00 00 00 00 47 5a 0e 00 00 00 00 00   g.SZ....GZ......
0020  08 00 00 00 08 00 00 00 00 00 00 00 00 00 00 00   ................
0030  08 00 00 00 00 00 00 00 04 02 00 00 00 00 00 00   ................
0040  00 00 00 00 00 00 00 00                           ........

     66 16.034024      host                  1.18.1                USB      64     URB_INTERRUPT in

Frame 66: 64 bytes on wire (512 bits), 64 bytes captured (512 bits) on interface 0
    Interface id: 0 (usbmon0)
        Interface name: usbmon0
    Encapsulation type: USB packets with Linux header and padding (115)
    Arrival Time: Jan  8, 2018 23:49:11.940704000 CET
    [Time shift for this packet: 0.000000000 seconds]
    Epoch Time: 1515451751.940704000 seconds
    [Time delta from previous captured frame: 0.000089000 seconds]
    [Time delta from previous displayed frame: 0.000089000 seconds]
    [Time since reference or first frame: 16.034024000 seconds]
    Frame Number: 66
    Frame Length: 64 bytes (512 bits)
    Capture Length: 64 bytes (512 bits)
    [Frame is marked: False]
    [Frame is ignored: False]
    [Protocols in frame: usb]
USB URB
    [Source: host]
    [Destination: 1.18.1]
    URB id: 0xffff993e827d50c0
    URB type: URB_SUBMIT ('S')
    URB transfer type: URB_INTERRUPT (0x01)
    Endpoint: 0x81, Direction: IN
        1... .... = Direction: IN (1)
        .... 0001 = Endpoint number: 1
    Device: 18
    URB bus id: 1
    Device setup request: not relevant ('-')
    Data: not present ('<')
    URB sec: 1515451751
    URB usec: 940704
    URB status: Operation now in progress (-EINPROGRESS) (-115)
    URB length [bytes]: 8
    Data length [bytes]: 0
    [bInterfaceClass: HID (0x03)]
    Unused Setup Header
    Interval: 8
    Start frame: 0
    Copy of Transfer Flags: 0x00000204
    Number of ISO descriptors: 0

0000  c0 50 7d 82 3e 99 ff ff 53 01 81 12 01 00 2d 3c   .P}.>...S.....-<
0010  67 f5 53 5a 00 00 00 00 a0 5a 0e 00 8d ff ff ff   g.SZ.....Z......
0020  08 00 00 00 00 00 00 00 00 00 00 00 00 00 00 00   ................
0030  08 00 00 00 00 00 00 00 04 02 00 00 00 00 00 00   ................
