No.     Time           Source                Destination           Protocol Length Info
      1 0.000000       1.1.1                 host                  USB      66     URB_INTERRUPT in

Frame 1: 66 bytes on wire (528 bits), 66 bytes captured (528 bits) on interface 0
    Interface id: 0 (usbmon0)
        Interface name: usbmon0
    Encapsulation type: USB packets with Linux header and padding (115)
    Arrival Time: Jan  8, 2018 11:58:05.285644000 CET
    [Time shift for this packet: 0.000000000 seconds]
    Epoch Time: 1515409085.285644000 seconds
    [Time delta from previous captured frame: 0.000000000 seconds]
    [Time delta from previous displayed frame: 0.000000000 seconds]
    [Time since reference or first frame: 0.000000000 seconds]
    Frame Number: 1
    Frame Length: 66 bytes (528 bits)
    Capture Length: 66 bytes (528 bits)
    [Frame is marked: False]
    [Frame is ignored: False]
    [Protocols in frame: usb]
USB URB
    [Source: 1.1.1]
    [Destination: host]
    URB id: 0xffff8da1604bc600
    URB type: URB_COMPLETE ('C')
    URB transfer type: URB_INTERRUPT (0x01)
    Endpoint: 0x81, Direction: IN
        1... .... = Direction: IN (1)
        .... 0001 = Endpoint number: 1
    Device: 1
    URB bus id: 1
    Device setup request: not relevant ('-')
    Data: present (0)
    URB sec: 1515409085
    URB usec: 285644
    URB status: Success (0)
    URB length [bytes]: 2
    Data length [bytes]: 2
    [bInterfaceClass: Unknown (0xffff)]
    Unused Setup Header
    Interval: 2048
    Start frame: 0
    Copy of Transfer Flags: 0x00000200
    Number of ISO descriptors: 0
Leftover Capture Data: 1000

0000  00 c6 4b 60 a1 8d ff ff 43 01 81 01 01 00 2d 00   ..K`....C.....-.
0010  bd 4e 53 5a 00 00 00 00 cc 5b 04 00 00 00 00 00   .NSZ.....[......
0020  02 00 00 00 02 00 00 00 00 00 00 00 00 00 00 00   ................
0030  00 08 00 00 00 00 00 00 00 02 00 00 00 00 00 00   ................
0040  10 00                                             ..

No.     Time           Source                Destination           Protocol Length Info
      2 0.000026       host                  1.1.1                 USB      64     URB_INTERRUPT in

Frame 2: 64 bytes on wire (512 bits), 64 bytes captured (512 bits) on interface 0
    Interface id: 0 (usbmon0)
        Interface name: usbmon0
    Encapsulation type: USB packets with Linux header and padding (115)
    Arrival Time: Jan  8, 2018 11:58:05.285670000 CET
    [Time shift for this packet: 0.000000000 seconds]
    Epoch Time: 1515409085.285670000 seconds
    [Time delta from previous captured frame: 0.000026000 seconds]
    [Time delta from previous displayed frame: 0.000026000 seconds]
    [Time since reference or first frame: 0.000026000 seconds]
    Frame Number: 2
    Frame Length: 64 bytes (512 bits)
    Capture Length: 64 bytes (512 bits)
    [Frame is marked: False]
    [Frame is ignored: False]
    [Protocols in frame: usb]
USB URB
    [Source: host]
    [Destination: 1.1.1]
    URB id: 0xffff8da1604bc600
    URB type: URB_SUBMIT ('S')
    URB transfer type: URB_INTERRUPT (0x01)
    Endpoint: 0x81, Direction: IN
        1... .... = Direction: IN (1)
        .... 0001 = Endpoint number: 1
    Device: 1
    URB bus id: 1
    Device setup request: not relevant ('-')
    Data: not present ('<')
    URB sec: 1515409085
    URB usec: 285670
    URB status: Operation now in progress (-EINPROGRESS) (-115)
    URB length [bytes]: 4
    Data length [bytes]: 0
    [bInterfaceClass: Unknown (0xffff)]
    Unused Setup Header
    Interval: 2048
    Start frame: 0
    Copy of Transfer Flags: 0x00000200
    Number of ISO descriptors: 0

0000  00 c6 4b 60 a1 8d ff ff 53 01 81 01 01 00 2d 3c   ..K`....S.....-<
0010  bd 4e 53 5a 00 00 00 00 e6 5b 04 00 8d ff ff ff   .NSZ.....[......
0020  04 00 00 00 00 00 00 00 00 00 00 00 00 00 00 00   ................
0030  00 08 00 00 00 00 00 00 00 02 00 00 00 00 00 00   ................

No.     Time           Source                Destination           Protocol Length Info
      3 0.000211       host                  1.1.0                 USBHUB   64     GET_STATUS Request     [Port 4]

Frame 3: 64 bytes on wire (512 bits), 64 bytes captured (512 bits) on interface 0
    Interface id: 0 (usbmon0)
        Interface name: usbmon0
    Encapsulation type: USB packets with Linux header and padding (115)
    Arrival Time: Jan  8, 2018 11:58:05.285855000 CET
    [Time shift for this packet: 0.000000000 seconds]
    Epoch Time: 1515409085.285855000 seconds
    [Time delta from previous captured frame: 0.000185000 seconds]
    [Time delta from previous displayed frame: 0.000185000 seconds]
    [Time since reference or first frame: 0.000211000 seconds]
    Frame Number: 3
    Frame Length: 64 bytes (512 bits)
    Capture Length: 64 bytes (512 bits)
    [Frame is marked: False]
    [Frame is ignored: False]
    [Protocols in frame: usb:usbhub]
USB URB
    [Source: host]
    [Destination: 1.1.0]
    URB id: 0xffff8d9f64b4ab40
    URB type: URB_SUBMIT ('S')
    URB transfer type: URB_CONTROL (0x02)
    Endpoint: 0x80, Direction: IN
        1... .... = Direction: IN (1)
        .... 0000 = Endpoint number: 0
    Device: 1
    URB bus id: 1
    Device setup request: relevant (0)
    Data: not present ('<')
    URB sec: 1515409085
    URB usec: 285855
    URB status: Operation now in progress (-EINPROGRESS) (-115)
    URB length [bytes]: 4
    Data length [bytes]: 0
    [Response in: 4]
    Interval: 0
    Start frame: 0
    Copy of Transfer Flags: 0x00000200
    Number of ISO descriptors: 0
    [bInterfaceClass: Unknown (0xffff)]
URB setup
    bmRequestType: 0xa3
        1... .... = Direction: Device-to-host
        .01. .... = Type: Class (0x1)
        ...0 0011 = Recipient: Other (0x03)
bRequest: GET_STATUS (0x00)
wValue: 0x0000
    (zero): 0
wIndex: 4
    Port: 4
wLength: 4

0000  40 ab b4 64 9f 8d ff ff 53 02 80 01 01 00 00 3c   @..d....S......<
0010  bd 4e 53 5a 00 00 00 00 9f 5c 04 00 8d ff ff ff   .NSZ.....\......
0020  04 00 00 00 00 00 00 00 a3 00 00 00 04 00 04 00   ................
0030  00 00 00 00 00 00 00 00 00 02 00 00 00 00 00 00   ................

No.     Time           Source                Destination           Protocol Length Info
      4 0.000237       1.1.0                 host                  USBHUB   68     GET_STATUS Response    [Port 4]

Frame 4: 68 bytes on wire (544 bits), 68 bytes captured (544 bits) on interface 0
    Interface id: 0 (usbmon0)
        Interface name: usbmon0
    Encapsulation type: USB packets with Linux header and padding (115)
    Arrival Time: Jan  8, 2018 11:58:05.285881000 CET
    [Time shift for this packet: 0.000000000 seconds]
    Epoch Time: 1515409085.285881000 seconds
    [Time delta from previous captured frame: 0.000026000 seconds]
    [Time delta from previous displayed frame: 0.000026000 seconds]
    [Time since reference or first frame: 0.000237000 seconds]
    Frame Number: 4
    Frame Length: 68 bytes (544 bits)
    Capture Length: 68 bytes (544 bits)
    [Frame is marked: False]
    [Frame is ignored: False]
    [Protocols in frame: usb:usbhub]
USB URB
    [Source: 1.1.0]
    [Destination: host]
    URB id: 0xffff8d9f64b4ab40
    URB type: URB_COMPLETE ('C')
    URB transfer type: URB_CONTROL (0x02)
    Endpoint: 0x80, Direction: IN
        1... .... = Direction: IN (1)
        .... 0000 = Endpoint number: 0
    Device: 1
    URB bus id: 1
    Device setup request: not relevant ('-')
    Data: present (0)
    URB sec: 1515409085
    URB usec: 285881
    URB status: Success (0)
    URB length [bytes]: 4
    Data length [bytes]: 4
    [Request in: 3]
    [Time from request: 0.000026000 seconds]
    Unused Setup Header
    Interval: 0
    Start frame: 0
    Copy of Transfer Flags: 0x00000200
    Number of ISO descriptors: 0
    [bInterfaceClass: Unknown (0xffff)]
Port Status: 0x0301, PORT_CONNECTION, PORT_POWER, PORT_LOW_SPEED
    .... .... .... ...1 = PORT_CONNECTION: True
    .... .... .... ..0. = PORT_ENABLE: False
    .... .... .... .0.. = PORT_SUSPEND: False
    .... .... .... 0... = PORT_OVER_CURRENT: False
    .... .... ...0 .... = PORT_RESET: False
    .... ...1 .... .... = PORT_POWER: True
    .... ..1. .... .... = PORT_LOW_SPEED: True
    .... .0.. .... .... = PORT_HIGH_SPEED: False
    .... 0... .... .... = PORT_TEST: False
    ...0 .... .... .... = PORT_INDICATOR: Default colors
Port Change: 0x0001, C_PORT_CONNECTION
    .... .... .... ...1 = C_PORT_CONNECTION: True
    .... .... .... ..0. = C_PORT_ENABLE: False
    .... .... .... .0.. = C_PORT_SUSPEND: False
    .... .... .... 0... = C_PORT_OVER_CURRENT: False
    .... .... ...0 .... = C_PORT_RESET: False

0000  40 ab b4 64 9f 8d ff ff 43 02 80 01 01 00 2d 00   @..d....C.....-.
0010  bd 4e 53 5a 00 00 00 00 b9 5c 04 00 00 00 00 00   .NSZ.....\......
0020  04 00 00 00 04 00 00 00 00 00 00 00 00 00 00 00   ................
0030  00 00 00 00 00 00 00 00 00 02 00 00 00 00 00 00   ................
0040  01 03 01 00                                       ....

No.     Time           Source                Destination           Protocol Length Info
      5 0.000248       host                  1.1.0                 USBHUB   64     CLEAR_FEATURE Request  [Port 4: C_PORT_CONNECTION]

Frame 5: 64 bytes on wire (512 bits), 64 bytes captured (512 bits) on interface 0
    Interface id: 0 (usbmon0)
        Interface name: usbmon0
    Encapsulation type: USB packets with Linux header and padding (115)
    Arrival Time: Jan  8, 2018 11:58:05.285892000 CET
    [Time shift for this packet: 0.000000000 seconds]
    Epoch Time: 1515409085.285892000 seconds
    [Time delta from previous captured frame: 0.000011000 seconds]
    [Time delta from previous displayed frame: 0.000011000 seconds]
    [Time since reference or first frame: 0.000248000 seconds]
    Frame Number: 5
    Frame Length: 64 bytes (512 bits)
    Capture Length: 64 bytes (512 bits)
    [Frame is marked: False]
    [Frame is ignored: False]
    [Protocols in frame: usb:usbhub]
USB URB
    [Source: host]
    [Destination: 1.1.0]
    URB id: 0xffff8d9f64b4ab40
    URB type: URB_SUBMIT ('S')
    URB transfer type: URB_CONTROL (0x02)
    Endpoint: 0x00, Direction: OUT
        0... .... = Direction: OUT (0)
        .... 0000 = Endpoint number: 0
    Device: 1
    URB bus id: 1
    Device setup request: relevant (0)
    Data: present (0)
    URB sec: 1515409085
    URB usec: 285892
    URB status: Operation now in progress (-EINPROGRESS) (-115)
    URB length [bytes]: 0
    Data length [bytes]: 0
    [Response in: 6]
    Interval: 0
    Start frame: 0
    Copy of Transfer Flags: 0x00000000
    Number of ISO descriptors: 0
    [bInterfaceClass: Unknown (0xffff)]
URB setup
    bmRequestType: 0x23
        0... .... = Direction: Host-to-device
        .01. .... = Type: Class (0x1)
        ...0 0011 = Recipient: Other (0x03)
bRequest: CLEAR_FEATURE (0x01)
wValue: 0x0010
    PortFeatureSelector: C_PORT_CONNECTION (16)
wIndex: 4
    Port: 4
    PortSelector: 0
wLength: 0
    (zero): 0

0000  40 ab b4 64 9f 8d ff ff 53 02 00 01 01 00 00 00   @..d....S.......
0010  bd 4e 53 5a 00 00 00 00 c4 5c 04 00 8d ff ff ff   .NSZ.....\......
0020  00 00 00 00 00 00 00 00 23 01 10 00 04 00 00 00   ........#.......
0030  00 00 00 00 00 00 00 00 00 00 00 00 00 00 00 00   ................

No.     Time           Source                Destination           Protocol Length Info
      6 0.000257       1.1.0                 host                  USBHUB   64     CLEAR_FEATURE Response [Port 4: C_PORT_CONNECTION]

Frame 6: 64 bytes on wire (512 bits), 64 bytes captured (512 bits) on interface 0
    Interface id: 0 (usbmon0)
        Interface name: usbmon0
    Encapsulation type: USB packets with Linux header and padding (115)
    Arrival Time: Jan  8, 2018 11:58:05.285901000 CET
    [Time shift for this packet: 0.000000000 seconds]
    Epoch Time: 1515409085.285901000 seconds
    [Time delta from previous captured frame: 0.000009000 seconds]
    [Time delta from previous displayed frame: 0.000009000 seconds]
    [Time since reference or first frame: 0.000257000 seconds]
    Frame Number: 6
    Frame Length: 64 bytes (512 bits)
    Capture Length: 64 bytes (512 bits)
    [Frame is marked: False]
    [Frame is ignored: False]
    [Protocols in frame: usb]
USB URB
    [Source: 1.1.0]
    [Destination: host]
    URB id: 0xffff8d9f64b4ab40
    URB type: URB_COMPLETE ('C')
    URB transfer type: URB_CONTROL (0x02)
    Endpoint: 0x00, Direction: OUT
        0... .... = Direction: OUT (0)
        .... 0000 = Endpoint number: 0
    Device: 1
    URB bus id: 1
    Device setup request: not relevant ('-')
    Data: not present ('>')
    URB sec: 1515409085
    URB usec: 285901
    URB status: Success (0)
    URB length [bytes]: 0
    Data length [bytes]: 0
    [Request in: 5]
    [Time from request: 0.000009000 seconds]
    Unused Setup Header
    Interval: 0
    Start frame: 0
    Copy of Transfer Flags: 0x00000000
    Number of ISO descriptors: 0
    [bInterfaceClass: Unknown (0xffff)]

0000  40 ab b4 64 9f 8d ff ff 43 02 00 01 01 00 2d 3e   @..d....C.....->
0010  bd 4e 53 5a 00 00 00 00 cd 5c 04 00 00 00 00 00   .NSZ.....\......
0020  00 00 00 00 00 00 00 00 00 00 00 00 00 00 00 00   ................
0030  00 00 00 00 00 00 00 00 00 00 00 00 00 00 00 00   ................

No.     Time           Source                Destination           Protocol Length Info
      7 0.000264       host                  1.1.0                 USBHUB   64     GET_STATUS Request     [Port 4]

Frame 7: 64 bytes on wire (512 bits), 64 bytes captured (512 bits) on interface 0
    Interface id: 0 (usbmon0)
        Interface name: usbmon0
    Encapsulation type: USB packets with Linux header and padding (115)
    Arrival Time: Jan  8, 2018 11:58:05.285908000 CET
    [Time shift for this packet: 0.000000000 seconds]
    Epoch Time: 1515409085.285908000 seconds
    [Time delta from previous captured frame: 0.000007000 seconds]
    [Time delta from previous displayed frame: 0.000007000 seconds]
    [Time since reference or first frame: 0.000264000 seconds]
    Frame Number: 7
    Frame Length: 64 bytes (512 bits)
    Capture Length: 64 bytes (512 bits)
    [Frame is marked: False]
    [Frame is ignored: False]
    [Protocols in frame: usb:usbhub]
USB URB
    [Source: host]
    [Destination: 1.1.0]
    URB id: 0xffff8d9f64b4ab40
    URB type: URB_SUBMIT ('S')
    URB transfer type: URB_CONTROL (0x02)
    Endpoint: 0x80, Direction: IN
        1... .... = Direction: IN (1)
        .... 0000 = Endpoint number: 0
    Device: 1
    URB bus id: 1
    Device setup request: relevant (0)
    Data: not present ('<')
    URB sec: 1515409085
    URB usec: 285908
    URB status: Operation now in progress (-EINPROGRESS) (-115)
    URB length [bytes]: 4
    Data length [bytes]: 0
    [Response in: 8]
    Interval: 0
    Start frame: 0
    Copy of Transfer Flags: 0x00000200
    Number of ISO descriptors: 0
    [bInterfaceClass: Unknown (0xffff)]
URB setup
    bmRequestType: 0xa3
        1... .... = Direction: Device-to-host
        .01. .... = Type: Class (0x1)
        ...0 0011 = Recipient: Other (0x03)
bRequest: GET_STATUS (0x00)
wValue: 0x0000
    (zero): 0
wIndex: 4
    Port: 4
wLength: 4

0000  40 ab b4 64 9f 8d ff ff 53 02 80 01 01 00 00 3c   @..d....S......<
0010  bd 4e 53 5a 00 00 00 00 d4 5c 04 00 8d ff ff ff   .NSZ.....\......
0020  04 00 00 00 00 00 00 00 a3 00 00 00 04 00 04 00   ................
0030  00 00 00 00 00 00 00 00 00 02 00 00 00 00 00 00   ................

No.     Time           Source                Destination           Protocol Length Info
      8 0.000271       1.1.0                 host                  USBHUB   68     GET_STATUS Response    [Port 4]

Frame 8: 68 bytes on wire (544 bits), 68 bytes captured (544 bits) on interface 0
    Interface id: 0 (usbmon0)
        Interface name: usbmon0
    Encapsulation type: USB packets with Linux header and padding (115)
    Arrival Time: Jan  8, 2018 11:58:05.285915000 CET
    [Time shift for this packet: 0.000000000 seconds]
    Epoch Time: 1515409085.285915000 seconds
    [Time delta from previous captured frame: 0.000007000 seconds]
    [Time delta from previous displayed frame: 0.000007000 seconds]
    [Time since reference or first frame: 0.000271000 seconds]
    Frame Number: 8
    Frame Length: 68 bytes (544 bits)
    Capture Length: 68 bytes (544 bits)
    [Frame is marked: False]
    [Frame is ignored: False]
    [Protocols in frame: usb:usbhub]
USB URB
    [Source: 1.1.0]
    [Destination: host]
    URB id: 0xffff8d9f64b4ab40
    URB type: URB_COMPLETE ('C')
    URB transfer type: URB_CONTROL (0x02)
    Endpoint: 0x80, Direction: IN
        1... .... = Direction: IN (1)
        .... 0000 = Endpoint number: 0
    Device: 1
    URB bus id: 1
    Device setup request: not relevant ('-')
    Data: present (0)
    URB sec: 1515409085
    URB usec: 285915
    URB status: Success (0)
    URB length [bytes]: 4
    Data length [bytes]: 4
    [Request in: 7]
    [Time from request: 0.000007000 seconds]
    Unused Setup Header
    Interval: 0
    Start frame: 0
    Copy of Transfer Flags: 0x00000200
    Number of ISO descriptors: 0
    [bInterfaceClass: Unknown (0xffff)]
Port Status: 0x0301, PORT_CONNECTION, PORT_POWER, PORT_LOW_SPEED
    .... .... .... ...1 = PORT_CONNECTION: True
    .... .... .... ..0. = PORT_ENABLE: False
    .... .... .... .0.. = PORT_SUSPEND: False
    .... .... .... 0... = PORT_OVER_CURRENT: False
    .... .... ...0 .... = PORT_RESET: False
    .... ...1 .... .... = PORT_POWER: True
    .... ..1. .... .... = PORT_LOW_SPEED: True
    .... .0.. .... .... = PORT_HIGH_SPEED: False
    .... 0... .... .... = PORT_TEST: False
    ...0 .... .... .... = PORT_INDICATOR: Default colors
Port Change: 0x0000
    .... .... .... ...0 = C_PORT_CONNECTION: False
    .... .... .... ..0. = C_PORT_ENABLE: False
    .... .... .... .0.. = C_PORT_SUSPEND: False
    .... .... .... 0... = C_PORT_OVER_CURRENT: False
    .... .... ...0 .... = C_PORT_RESET: False

0000  40 ab b4 64 9f 8d ff ff 43 02 80 01 01 00 2d 00   @..d....C.....-.
0010  bd 4e 53 5a 00 00 00 00 db 5c 04 00 00 00 00 00   .NSZ.....\......
0020  04 00 00 00 04 00 00 00 00 00 00 00 00 00 00 00   ................
0030  00 00 00 00 00 00 00 00 00 02 00 00 00 00 00 00   ................
0040  01 03 00 00                                       ....

No.     Time           Source                Destination           Protocol Length Info
      9 0.027093       host                  1.1.0                 USBHUB   64     GET_STATUS Request     [Port 4]

Frame 9: 64 bytes on wire (512 bits), 64 bytes captured (512 bits) on interface 0
    Interface id: 0 (usbmon0)
        Interface name: usbmon0
    Encapsulation type: USB packets with Linux header and padding (115)
    Arrival Time: Jan  8, 2018 11:58:05.312737000 CET
    [Time shift for this packet: 0.000000000 seconds]
    Epoch Time: 1515409085.312737000 seconds
    [Time delta from previous captured frame: 0.026822000 seconds]
    [Time delta from previous displayed frame: 0.026822000 seconds]
    [Time since reference or first frame: 0.027093000 seconds]
    Frame Number: 9
    Frame Length: 64 bytes (512 bits)
    Capture Length: 64 bytes (512 bits)
    [Frame is marked: False]
    [Frame is ignored: False]
    [Protocols in frame: usb:usbhub]
USB URB
    [Source: host]
    [Destination: 1.1.0]
    URB id: 0xffff8d9f64b4ab40
    URB type: URB_SUBMIT ('S')
    URB transfer type: URB_CONTROL (0x02)
    Endpoint: 0x80, Direction: IN
        1... .... = Direction: IN (1)
        .... 0000 = Endpoint number: 0
    Device: 1
    URB bus id: 1
    Device setup request: relevant (0)
    Data: not present ('<')
    URB sec: 1515409085
    URB usec: 312737
    URB status: Operation now in progress (-EINPROGRESS) (-115)
    URB length [bytes]: 4
    Data length [bytes]: 0
    [Response in: 10]
    Interval: 0
    Start frame: 0
    Copy of Transfer Flags: 0x00000200
    Number of ISO descriptors: 0
    [bInterfaceClass: Unknown (0xffff)]
URB setup
    bmRequestType: 0xa3
        1... .... = Direction: Device-to-host
        .01. .... = Type: Class (0x1)
        ...0 0011 = Recipient: Other (0x03)
bRequest: GET_STATUS (0x00)
wValue: 0x0000
    (zero): 0
wIndex: 4
    Port: 4
wLength: 4

0000  40 ab b4 64 9f 8d ff ff 53 02 80 01 01 00 00 3c   @..d....S......<
0010  bd 4e 53 5a 00 00 00 00 a1 c5 04 00 8d ff ff ff   .NSZ............
0020  04 00 00 00 00 00 00 00 a3 00 00 00 04 00 04 00   ................
0030  00 00 00 00 00 00 00 00 00 02 00 00 00 00 00 00   ................

No.     Time           Source                Destination           Protocol Length Info
     10 0.027126       1.1.0                 host                  USBHUB   68     GET_STATUS Response    [Port 4]

Frame 10: 68 bytes on wire (544 bits), 68 bytes captured (544 bits) on interface 0
    Interface id: 0 (usbmon0)
        Interface name: usbmon0
    Encapsulation type: USB packets with Linux header and padding (115)
    Arrival Time: Jan  8, 2018 11:58:05.312770000 CET
    [Time shift for this packet: 0.000000000 seconds]
    Epoch Time: 1515409085.312770000 seconds
    [Time delta from previous captured frame: 0.000033000 seconds]
    [Time delta from previous displayed frame: 0.000033000 seconds]
    [Time since reference or first frame: 0.027126000 seconds]
    Frame Number: 10
    Frame Length: 68 bytes (544 bits)
    Capture Length: 68 bytes (544 bits)
    [Frame is marked: False]
    [Frame is ignored: False]
    [Protocols in frame: usb:usbhub]
USB URB
    [Source: 1.1.0]
    [Destination: host]
    URB id: 0xffff8d9f64b4ab40
    URB type: URB_COMPLETE ('C')
    URB transfer type: URB_CONTROL (0x02)
    Endpoint: 0x80, Direction: IN
        1... .... = Direction: IN (1)
        .... 0000 = Endpoint number: 0
    Device: 1
    URB bus id: 1
    Device setup request: not relevant ('-')
    Data: present (0)
    URB sec: 1515409085
    URB usec: 312770
    URB status: Success (0)
    URB length [bytes]: 4
    Data length [bytes]: 4
    [Request in: 9]
    [Time from request: 0.000033000 seconds]
    Unused Setup Header
    Interval: 0
    Start frame: 0
    Copy of Transfer Flags: 0x00000200
    Number of ISO descriptors: 0
    [bInterfaceClass: Unknown (0xffff)]
Port Status: 0x0301, PORT_CONNECTION, PORT_POWER, PORT_LOW_SPEED
    .... .... .... ...1 = PORT_CONNECTION: True
    .... .... .... ..0. = PORT_ENABLE: False
    .... .... .... .0.. = PORT_SUSPEND: False
    .... .... .... 0... = PORT_OVER_CURRENT: False
    .... .... ...0 .... = PORT_RESET: False
    .... ...1 .... .... = PORT_POWER: True
    .... ..1. .... .... = PORT_LOW_SPEED: True
    .... .0.. .... .... = PORT_HIGH_SPEED: False
    .... 0... .... .... = PORT_TEST: False
    ...0 .... .... .... = PORT_INDICATOR: Default colors
Port Change: 0x0000
    .... .... .... ...0 = C_PORT_CONNECTION: False
    .... .... .... ..0. = C_PORT_ENABLE: False
    .... .... .... .0.. = C_PORT_SUSPEND: False
    .... .... .... 0... = C_PORT_OVER_CURRENT: False
    .... .... ...0 .... = C_PORT_RESET: False

0000  40 ab b4 64 9f 8d ff ff 43 02 80 01 01 00 2d 00   @..d....C.....-.
0010  bd 4e 53 5a 00 00 00 00 c2 c5 04 00 00 00 00 00   .NSZ............
0020  04 00 00 00 04 00 00 00 00 00 00 00 00 00 00 00   ................
0030  00 00 00 00 00 00 00 00 00 02 00 00 00 00 00 00   ................
0040  01 03 00 00                                       ....

No.     Time           Source                Destination           Protocol Length Info
     11 0.054157       host                  1.1.0                 USBHUB   64     GET_STATUS Request     [Port 4]

Frame 11: 64 bytes on wire (512 bits), 64 bytes captured (512 bits) on interface 0
    Interface id: 0 (usbmon0)
        Interface name: usbmon0
    Encapsulation type: USB packets with Linux header and padding (115)
    Arrival Time: Jan  8, 2018 11:58:05.339801000 CET
    [Time shift for this packet: 0.000000000 seconds]
    Epoch Time: 1515409085.339801000 seconds
    [Time delta from previous captured frame: 0.027031000 seconds]
    [Time delta from previous displayed frame: 0.027031000 seconds]
    [Time since reference or first frame: 0.054157000 seconds]
    Frame Number: 11
    Frame Length: 64 bytes (512 bits)
    Capture Length: 64 bytes (512 bits)
    [Frame is marked: False]
    [Frame is ignored: False]
    [Protocols in frame: usb:usbhub]
USB URB
    [Source: host]
    [Destination: 1.1.0]
    URB id: 0xffff8d9f64b4ab40
    URB type: URB_SUBMIT ('S')
    URB transfer type: URB_CONTROL (0x02)
    Endpoint: 0x80, Direction: IN
        1... .... = Direction: IN (1)
        .... 0000 = Endpoint number: 0
    Device: 1
    URB bus id: 1
    Device setup request: relevant (0)
    Data: not present ('<')
    URB sec: 1515409085
    URB usec: 339801
    URB status: Operation now in progress (-EINPROGRESS) (-115)
    URB length [bytes]: 4
    Data length [bytes]: 0
    [Response in: 12]
    Interval: 0
    Start frame: 0
    Copy of Transfer Flags: 0x00000200
    Number of ISO descriptors: 0
    [bInterfaceClass: Unknown (0xffff)]
URB setup
    bmRequestType: 0xa3
        1... .... = Direction: Device-to-host
        .01. .... = Type: Class (0x1)
        ...0 0011 = Recipient: Other (0x03)
bRequest: GET_STATUS (0x00)
wValue: 0x0000
    (zero): 0
wIndex: 4
    Port: 4
wLength: 4

0000  40 ab b4 64 9f 8d ff ff 53 02 80 01 01 00 00 3c   @..d....S......<
0010  bd 4e 53 5a 00 00 00 00 59 2f 05 00 8d ff ff ff   .NSZ....Y/......
0020  04 00 00 00 00 00 00 00 a3 00 00 00 04 00 04 00   ................
0030  00 00 00 00 00 00 00 00 00 02 00 00 00 00 00 00   ................

No.     Time           Source                Destination           Protocol Length Info
     12 0.054188       1.1.0                 host                  USBHUB   68     GET_STATUS Response    [Port 4]

Frame 12: 68 bytes on wire (544 bits), 68 bytes captured (544 bits) on interface 0
    Interface id: 0 (usbmon0)
        Interface name: usbmon0
    Encapsulation type: USB packets with Linux header and padding (115)
    Arrival Time: Jan  8, 2018 11:58:05.339832000 CET
    [Time shift for this packet: 0.000000000 seconds]
    Epoch Time: 1515409085.339832000 seconds
    [Time delta from previous captured frame: 0.000031000 seconds]
    [Time delta from previous displayed frame: 0.000031000 seconds]
    [Time since reference or first frame: 0.054188000 seconds]
    Frame Number: 12
    Frame Length: 68 bytes (544 bits)
    Capture Length: 68 bytes (544 bits)
    [Frame is marked: False]
    [Frame is ignored: False]
    [Protocols in frame: usb:usbhub]
USB URB
    [Source: 1.1.0]
    [Destination: host]
    URB id: 0xffff8d9f64b4ab40
    URB type: URB_COMPLETE ('C')
    URB transfer type: URB_CONTROL (0x02)
    Endpoint: 0x80, Direction: IN
        1... .... = Direction: IN (1)
        .... 0000 = Endpoint number: 0
    Device: 1
    URB bus id: 1
    Device setup request: not relevant ('-')
    Data: present (0)
    URB sec: 1515409085
    URB usec: 339832
    URB status: Success (0)
    URB length [bytes]: 4
    Data length [bytes]: 4
    [Request in: 11]
    [Time from request: 0.000031000 seconds]
    Unused Setup Header
    Interval: 0
    Start frame: 0
    Copy of Transfer Flags: 0x00000200
    Number of ISO descriptors: 0
    [bInterfaceClass: Unknown (0xffff)]
Port Status: 0x0301, PORT_CONNECTION, PORT_POWER, PORT_LOW_SPEED
    .... .... .... ...1 = PORT_CONNECTION: True
    .... .... .... ..0. = PORT_ENABLE: False
    .... .... .... .0.. = PORT_SUSPEND: False
    .... .... .... 0... = PORT_OVER_CURRENT: False
    .... .... ...0 .... = PORT_RESET: False
    .... ...1 .... .... = PORT_POWER: True
    .... ..1. .... .... = PORT_LOW_SPEED: True
    .... .0.. .... .... = PORT_HIGH_SPEED: False
    .... 0... .... .... = PORT_TEST: False
    ...0 .... .... .... = PORT_INDICATOR: Default colors
Port Change: 0x0000
    .... .... .... ...0 = C_PORT_CONNECTION: False
    .... .... .... ..0. = C_PORT_ENABLE: False
    .... .... .... .0.. = C_PORT_SUSPEND: False
    .... .... .... 0... = C_PORT_OVER_CURRENT: False
    .... .... ...0 .... = C_PORT_RESET: False

0000  40 ab b4 64 9f 8d ff ff 43 02 80 01 01 00 2d 00   @..d....C.....-.
0010  bd 4e 53 5a 00 00 00 00 78 2f 05 00 00 00 00 00   .NSZ....x/......
0020  04 00 00 00 04 00 00 00 00 00 00 00 00 00 00 00   ................
0030  00 00 00 00 00 00 00 00 00 02 00 00 00 00 00 00   ................
0040  01 03 00 00                                       ....

No.     Time           Source                Destination           Protocol Length Info
     13 0.081092       host                  1.1.0                 USBHUB   64     GET_STATUS Request     [Port 4]

Frame 13: 64 bytes on wire (512 bits), 64 bytes captured (512 bits) on interface 0
    Interface id: 0 (usbmon0)
        Interface name: usbmon0
    Encapsulation type: USB packets with Linux header and padding (115)
    Arrival Time: Jan  8, 2018 11:58:05.366736000 CET
    [Time shift for this packet: 0.000000000 seconds]
    Epoch Time: 1515409085.366736000 seconds
    [Time delta from previous captured frame: 0.026904000 seconds]
    [Time delta from previous displayed frame: 0.026904000 seconds]
    [Time since reference or first frame: 0.081092000 seconds]
    Frame Number: 13
    Frame Length: 64 bytes (512 bits)
    Capture Length: 64 bytes (512 bits)
    [Frame is marked: False]
    [Frame is ignored: False]
    [Protocols in frame: usb:usbhub]
USB URB
    [Source: host]
    [Destination: 1.1.0]
    URB id: 0xffff8d9f64b4ab40
    URB type: URB_SUBMIT ('S')
    URB transfer type: URB_CONTROL (0x02)
    Endpoint: 0x80, Direction: IN
        1... .... = Direction: IN (1)
        .... 0000 = Endpoint number: 0
    Device: 1
    URB bus id: 1
    Device setup request: relevant (0)
    Data: not present ('<')
    URB sec: 1515409085
    URB usec: 366736
    URB status: Operation now in progress (-EINPROGRESS) (-115)
    URB length [bytes]: 4
    Data length [bytes]: 0
    [Response in: 14]
    Interval: 0
    Start frame: 0
    Copy of Transfer Flags: 0x00000200
    Number of ISO descriptors: 0
    [bInterfaceClass: Unknown (0xffff)]
URB setup
    bmRequestType: 0xa3
        1... .... = Direction: Device-to-host
        .01. .... = Type: Class (0x1)
        ...0 0011 = Recipient: Other (0x03)
bRequest: GET_STATUS (0x00)
wValue: 0x0000
    (zero): 0
wIndex: 4
    Port: 4
wLength: 4

0000  40 ab b4 64 9f 8d ff ff 53 02 80 01 01 00 00 3c   @..d....S......<
0010  bd 4e 53 5a 00 00 00 00 90 98 05 00 8d ff ff ff   .NSZ............
0020  04 00 00 00 00 00 00 00 a3 00 00 00 04 00 04 00   ................
0030  00 00 00 00 00 00 00 00 00 02 00 00 00 00 00 00   ................

No.     Time           Source                Destination           Protocol Length Info
     14 0.081131       1.1.0                 host                  USBHUB   68     GET_STATUS Response    [Port 4]

Frame 14: 68 bytes on wire (544 bits), 68 bytes captured (544 bits) on interface 0
    Interface id: 0 (usbmon0)
        Interface name: usbmon0
    Encapsulation type: USB packets with Linux header and padding (115)
    Arrival Time: Jan  8, 2018 11:58:05.366775000 CET
    [Time shift for this packet: 0.000000000 seconds]
    Epoch Time: 1515409085.366775000 seconds
    [Time delta from previous captured frame: 0.000039000 seconds]
    [Time delta from previous displayed frame: 0.000039000 seconds]
    [Time since reference or first frame: 0.081131000 seconds]
    Frame Number: 14
    Frame Length: 68 bytes (544 bits)
    Capture Length: 68 bytes (544 bits)
    [Frame is marked: False]
    [Frame is ignored: False]
    [Protocols in frame: usb:usbhub]
USB URB
    [Source: 1.1.0]
    [Destination: host]
    URB id: 0xffff8d9f64b4ab40
    URB type: URB_COMPLETE ('C')
    URB transfer type: URB_CONTROL (0x02)
    Endpoint: 0x80, Direction: IN
        1... .... = Direction: IN (1)
        .... 0000 = Endpoint number: 0
    Device: 1
    URB bus id: 1
    Device setup request: not relevant ('-')
    Data: present (0)
    URB sec: 1515409085
    URB usec: 366775
    URB status: Success (0)
    URB length [bytes]: 4
    Data length [bytes]: 4
    [Request in: 13]
    [Time from request: 0.000039000 seconds]
    Unused Setup Header
    Interval: 0
    Start frame: 0
    Copy of Transfer Flags: 0x00000200
    Number of ISO descriptors: 0
    [bInterfaceClass: Unknown (0xffff)]
Port Status: 0x0301, PORT_CONNECTION, PORT_POWER, PORT_LOW_SPEED
    .... .... .... ...1 = PORT_CONNECTION: True
    .... .... .... ..0. = PORT_ENABLE: False
    .... .... .... .0.. = PORT_SUSPEND: False
    .... .... .... 0... = PORT_OVER_CURRENT: False
    .... .... ...0 .... = PORT_RESET: False
    .... ...1 .... .... = PORT_POWER: True
    .... ..1. .... .... = PORT_LOW_SPEED: True
    .... .0.. .... .... = PORT_HIGH_SPEED: False
    .... 0... .... .... = PORT_TEST: False
    ...0 .... .... .... = PORT_INDICATOR: Default colors
Port Change: 0x0000
    .... .... .... ...0 = C_PORT_CONNECTION: False
    .... .... .... ..0. = C_PORT_ENABLE: False
    .... .... .... .0.. = C_PORT_SUSPEND: False
    .... .... .... 0... = C_PORT_OVER_CURRENT: False
    .... .... ...0 .... = C_PORT_RESET: False

0000  40 ab b4 64 9f 8d ff ff 43 02 80 01 01 00 2d 00   @..d....C.....-.
0010  bd 4e 53 5a 00 00 00 00 b7 98 05 00 00 00 00 00   .NSZ............
0020  04 00 00 00 04 00 00 00 00 00 00 00 00 00 00 00   ................
0030  00 00 00 00 00 00 00 00 00 02 00 00 00 00 00 00   ................
0040  01 03 00 00                                       ....

No.     Time           Source                Destination           Protocol Length Info
     15 0.108137       host                  1.1.0                 USBHUB   64     GET_STATUS Request     [Port 4]

Frame 15: 64 bytes on wire (512 bits), 64 bytes captured (512 bits) on interface 0
    Interface id: 0 (usbmon0)
        Interface name: usbmon0
    Encapsulation type: USB packets with Linux header and padding (115)
    Arrival Time: Jan  8, 2018 11:58:05.393781000 CET
    [Time shift for this packet: 0.000000000 seconds]
    Epoch Time: 1515409085.393781000 seconds
    [Time delta from previous captured frame: 0.027006000 seconds]
    [Time delta from previous displayed frame: 0.027006000 seconds]
    [Time since reference or first frame: 0.108137000 seconds]
    Frame Number: 15
    Frame Length: 64 bytes (512 bits)
    Capture Length: 64 bytes (512 bits)
    [Frame is marked: False]
    [Frame is ignored: False]
    [Protocols in frame: usb:usbhub]
USB URB
    [Source: host]
    [Destination: 1.1.0]
    URB id: 0xffff8d9f64b4ab40
    URB type: URB_SUBMIT ('S')
    URB transfer type: URB_CONTROL (0x02)
    Endpoint: 0x80, Direction: IN
        1... .... = Direction: IN (1)
        .... 0000 = Endpoint number: 0
    Device: 1
    URB bus id: 1
    Device setup request: relevant (0)
    Data: not present ('<')
    URB sec: 1515409085
    URB usec: 393781
    URB status: Operation now in progress (-EINPROGRESS) (-115)
    URB length [bytes]: 4
    Data length [bytes]: 0
    [Response in: 16]
    Interval: 0
    Start frame: 0
    Copy of Transfer Flags: 0x00000200
    Number of ISO descriptors: 0
    [bInterfaceClass: Unknown (0xffff)]
URB setup
    bmRequestType: 0xa3
        1... .... = Direction: Device-to-host
        .01. .... = Type: Class (0x1)
        ...0 0011 = Recipient: Other (0x03)
bRequest: GET_STATUS (0x00)
wValue: 0x0000
    (zero): 0
wIndex: 4
    Port: 4
wLength: 4

0000  40 ab b4 64 9f 8d ff ff 53 02 80 01 01 00 00 3c   @..d....S......<
0010  bd 4e 53 5a 00 00 00 00 35 02 06 00 8d ff ff ff   .NSZ....5.......
0020  04 00 00 00 00 00 00 00 a3 00 00 00 04 00 04 00   ................
0030  00 00 00 00 00 00 00 00 00 02 00 00 00 00 00 00   ................

No.     Time           Source                Destination           Protocol Length Info
     16 0.108169       1.1.0                 host                  USBHUB   68     GET_STATUS Response    [Port 4]

Frame 16: 68 bytes on wire (544 bits), 68 bytes captured (544 bits) on interface 0
    Interface id: 0 (usbmon0)
        Interface name: usbmon0
    Encapsulation type: USB packets with Linux header and padding (115)
    Arrival Time: Jan  8, 2018 11:58:05.393813000 CET
    [Time shift for this packet: 0.000000000 seconds]
    Epoch Time: 1515409085.393813000 seconds
    [Time delta from previous captured frame: 0.000032000 seconds]
    [Time delta from previous displayed frame: 0.000032000 seconds]
    [Time since reference or first frame: 0.108169000 seconds]
    Frame Number: 16
    Frame Length: 68 bytes (544 bits)
    Capture Length: 68 bytes (544 bits)
    [Frame is marked: False]
    [Frame is ignored: False]
    [Protocols in frame: usb:usbhub]
USB URB
    [Source: 1.1.0]
    [Destination: host]
    URB id: 0xffff8d9f64b4ab40
    URB type: URB_COMPLETE ('C')
    URB transfer type: URB_CONTROL (0x02)
    Endpoint: 0x80, Direction: IN
        1... .... = Direction: IN (1)
        .... 0000 = Endpoint number: 0
    Device: 1
    URB bus id: 1
    Device setup request: not relevant ('-')
    Data: present (0)
    URB sec: 1515409085
    URB usec: 393813
    URB status: Success (0)
    URB length [bytes]: 4
    Data length [bytes]: 4
    [Request in: 15]
    [Time from request: 0.000032000 seconds]
    Unused Setup Header
    Interval: 0
    Start frame: 0
    Copy of Transfer Flags: 0x00000200
    Number of ISO descriptors: 0
    [bInterfaceClass: Unknown (0xffff)]
Port Status: 0x0301, PORT_CONNECTION, PORT_POWER, PORT_LOW_SPEED
    .... .... .... ...1 = PORT_CONNECTION: True
    .... .... .... ..0. = PORT_ENABLE: False
    .... .... .... .0.. = PORT_SUSPEND: False
    .... .... .... 0... = PORT_OVER_CURRENT: False
    .... .... ...0 .... = PORT_RESET: False
    .... ...1 .... .... = PORT_POWER: True
    .... ..1. .... .... = PORT_LOW_SPEED: True
    .... .0.. .... .... = PORT_HIGH_SPEED: False
    .... 0... .... .... = PORT_TEST: False
    ...0 .... .... .... = PORT_INDICATOR: Default colors
Port Change: 0x0000
    .... .... .... ...0 = C_PORT_CONNECTION: False
    .... .... .... ..0. = C_PORT_ENABLE: False
    .... .... .... .0.. = C_PORT_SUSPEND: False
    .... .... .... 0... = C_PORT_OVER_CURRENT: False
    .... .... ...0 .... = C_PORT_RESET: False

0000  40 ab b4 64 9f 8d ff ff 43 02 80 01 01 00 2d 00   @..d....C.....-.
0010  bd 4e 53 5a 00 00 00 00 55 02 06 00 00 00 00 00   .NSZ....U.......
0020  04 00 00 00 04 00 00 00 00 00 00 00 00 00 00 00   ................
0030  00 00 00 00 00 00 00 00 00 02 00 00 00 00 00 00   ................
0040  01 03 00 00                                       ....

No.     Time           Source                Destination           Protocol Length Info
     17 0.108268       host                  1.1.0                 USBHUB   64     SET_FEATURE Request    [Port 4: PORT_RESET]

Frame 17: 64 bytes on wire (512 bits), 64 bytes captured (512 bits) on interface 0
    Interface id: 0 (usbmon0)
        Interface name: usbmon0
    Encapsulation type: USB packets with Linux header and padding (115)
    Arrival Time: Jan  8, 2018 11:58:05.393912000 CET
    [Time shift for this packet: 0.000000000 seconds]
    Epoch Time: 1515409085.393912000 seconds
    [Time delta from previous captured frame: 0.000099000 seconds]
    [Time delta from previous displayed frame: 0.000099000 seconds]
    [Time since reference or first frame: 0.108268000 seconds]
    Frame Number: 17
    Frame Length: 64 bytes (512 bits)
    Capture Length: 64 bytes (512 bits)
    [Frame is marked: False]
    [Frame is ignored: False]
    [Protocols in frame: usb:usbhub]
USB URB
    [Source: host]
    [Destination: 1.1.0]
    URB id: 0xffff8d9f64b4ab40
    URB type: URB_SUBMIT ('S')
    URB transfer type: URB_CONTROL (0x02)
    Endpoint: 0x00, Direction: OUT
        0... .... = Direction: OUT (0)
        .... 0000 = Endpoint number: 0
    Device: 1
    URB bus id: 1
    Device setup request: relevant (0)
    Data: present (0)
    URB sec: 1515409085
    URB usec: 393912
    URB status: Operation now in progress (-EINPROGRESS) (-115)
    URB length [bytes]: 0
    Data length [bytes]: 0
    [Response in: 18]
    Interval: 0
    Start frame: 0
    Copy of Transfer Flags: 0x00000000
    Number of ISO descriptors: 0
    [bInterfaceClass: Unknown (0xffff)]
URB setup
    bmRequestType: 0x23
        0... .... = Direction: Host-to-device
        .01. .... = Type: Class (0x1)
        ...0 0011 = Recipient: Other (0x03)
bRequest: SET_FEATURE (0x03)
wValue: 0x0004
    PortFeatureSelector: PORT_RESET (4)
wIndex: 4
    Port: 4
    PortSelector: 0
wLength: 0
    (zero): 0

0000  40 ab b4 64 9f 8d ff ff 53 02 00 01 01 00 00 00   @..d....S.......
0010  bd 4e 53 5a 00 00 00 00 b8 02 06 00 8d ff ff ff   .NSZ............
0020  00 00 00 00 00 00 00 00 23 03 04 00 04 00 00 00   ........#.......
0030  00 00 00 00 00 00 00 00 00 00 00 00 00 00 00 00   ................

No.     Time           Source                Destination           Protocol Length Info
     18 0.108280       1.1.0                 host                  USBHUB   64     SET_FEATURE Response   [Port 4: PORT_RESET]

Frame 18: 64 bytes on wire (512 bits), 64 bytes captured (512 bits) on interface 0
    Interface id: 0 (usbmon0)
        Interface name: usbmon0
    Encapsulation type: USB packets with Linux header and padding (115)
    Arrival Time: Jan  8, 2018 11:58:05.393924000 CET
    [Time shift for this packet: 0.000000000 seconds]
    Epoch Time: 1515409085.393924000 seconds
    [Time delta from previous captured frame: 0.000012000 seconds]
    [Time delta from previous displayed frame: 0.000012000 seconds]
    [Time since reference or first frame: 0.108280000 seconds]
    Frame Number: 18
    Frame Length: 64 bytes (512 bits)
    Capture Length: 64 bytes (512 bits)
    [Frame is marked: False]
    [Frame is ignored: False]
    [Protocols in frame: usb]
USB URB
    [Source: 1.1.0]
    [Destination: host]
    URB id: 0xffff8d9f64b4ab40
    URB type: URB_COMPLETE ('C')
    URB transfer type: URB_CONTROL (0x02)
    Endpoint: 0x00, Direction: OUT
        0... .... = Direction: OUT (0)
        .... 0000 = Endpoint number: 0
    Device: 1
    URB bus id: 1
    Device setup request: not relevant ('-')
    Data: not present ('>')
    URB sec: 1515409085
    URB usec: 393924
    URB status: Success (0)
    URB length [bytes]: 0
    Data length [bytes]: 0
    [Request in: 17]
    [Time from request: 0.000012000 seconds]
    Unused Setup Header
    Interval: 0
    Start frame: 0
    Copy of Transfer Flags: 0x00000000
    Number of ISO descriptors: 0
    [bInterfaceClass: Unknown (0xffff)]

0000  40 ab b4 64 9f 8d ff ff 43 02 00 01 01 00 2d 3e   @..d....C.....->
0010  bd 4e 53 5a 00 00 00 00 c4 02 06 00 00 00 00 00   .NSZ............
0020  00 00 00 00 00 00 00 00 00 00 00 00 00 00 00 00   ................
0030  00 00 00 00 00 00 00 00 00 00 00 00 00 00 00 00   ................

No.     Time           Source                Destination           Protocol Length Info
     19 0.170121       host                  1.1.0                 USBHUB   64     GET_STATUS Request     [Port 4]

Frame 19: 64 bytes on wire (512 bits), 64 bytes captured (512 bits) on interface 0
    Interface id: 0 (usbmon0)
        Interface name: usbmon0
    Encapsulation type: USB packets with Linux header and padding (115)
    Arrival Time: Jan  8, 2018 11:58:05.455765000 CET
    [Time shift for this packet: 0.000000000 seconds]
    Epoch Time: 1515409085.455765000 seconds
    [Time delta from previous captured frame: 0.061841000 seconds]
    [Time delta from previous displayed frame: 0.061841000 seconds]
    [Time since reference or first frame: 0.170121000 seconds]
    Frame Number: 19
    Frame Length: 64 bytes (512 bits)
    Capture Length: 64 bytes (512 bits)
    [Frame is marked: False]
    [Frame is ignored: False]
    [Protocols in frame: usb:usbhub]
USB URB
    [Source: host]
    [Destination: 1.1.0]
    URB id: 0xffff8d9f64b4ab40
    URB type: URB_SUBMIT ('S')
    URB transfer type: URB_CONTROL (0x02)
    Endpoint: 0x80, Direction: IN
        1... .... = Direction: IN (1)
        .... 0000 = Endpoint number: 0
    Device: 1
    URB bus id: 1
    Device setup request: relevant (0)
    Data: not present ('<')
    URB sec: 1515409085
    URB usec: 455765
    URB status: Operation now in progress (-EINPROGRESS) (-115)
    URB length [bytes]: 4
    Data length [bytes]: 0
    [Response in: 20]
    Interval: 0
    Start frame: 0
    Copy of Transfer Flags: 0x00000200
    Number of ISO descriptors: 0
    [bInterfaceClass: Unknown (0xffff)]
URB setup
    bmRequestType: 0xa3
        1... .... = Direction: Device-to-host
        .01. .... = Type: Class (0x1)
        ...0 0011 = Recipient: Other (0x03)
bRequest: GET_STATUS (0x00)
wValue: 0x0000
    (zero): 0
wIndex: 4
    Port: 4
wLength: 4

0000  40 ab b4 64 9f 8d ff ff 53 02 80 01 01 00 00 3c   @..d....S......<
0010  bd 4e 53 5a 00 00 00 00 55 f4 06 00 8d ff ff ff   .NSZ....U.......
0020  04 00 00 00 00 00 00 00 a3 00 00 00 04 00 04 00   ................
0030  00 00 00 00 00 00 00 00 00 02 00 00 00 00 00 00   ................

No.     Time           Source                Destination           Protocol Length Info
     20 0.170159       1.1.0                 host                  USBHUB   68     GET_STATUS Response    [Port 4]

Frame 20: 68 bytes on wire (544 bits), 68 bytes captured (544 bits) on interface 0
    Interface id: 0 (usbmon0)
        Interface name: usbmon0
    Encapsulation type: USB packets with Linux header and padding (115)
    Arrival Time: Jan  8, 2018 11:58:05.455803000 CET
    [Time shift for this packet: 0.000000000 seconds]
    Epoch Time: 1515409085.455803000 seconds
    [Time delta from previous captured frame: 0.000038000 seconds]
    [Time delta from previous displayed frame: 0.000038000 seconds]
    [Time since reference or first frame: 0.170159000 seconds]
    Frame Number: 20
    Frame Length: 68 bytes (544 bits)
    Capture Length: 68 bytes (544 bits)
    [Frame is marked: False]
    [Frame is ignored: False]
    [Protocols in frame: usb:usbhub]
USB URB
    [Source: 1.1.0]
    [Destination: host]
    URB id: 0xffff8d9f64b4ab40
    URB type: URB_COMPLETE ('C')
    URB transfer type: URB_CONTROL (0x02)
    Endpoint: 0x80, Direction: IN
        1... .... = Direction: IN (1)
        .... 0000 = Endpoint number: 0
    Device: 1
    URB bus id: 1
    Device setup request: not relevant ('-')
    Data: present (0)
    URB sec: 1515409085
    URB usec: 455803
    URB status: Success (0)
    URB length [bytes]: 4
    Data length [bytes]: 4
    [Request in: 19]
    [Time from request: 0.000038000 seconds]
    Unused Setup Header
    Interval: 0
    Start frame: 0
    Copy of Transfer Flags: 0x00000200
    Number of ISO descriptors: 0
    [bInterfaceClass: Unknown (0xffff)]
Port Status: 0x0303, PORT_CONNECTION, PORT_ENABLE, PORT_POWER, PORT_LOW_SPEED
    .... .... .... ...1 = PORT_CONNECTION: True
    .... .... .... ..1. = PORT_ENABLE: True
    .... .... .... .0.. = PORT_SUSPEND: False
    .... .... .... 0... = PORT_OVER_CURRENT: False
    .... .... ...0 .... = PORT_RESET: False
    .... ...1 .... .... = PORT_POWER: True
    .... ..1. .... .... = PORT_LOW_SPEED: True
    .... .0.. .... .... = PORT_HIGH_SPEED: False
    .... 0... .... .... = PORT_TEST: False
    ...0 .... .... .... = PORT_INDICATOR: Default colors
Port Change: 0x0010, C_PORT_RESET
    .... .... .... ...0 = C_PORT_CONNECTION: False
    .... .... .... ..0. = C_PORT_ENABLE: False
    .... .... .... .0.. = C_PORT_SUSPEND: False
    .... .... .... 0... = C_PORT_OVER_CURRENT: False
    .... .... ...1 .... = C_PORT_RESET: True

0000  40 ab b4 64 9f 8d ff ff 43 02 80 01 01 00 2d 00   @..d....C.....-.
0010  bd 4e 53 5a 00 00 00 00 7b f4 06 00 00 00 00 00   .NSZ....{.......
0020  04 00 00 00 04 00 00 00 00 00 00 00 00 00 00 00   ................
0030  00 00 00 00 00 00 00 00 00 02 00 00 00 00 00 00   ................
0040  03 03 10 00                                       ....

No.     Time           Source                Destination           Protocol Length Info
     21 0.170175       host                  1.1.0                 USBHUB   64     CLEAR_FEATURE Request  [Port 4: C_PORT_RESET]

Frame 21: 64 bytes on wire (512 bits), 64 bytes captured (512 bits) on interface 0
    Interface id: 0 (usbmon0)
        Interface name: usbmon0
    Encapsulation type: USB packets with Linux header and padding (115)
    Arrival Time: Jan  8, 2018 11:58:05.455819000 CET
    [Time shift for this packet: 0.000000000 seconds]
    Epoch Time: 1515409085.455819000 seconds
    [Time delta from previous captured frame: 0.000016000 seconds]
    [Time delta from previous displayed frame: 0.000016000 seconds]
    [Time since reference or first frame: 0.170175000 seconds]
    Frame Number: 21
    Frame Length: 64 bytes (512 bits)
    Capture Length: 64 bytes (512 bits)
    [Frame is marked: False]
    [Frame is ignored: False]
    [Protocols in frame: usb:usbhub]
USB URB
    [Source: host]
    [Destination: 1.1.0]
    URB id: 0xffff8d9f64b4ab40
    URB type: URB_SUBMIT ('S')
    URB transfer type: URB_CONTROL (0x02)
    Endpoint: 0x00, Direction: OUT
        0... .... = Direction: OUT (0)
        .... 0000 = Endpoint number: 0
    Device: 1
    URB bus id: 1
    Device setup request: relevant (0)
    Data: present (0)
    URB sec: 1515409085
    URB usec: 455819
    URB status: Operation now in progress (-EINPROGRESS) (-115)
    URB length [bytes]: 0
    Data length [bytes]: 0
    [Response in: 22]
    Interval: 0
    Start frame: 0
    Copy of Transfer Flags: 0x00000000
    Number of ISO descriptors: 0
    [bInterfaceClass: Unknown (0xffff)]
URB setup
    bmRequestType: 0x23
        0... .... = Direction: Host-to-device
        .01. .... = Type: Class (0x1)
        ...0 0011 = Recipient: Other (0x03)
bRequest: CLEAR_FEATURE (0x01)
wValue: 0x0014
    PortFeatureSelector: C_PORT_RESET (20)
wIndex: 4
    Port: 4
    PortSelector: 0
wLength: 0
    (zero): 0

0000  40 ab b4 64 9f 8d ff ff 53 02 00 01 01 00 00 00   @..d....S.......
0010  bd 4e 53 5a 00 00 00 00 8b f4 06 00 8d ff ff ff   .NSZ............
0020  00 00 00 00 00 00 00 00 23 01 14 00 04 00 00 00   ........#.......
0030  00 00 00 00 00 00 00 00 00 00 00 00 00 00 00 00   ................

No.     Time           Source                Destination           Protocol Length Info
     22 0.170185       1.1.0                 host                  USBHUB   64     CLEAR_FEATURE Response [Port 4: C_PORT_RESET]

Frame 22: 64 bytes on wire (512 bits), 64 bytes captured (512 bits) on interface 0
    Interface id: 0 (usbmon0)
        Interface name: usbmon0
    Encapsulation type: USB packets with Linux header and padding (115)
    Arrival Time: Jan  8, 2018 11:58:05.455829000 CET
    [Time shift for this packet: 0.000000000 seconds]
    Epoch Time: 1515409085.455829000 seconds
    [Time delta from previous captured frame: 0.000010000 seconds]
    [Time delta from previous displayed frame: 0.000010000 seconds]
    [Time since reference or first frame: 0.170185000 seconds]
    Frame Number: 22
    Frame Length: 64 bytes (512 bits)
    Capture Length: 64 bytes (512 bits)
    [Frame is marked: False]
    [Frame is ignored: False]
    [Protocols in frame: usb]
USB URB
    [Source: 1.1.0]
    [Destination: host]
    URB id: 0xffff8d9f64b4ab40
    URB type: URB_COMPLETE ('C')
    URB transfer type: URB_CONTROL (0x02)
    Endpoint: 0x00, Direction: OUT
        0... .... = Direction: OUT (0)
        .... 0000 = Endpoint number: 0
    Device: 1
    URB bus id: 1
    Device setup request: not relevant ('-')
    Data: not present ('>')
    URB sec: 1515409085
    URB usec: 455829
    URB status: Success (0)
    URB length [bytes]: 0
    Data length [bytes]: 0
    [Request in: 21]
    [Time from request: 0.000010000 seconds]
    Unused Setup Header
    Interval: 0
    Start frame: 0
    Copy of Transfer Flags: 0x00000000
    Number of ISO descriptors: 0
    [bInterfaceClass: Unknown (0xffff)]

0000  40 ab b4 64 9f 8d ff ff 43 02 00 01 01 00 2d 3e   @..d....C.....->
0010  bd 4e 53 5a 00 00 00 00 95 f4 06 00 00 00 00 00   .NSZ............
0020  00 00 00 00 00 00 00 00 00 00 00 00 00 00 00 00   ................
0030  00 00 00 00 00 00 00 00 00 00 00 00 00 00 00 00   ................

No.     Time           Source                Destination           Protocol Length Info
     23 0.222115       host                  1.0.0                 USB      64     GET DESCRIPTOR Request DEVICE

Frame 23: 64 bytes on wire (512 bits), 64 bytes captured (512 bits) on interface 0
    Interface id: 0 (usbmon0)
        Interface name: usbmon0
    Encapsulation type: USB packets with Linux header and padding (115)
    Arrival Time: Jan  8, 2018 11:58:05.507759000 CET
    [Time shift for this packet: 0.000000000 seconds]
    Epoch Time: 1515409085.507759000 seconds
    [Time delta from previous captured frame: 0.051930000 seconds]
    [Time delta from previous displayed frame: 0.051930000 seconds]
    [Time since reference or first frame: 0.222115000 seconds]
    Frame Number: 23
    Frame Length: 64 bytes (512 bits)
    Capture Length: 64 bytes (512 bits)
    [Frame is marked: False]
    [Frame is ignored: False]
    [Protocols in frame: usb]
USB URB
    [Source: host]
    [Destination: 1.0.0]
    URB id: 0xffff8d9f64b4ab40
    URB type: URB_SUBMIT ('S')
    URB transfer type: URB_CONTROL (0x02)
    Endpoint: 0x80, Direction: IN
        1... .... = Direction: IN (1)
        .... 0000 = Endpoint number: 0
    Device: 0
    URB bus id: 1
    Device setup request: relevant (0)
    Data: not present ('<')
    URB sec: 1515409085
    URB usec: 507759
    URB status: Operation now in progress (-EINPROGRESS) (-115)
    URB length [bytes]: 64
    Data length [bytes]: 0
    [Response in: 24]
    Interval: 0
    Start frame: 0
    Copy of Transfer Flags: 0x00000200
    Number of ISO descriptors: 0
URB setup
    bmRequestType: 0x80
        1... .... = Direction: Device-to-host
        .00. .... = Type: Standard (0x0)
        ...0 0000 = Recipient: Device (0x00)
    bRequest: GET DESCRIPTOR (6)
    Descriptor Index: 0x00
    bDescriptorType: 0x01
    Language Id: no language specified (0x0000)
    wLength: 64

0000  40 ab b4 64 9f 8d ff ff 53 02 80 00 01 00 00 3c   @..d....S......<
0010  bd 4e 53 5a 00 00 00 00 6f bf 07 00 8d ff ff ff   .NSZ....o.......
0020  40 00 00 00 00 00 00 00 80 06 00 01 00 00 40 00   @.............@.
0030  00 00 00 00 00 00 00 00 00 02 00 00 00 00 00 00   ................

No.     Time           Source                Destination           Protocol Length Info
     24 0.222997       1.0.0                 host                  USB      82     GET DESCRIPTOR Response DEVICE

Frame 24: 82 bytes on wire (656 bits), 82 bytes captured (656 bits) on interface 0
    Interface id: 0 (usbmon0)
        Interface name: usbmon0
    Encapsulation type: USB packets with Linux header and padding (115)
    Arrival Time: Jan  8, 2018 11:58:05.508641000 CET
    [Time shift for this packet: 0.000000000 seconds]
    Epoch Time: 1515409085.508641000 seconds
    [Time delta from previous captured frame: 0.000882000 seconds]
    [Time delta from previous displayed frame: 0.000882000 seconds]
    [Time since reference or first frame: 0.222997000 seconds]
    Frame Number: 24
    Frame Length: 82 bytes (656 bits)
    Capture Length: 82 bytes (656 bits)
    [Frame is marked: False]
    [Frame is ignored: False]
    [Protocols in frame: usb]
USB URB
    [Source: 1.0.0]
    [Destination: host]
    URB id: 0xffff8d9f64b4ab40
    URB type: URB_COMPLETE ('C')
    URB transfer type: URB_CONTROL (0x02)
    Endpoint: 0x80, Direction: IN
        1... .... = Direction: IN (1)
        .... 0000 = Endpoint number: 0
    Device: 0
    URB bus id: 1
    Device setup request: not relevant ('-')
    Data: present (0)
    URB sec: 1515409085
    URB usec: 508641
    URB status: Success (0)
    URB length [bytes]: 18
    Data length [bytes]: 18
    [Request in: 23]
    [Time from request: 0.000882000 seconds]
    Unused Setup Header
    Interval: 0
    Start frame: 0
    Copy of Transfer Flags: 0x00000200
    Number of ISO descriptors: 0
DEVICE DESCRIPTOR
    bLength: 18
    bDescriptorType: 0x01 (DEVICE)
    bcdUSB: 0x0110
    bDeviceClass: Device (0x00)
    bDeviceSubClass: 0
    bDeviceProtocol: 0 (Use class code info from Interface Descriptors)
    bMaxPacketSize0: 8
    idVendor: Dell Computer Corp. (0x413c)
    idProduct: Unknown (0x2107)
    bcdDevice: 0x0178
    iManufacturer: 1
    iProduct: 2
    iSerialNumber: 0
    bNumConfigurations: 1

0000  40 ab b4 64 9f 8d ff ff 43 02 80 00 01 00 2d 00   @..d....C.....-.
0010  bd 4e 53 5a 00 00 00 00 e1 c2 07 00 00 00 00 00   .NSZ............
0020  12 00 00 00 12 00 00 00 00 00 00 00 00 00 00 00   ................
0030  00 00 00 00 00 00 00 00 00 02 00 00 00 00 00 00   ................
0040  12 01 10 01 00 00 00 08 3c 41 07 21 78 01 01 02   ........<A.!x...
0050  00 01                                             ..

No.     Time           Source                Destination           Protocol Length Info
     25 0.223011       host                  1.1.0                 USBHUB   64     SET_FEATURE Request    [Port 4: PORT_RESET]

Frame 25: 64 bytes on wire (512 bits), 64 bytes captured (512 bits) on interface 0
    Interface id: 0 (usbmon0)
        Interface name: usbmon0
    Encapsulation type: USB packets with Linux header and padding (115)
    Arrival Time: Jan  8, 2018 11:58:05.508655000 CET
    [Time shift for this packet: 0.000000000 seconds]
    Epoch Time: 1515409085.508655000 seconds
    [Time delta from previous captured frame: 0.000014000 seconds]
    [Time delta from previous displayed frame: 0.000014000 seconds]
    [Time since reference or first frame: 0.223011000 seconds]
    Frame Number: 25
    Frame Length: 64 bytes (512 bits)
    Capture Length: 64 bytes (512 bits)
    [Frame is marked: False]
    [Frame is ignored: False]
    [Protocols in frame: usb:usbhub]
USB URB
    [Source: host]
    [Destination: 1.1.0]
    URB id: 0xffff8d9f64b4ab40
    URB type: URB_SUBMIT ('S')
    URB transfer type: URB_CONTROL (0x02)
    Endpoint: 0x00, Direction: OUT
        0... .... = Direction: OUT (0)
        .... 0000 = Endpoint number: 0
    Device: 1
    URB bus id: 1
    Device setup request: relevant (0)
    Data: present (0)
    URB sec: 1515409085
    URB usec: 508655
    URB status: Operation now in progress (-EINPROGRESS) (-115)
    URB length [bytes]: 0
    Data length [bytes]: 0
    [Response in: 26]
    Interval: 0
    Start frame: 0
    Copy of Transfer Flags: 0x00000000
    Number of ISO descriptors: 0
    [bInterfaceClass: Unknown (0xffff)]
URB setup
    bmRequestType: 0x23
        0... .... = Direction: Host-to-device
        .01. .... = Type: Class (0x1)
        ...0 0011 = Recipient: Other (0x03)
bRequest: SET_FEATURE (0x03)
wValue: 0x0004
    PortFeatureSelector: PORT_RESET (4)
wIndex: 4
    Port: 4
    PortSelector: 0
wLength: 0
    (zero): 0

0000  40 ab b4 64 9f 8d ff ff 53 02 00 01 01 00 00 00   @..d....S.......
0010  bd 4e 53 5a 00 00 00 00 ef c2 07 00 8d ff ff ff   .NSZ............
0020  00 00 00 00 00 00 00 00 23 03 04 00 04 00 00 00   ........#.......
0030  00 00 00 00 00 00 00 00 00 00 00 00 00 00 00 00   ................

No.     Time           Source                Destination           Protocol Length Info
     26 0.223023       1.1.0                 host                  USBHUB   64     SET_FEATURE Response   [Port 4: PORT_RESET]

Frame 26: 64 bytes on wire (512 bits), 64 bytes captured (512 bits) on interface 0
    Interface id: 0 (usbmon0)
        Interface name: usbmon0
    Encapsulation type: USB packets with Linux header and padding (115)
    Arrival Time: Jan  8, 2018 11:58:05.508667000 CET
    [Time shift for this packet: 0.000000000 seconds]
    Epoch Time: 1515409085.508667000 seconds
    [Time delta from previous captured frame: 0.000012000 seconds]
    [Time delta from previous displayed frame: 0.000012000 seconds]
    [Time since reference or first frame: 0.223023000 seconds]
    Frame Number: 26
    Frame Length: 64 bytes (512 bits)
    Capture Length: 64 bytes (512 bits)
    [Frame is marked: False]
    [Frame is ignored: False]
    [Protocols in frame: usb]
USB URB
    [Source: 1.1.0]
    [Destination: host]
    URB id: 0xffff8d9f64b4ab40
    URB type: URB_COMPLETE ('C')
    URB transfer type: URB_CONTROL (0x02)
    Endpoint: 0x00, Direction: OUT
        0... .... = Direction: OUT (0)
        .... 0000 = Endpoint number: 0
    Device: 1
    URB bus id: 1
    Device setup request: not relevant ('-')
    Data: not present ('>')
    URB sec: 1515409085
    URB usec: 508667
    URB status: Success (0)
    URB length [bytes]: 0
    Data length [bytes]: 0
    [Request in: 25]
    [Time from request: 0.000012000 seconds]
    Unused Setup Header
    Interval: 0
    Start frame: 0
    Copy of Transfer Flags: 0x00000000
    Number of ISO descriptors: 0
    [bInterfaceClass: Unknown (0xffff)]

0000  40 ab b4 64 9f 8d ff ff 43 02 00 01 01 00 2d 3e   @..d....C.....->
0010  bd 4e 53 5a 00 00 00 00 fb c2 07 00 00 00 00 00   .NSZ............
0020  00 00 00 00 00 00 00 00 00 00 00 00 00 00 00 00   ................
0030  00 00 00 00 00 00 00 00 00 00 00 00 00 00 00 00   ................

No.     Time           Source                Destination           Protocol Length Info
     27 0.284143       host                  1.1.0                 USBHUB   64     GET_STATUS Request     [Port 4]

Frame 27: 64 bytes on wire (512 bits), 64 bytes captured (512 bits) on interface 0
    Interface id: 0 (usbmon0)
        Interface name: usbmon0
    Encapsulation type: USB packets with Linux header and padding (115)
    Arrival Time: Jan  8, 2018 11:58:05.569787000 CET
    [Time shift for this packet: 0.000000000 seconds]
    Epoch Time: 1515409085.569787000 seconds
    [Time delta from previous captured frame: 0.061120000 seconds]
    [Time delta from previous displayed frame: 0.061120000 seconds]
    [Time since reference or first frame: 0.284143000 seconds]
    Frame Number: 27
    Frame Length: 64 bytes (512 bits)
    Capture Length: 64 bytes (512 bits)
    [Frame is marked: False]
    [Frame is ignored: False]
    [Protocols in frame: usb:usbhub]
USB URB
    [Source: host]
    [Destination: 1.1.0]
    URB id: 0xffff8d9f64b4ab40
    URB type: URB_SUBMIT ('S')
    URB transfer type: URB_CONTROL (0x02)
    Endpoint: 0x80, Direction: IN
        1... .... = Direction: IN (1)
        .... 0000 = Endpoint number: 0
    Device: 1
    URB bus id: 1
    Device setup request: relevant (0)
    Data: not present ('<')
    URB sec: 1515409085
    URB usec: 569787
    URB status: Operation now in progress (-EINPROGRESS) (-115)
    URB length [bytes]: 4
    Data length [bytes]: 0
    [Response in: 28]
    Interval: 0
    Start frame: 0
    Copy of Transfer Flags: 0x00000200
    Number of ISO descriptors: 0
    [bInterfaceClass: Unknown (0xffff)]
URB setup
    bmRequestType: 0xa3
        1... .... = Direction: Device-to-host
        .01. .... = Type: Class (0x1)
        ...0 0011 = Recipient: Other (0x03)
bRequest: GET_STATUS (0x00)
wValue: 0x0000
    (zero): 0
wIndex: 4
    Port: 4
wLength: 4

0000  40 ab b4 64 9f 8d ff ff 53 02 80 01 01 00 00 3c   @..d....S......<
0010  bd 4e 53 5a 00 00 00 00 bb b1 08 00 8d ff ff ff   .NSZ............
0020  04 00 00 00 00 00 00 00 a3 00 00 00 04 00 04 00   ................
0030  00 00 00 00 00 00 00 00 00 02 00 00 00 00 00 00   ................

No.     Time           Source                Destination           Protocol Length Info
     28 0.284170       1.1.0                 host                  USBHUB   68     GET_STATUS Response    [Port 4]

Frame 28: 68 bytes on wire (544 bits), 68 bytes captured (544 bits) on interface 0
    Interface id: 0 (usbmon0)
        Interface name: usbmon0
    Encapsulation type: USB packets with Linux header and padding (115)
    Arrival Time: Jan  8, 2018 11:58:05.569814000 CET
    [Time shift for this packet: 0.000000000 seconds]
    Epoch Time: 1515409085.569814000 seconds
    [Time delta from previous captured frame: 0.000027000 seconds]
    [Time delta from previous displayed frame: 0.000027000 seconds]
    [Time since reference or first frame: 0.284170000 seconds]
    Frame Number: 28
    Frame Length: 68 bytes (544 bits)
    Capture Length: 68 bytes (544 bits)
    [Frame is marked: False]
    [Frame is ignored: False]
    [Protocols in frame: usb:usbhub]
USB URB
    [Source: 1.1.0]
    [Destination: host]
    URB id: 0xffff8d9f64b4ab40
    URB type: URB_COMPLETE ('C')
    URB transfer type: URB_CONTROL (0x02)
    Endpoint: 0x80, Direction: IN
        1... .... = Direction: IN (1)
        .... 0000 = Endpoint number: 0
    Device: 1
    URB bus id: 1
    Device setup request: not relevant ('-')
    Data: present (0)
    URB sec: 1515409085
    URB usec: 569814
    URB status: Success (0)
    URB length [bytes]: 4
    Data length [bytes]: 4
    [Request in: 27]
    [Time from request: 0.000027000 seconds]
    Unused Setup Header
    Interval: 0
    Start frame: 0
    Copy of Transfer Flags: 0x00000200
    Number of ISO descriptors: 0
    [bInterfaceClass: Unknown (0xffff)]
Port Status: 0x0303, PORT_CONNECTION, PORT_ENABLE, PORT_POWER, PORT_LOW_SPEED
    .... .... .... ...1 = PORT_CONNECTION: True
    .... .... .... ..1. = PORT_ENABLE: True
    .... .... .... .0.. = PORT_SUSPEND: False
    .... .... .... 0... = PORT_OVER_CURRENT: False
    .... .... ...0 .... = PORT_RESET: False
    .... ...1 .... .... = PORT_POWER: True
    .... ..1. .... .... = PORT_LOW_SPEED: True
    .... .0.. .... .... = PORT_HIGH_SPEED: False
    .... 0... .... .... = PORT_TEST: False
    ...0 .... .... .... = PORT_INDICATOR: Default colors
Port Change: 0x0010, C_PORT_RESET
    .... .... .... ...0 = C_PORT_CONNECTION: False
    .... .... .... ..0. = C_PORT_ENABLE: False
    .... .... .... .0.. = C_PORT_SUSPEND: False
    .... .... .... 0... = C_PORT_OVER_CURRENT: False
    .... .... ...1 .... = C_PORT_RESET: True

0000  40 ab b4 64 9f 8d ff ff 43 02 80 01 01 00 2d 00   @..d....C.....-.
0010  bd 4e 53 5a 00 00 00 00 d6 b1 08 00 00 00 00 00   .NSZ............
0020  04 00 00 00 04 00 00 00 00 00 00 00 00 00 00 00   ................
0030  00 00 00 00 00 00 00 00 00 02 00 00 00 00 00 00   ................
0040  03 03 10 00                                       ....

No.     Time           Source                Destination           Protocol Length Info
     29 0.284182       host                  1.1.0                 USBHUB   64     CLEAR_FEATURE Request  [Port 4: C_PORT_RESET]

Frame 29: 64 bytes on wire (512 bits), 64 bytes captured (512 bits) on interface 0
    Interface id: 0 (usbmon0)
        Interface name: usbmon0
    Encapsulation type: USB packets with Linux header and padding (115)
    Arrival Time: Jan  8, 2018 11:58:05.569826000 CET
    [Time shift for this packet: 0.000000000 seconds]
    Epoch Time: 1515409085.569826000 seconds
    [Time delta from previous captured frame: 0.000012000 seconds]
    [Time delta from previous displayed frame: 0.000012000 seconds]
    [Time since reference or first frame: 0.284182000 seconds]
    Frame Number: 29
    Frame Length: 64 bytes (512 bits)
    Capture Length: 64 bytes (512 bits)
    [Frame is marked: False]
    [Frame is ignored: False]
    [Protocols in frame: usb:usbhub]
USB URB
    [Source: host]
    [Destination: 1.1.0]
    URB id: 0xffff8d9f64b4ab40
    URB type: URB_SUBMIT ('S')
    URB transfer type: URB_CONTROL (0x02)
    Endpoint: 0x00, Direction: OUT
        0... .... = Direction: OUT (0)
        .... 0000 = Endpoint number: 0
    Device: 1
    URB bus id: 1
    Device setup request: relevant (0)
    Data: present (0)
    URB sec: 1515409085
    URB usec: 569826
    URB status: Operation now in progress (-EINPROGRESS) (-115)
    URB length [bytes]: 0
    Data length [bytes]: 0
    [Response in: 30]
    Interval: 0
    Start frame: 0
    Copy of Transfer Flags: 0x00000000
    Number of ISO descriptors: 0
    [bInterfaceClass: Unknown (0xffff)]
URB setup
    bmRequestType: 0x23
        0... .... = Direction: Host-to-device
        .01. .... = Type: Class (0x1)
        ...0 0011 = Recipient: Other (0x03)
bRequest: CLEAR_FEATURE (0x01)
wValue: 0x0014
    PortFeatureSelector: C_PORT_RESET (20)
wIndex: 4
    Port: 4
    PortSelector: 0
wLength: 0
    (zero): 0

0000  40 ab b4 64 9f 8d ff ff 53 02 00 01 01 00 00 00   @..d....S.......
0010  bd 4e 53 5a 00 00 00 00 e2 b1 08 00 8d ff ff ff   .NSZ............
0020  00 00 00 00 00 00 00 00 23 01 14 00 04 00 00 00   ........#.......
0030  00 00 00 00 00 00 00 00 00 00 00 00 00 00 00 00   ................

No.     Time           Source                Destination           Protocol Length Info
     30 0.284189       1.1.0                 host                  USBHUB   64     CLEAR_FEATURE Response [Port 4: C_PORT_RESET]

Frame 30: 64 bytes on wire (512 bits), 64 bytes captured (512 bits) on interface 0
    Interface id: 0 (usbmon0)
        Interface name: usbmon0
    Encapsulation type: USB packets with Linux header and padding (115)
    Arrival Time: Jan  8, 2018 11:58:05.569833000 CET
    [Time shift for this packet: 0.000000000 seconds]
    Epoch Time: 1515409085.569833000 seconds
    [Time delta from previous captured frame: 0.000007000 seconds]
    [Time delta from previous displayed frame: 0.000007000 seconds]
    [Time since reference or first frame: 0.284189000 seconds]
    Frame Number: 30
    Frame Length: 64 bytes (512 bits)
    Capture Length: 64 bytes (512 bits)
    [Frame is marked: False]
    [Frame is ignored: False]
    [Protocols in frame: usb]
USB URB
    [Source: 1.1.0]
    [Destination: host]
    URB id: 0xffff8d9f64b4ab40
    URB type: URB_COMPLETE ('C')
    URB transfer type: URB_CONTROL (0x02)
    Endpoint: 0x00, Direction: OUT
        0... .... = Direction: OUT (0)
        .... 0000 = Endpoint number: 0
    Device: 1
    URB bus id: 1
    Device setup request: not relevant ('-')
    Data: not present ('>')
    URB sec: 1515409085
    URB usec: 569833
    URB status: Success (0)
    URB length [bytes]: 0
    Data length [bytes]: 0
    [Request in: 29]
    [Time from request: 0.000007000 seconds]
    Unused Setup Header
    Interval: 0
    Start frame: 0
    Copy of Transfer Flags: 0x00000000
    Number of ISO descriptors: 0
    [bInterfaceClass: Unknown (0xffff)]

0000  40 ab b4 64 9f 8d ff ff 43 02 00 01 01 00 2d 3e   @..d....C.....->
0010  bd 4e 53 5a 00 00 00 00 e9 b1 08 00 00 00 00 00   .NSZ............
0020  00 00 00 00 00 00 00 00 00 00 00 00 00 00 00 00   ................
0030  00 00 00 00 00 00 00 00 00 00 00 00 00 00 00 00   ................

No.     Time           Source                Destination           Protocol Length Info
     31 0.348151       host                  1.47.0                USB      64     GET DESCRIPTOR Request DEVICE

Frame 31: 64 bytes on wire (512 bits), 64 bytes captured (512 bits) on interface 0
    Interface id: 0 (usbmon0)
        Interface name: usbmon0
    Encapsulation type: USB packets with Linux header and padding (115)
    Arrival Time: Jan  8, 2018 11:58:05.633795000 CET
    [Time shift for this packet: 0.000000000 seconds]
    Epoch Time: 1515409085.633795000 seconds
    [Time delta from previous captured frame: 0.063962000 seconds]
    [Time delta from previous displayed frame: 0.063962000 seconds]
    [Time since reference or first frame: 0.348151000 seconds]
    Frame Number: 31
    Frame Length: 64 bytes (512 bits)
    Capture Length: 64 bytes (512 bits)
    [Frame is marked: False]
    [Frame is ignored: False]
    [Protocols in frame: usb]
USB URB
    [Source: host]
    [Destination: 1.47.0]
    URB id: 0xffff8d9f64b4ab40
    URB type: URB_SUBMIT ('S')
    URB transfer type: URB_CONTROL (0x02)
    Endpoint: 0x80, Direction: IN
        1... .... = Direction: IN (1)
        .... 0000 = Endpoint number: 0
    Device: 47
    URB bus id: 1
    Device setup request: relevant (0)
    Data: not present ('<')
    URB sec: 1515409085
    URB usec: 633795
    URB status: Operation now in progress (-EINPROGRESS) (-115)
    URB length [bytes]: 18
    Data length [bytes]: 0
    [Response in: 32]
    Interval: 0
    Start frame: 0
    Copy of Transfer Flags: 0x00000200
    Number of ISO descriptors: 0
URB setup
    bmRequestType: 0x80
        1... .... = Direction: Device-to-host
        .00. .... = Type: Standard (0x0)
        ...0 0000 = Recipient: Device (0x00)
    bRequest: GET DESCRIPTOR (6)
    Descriptor Index: 0x00
    bDescriptorType: 0x01
    Language Id: no language specified (0x0000)
    wLength: 18

0000  40 ab b4 64 9f 8d ff ff 53 02 80 2f 01 00 00 3c   @..d....S../...<
0010  bd 4e 53 5a 00 00 00 00 c3 ab 09 00 8d ff ff ff   .NSZ............
0020  12 00 00 00 00 00 00 00 80 06 00 01 00 00 12 00   ................
0030  00 00 00 00 00 00 00 00 00 02 00 00 00 00 00 00   ................

No.     Time           Source                Destination           Protocol Length Info
     32 0.349057       1.47.0                host                  USB      82     GET DESCRIPTOR Response DEVICE

Frame 32: 82 bytes on wire (656 bits), 82 bytes captured (656 bits) on interface 0
    Interface id: 0 (usbmon0)
        Interface name: usbmon0
    Encapsulation type: USB packets with Linux header and padding (115)
    Arrival Time: Jan  8, 2018 11:58:05.634701000 CET
    [Time shift for this packet: 0.000000000 seconds]
    Epoch Time: 1515409085.634701000 seconds
    [Time delta from previous captured frame: 0.000906000 seconds]
    [Time delta from previous displayed frame: 0.000906000 seconds]
    [Time since reference or first frame: 0.349057000 seconds]
    Frame Number: 32
    Frame Length: 82 bytes (656 bits)
    Capture Length: 82 bytes (656 bits)
    [Frame is marked: False]
    [Frame is ignored: False]
    [Protocols in frame: usb]
USB URB
    [Source: 1.47.0]
    [Destination: host]
    URB id: 0xffff8d9f64b4ab40
    URB type: URB_COMPLETE ('C')
    URB transfer type: URB_CONTROL (0x02)
    Endpoint: 0x80, Direction: IN
        1... .... = Direction: IN (1)
        .... 0000 = Endpoint number: 0
    Device: 47
    URB bus id: 1
    Device setup request: not relevant ('-')
    Data: present (0)
    URB sec: 1515409085
    URB usec: 634701
    URB status: Success (0)
    URB length [bytes]: 18
    Data length [bytes]: 18
    [Request in: 31]
    [Time from request: 0.000906000 seconds]
    Unused Setup Header
    Interval: 0
    Start frame: 0
    Copy of Transfer Flags: 0x00000200
    Number of ISO descriptors: 0
DEVICE DESCRIPTOR
    bLength: 18
    bDescriptorType: 0x01 (DEVICE)
    bcdUSB: 0x0110
    bDeviceClass: Device (0x00)
    bDeviceSubClass: 0
    bDeviceProtocol: 0 (Use class code info from Interface Descriptors)
    bMaxPacketSize0: 8
    idVendor: Dell Computer Corp. (0x413c)
    idProduct: Unknown (0x2107)
    bcdDevice: 0x0178
    iManufacturer: 1
    iProduct: 2
    iSerialNumber: 0
    bNumConfigurations: 1

0000  40 ab b4 64 9f 8d ff ff 43 02 80 2f 01 00 2d 00   @..d....C../..-.
0010  bd 4e 53 5a 00 00 00 00 4d af 09 00 00 00 00 00   .NSZ....M.......
0020  12 00 00 00 12 00 00 00 00 00 00 00 00 00 00 00   ................
0030  00 00 00 00 00 00 00 00 00 02 00 00 00 00 00 00   ................
0040  12 01 10 01 00 00 00 08 3c 41 07 21 78 01 01 02   ........<A.!x...
0050  00 01                                             ..

No.     Time           Source                Destination           Protocol Length Info
     33 0.349117       host                  1.47.0                USB      64     GET DESCRIPTOR Request CONFIGURATION

Frame 33: 64 bytes on wire (512 bits), 64 bytes captured (512 bits) on interface 0
    Interface id: 0 (usbmon0)
        Interface name: usbmon0
    Encapsulation type: USB packets with Linux header and padding (115)
    Arrival Time: Jan  8, 2018 11:58:05.634761000 CET
    [Time shift for this packet: 0.000000000 seconds]
    Epoch Time: 1515409085.634761000 seconds
    [Time delta from previous captured frame: 0.000060000 seconds]
    [Time delta from previous displayed frame: 0.000060000 seconds]
    [Time since reference or first frame: 0.349117000 seconds]
    Frame Number: 33
    Frame Length: 64 bytes (512 bits)
    Capture Length: 64 bytes (512 bits)
    [Frame is marked: False]
    [Frame is ignored: False]
    [Protocols in frame: usb]
USB URB
    [Source: host]
    [Destination: 1.47.0]
    URB id: 0xffff8d9f64b4ab40
    URB type: URB_SUBMIT ('S')
    URB transfer type: URB_CONTROL (0x02)
    Endpoint: 0x80, Direction: IN
        1... .... = Direction: IN (1)
        .... 0000 = Endpoint number: 0
    Device: 47
    URB bus id: 1
    Device setup request: relevant (0)
    Data: not present ('<')
    URB sec: 1515409085
    URB usec: 634761
    URB status: Operation now in progress (-EINPROGRESS) (-115)
    URB length [bytes]: 9
    Data length [bytes]: 0
    [Response in: 34]
    Interval: 0
    Start frame: 0
    Copy of Transfer Flags: 0x00000200
    Number of ISO descriptors: 0
URB setup
    bmRequestType: 0x80
        1... .... = Direction: Device-to-host
        .00. .... = Type: Standard (0x0)
        ...0 0000 = Recipient: Device (0x00)
    bRequest: GET DESCRIPTOR (6)
    Descriptor Index: 0x00
    bDescriptorType: 0x02
    Language Id: no language specified (0x0000)
    wLength: 9

0000  40 ab b4 64 9f 8d ff ff 53 02 80 2f 01 00 00 3c   @..d....S../...<
0010  bd 4e 53 5a 00 00 00 00 89 af 09 00 8d ff ff ff   .NSZ............
0020  09 00 00 00 00 00 00 00 80 06 00 02 00 00 09 00   ................
0030  00 00 00 00 00 00 00 00 00 02 00 00 00 00 00 00   ................

No.     Time           Source                Destination           Protocol Length Info
     34 0.349840       1.47.0                host                  USB      73     GET DESCRIPTOR Response CONFIGURATION

Frame 34: 73 bytes on wire (584 bits), 73 bytes captured (584 bits) on interface 0
    Interface id: 0 (usbmon0)
        Interface name: usbmon0
    Encapsulation type: USB packets with Linux header and padding (115)
    Arrival Time: Jan  8, 2018 11:58:05.635484000 CET
    [Time shift for this packet: 0.000000000 seconds]
    Epoch Time: 1515409085.635484000 seconds
    [Time delta from previous captured frame: 0.000723000 seconds]
    [Time delta from previous displayed frame: 0.000723000 seconds]
    [Time since reference or first frame: 0.349840000 seconds]
    Frame Number: 34
    Frame Length: 73 bytes (584 bits)
    Capture Length: 73 bytes (584 bits)
    [Frame is marked: False]
    [Frame is ignored: False]
    [Protocols in frame: usb]
USB URB
    [Source: 1.47.0]
    [Destination: host]
    URB id: 0xffff8d9f64b4ab40
    URB type: URB_COMPLETE ('C')
    URB transfer type: URB_CONTROL (0x02)
    Endpoint: 0x80, Direction: IN
        1... .... = Direction: IN (1)
        .... 0000 = Endpoint number: 0
    Device: 47
    URB bus id: 1
    Device setup request: not relevant ('-')
    Data: present (0)
    URB sec: 1515409085
    URB usec: 635484
    URB status: Success (0)
    URB length [bytes]: 9
    Data length [bytes]: 9
    [Request in: 33]
    [Time from request: 0.000723000 seconds]
    Unused Setup Header
    Interval: 0
    Start frame: 0
    Copy of Transfer Flags: 0x00000200
    Number of ISO descriptors: 0
CONFIGURATION DESCRIPTOR
    bLength: 9
    bDescriptorType: 0x02 (CONFIGURATION)
    wTotalLength: 34
    bNumInterfaces: 1
    bConfigurationValue: 1
    iConfiguration: 0
    Configuration bmAttributes: 0xa0  NOT SELF-POWERED  REMOTE-WAKEUP
        1... .... = Must be 1: Must be 1 for USB 1.1 and higher
        .0.. .... = Self-Powered: This device is powered from the USB bus
        ..1. .... = Remote Wakeup: This device supports REMOTE WAKEUP
    bMaxPower: 50  (100mA)

0000  40 ab b4 64 9f 8d ff ff 43 02 80 2f 01 00 2d 00   @..d....C../..-.
0010  bd 4e 53 5a 00 00 00 00 5c b2 09 00 00 00 00 00   .NSZ....\.......
0020  09 00 00 00 09 00 00 00 00 00 00 00 00 00 00 00   ................
0030  00 00 00 00 00 00 00 00 00 02 00 00 00 00 00 00   ................
0040  09 02 22 00 01 01 00 a0 32                        ..".....2

No.     Time           Source                Destination           Protocol Length Info
     35 0.349881       host                  1.47.0                USB      64     GET DESCRIPTOR Request CONFIGURATION

Frame 35: 64 bytes on wire (512 bits), 64 bytes captured (512 bits) on interface 0
    Interface id: 0 (usbmon0)
        Interface name: usbmon0
    Encapsulation type: USB packets with Linux header and padding (115)
    Arrival Time: Jan  8, 2018 11:58:05.635525000 CET
    [Time shift for this packet: 0.000000000 seconds]
    Epoch Time: 1515409085.635525000 seconds
    [Time delta from previous captured frame: 0.000041000 seconds]
    [Time delta from previous displayed frame: 0.000041000 seconds]
    [Time since reference or first frame: 0.349881000 seconds]
    Frame Number: 35
    Frame Length: 64 bytes (512 bits)
    Capture Length: 64 bytes (512 bits)
    [Frame is marked: False]
    [Frame is ignored: False]
    [Protocols in frame: usb]
USB URB
    [Source: host]
    [Destination: 1.47.0]
    URB id: 0xffff8d9f64b4ab40
    URB type: URB_SUBMIT ('S')
    URB transfer type: URB_CONTROL (0x02)
    Endpoint: 0x80, Direction: IN
        1... .... = Direction: IN (1)
        .... 0000 = Endpoint number: 0
    Device: 47
    URB bus id: 1
    Device setup request: relevant (0)
    Data: not present ('<')
    URB sec: 1515409085
    URB usec: 635525
    URB status: Operation now in progress (-EINPROGRESS) (-115)
    URB length [bytes]: 34
    Data length [bytes]: 0
    [Response in: 36]
    Interval: 0
    Start frame: 0
    Copy of Transfer Flags: 0x00000200
    Number of ISO descriptors: 0
URB setup
    bmRequestType: 0x80
        1... .... = Direction: Device-to-host
        .00. .... = Type: Standard (0x0)
        ...0 0000 = Recipient: Device (0x00)
    bRequest: GET DESCRIPTOR (6)
    Descriptor Index: 0x00
    bDescriptorType: 0x02
    Language Id: no language specified (0x0000)
    wLength: 34

0000  40 ab b4 64 9f 8d ff ff 53 02 80 2f 01 00 00 3c   @..d....S../...<
0010  bd 4e 53 5a 00 00 00 00 85 b2 09 00 8d ff ff ff   .NSZ............
0020  22 00 00 00 00 00 00 00 80 06 00 02 00 00 22 00   ".............".
0030  00 00 00 00 00 00 00 00 00 02 00 00 00 00 00 00   ................

No.     Time           Source                Destination           Protocol Length Info
     36 0.351001       1.47.0                host                  USB      98     GET DESCRIPTOR Response CONFIGURATION

Frame 36: 98 bytes on wire (784 bits), 98 bytes captured (784 bits) on interface 0
    Interface id: 0 (usbmon0)
        Interface name: usbmon0
    Encapsulation type: USB packets with Linux header and padding (115)
    Arrival Time: Jan  8, 2018 11:58:05.636645000 CET
    [Time shift for this packet: 0.000000000 seconds]
    Epoch Time: 1515409085.636645000 seconds
    [Time delta from previous captured frame: 0.001120000 seconds]
    [Time delta from previous displayed frame: 0.001120000 seconds]
    [Time since reference or first frame: 0.351001000 seconds]
    Frame Number: 36
    Frame Length: 98 bytes (784 bits)
    Capture Length: 98 bytes (784 bits)
    [Frame is marked: False]
    [Frame is ignored: False]
    [Protocols in frame: usb:usbhid]
USB URB
    [Source: 1.47.0]
    [Destination: host]
    URB id: 0xffff8d9f64b4ab40
    URB type: URB_COMPLETE ('C')
    URB transfer type: URB_CONTROL (0x02)
    Endpoint: 0x80, Direction: IN
        1... .... = Direction: IN (1)
        .... 0000 = Endpoint number: 0
    Device: 47
    URB bus id: 1
    Device setup request: not relevant ('-')
    Data: present (0)
    URB sec: 1515409085
    URB usec: 636645
    URB status: Success (0)
    URB length [bytes]: 34
    Data length [bytes]: 34
    [Request in: 35]
    [Time from request: 0.001120000 seconds]
    Unused Setup Header
    Interval: 0
    Start frame: 0
    Copy of Transfer Flags: 0x00000200
    Number of ISO descriptors: 0
CONFIGURATION DESCRIPTOR
    bLength: 9
    bDescriptorType: 0x02 (CONFIGURATION)
    wTotalLength: 34
    bNumInterfaces: 1
    bConfigurationValue: 1
    iConfiguration: 0
    Configuration bmAttributes: 0xa0  NOT SELF-POWERED  REMOTE-WAKEUP
        1... .... = Must be 1: Must be 1 for USB 1.1 and higher
        .0.. .... = Self-Powered: This device is powered from the USB bus
        ..1. .... = Remote Wakeup: This device supports REMOTE WAKEUP
    bMaxPower: 50  (100mA)
INTERFACE DESCRIPTOR (0.0): class HID
    bLength: 9
    bDescriptorType: 0x04 (INTERFACE)
    bInterfaceNumber: 0
    bAlternateSetting: 0
    bNumEndpoints: 1
    bInterfaceClass: HID (0x03)
    bInterfaceSubClass: Boot Interface (0x01)
    bInterfaceProtocol: Keyboard (0x01)
    iInterface: 0
HID DESCRIPTOR
    bLength: 9
    bDescriptorType: 0x21 (HID)
    bcdHID: 0x0110
    bCountryCode: Not Supported (0x00)
    bNumDescriptors: 1
    bDescriptorType: HID Report (0x22)
    wDescriptorLength: 65
ENDPOINT DESCRIPTOR
    bLength: 7
    bDescriptorType: 0x05 (ENDPOINT)
    bEndpointAddress: 0x81  IN  Endpoint:1
        1... .... = Direction: IN Endpoint
        .... 0001 = Endpoint Number: 0x1
    bmAttributes: 0x03
        .... ..11 = Transfertype: Interrupt-Transfer (0x3)
    wMaxPacketSize: 8
        ...0 0... .... .... = Transactions per microframe: 1 (0)
        .... ..00 0000 1000 = Maximum Packet Size: 8
    bInterval: 10

0000  40 ab b4 64 9f 8d ff ff 43 02 80 2f 01 00 2d 00   @..d....C../..-.
0010  bd 4e 53 5a 00 00 00 00 e5 b6 09 00 00 00 00 00   .NSZ............
0020  22 00 00 00 22 00 00 00 00 00 00 00 00 00 00 00   "..."...........
0030  00 00 00 00 00 00 00 00 00 02 00 00 00 00 00 00   ................
0040  09 02 22 00 01 01 00 a0 32 09 04 00 00 01 03 01   ..".....2.......
0050  01 00 09 21 10 01 00 01 22 41 00 07 05 81 03 08   ...!...."A......
0060  00 0a                                             ..

No.     Time           Source                Destination           Protocol Length Info
     37 0.351078       host                  1.47.0                USB      64     GET DESCRIPTOR Request STRING

Frame 37: 64 bytes on wire (512 bits), 64 bytes captured (512 bits) on interface 0
    Interface id: 0 (usbmon0)
        Interface name: usbmon0
    Encapsulation type: USB packets with Linux header and padding (115)
    Arrival Time: Jan  8, 2018 11:58:05.636722000 CET
    [Time shift for this packet: 0.000000000 seconds]
    Epoch Time: 1515409085.636722000 seconds
    [Time delta from previous captured frame: 0.000077000 seconds]
    [Time delta from previous displayed frame: 0.000077000 seconds]
    [Time since reference or first frame: 0.351078000 seconds]
    Frame Number: 37
    Frame Length: 64 bytes (512 bits)
    Capture Length: 64 bytes (512 bits)
    [Frame is marked: False]
    [Frame is ignored: False]
    [Protocols in frame: usb]
USB URB
    [Source: host]
    [Destination: 1.47.0]
    URB id: 0xffff8d9f64b4ab40
    URB type: URB_SUBMIT ('S')
    URB transfer type: URB_CONTROL (0x02)
    Endpoint: 0x80, Direction: IN
        1... .... = Direction: IN (1)
        .... 0000 = Endpoint number: 0
    Device: 47
    URB bus id: 1
    Device setup request: relevant (0)
    Data: not present ('<')
    URB sec: 1515409085
    URB usec: 636722
    URB status: Operation now in progress (-EINPROGRESS) (-115)
    URB length [bytes]: 255
    Data length [bytes]: 0
    [Response in: 38]
    Interval: 0
    Start frame: 0
    Copy of Transfer Flags: 0x00000200
    Number of ISO descriptors: 0
URB setup
    bmRequestType: 0x80
        1... .... = Direction: Device-to-host
        .00. .... = Type: Standard (0x0)
        ...0 0000 = Recipient: Device (0x00)
    bRequest: GET DESCRIPTOR (6)
    Descriptor Index: 0x00
    bDescriptorType: 0x03
    Language Id: no language specified (0x0000)
    wLength: 255

0000  40 ab b4 64 9f 8d ff ff 53 02 80 2f 01 00 00 3c   @..d....S../...<
0010  bd 4e 53 5a 00 00 00 00 32 b7 09 00 8d ff ff ff   .NSZ....2.......
0020  ff 00 00 00 00 00 00 00 80 06 00 03 00 00 ff 00   ................
0030  00 00 00 00 00 00 00 00 00 02 00 00 00 00 00 00   ................

No.     Time           Source                Destination           Protocol Length Info
     38 0.351621       1.47.0                host                  USB      68     GET DESCRIPTOR Response STRING

Frame 38: 68 bytes on wire (544 bits), 68 bytes captured (544 bits) on interface 0
    Interface id: 0 (usbmon0)
        Interface name: usbmon0
    Encapsulation type: USB packets with Linux header and padding (115)
    Arrival Time: Jan  8, 2018 11:58:05.637265000 CET
    [Time shift for this packet: 0.000000000 seconds]
    Epoch Time: 1515409085.637265000 seconds
    [Time delta from previous captured frame: 0.000543000 seconds]
    [Time delta from previous displayed frame: 0.000543000 seconds]
    [Time since reference or first frame: 0.351621000 seconds]
    Frame Number: 38
    Frame Length: 68 bytes (544 bits)
    Capture Length: 68 bytes (544 bits)
    [Frame is marked: False]
    [Frame is ignored: False]
    [Protocols in frame: usb]
USB URB
    [Source: 1.47.0]
    [Destination: host]
    URB id: 0xffff8d9f64b4ab40
    URB type: URB_COMPLETE ('C')
    URB transfer type: URB_CONTROL (0x02)
    Endpoint: 0x80, Direction: IN
        1... .... = Direction: IN (1)
        .... 0000 = Endpoint number: 0
    Device: 47
    URB bus id: 1
    Device setup request: not relevant ('-')
    Data: present (0)
    URB sec: 1515409085
    URB usec: 637265
    URB status: Success (0)
    URB length [bytes]: 4
    Data length [bytes]: 4
    [Request in: 37]
    [Time from request: 0.000543000 seconds]
    Unused Setup Header
    Interval: 0
    Start frame: 0
    Copy of Transfer Flags: 0x00000200
    Number of ISO descriptors: 0
STRING DESCRIPTOR
    bLength: 4
    bDescriptorType: 0x03 (STRING)
    wLANGID: English (United States) (0x0409)

0000  40 ab b4 64 9f 8d ff ff 43 02 80 2f 01 00 2d 00   @..d....C../..-.
0010  bd 4e 53 5a 00 00 00 00 51 b9 09 00 00 00 00 00   .NSZ....Q.......
0020  04 00 00 00 04 00 00 00 00 00 00 00 00 00 00 00   ................
0030  00 00 00 00 00 00 00 00 00 02 00 00 00 00 00 00   ................
0040  04 03 09 04                                       ....

No.     Time           Source                Destination           Protocol Length Info
     39 0.351658       host                  1.47.0                USB      64     GET DESCRIPTOR Request STRING

Frame 39: 64 bytes on wire (512 bits), 64 bytes captured (512 bits) on interface 0
    Interface id: 0 (usbmon0)
        Interface name: usbmon0
    Encapsulation type: USB packets with Linux header and padding (115)
    Arrival Time: Jan  8, 2018 11:58:05.637302000 CET
    [Time shift for this packet: 0.000000000 seconds]
    Epoch Time: 1515409085.637302000 seconds
    [Time delta from previous captured frame: 0.000037000 seconds]
    [Time delta from previous displayed frame: 0.000037000 seconds]
    [Time since reference or first frame: 0.351658000 seconds]
    Frame Number: 39
    Frame Length: 64 bytes (512 bits)
    Capture Length: 64 bytes (512 bits)
    [Frame is marked: False]
    [Frame is ignored: False]
    [Protocols in frame: usb]
USB URB
    [Source: host]
    [Destination: 1.47.0]
    URB id: 0xffff8d9f64b4ab40
    URB type: URB_SUBMIT ('S')
    URB transfer type: URB_CONTROL (0x02)
    Endpoint: 0x80, Direction: IN
        1... .... = Direction: IN (1)
        .... 0000 = Endpoint number: 0
    Device: 47
    URB bus id: 1
    Device setup request: relevant (0)
    Data: not present ('<')
    URB sec: 1515409085
    URB usec: 637302
    URB status: Operation now in progress (-EINPROGRESS) (-115)
    URB length [bytes]: 255
    Data length [bytes]: 0
    [Response in: 40]
    Interval: 0
    Start frame: 0
    Copy of Transfer Flags: 0x00000200
    Number of ISO descriptors: 0
URB setup
    bmRequestType: 0x80
        1... .... = Direction: Device-to-host
        .00. .... = Type: Standard (0x0)
        ...0 0000 = Recipient: Device (0x00)
    bRequest: GET DESCRIPTOR (6)
    Descriptor Index: 0x02
    bDescriptorType: 0x03
    Language Id: English (United States) (0x0409)
    wLength: 255

0000  40 ab b4 64 9f 8d ff ff 53 02 80 2f 01 00 00 3c   @..d....S../...<
0010  bd 4e 53 5a 00 00 00 00 76 b9 09 00 8d ff ff ff   .NSZ....v.......
0020  ff 00 00 00 00 00 00 00 80 06 02 03 09 04 ff 00   ................
0030  00 00 00 00 00 00 00 00 00 02 00 00 00 00 00 00   ................

No.     Time           Source                Destination           Protocol Length Info
     40 0.353037       1.47.0                host                  USB      112    GET DESCRIPTOR Response STRING

Frame 40: 112 bytes on wire (896 bits), 112 bytes captured (896 bits) on interface 0
    Interface id: 0 (usbmon0)
        Interface name: usbmon0
    Encapsulation type: USB packets with Linux header and padding (115)
    Arrival Time: Jan  8, 2018 11:58:05.638681000 CET
    [Time shift for this packet: 0.000000000 seconds]
    Epoch Time: 1515409085.638681000 seconds
    [Time delta from previous captured frame: 0.001379000 seconds]
    [Time delta from previous displayed frame: 0.001379000 seconds]
    [Time since reference or first frame: 0.353037000 seconds]
    Frame Number: 40
    Frame Length: 112 bytes (896 bits)
    Capture Length: 112 bytes (896 bits)
    [Frame is marked: False]
    [Frame is ignored: False]
    [Protocols in frame: usb]
USB URB
    [Source: 1.47.0]
    [Destination: host]
    URB id: 0xffff8d9f64b4ab40
    URB type: URB_COMPLETE ('C')
    URB transfer type: URB_CONTROL (0x02)
    Endpoint: 0x80, Direction: IN
        1... .... = Direction: IN (1)
        .... 0000 = Endpoint number: 0
    Device: 47
    URB bus id: 1
    Device setup request: not relevant ('-')
    Data: present (0)
    URB sec: 1515409085
    URB usec: 638681
    URB status: Success (0)
    URB length [bytes]: 48
    Data length [bytes]: 48
    [Request in: 39]
    [Time from request: 0.001379000 seconds]
    Unused Setup Header
    Interval: 0
    Start frame: 0
    Copy of Transfer Flags: 0x00000200
    Number of ISO descriptors: 0
STRING DESCRIPTOR
    bLength: 48
    bDescriptorType: 0x03 (STRING)
    bString: Dell USB Entry Keyboard

0000  40 ab b4 64 9f 8d ff ff 43 02 80 2f 01 00 2d 00   @..d....C../..-.
0010  bd 4e 53 5a 00 00 00 00 d9 be 09 00 00 00 00 00   .NSZ............
0020  30 00 00 00 30 00 00 00 00 00 00 00 00 00 00 00   0...0...........
0030  00 00 00 00 00 00 00 00 00 02 00 00 00 00 00 00   ................
0040  30 03 44 00 65 00 6c 00 6c 00 20 00 55 00 53 00   0.D.e.l.l. .U.S.
0050  42 00 20 00 45 00 6e 00 74 00 72 00 79 00 20 00   B. .E.n.t.r.y. .
0060  4b 00 65 00 79 00 62 00 6f 00 61 00 72 00 64 00   K.e.y.b.o.a.r.d.

No.     Time           Source                Destination           Protocol Length Info
     41 0.356008       host                  1.47.0                USB      64     GET DESCRIPTOR Request STRING

Frame 41: 64 bytes on wire (512 bits), 64 bytes captured (512 bits) on interface 0
    Interface id: 0 (usbmon0)
        Interface name: usbmon0
    Encapsulation type: USB packets with Linux header and padding (115)
    Arrival Time: Jan  8, 2018 11:58:05.641652000 CET
    [Time shift for this packet: 0.000000000 seconds]
    Epoch Time: 1515409085.641652000 seconds
    [Time delta from previous captured frame: 0.002971000 seconds]
    [Time delta from previous displayed frame: 0.002971000 seconds]
    [Time since reference or first frame: 0.356008000 seconds]
    Frame Number: 41
    Frame Length: 64 bytes (512 bits)
    Capture Length: 64 bytes (512 bits)
    [Frame is marked: False]
    [Frame is ignored: False]
    [Protocols in frame: usb]
USB URB
    [Source: host]
    [Destination: 1.47.0]
    URB id: 0xffff8d9f64b4ab40
    URB type: URB_SUBMIT ('S')
    URB transfer type: URB_CONTROL (0x02)
    Endpoint: 0x80, Direction: IN
        1... .... = Direction: IN (1)
        .... 0000 = Endpoint number: 0
    Device: 47
    URB bus id: 1
    Device setup request: relevant (0)
    Data: not present ('<')
    URB sec: 1515409085
    URB usec: 641652
    URB status: Operation now in progress (-EINPROGRESS) (-115)
    URB length [bytes]: 255
    Data length [bytes]: 0
    [Response in: 42]
    Interval: 0
    Start frame: 0
    Copy of Transfer Flags: 0x00000200
    Number of ISO descriptors: 0
URB setup
    bmRequestType: 0x80
        1... .... = Direction: Device-to-host
        .00. .... = Type: Standard (0x0)
        ...0 0000 = Recipient: Device (0x00)
    bRequest: GET DESCRIPTOR (6)
    Descriptor Index: 0x01
    bDescriptorType: 0x03
    Language Id: English (United States) (0x0409)
    wLength: 255

0000  40 ab b4 64 9f 8d ff ff 53 02 80 2f 01 00 00 3c   @..d....S../...<
0010  bd 4e 53 5a 00 00 00 00 74 ca 09 00 8d ff ff ff   .NSZ....t.......
0020  ff 00 00 00 00 00 00 00 80 06 01 03 09 04 ff 00   ................
0030  00 00 00 00 00 00 00 00 00 02 00 00 00 00 00 00   ................

No.     Time           Source                Destination           Protocol Length Info
     42 0.356613       1.47.0                host                  USB      74     GET DESCRIPTOR Response STRING

Frame 42: 74 bytes on wire (592 bits), 74 bytes captured (592 bits) on interface 0
    Interface id: 0 (usbmon0)
        Interface name: usbmon0
    Encapsulation type: USB packets with Linux header and padding (115)
    Arrival Time: Jan  8, 2018 11:58:05.642257000 CET
    [Time shift for this packet: 0.000000000 seconds]
    Epoch Time: 1515409085.642257000 seconds
    [Time delta from previous captured frame: 0.000605000 seconds]
    [Time delta from previous displayed frame: 0.000605000 seconds]
    [Time since reference or first frame: 0.356613000 seconds]
    Frame Number: 42
    Frame Length: 74 bytes (592 bits)
    Capture Length: 74 bytes (592 bits)
    [Frame is marked: False]
    [Frame is ignored: False]
    [Protocols in frame: usb]
USB URB
    [Source: 1.47.0]
    [Destination: host]
    URB id: 0xffff8d9f64b4ab40
    URB type: URB_COMPLETE ('C')
    URB transfer type: URB_CONTROL (0x02)
    Endpoint: 0x80, Direction: IN
        1... .... = Direction: IN (1)
        .... 0000 = Endpoint number: 0
    Device: 47
    URB bus id: 1
    Device setup request: not relevant ('-')
    Data: present (0)
    URB sec: 1515409085
    URB usec: 642257
    URB status: Success (0)
    URB length [bytes]: 10
    Data length [bytes]: 10
    [Request in: 41]
    [Time from request: 0.000605000 seconds]
    Unused Setup Header
    Interval: 0
    Start frame: 0
    Copy of Transfer Flags: 0x00000200
    Number of ISO descriptors: 0
STRING DESCRIPTOR
    bLength: 10
    bDescriptorType: 0x03 (STRING)
    bString: DELL

0000  40 ab b4 64 9f 8d ff ff 43 02 80 2f 01 00 2d 00   @..d....C../..-.
0010  bd 4e 53 5a 00 00 00 00 d1 cc 09 00 00 00 00 00   .NSZ............
0020  0a 00 00 00 0a 00 00 00 00 00 00 00 00 00 00 00   ................
0030  00 00 00 00 00 00 00 00 00 02 00 00 00 00 00 00   ................
0040  0a 03 44 00 45 00 4c 00 4c 00                     ..D.E.L.L.

No.     Time           Source                Destination           Protocol Length Info
     43 0.361578       host                  1.47.0                USB      64     SET CONFIGURATION Request

Frame 43: 64 bytes on wire (512 bits), 64 bytes captured (512 bits) on interface 0
    Interface id: 0 (usbmon0)
        Interface name: usbmon0
    Encapsulation type: USB packets with Linux header and padding (115)
    Arrival Time: Jan  8, 2018 11:58:05.647222000 CET
    [Time shift for this packet: 0.000000000 seconds]
    Epoch Time: 1515409085.647222000 seconds
    [Time delta from previous captured frame: 0.004965000 seconds]
    [Time delta from previous displayed frame: 0.004965000 seconds]
    [Time since reference or first frame: 0.361578000 seconds]
    Frame Number: 43
    Frame Length: 64 bytes (512 bits)
    Capture Length: 64 bytes (512 bits)
    [Frame is marked: False]
    [Frame is ignored: False]
    [Protocols in frame: usb]
USB URB
    [Source: host]
    [Destination: 1.47.0]
    URB id: 0xffff8d9f64b4a840
    URB type: URB_SUBMIT ('S')
    URB transfer type: URB_CONTROL (0x02)
    Endpoint: 0x00, Direction: OUT
        0... .... = Direction: OUT (0)
        .... 0000 = Endpoint number: 0
    Device: 47
    URB bus id: 1
    Device setup request: relevant (0)
    Data: present (0)
    URB sec: 1515409085
    URB usec: 647222
    URB status: Operation now in progress (-EINPROGRESS) (-115)
    URB length [bytes]: 0
    Data length [bytes]: 0
    [Response in: 44]
    Interval: 0
    Start frame: 0
    Copy of Transfer Flags: 0x00000000
    Number of ISO descriptors: 0
URB setup
    bmRequestType: 0x00
        0... .... = Direction: Host-to-device
        .00. .... = Type: Standard (0x0)
        ...0 0000 = Recipient: Device (0x00)
    bRequest: SET CONFIGURATION (9)
    bConfigurationValue: 1
    wIndex: 0 (0x0000)
    wLength: 0

0000  40 a8 b4 64 9f 8d ff ff 53 02 00 2f 01 00 00 00   @..d....S../....
0010  bd 4e 53 5a 00 00 00 00 36 e0 09 00 8d ff ff ff   .NSZ....6.......
0020  00 00 00 00 00 00 00 00 00 09 01 00 00 00 00 00   ................
0030  00 00 00 00 00 00 00 00 00 00 00 00 00 00 00 00   ................

No.     Time           Source                Destination           Protocol Length Info
     44 0.361833       1.47.0                host                  USB      64     SET CONFIGURATION Response

Frame 44: 64 bytes on wire (512 bits), 64 bytes captured (512 bits) on interface 0
    Interface id: 0 (usbmon0)
        Interface name: usbmon0
    Encapsulation type: USB packets with Linux header and padding (115)
    Arrival Time: Jan  8, 2018 11:58:05.647477000 CET
    [Time shift for this packet: 0.000000000 seconds]
    Epoch Time: 1515409085.647477000 seconds
    [Time delta from previous captured frame: 0.000255000 seconds]
    [Time delta from previous displayed frame: 0.000255000 seconds]
    [Time since reference or first frame: 0.361833000 seconds]
    Frame Number: 44
    Frame Length: 64 bytes (512 bits)
    Capture Length: 64 bytes (512 bits)
    [Frame is marked: False]
    [Frame is ignored: False]
    [Protocols in frame: usb]
USB URB
    [Source: 1.47.0]
    [Destination: host]
    URB id: 0xffff8d9f64b4a840
    URB type: URB_COMPLETE ('C')
    URB transfer type: URB_CONTROL (0x02)
    Endpoint: 0x00, Direction: OUT
        0... .... = Direction: OUT (0)
        .... 0000 = Endpoint number: 0
    Device: 47
    URB bus id: 1
    Device setup request: not relevant ('-')
    Data: not present ('>')
    URB sec: 1515409085
    URB usec: 647477
    URB status: Success (0)
    URB length [bytes]: 0
    Data length [bytes]: 0
    [Request in: 43]
    [Time from request: 0.000255000 seconds]
    Unused Setup Header
    Interval: 0
    Start frame: 0
    Copy of Transfer Flags: 0x00000000
    Number of ISO descriptors: 0

0000  40 a8 b4 64 9f 8d ff ff 43 02 00 2f 01 00 2d 3e   @..d....C../..->
0010  bd 4e 53 5a 00 00 00 00 35 e1 09 00 00 00 00 00   .NSZ....5.......
0020  00 00 00 00 00 00 00 00 00 00 00 00 00 00 00 00   ................
0030  00 00 00 00 00 00 00 00 00 00 00 00 00 00 00 00   ................

No.     Time           Source                Destination           Protocol Length Info
     45 0.362120       host                  1.47.0                USBHID   64     SET_IDLE Request

Frame 45: 64 bytes on wire (512 bits), 64 bytes captured (512 bits) on interface 0
    Interface id: 0 (usbmon0)
        Interface name: usbmon0
    Encapsulation type: USB packets with Linux header and padding (115)
    Arrival Time: Jan  8, 2018 11:58:05.647764000 CET
    [Time shift for this packet: 0.000000000 seconds]
    Epoch Time: 1515409085.647764000 seconds
    [Time delta from previous captured frame: 0.000287000 seconds]
    [Time delta from previous displayed frame: 0.000287000 seconds]
    [Time since reference or first frame: 0.362120000 seconds]
    Frame Number: 45
    Frame Length: 64 bytes (512 bits)
    Capture Length: 64 bytes (512 bits)
    [Frame is marked: False]
    [Frame is ignored: False]
    [Protocols in frame: usb:usbhid]
USB URB
    [Source: host]
    [Destination: 1.47.0]
    URB id: 0xffff8d9f64b4a0c0
    URB type: URB_SUBMIT ('S')
    URB transfer type: URB_CONTROL (0x02)
    Endpoint: 0x00, Direction: OUT
        0... .... = Direction: OUT (0)
        .... 0000 = Endpoint number: 0
    Device: 47
    URB bus id: 1
    Device setup request: relevant (0)
    Data: present (0)
    URB sec: 1515409085
    URB usec: 647764
    URB status: Operation now in progress (-EINPROGRESS) (-115)
    URB length [bytes]: 0
    Data length [bytes]: 0
    [Response in: 46]
    Interval: 0
    Start frame: 0
    Copy of Transfer Flags: 0x00000000
    Number of ISO descriptors: 0
    [bInterfaceClass: HID (0x03)]
URB setup
    bmRequestType: 0x21
        0... .... = Direction: Host-to-device
        .01. .... = Type: Class (0x1)
        ...0 0001 = Recipient: Interface (0x01)
bRequest: SET_IDLE (0x0a)
wValue: 0x0000
    ReportID: 0
    Duration: 0
wIndex: 0
wLength: 0

0000  c0 a0 b4 64 9f 8d ff ff 53 02 00 2f 01 00 00 00   ...d....S../....
0010  bd 4e 53 5a 00 00 00 00 54 e2 09 00 8d ff ff ff   .NSZ....T.......
0020  00 00 00 00 00 00 00 00 21 0a 00 00 00 00 00 00   ........!.......
0030  00 00 00 00 00 00 00 00 00 00 00 00 00 00 00 00   ................

No.     Time           Source                Destination           Protocol Length Info
     46 0.362366       1.47.0                host                  USBHID   64     SET_IDLE Response

Frame 46: 64 bytes on wire (512 bits), 64 bytes captured (512 bits) on interface 0
    Interface id: 0 (usbmon0)
        Interface name: usbmon0
    Encapsulation type: USB packets with Linux header and padding (115)
    Arrival Time: Jan  8, 2018 11:58:05.648010000 CET
    [Time shift for this packet: 0.000000000 seconds]
    Epoch Time: 1515409085.648010000 seconds
    [Time delta from previous captured frame: 0.000246000 seconds]
    [Time delta from previous displayed frame: 0.000246000 seconds]
    [Time since reference or first frame: 0.362366000 seconds]
    Frame Number: 46
    Frame Length: 64 bytes (512 bits)
    Capture Length: 64 bytes (512 bits)
    [Frame is marked: False]
    [Frame is ignored: False]
    [Protocols in frame: usb]
USB URB
    [Source: 1.47.0]
    [Destination: host]
    URB id: 0xffff8d9f64b4a0c0
    URB type: URB_COMPLETE ('C')
    URB transfer type: URB_CONTROL (0x02)
    Endpoint: 0x00, Direction: OUT
        0... .... = Direction: OUT (0)
        .... 0000 = Endpoint number: 0
    Device: 47
    URB bus id: 1
    Device setup request: not relevant ('-')
    Data: not present ('>')
    URB sec: 1515409085
    URB usec: 648010
    URB status: Success (0)
    URB length [bytes]: 0
    Data length [bytes]: 0
    [Request in: 45]
    [Time from request: 0.000246000 seconds]
    Unused Setup Header
    Interval: 0
    Start frame: 0
    Copy of Transfer Flags: 0x00000000
    Number of ISO descriptors: 0
    [bInterfaceClass: HID (0x03)]

0000  c0 a0 b4 64 9f 8d ff ff 43 02 00 2f 01 00 2d 3e   ...d....C../..->
0010  bd 4e 53 5a 00 00 00 00 4a e3 09 00 00 00 00 00   .NSZ....J.......
0020  00 00 00 00 00 00 00 00 00 00 00 00 00 00 00 00   ................
0030  00 00 00 00 00 00 00 00 00 00 00 00 00 00 00 00   ................

No.     Time           Source                Destination           Protocol Length Info
     47 0.362391       host                  1.47.0                USBHID   64     GET DESCRIPTOR Request HID Report

Frame 47: 64 bytes on wire (512 bits), 64 bytes captured (512 bits) on interface 0
    Interface id: 0 (usbmon0)
        Interface name: usbmon0
    Encapsulation type: USB packets with Linux header and padding (115)
    Arrival Time: Jan  8, 2018 11:58:05.648035000 CET
    [Time shift for this packet: 0.000000000 seconds]
    Epoch Time: 1515409085.648035000 seconds
    [Time delta from previous captured frame: 0.000025000 seconds]
    [Time delta from previous displayed frame: 0.000025000 seconds]
    [Time since reference or first frame: 0.362391000 seconds]
    Frame Number: 47
    Frame Length: 64 bytes (512 bits)
    Capture Length: 64 bytes (512 bits)
    [Frame is marked: False]
    [Frame is ignored: False]
    [Protocols in frame: usb:usbhid]
USB URB
    [Source: host]
    [Destination: 1.47.0]
    URB id: 0xffff8d9f64b4a0c0
    URB type: URB_SUBMIT ('S')
    URB transfer type: URB_CONTROL (0x02)
    Endpoint: 0x80, Direction: IN
        1... .... = Direction: IN (1)
        .... 0000 = Endpoint number: 0
    Device: 47
    URB bus id: 1
    Device setup request: relevant (0)
    Data: not present ('<')
    URB sec: 1515409085
    URB usec: 648035
    URB status: Operation now in progress (-EINPROGRESS) (-115)
    URB length [bytes]: 65
    Data length [bytes]: 0
    [Response in: 48]
    Interval: 0
    Start frame: 0
    Copy of Transfer Flags: 0x00000200
    Number of ISO descriptors: 0
    [bInterfaceClass: HID (0x03)]
URB setup
    bmRequestType: 0x81
        1... .... = Direction: Device-to-host
        .00. .... = Type: Standard (0x0)
        ...0 0001 = Recipient: Interface (0x01)
bDescriptorIndex: 0x00
bDescriptorType: HID Report (0x22)
wInterfaceNumber: 0
wDescriptorLength: 65

0000  c0 a0 b4 64 9f 8d ff ff 53 02 80 2f 01 00 00 3c   ...d....S../...<
0010  bd 4e 53 5a 00 00 00 00 63 e3 09 00 8d ff ff ff   .NSZ....c.......
0020  41 00 00 00 00 00 00 00 81 06 00 22 00 00 41 00   A.........."..A.
0030  00 00 00 00 00 00 00 00 00 02 00 00 00 00 00 00   ................

No.     Time           Source                Destination           Protocol Length Info
     48 0.364370       1.47.0                host                  USBHID   129    GET DESCRIPTOR Response HID Report

Frame 48: 129 bytes on wire (1032 bits), 129 bytes captured (1032 bits) on interface 0
    Interface id: 0 (usbmon0)
        Interface name: usbmon0
    Encapsulation type: USB packets with Linux header and padding (115)
    Arrival Time: Jan  8, 2018 11:58:05.650014000 CET
    [Time shift for this packet: 0.000000000 seconds]
    Epoch Time: 1515409085.650014000 seconds
    [Time delta from previous captured frame: 0.001979000 seconds]
    [Time delta from previous displayed frame: 0.001979000 seconds]
    [Time since reference or first frame: 0.364370000 seconds]
    Frame Number: 48
    Frame Length: 129 bytes (1032 bits)
    Capture Length: 129 bytes (1032 bits)
    [Frame is marked: False]
    [Frame is ignored: False]
    [Protocols in frame: usb:usbhid]
USB URB
    [Source: 1.47.0]
    [Destination: host]
    URB id: 0xffff8d9f64b4a0c0
    URB type: URB_COMPLETE ('C')
    URB transfer type: URB_CONTROL (0x02)
    Endpoint: 0x80, Direction: IN
        1... .... = Direction: IN (1)
        .... 0000 = Endpoint number: 0
    Device: 47
    URB bus id: 1
    Device setup request: not relevant ('-')
    Data: present (0)
    URB sec: 1515409085
    URB usec: 650014
    URB status: Success (0)
    URB length [bytes]: 65
    Data length [bytes]: 65
    [Request in: 47]
    [Time from request: 0.001979000 seconds]
    Unused Setup Header
    Interval: 0
    Start frame: 0
    Copy of Transfer Flags: 0x00000200
    Number of ISO descriptors: 0
    [bInterfaceClass: HID (0x03)]
HID Report
    Global item (Usage)
        Header
            .... ..01 = bSize: 1 byte (1)
            .... 01.. = bType: Global (1)
            0000 .... = bTag: Usage (0x0)
        Usage page: Generic desktop controls (0x01)
    Local item (Usage)
        Header
            .... ..01 = bSize: 1 byte (1)
            .... 10.. = bType: Local (2)
            0000 .... = bTag: Usage (0x0)
        Usage: Generic device controls (0x06)
    Main item (Collection)
        Header
            .... ..01 = bSize: 1 byte (1)
            .... 00.. = bType: Main (0)
            1010 .... = bTag: Collection (0xa)
        Collection type: Application (0x01)
        Global item (Usage)
            Header
                .... ..01 = bSize: 1 byte (1)
                .... 01.. = bType: Global (1)
                0000 .... = bTag: Usage (0x0)
            Usage page: Keyboard/keypad (0x07)
        Local item (Usage minimum)
            Header
                .... ..01 = bSize: 1 byte (1)
                .... 10.. = bType: Local (2)
                0001 .... = bTag: Usage minimum (0x1)
            Usage minimum: 0xe0
        Local item (Usage maximum)
            Header
                .... ..01 = bSize: 1 byte (1)
                .... 10.. = bType: Local (2)
                0010 .... = bTag: Usage maximum (0x2)
            Usage: [Reserved] (0xe7)
        Global item (Logical minimum)
            Header
                .... ..01 = bSize: 1 byte (1)
                .... 01.. = bType: Global (1)
                0001 .... = bTag: Logical minimum (0x1)
            Logical minimum: 0
        Global item (Logical maximum)
            Header
                .... ..01 = bSize: 1 byte (1)
                .... 01.. = bType: Global (1)
                0010 .... = bTag: Logical maximum (0x2)
            Logical maximum: 1
        Global item (Report size)
            Header
                .... ..01 = bSize: 1 byte (1)
                .... 01.. = bType: Global (1)
                0111 .... = bTag: Report size (0x7)
            Report size: 1
        Global item (Report count)
            Header
                .... ..01 = bSize: 1 byte (1)
                .... 01.. = bType: Global (1)
                1001 .... = bTag: Report count (0x9)
            Report count: 8
        Main item (Input)
            Header
                .... ..01 = bSize: 1 byte (1)
                .... 00.. = bType: Main (0)
                1000 .... = bTag: Input (0x8)
            .... .... 0 = Data/constant: Data
            .... ...1 . = Data type: Variable
            .... ..0. . = Coordinates: Absolute
            .... .0.. . = Min/max wraparound: No Wrap
            .... 0... . = Physical relationship to data: Linear
            ...0 .... . = Preferred state: Preferred State
            ..0. .... . = Has null position: No Null position
            .0.. .... . = [Reserved]: False
            0... .... . = Bits or bytes: Buffered bytes (default, no second byte present)
        Global item (Report count)
            Header
                .... ..01 = bSize: 1 byte (1)
                .... 01.. = bType: Global (1)
                1001 .... = bTag: Report count (0x9)
            Report count: 1
        Global item (Report size)
            Header
                .... ..01 = bSize: 1 byte (1)
                .... 01.. = bType: Global (1)
                0111 .... = bTag: Report size (0x7)
            Report size: 8
        Main item (Input)
            Header
                .... ..01 = bSize: 1 byte (1)
                .... 00.. = bType: Main (0)
                1000 .... = bTag: Input (0x8)
            .... .... 1 = Data/constant: Constant
            .... ...0 . = Data type: Array
            .... ..0. . = Coordinates: Absolute
            .... .0.. . = Min/max wraparound: No Wrap
            .... 0... . = Physical relationship to data: Linear
            ...0 .... . = Preferred state: Preferred State
            ..0. .... . = Has null position: No Null position
            .0.. .... . = [Reserved]: False
            0... .... . = Bits or bytes: Buffered bytes (default, no second byte present)
        Global item (Report count)
            Header
                .... ..01 = bSize: 1 byte (1)
                .... 01.. = bType: Global (1)
                1001 .... = bTag: Report count (0x9)
            Report count: 3
        Global item (Report size)
            Header
                .... ..01 = bSize: 1 byte (1)
                .... 01.. = bType: Global (1)
                0111 .... = bTag: Report size (0x7)
            Report size: 1
        Global item (Usage)
            Header
                .... ..01 = bSize: 1 byte (1)
                .... 01.. = bType: Global (1)
                0000 .... = bTag: Usage (0x0)
            Usage page: LEDs (0x08)
        Local item (Usage minimum)
            Header
                .... ..01 = bSize: 1 byte (1)
                .... 10.. = bType: Local (2)
                0001 .... = bTag: Usage minimum (0x1)
            Usage minimum: 0x01
        Local item (Usage maximum)
            Header
                .... ..01 = bSize: 1 byte (1)
                .... 10.. = bType: Local (2)
                0010 .... = bTag: Usage maximum (0x2)
            Usage: VR controls (0x03)
        Main item (Output)
            Header
                .... ..01 = bSize: 1 byte (1)
                .... 00.. = bType: Main (0)
                1001 .... = bTag: Output (0x9)
            .... .... 0 = Data/constant: Data
            .... ...1 . = Data type: Variable
            .... ..0. . = Coordinates: Absolute
            .... .0.. . = Min/max wraparound: No Wrap
            .... 0... . = Physical relationship to data: Linear
            ...0 .... . = Preferred state: Preferred State
            ..0. .... . = Has null position: No Null position
            .0.. .... . = (Non)-volatile: Non Volatile
            0... .... . = Bits or bytes: Buffered bytes (default, no second byte present)
        Global item (Report count)
            Header
                .... ..01 = bSize: 1 byte (1)
                .... 01.. = bType: Global (1)
                1001 .... = bTag: Report count (0x9)
            Report count: 5
        Global item (Report size)
            Header
                .... ..01 = bSize: 1 byte (1)
                .... 01.. = bType: Global (1)
                0111 .... = bTag: Report size (0x7)
            Report size: 1
        Main item (Output)
            Header
                .... ..01 = bSize: 1 byte (1)
                .... 00.. = bType: Main (0)
                1001 .... = bTag: Output (0x9)
            .... .... 1 = Data/constant: Constant
            .... ...0 . = Data type: Array
            .... ..0. . = Coordinates: Absolute
            .... .0.. . = Min/max wraparound: No Wrap
            .... 0... . = Physical relationship to data: Linear
            ...0 .... . = Preferred state: Preferred State
            ..0. .... . = Has null position: No Null position
            .0.. .... . = (Non)-volatile: Non Volatile
            0... .... . = Bits or bytes: Buffered bytes (default, no second byte present)
        Global item (Report count)
            Header
                .... ..01 = bSize: 1 byte (1)
                .... 01.. = bType: Global (1)
                1001 .... = bTag: Report count (0x9)
            Report count: 6
        Global item (Report size)
            Header
                .... ..01 = bSize: 1 byte (1)
                .... 01.. = bType: Global (1)
                0111 .... = bTag: Report size (0x7)
            Report size: 8
        Global item (Logical minimum)
            Header
                .... ..01 = bSize: 1 byte (1)
                .... 01.. = bType: Global (1)
                0001 .... = bTag: Logical minimum (0x1)
            Logical minimum: 0
        Global item (Logical maximum)
            Header
                .... ..10 = bSize: 2 bytes (2)
                .... 01.. = bType: Global (1)
                0010 .... = bTag: Logical maximum (0x2)
            Logical maximum: 255
        Global item (Usage)
            Header
                .... ..01 = bSize: 1 byte (1)
                .... 01.. = bType: Global (1)
                0000 .... = bTag: Usage (0x0)
            Usage page: Keyboard/keypad (0x07)
        Local item (Usage minimum)
            Header
                .... ..01 = bSize: 1 byte (1)
                .... 10.. = bType: Local (2)
                0001 .... = bTag: Usage minimum (0x1)
            Usage minimum: 0x00
        Local item (Usage maximum)
            Header
                .... ..10 = bSize: 2 bytes (2)
                .... 10.. = bType: Local (2)
                0010 .... = bTag: Usage maximum (0x2)
            Usage: [Reserved] (0xff)
        Main item (Input)
            Header
                .... ..01 = bSize: 1 byte (1)
                .... 00.. = bType: Main (0)
                1000 .... = bTag: Input (0x8)
            .... .... 0 = Data/constant: Data
            .... ...0 . = Data type: Array
            .... ..0. . = Coordinates: Absolute
            .... .0.. . = Min/max wraparound: No Wrap
            .... 0... . = Physical relationship to data: Linear
            ...0 .... . = Preferred state: Preferred State
            ..0. .... . = Has null position: No Null position
            .0.. .... . = [Reserved]: False
            0... .... . = Bits or bytes: Buffered bytes (default, no second byte present)
        Main item (End collection)
            Header
                .... ..00 = bSize: 0 bytes (0)
                .... 00.. = bType: Main (0)
                1100 .... = bTag: End collection (0xc)

0000  c0 a0 b4 64 9f 8d ff ff 43 02 80 2f 01 00 2d 00   ...d....C../..-.
0010  bd 4e 53 5a 00 00 00 00 1e eb 09 00 00 00 00 00   .NSZ............
0020  41 00 00 00 41 00 00 00 00 00 00 00 00 00 00 00   A...A...........
0030  00 00 00 00 00 00 00 00 00 02 00 00 00 00 00 00   ................
0040  05 01 09 06 a1 01 05 07 19 e0 29 e7 15 00 25 01   ..........)...%.
0050  75 01 95 08 81 02 95 01 75 08 81 01 95 03 75 01   u.......u.....u.
0060  05 08 19 01 29 03 91 02 95 05 75 01 91 01 95 06   ....).....u.....
0070  75 08 15 00 26 ff 00 05 07 19 00 2a ff 00 81 00   u...&......*....
0080  c0                                                .

No.     Time           Source                Destination           Protocol Length Info
     49 0.365573       host                  1.47.0                USBHID   65     SET_REPORT Request

Frame 49: 65 bytes on wire (520 bits), 65 bytes captured (520 bits) on interface 0
    Interface id: 0 (usbmon0)
        Interface name: usbmon0
    Encapsulation type: USB packets with Linux header and padding (115)
    Arrival Time: Jan  8, 2018 11:58:05.651217000 CET
    [Time shift for this packet: 0.000000000 seconds]
    Epoch Time: 1515409085.651217000 seconds
    [Time delta from previous captured frame: 0.001203000 seconds]
    [Time delta from previous displayed frame: 0.001203000 seconds]
    [Time since reference or first frame: 0.365573000 seconds]
    Frame Number: 49
    Frame Length: 65 bytes (520 bits)
    Capture Length: 65 bytes (520 bits)
    [Frame is marked: False]
    [Frame is ignored: False]
    [Protocols in frame: usb:usbhid]
USB URB
    [Source: host]
    [Destination: 1.47.0]
    URB id: 0xffff8d9f64b4a9c0
    URB type: URB_SUBMIT ('S')
    URB transfer type: URB_CONTROL (0x02)
    Endpoint: 0x00, Direction: OUT
        0... .... = Direction: OUT (0)
        .... 0000 = Endpoint number: 0
    Device: 47
    URB bus id: 1
    Device setup request: relevant (0)
    Data: present (0)
    URB sec: 1515409085
    URB usec: 651217
    URB status: Operation now in progress (-EINPROGRESS) (-115)
    URB length [bytes]: 1
    Data length [bytes]: 1
    [Response in: 50]
    Interval: 0
    Start frame: 0
    Copy of Transfer Flags: 0x00000004
    Number of ISO descriptors: 0
    [bInterfaceClass: HID (0x03)]
URB setup
    bmRequestType: 0x21
        0... .... = Direction: Host-to-device
        .01. .... = Type: Class (0x1)
        ...0 0001 = Recipient: Interface (0x01)
    bRequest: 9
    wValue: 0x0200
    wIndex: 0 (0x0000)
    wLength: 1
    Data Fragment: 00
bRequest: SET_REPORT (0x09)
wValue: 0x0200
    ReportID: 0
    ReportType: Output (2)
wIndex: 0
wLength: 1

Frame (65 bytes):
0000  c0 a9 b4 64 9f 8d ff ff 53 02 00 2f 01 00 00 00   ...d....S../....
0010  bd 4e 53 5a 00 00 00 00 d1 ef 09 00 8d ff ff ff   .NSZ............
0020  01 00 00 00 01 00 00 00 21 09 00 02 00 00 01 00   ........!.......
0030  00 00 00 00 00 00 00 00 04 00 00 00 00 00 00 00   ................
0040  00                                                .
USB Control (8 bytes):
0000  09 00 02 00 00 01 00 00                           ........

No.     Time           Source                Destination           Protocol Length Info
     50 0.365932       1.47.0                host                  USBHID   64     SET_REPORT Response

Frame 50: 64 bytes on wire (512 bits), 64 bytes captured (512 bits) on interface 0
    Interface id: 0 (usbmon0)
        Interface name: usbmon0
    Encapsulation type: USB packets with Linux header and padding (115)
    Arrival Time: Jan  8, 2018 11:58:05.651576000 CET
    [Time shift for this packet: 0.000000000 seconds]
    Epoch Time: 1515409085.651576000 seconds
    [Time delta from previous captured frame: 0.000359000 seconds]
    [Time delta from previous displayed frame: 0.000359000 seconds]
    [Time since reference or first frame: 0.365932000 seconds]
    Frame Number: 50
    Frame Length: 64 bytes (512 bits)
    Capture Length: 64 bytes (512 bits)
    [Frame is marked: False]
    [Frame is ignored: False]
    [Protocols in frame: usb]
USB URB
    [Source: 1.47.0]
    [Destination: host]
    URB id: 0xffff8d9f64b4a9c0
    URB type: URB_COMPLETE ('C')
    URB transfer type: URB_CONTROL (0x02)
    Endpoint: 0x00, Direction: OUT
        0... .... = Direction: OUT (0)
        .... 0000 = Endpoint number: 0
    Device: 47
    URB bus id: 1
    Device setup request: not relevant ('-')
    Data: not present ('>')
    URB sec: 1515409085
    URB usec: 651576
    URB status: Success (0)
    URB length [bytes]: 1
    Data length [bytes]: 0
    [Request in: 49]
    [Time from request: 0.000359000 seconds]
    Unused Setup Header
    Interval: 0
    Start frame: 0
    Copy of Transfer Flags: 0x00000004
    Number of ISO descriptors: 0
    [bInterfaceClass: HID (0x03)]

0000  c0 a9 b4 64 9f 8d ff ff 43 02 00 2f 01 00 2d 3e   ...d....C../..->
0010  bd 4e 53 5a 00 00 00 00 38 f1 09 00 00 00 00 00   .NSZ....8.......
0020  01 00 00 00 00 00 00 00 00 00 00 00 00 00 00 00   ................
0030  00 00 00 00 00 00 00 00 04 00 00 00 00 00 00 00   ................

No.     Time           Source                Destination           Protocol Length Info
     51 0.366022       host                  1.47.1                USB      64     URB_INTERRUPT in

Frame 51: 64 bytes on wire (512 bits), 64 bytes captured (512 bits) on interface 0
    Interface id: 0 (usbmon0)
        Interface name: usbmon0
    Encapsulation type: USB packets with Linux header and padding (115)
    Arrival Time: Jan  8, 2018 11:58:05.651666000 CET
    [Time shift for this packet: 0.000000000 seconds]
    Epoch Time: 1515409085.651666000 seconds
    [Time delta from previous captured frame: 0.000090000 seconds]
    [Time delta from previous displayed frame: 0.000090000 seconds]
    [Time since reference or first frame: 0.366022000 seconds]
    Frame Number: 51
    Frame Length: 64 bytes (512 bits)
    Capture Length: 64 bytes (512 bits)
    [Frame is marked: False]
    [Frame is ignored: False]
    [Protocols in frame: usb]
USB URB
    [Source: host]
    [Destination: 1.47.1]
    URB id: 0xffff8d9f64b4af00
    URB type: URB_SUBMIT ('S')
    URB transfer type: URB_INTERRUPT (0x01)
    Endpoint: 0x81, Direction: IN
        1... .... = Direction: IN (1)
        .... 0001 = Endpoint number: 1
    Device: 47
    URB bus id: 1
    Device setup request: not relevant ('-')
    Data: not present ('<')
    URB sec: 1515409085
    URB usec: 651666
    URB status: Operation now in progress (-EINPROGRESS) (-115)
    URB length [bytes]: 8
    Data length [bytes]: 0
    [Response in: 54]
    [bInterfaceClass: HID (0x03)]
    Unused Setup Header
    Interval: 8
    Start frame: 0
    Copy of Transfer Flags: 0x00000204
    Number of ISO descriptors: 0

0000  00 af b4 64 9f 8d ff ff 53 01 81 2f 01 00 2d 3c   ...d....S../..-<
0010  bd 4e 53 5a 00 00 00 00 92 f1 09 00 8d ff ff ff   .NSZ............
0020  08 00 00 00 00 00 00 00 00 00 00 00 00 00 00 00   ................
0030  08 00 00 00 00 00 00 00 04 02 00 00 00 00 00 00   ................

No.     Time           Source                Destination           Protocol Length Info
     52 0.528755       host                  1.47.0                USBHID   65     SET_REPORT Request

Frame 52: 65 bytes on wire (520 bits), 65 bytes captured (520 bits) on interface 0
    Interface id: 0 (usbmon0)
        Interface name: usbmon0
    Encapsulation type: USB packets with Linux header and padding (115)
    Arrival Time: Jan  8, 2018 11:58:05.814399000 CET
    [Time shift for this packet: 0.000000000 seconds]
    Epoch Time: 1515409085.814399000 seconds
    [Time delta from previous captured frame: 0.162733000 seconds]
    [Time delta from previous displayed frame: 0.162733000 seconds]
    [Time since reference or first frame: 0.528755000 seconds]
    Frame Number: 52
    Frame Length: 65 bytes (520 bits)
    Capture Length: 65 bytes (520 bits)
    [Frame is marked: False]
    [Frame is ignored: False]
    [Protocols in frame: usb:usbhid]
USB URB
    [Source: host]
    [Destination: 1.47.0]
    URB id: 0xffff8d9f64b4a9c0
    URB type: URB_SUBMIT ('S')
    URB transfer type: URB_CONTROL (0x02)
    Endpoint: 0x00, Direction: OUT
        0... .... = Direction: OUT (0)
        .... 0000 = Endpoint number: 0
    Device: 47
    URB bus id: 1
    Device setup request: relevant (0)
    Data: present (0)
    URB sec: 1515409085
    URB usec: 814399
    URB status: Operation now in progress (-EINPROGRESS) (-115)
    URB length [bytes]: 1
    Data length [bytes]: 1
    [Response in: 53]
    Interval: 0
    Start frame: 0
    Copy of Transfer Flags: 0x00000004
    Number of ISO descriptors: 0
    [bInterfaceClass: HID (0x03)]
URB setup
    bmRequestType: 0x21
        0... .... = Direction: Host-to-device
        .01. .... = Type: Class (0x1)
        ...0 0001 = Recipient: Interface (0x01)
    bRequest: 9
    wValue: 0x0200
    wIndex: 0 (0x0000)
    wLength: 1
    Data Fragment: 01
bRequest: SET_REPORT (0x09)
wValue: 0x0200
    ReportID: 0
    ReportType: Output (2)
wIndex: 0
wLength: 1

Frame (65 bytes):
0000  c0 a9 b4 64 9f 8d ff ff 53 02 00 2f 01 00 00 00   ...d....S../....
0010  bd 4e 53 5a 00 00 00 00 3f 6d 0c 00 8d ff ff ff   .NSZ....?m......
0020  01 00 00 00 01 00 00 00 21 09 00 02 00 00 01 00   ........!.......
0030  00 00 00 00 00 00 00 00 04 00 00 00 00 00 00 00   ................
0040  01                                                .
USB Control (8 bytes):
0000  09 00 02 00 00 01 00 01                           ........

No.     Time           Source                Destination           Protocol Length Info
     53 0.529101       1.47.0                host                  USBHID   64     SET_REPORT Response

Frame 53: 64 bytes on wire (512 bits), 64 bytes captured (512 bits) on interface 0
    Interface id: 0 (usbmon0)
        Interface name: usbmon0
    Encapsulation type: USB packets with Linux header and padding (115)
    Arrival Time: Jan  8, 2018 11:58:05.814745000 CET
    [Time shift for this packet: 0.000000000 seconds]
    Epoch Time: 1515409085.814745000 seconds
    [Time delta from previous captured frame: 0.000346000 seconds]
    [Time delta from previous displayed frame: 0.000346000 seconds]
    [Time since reference or first frame: 0.529101000 seconds]
    Frame Number: 53
    Frame Length: 64 bytes (512 bits)
    Capture Length: 64 bytes (512 bits)
    [Frame is marked: False]
    [Frame is ignored: False]
    [Protocols in frame: usb]
USB URB
    [Source: 1.47.0]
    [Destination: host]
    URB id: 0xffff8d9f64b4a9c0
    URB type: URB_COMPLETE ('C')
    URB transfer type: URB_CONTROL (0x02)
    Endpoint: 0x00, Direction: OUT
        0... .... = Direction: OUT (0)
        .... 0000 = Endpoint number: 0
    Device: 47
    URB bus id: 1
    Device setup request: not relevant ('-')
    Data: not present ('>')
    URB sec: 1515409085
    URB usec: 814745
    URB status: Success (0)
    URB length [bytes]: 1
    Data length [bytes]: 0
    [Request in: 52]
    [Time from request: 0.000346000 seconds]
    Unused Setup Header
    Interval: 0
    Start frame: 0
    Copy of Transfer Flags: 0x00000004
    Number of ISO descriptors: 0
    [bInterfaceClass: HID (0x03)]

0000  c0 a9 b4 64 9f 8d ff ff 43 02 00 2f 01 00 2d 3e   ...d....C../..->
0010  bd 4e 53 5a 00 00 00 00 99 6e 0c 00 00 00 00 00   .NSZ.....n......
0020  01 00 00 00 00 00 00 00 00 00 00 00 00 00 00 00   ................
0030  00 00 00 00 00 00 00 00 04 00 00 00 00 00 00 00   ................

No.     Time           Source                Destination           Protocol Length Info
     54 7.573713       1.47.1                host                  USB      72     URB_INTERRUPT in

Frame 54: 72 bytes on wire (576 bits), 72 bytes captured (576 bits) on interface 0
    Interface id: 0 (usbmon0)
        Interface name: usbmon0
    Encapsulation type: USB packets with Linux header and padding (115)
    Arrival Time: Jan  8, 2018 11:58:12.859357000 CET
    [Time shift for this packet: 0.000000000 seconds]
    Epoch Time: 1515409092.859357000 seconds
    [Time delta from previous captured frame: 7.044612000 seconds]
    [Time delta from previous displayed frame: 7.044612000 seconds]
    [Time since reference or first frame: 7.573713000 seconds]
    Frame Number: 54
    Frame Length: 72 bytes (576 bits)
    Capture Length: 72 bytes (576 bits)
    [Frame is marked: False]
    [Frame is ignored: False]
    [Protocols in frame: usb]
USB URB
    [Source: 1.47.1]
    [Destination: host]
    URB id: 0xffff8d9f64b4af00
    URB type: URB_COMPLETE ('C')
    URB transfer type: URB_INTERRUPT (0x01)
    Endpoint: 0x81, Direction: IN
        1... .... = Direction: IN (1)
        .... 0001 = Endpoint number: 1
    Device: 47
    URB bus id: 1
    Device setup request: not relevant ('-')
    Data: present (0)
    URB sec: 1515409092
    URB usec: 859357
    URB status: Success (0)
    URB length [bytes]: 8
    Data length [bytes]: 8
    [Request in: 51]
    [Time from request: 7.207691000 seconds]
    [bInterfaceClass: HID (0x03)]
    Unused Setup Header
    Interval: 8
    Start frame: 0
    Copy of Transfer Flags: 0x00000204
    Number of ISO descriptors: 0
Leftover Capture Data: 0000280000000000

0000  00 af b4 64 9f 8d ff ff 43 01 81 2f 01 00 2d 00   ...d....C../..-.
0010  c4 4e 53 5a 00 00 00 00 dd 1c 0d 00 00 00 00 00   .NSZ............
0020  08 00 00 00 08 00 00 00 00 00 00 00 00 00 00 00   ................
0030  08 00 00 00 00 00 00 00 04 02 00 00 00 00 00 00   ................
0040  00 00 28 00 00 00 00 00                           ..(.....

No.     Time           Source                Destination           Protocol Length Info
     55 7.573823       host                  1.47.1                USB      64     URB_INTERRUPT in

Frame 55: 64 bytes on wire (512 bits), 64 bytes captured (512 bits) on interface 0
    Interface id: 0 (usbmon0)
        Interface name: usbmon0
    Encapsulation type: USB packets with Linux header and padding (115)
    Arrival Time: Jan  8, 2018 11:58:12.859467000 CET
    [Time shift for this packet: 0.000000000 seconds]
    Epoch Time: 1515409092.859467000 seconds
    [Time delta from previous captured frame: 0.000110000 seconds]
    [Time delta from previous displayed frame: 0.000110000 seconds]
    [Time since reference or first frame: 7.573823000 seconds]
    Frame Number: 55
    Frame Length: 64 bytes (512 bits)
    Capture Length: 64 bytes (512 bits)
    [Frame is marked: False]
    [Frame is ignored: False]
    [Protocols in frame: usb]
USB URB
    [Source: host]
    [Destination: 1.47.1]
    URB id: 0xffff8d9f64b4af00
    URB type: URB_SUBMIT ('S')
    URB transfer type: URB_INTERRUPT (0x01)
    Endpoint: 0x81, Direction: IN
        1... .... = Direction: IN (1)
        .... 0001 = Endpoint number: 1
    Device: 47
    URB bus id: 1
    Device setup request: not relevant ('-')
    Data: not present ('<')
    URB sec: 1515409092
    URB usec: 859467
    URB status: Operation now in progress (-EINPROGRESS) (-115)
    URB length [bytes]: 8
    Data length [bytes]: 0
    [Response in: 56]
    [bInterfaceClass: HID (0x03)]
    Unused Setup Header
    Interval: 8
    Start frame: 0
    Copy of Transfer Flags: 0x00000204
    Number of ISO descriptors: 0

0000  00 af b4 64 9f 8d ff ff 53 01 81 2f 01 00 2d 3c   ...d....S../..-<
0010  c4 4e 53 5a 00 00 00 00 4b 1d 0d 00 8d ff ff ff   .NSZ....K.......
0020  08 00 00 00 00 00 00 00 00 00 00 00 00 00 00 00   ................
0030  08 00 00 00 00 00 00 00 04 02 00 00 00 00 00 00   ................

No.     Time           Source                Destination           Protocol Length Info
     56 7.909632       1.47.1                host                  USB      72     URB_INTERRUPT in

Frame 56: 72 bytes on wire (576 bits), 72 bytes captured (576 bits) on interface 0
    Interface id: 0 (usbmon0)
        Interface name: usbmon0
    Encapsulation type: USB packets with Linux header and padding (115)
    Arrival Time: Jan  8, 2018 11:58:13.195276000 CET
    [Time shift for this packet: 0.000000000 seconds]
    Epoch Time: 1515409093.195276000 seconds
    [Time delta from previous captured frame: 0.335809000 seconds]
    [Time delta from previous displayed frame: 0.335809000 seconds]
    [Time since reference or first frame: 7.909632000 seconds]
    Frame Number: 56
    Frame Length: 72 bytes (576 bits)
    Capture Length: 72 bytes (576 bits)
    [Frame is marked: False]
    [Frame is ignored: False]
    [Protocols in frame: usb]
USB URB
    [Source: 1.47.1]
    [Destination: host]
    URB id: 0xffff8d9f64b4af00
    URB type: URB_COMPLETE ('C')
    URB transfer type: URB_INTERRUPT (0x01)
    Endpoint: 0x81, Direction: IN
        1... .... = Direction: IN (1)
        .... 0001 = Endpoint number: 1
    Device: 47
    URB bus id: 1
    Device setup request: not relevant ('-')
    Data: present (0)
    URB sec: 1515409093
    URB usec: 195276
    URB status: Success (0)
    URB length [bytes]: 8
    Data length [bytes]: 8
    [Request in: 55]
    [Time from request: 0.335809000 seconds]
    [bInterfaceClass: HID (0x03)]
    Unused Setup Header
    Interval: 8
    Start frame: 0
    Copy of Transfer Flags: 0x00000204
    Number of ISO descriptors: 0
Leftover Capture Data: 0000000000000000

0000  00 af b4 64 9f 8d ff ff 43 01 81 2f 01 00 2d 00   ...d....C../..-.
0010  c5 4e 53 5a 00 00 00 00 cc fa 02 00 00 00 00 00   .NSZ............
0020  08 00 00 00 08 00 00 00 00 00 00 00 00 00 00 00   ................
0030  08 00 00 00 00 00 00 00 04 02 00 00 00 00 00 00   ................
0040  00 00 00 00 00 00 00 00                           ........

No.     Time           Source                Destination           Protocol Length Info
     57 7.909701       host                  1.47.1                USB      64     URB_INTERRUPT in

Frame 57: 64 bytes on wire (512 bits), 64 bytes captured (512 bits) on interface 0
    Interface id: 0 (usbmon0)
        Interface name: usbmon0
    Encapsulation type: USB packets with Linux header and padding (115)
    Arrival Time: Jan  8, 2018 11:58:13.195345000 CET
    [Time shift for this packet: 0.000000000 seconds]
    Epoch Time: 1515409093.195345000 seconds
    [Time delta from previous captured frame: 0.000069000 seconds]
    [Time delta from previous displayed frame: 0.000069000 seconds]
    [Time since reference or first frame: 7.909701000 seconds]
    Frame Number: 57
    Frame Length: 64 bytes (512 bits)
    Capture Length: 64 bytes (512 bits)
    [Frame is marked: False]
    [Frame is ignored: False]
    [Protocols in frame: usb]
USB URB
    [Source: host]
    [Destination: 1.47.1]
    URB id: 0xffff8d9f64b4af00
    URB type: URB_SUBMIT ('S')
    URB transfer type: URB_INTERRUPT (0x01)
    Endpoint: 0x81, Direction: IN
        1... .... = Direction: IN (1)
        .... 0001 = Endpoint number: 1
    Device: 47
    URB bus id: 1
    Device setup request: not relevant ('-')
    Data: not present ('<')
    URB sec: 1515409093
    URB usec: 195345
    URB status: Operation now in progress (-EINPROGRESS) (-115)
    URB length [bytes]: 8
    Data length [bytes]: 0
    [Response in: 58]
    [bInterfaceClass: HID (0x03)]
    Unused Setup Header
    Interval: 8
    Start frame: 0
    Copy of Transfer Flags: 0x00000204
    Number of ISO descriptors: 0

0000  00 af b4 64 9f 8d ff ff 53 01 81 2f 01 00 2d 3c   ...d....S../..-<
0010  c5 4e 53 5a 00 00 00 00 11 fb 02 00 8d ff ff ff   .NSZ............
0020  08 00 00 00 00 00 00 00 00 00 00 00 00 00 00 00   ................
0030  08 00 00 00 00 00 00 00 04 02 00 00 00 00 00 00   ................

No.     Time           Source                Destination           Protocol Length Info
     58 17.133782      1.47.1                host                  USB      72     URB_INTERRUPT in

Frame 58: 72 bytes on wire (576 bits), 72 bytes captured (576 bits) on interface 0
    Interface id: 0 (usbmon0)
        Interface name: usbmon0
    Encapsulation type: USB packets with Linux header and padding (115)
    Arrival Time: Jan  8, 2018 11:58:22.419426000 CET
    [Time shift for this packet: 0.000000000 seconds]
    Epoch Time: 1515409102.419426000 seconds
    [Time delta from previous captured frame: 9.224081000 seconds]
    [Time delta from previous displayed frame: 9.224081000 seconds]
    [Time since reference or first frame: 17.133782000 seconds]
    Frame Number: 58
    Frame Length: 72 bytes (576 bits)
    Capture Length: 72 bytes (576 bits)
    [Frame is marked: False]
    [Frame is ignored: False]
    [Protocols in frame: usb]
USB URB
    [Source: 1.47.1]
    [Destination: host]
    URB id: 0xffff8d9f64b4af00
    URB type: URB_COMPLETE ('C')
    URB transfer type: URB_INTERRUPT (0x01)
    Endpoint: 0x81, Direction: IN
        1... .... = Direction: IN (1)
        .... 0001 = Endpoint number: 1
    Device: 47
    URB bus id: 1
    Device setup request: not relevant ('-')
    Data: present (0)
    URB sec: 1515409102
    URB usec: 419426
    URB status: Success (0)
    URB length [bytes]: 8
    Data length [bytes]: 8
    [Request in: 57]
    [Time from request: 9.224081000 seconds]
    [bInterfaceClass: HID (0x03)]
    Unused Setup Header
    Interval: 8
    Start frame: 0
    Copy of Transfer Flags: 0x00000204
    Number of ISO descriptors: 0
Leftover Capture Data: 0100000000000000

0000  00 af b4 64 9f 8d ff ff 43 01 81 2f 01 00 2d 00   ...d....C../..-.
0010  ce 4e 53 5a 00 00 00 00 62 66 06 00 00 00 00 00   .NSZ....bf......
0020  08 00 00 00 08 00 00 00 00 00 00 00 00 00 00 00   ................
0030  08 00 00 00 00 00 00 00 04 02 00 00 00 00 00 00   ................
0040  01 00 00 00 00 00 00 00                           ........

No.     Time           Source                Destination           Protocol Length Info
     59 17.133886      host                  1.47.1                USB      64     URB_INTERRUPT in

Frame 59: 64 bytes on wire (512 bits), 64 bytes captured (512 bits) on interface 0
    Interface id: 0 (usbmon0)
        Interface name: usbmon0
    Encapsulation type: USB packets with Linux header and padding (115)
    Arrival Time: Jan  8, 2018 11:58:22.419530000 CET
    [Time shift for this packet: 0.000000000 seconds]
    Epoch Time: 1515409102.419530000 seconds
    [Time delta from previous captured frame: 0.000104000 seconds]
    [Time delta from previous displayed frame: 0.000104000 seconds]
    [Time since reference or first frame: 17.133886000 seconds]
    Frame Number: 59
    Frame Length: 64 bytes (512 bits)
    Capture Length: 64 bytes (512 bits)
    [Frame is marked: False]
    [Frame is ignored: False]
    [Protocols in frame: usb]
USB URB
    [Source: host]
    [Destination: 1.47.1]
    URB id: 0xffff8d9f64b4af00
    URB type: URB_SUBMIT ('S')
    URB transfer type: URB_INTERRUPT (0x01)
    Endpoint: 0x81, Direction: IN
        1... .... = Direction: IN (1)
        .... 0001 = Endpoint number: 1
    Device: 47
    URB bus id: 1
    Device setup request: not relevant ('-')
    Data: not present ('<')
    URB sec: 1515409102
    URB usec: 419530
    URB status: Operation now in progress (-EINPROGRESS) (-115)
    URB length [bytes]: 8
    Data length [bytes]: 0
    [Response in: 60]
    [bInterfaceClass: HID (0x03)]
    Unused Setup Header
    Interval: 8
    Start frame: 0
    Copy of Transfer Flags: 0x00000204
    Number of ISO descriptors: 0

0000  00 af b4 64 9f 8d ff ff 53 01 81 2f 01 00 2d 3c   ...d....S../..-<
0010  ce 4e 53 5a 00 00 00 00 ca 66 06 00 8d ff ff ff   .NSZ.....f......
0020  08 00 00 00 00 00 00 00 00 00 00 00 00 00 00 00   ................
0030  08 00 00 00 00 00 00 00 04 02 00 00 00 00 00 00   ................

No.     Time           Source                Destination           Protocol Length Info
     60 17.621781      1.47.1                host                  USB      72     URB_INTERRUPT in

Frame 60: 72 bytes on wire (576 bits), 72 bytes captured (576 bits) on interface 0
    Interface id: 0 (usbmon0)
        Interface name: usbmon0
    Encapsulation type: USB packets with Linux header and padding (115)
    Arrival Time: Jan  8, 2018 11:58:22.907425000 CET
    [Time shift for this packet: 0.000000000 seconds]
    Epoch Time: 1515409102.907425000 seconds
    [Time delta from previous captured frame: 0.487895000 seconds]
    [Time delta from previous displayed frame: 0.487895000 seconds]
    [Time since reference or first frame: 17.621781000 seconds]
    Frame Number: 60
    Frame Length: 72 bytes (576 bits)
    Capture Length: 72 bytes (576 bits)
    [Frame is marked: False]
    [Frame is ignored: False]
    [Protocols in frame: usb]
USB URB
    [Source: 1.47.1]
    [Destination: host]
    URB id: 0xffff8d9f64b4af00
    URB type: URB_COMPLETE ('C')
    URB transfer type: URB_INTERRUPT (0x01)
    Endpoint: 0x81, Direction: IN
        1... .... = Direction: IN (1)
        .... 0001 = Endpoint number: 1
    Device: 47
    URB bus id: 1
    Device setup request: not relevant ('-')
    Data: present (0)
    URB sec: 1515409102
    URB usec: 907425
    URB status: Success (0)
    URB length [bytes]: 8
    Data length [bytes]: 8
    [Request in: 59]
    [Time from request: 0.487895000 seconds]
    [bInterfaceClass: HID (0x03)]
    Unused Setup Header
    Interval: 8
    Start frame: 0
    Copy of Transfer Flags: 0x00000204
    Number of ISO descriptors: 0
Leftover Capture Data: 0000000000000000

0000  00 af b4 64 9f 8d ff ff 43 01 81 2f 01 00 2d 00   ...d....C../..-.
0010  ce 4e 53 5a 00 00 00 00 a1 d8 0d 00 00 00 00 00   .NSZ............
0020  08 00 00 00 08 00 00 00 00 00 00 00 00 00 00 00   ................
0030  08 00 00 00 00 00 00 00 04 02 00 00 00 00 00 00   ................
0040  00 00 00 00 00 00 00 00                           ........

No.     Time           Source                Destination           Protocol Length Info
     61 17.621881      host                  1.47.1                USB      64     URB_INTERRUPT in

Frame 61: 64 bytes on wire (512 bits), 64 bytes captured (512 bits) on interface 0
    Interface id: 0 (usbmon0)
        Interface name: usbmon0
    Encapsulation type: USB packets with Linux header and padding (115)
    Arrival Time: Jan  8, 2018 11:58:22.907525000 CET
    [Time shift for this packet: 0.000000000 seconds]
    Epoch Time: 1515409102.907525000 seconds
    [Time delta from previous captured frame: 0.000100000 seconds]
    [Time delta from previous displayed frame: 0.000100000 seconds]
    [Time since reference or first frame: 17.621881000 seconds]
    Frame Number: 61
    Frame Length: 64 bytes (512 bits)
    Capture Length: 64 bytes (512 bits)
    [Frame is marked: False]
    [Frame is ignored: False]
    [Protocols in frame: usb]
USB URB
    [Source: host]
    [Destination: 1.47.1]
    URB id: 0xffff8d9f64b4af00
    URB type: URB_SUBMIT ('S')
    URB transfer type: URB_INTERRUPT (0x01)
    Endpoint: 0x81, Direction: IN
        1... .... = Direction: IN (1)
        .... 0001 = Endpoint number: 1
    Device: 47
    URB bus id: 1
    Device setup request: not relevant ('-')
    Data: not present ('<')
    URB sec: 1515409102
    URB usec: 907525
    URB status: Operation now in progress (-EINPROGRESS) (-115)
    URB length [bytes]: 8
    Data length [bytes]: 0
    [bInterfaceClass: HID (0x03)]
    Unused Setup Header
    Interval: 8
    Start frame: 0
    Copy of Transfer Flags: 0x00000204
    Number of ISO descriptors: 0

0000  00 af b4 64 9f 8d ff ff 53 01 81 2f 01 00 2d 3c   ...d....S../..-<
0010  ce 4e 53 5a 00 00 00 00 05 d9 0d 00 8d ff ff ff   .NSZ............
0020  08 00 00 00 00 00 00 00 00 00 00 00 00 00 00 00   ................
0030  08 00 00 00 00 00 00 00 04 02 00 00 00 00 00 00   ................
