      1 0.000000       1.1.1                 host                  USB      66     URB_INTERRUPT in

Frame 1: 66 bytes on wire (528 bits), 66 bytes captured (528 bits) on interface 0
USB URB
    [Source: 1.1.1]
    [Destination: host]
    URB id: 0xffff8da1604bc600
    URB type: URB_COMPLETE ('C')
    URB transfer type: URB_INTERRUPT (0x01)
    Endpoint: 0x81, Direction: IN
        1... .... = Direction: IN (1)
        .... 0001 = Endpoint number: 1
    Device: 1
    URB bus id: 1
    Device setup request: not relevant ('-')
    Data: present (0)
    URB sec: 1515423774
    URB usec: 347423
    URB status: Success (0)
    URB length [bytes]: 2
    Data length [bytes]: 2
    [bInterfaceClass: Unknown (0xffff)]
    Unused Setup Header
    Interval: 2048
    Start frame: 0
    Copy of Transfer Flags: 0x00000200
    Number of ISO descriptors: 0
Leftover Capture Data: 1000

      2 0.000041       host                  1.1.1                 USB      64     URB_INTERRUPT in

Frame 2: 64 bytes on wire (512 bits), 64 bytes captured (512 bits) on interface 0
USB URB
    [Source: host]
    [Destination: 1.1.1]
    URB id: 0xffff8da1604bc600
    URB type: URB_SUBMIT ('S')
    URB transfer type: URB_INTERRUPT (0x01)
    Endpoint: 0x81, Direction: IN
        1... .... = Direction: IN (1)
        .... 0001 = Endpoint number: 1
    Device: 1
    URB bus id: 1
    Device setup request: not relevant ('-')
    Data: not present ('<')
    URB sec: 1515423774
    URB usec: 347464
    URB status: Operation now in progress (-EINPROGRESS) (-115)
    URB length [bytes]: 4
    Data length [bytes]: 0
    [Response in: 69]
    [bInterfaceClass: Unknown (0xffff)]
    Unused Setup Header
    Interval: 2048
    Start frame: 0
    Copy of Transfer Flags: 0x00000200
    Number of ISO descriptors: 0

      3 0.000168       host                  1.1.0                 USBHUB   64     GET_STATUS Request     [Port 4]

Frame 3: 64 bytes on wire (512 bits), 64 bytes captured (512 bits) on interface 0
USB URB
    [Source: host]
    [Destination: 1.1.0]
    URB id: 0xffff8da015e4e0c0
    URB type: URB_SUBMIT ('S')
    URB transfer type: URB_CONTROL (0x02)
    Endpoint: 0x80, Direction: IN
        1... .... = Direction: IN (1)
        .... 0000 = Endpoint number: 0
    Device: 1
    URB bus id: 1
    Device setup request: relevant (0)
    Data: not present ('<')
    URB sec: 1515423774
    URB usec: 347591
    URB status: Operation now in progress (-EINPROGRESS) (-115)
    URB length [bytes]: 4
    Data length [bytes]: 0
    [Response in: 4]
    Interval: 0
    Start frame: 0
    Copy of Transfer Flags: 0x00000200
    Number of ISO descriptors: 0
    [bInterfaceClass: Unknown (0xffff)]
URB setup
    bmRequestType: 0xa3
bRequest: GET_STATUS (0x00)
wValue: 0x0000
wIndex: 4
wLength: 4

      4 0.000203       1.1.0                 host                  USBHUB   68     GET_STATUS Response    [Port 4]

Frame 4: 68 bytes on wire (544 bits), 68 bytes captured (544 bits) on interface 0
USB URB
    [Source: 1.1.0]
    [Destination: host]
    URB id: 0xffff8da015e4e0c0
    URB type: URB_COMPLETE ('C')
    URB transfer type: URB_CONTROL (0x02)
    Endpoint: 0x80, Direction: IN
        1... .... = Direction: IN (1)
        .... 0000 = Endpoint number: 0
    Device: 1
    URB bus id: 1
    Device setup request: not relevant ('-')
    Data: present (0)
    URB sec: 1515423774
    URB usec: 347626
    URB status: Success (0)
    URB length [bytes]: 4
    Data length [bytes]: 4
    [Request in: 3]
    [Time from request: 0.000035000 seconds]
    Unused Setup Header
    Interval: 0
    Start frame: 0
    Copy of Transfer Flags: 0x00000200
    Number of ISO descriptors: 0
    [bInterfaceClass: Unknown (0xffff)]
Port Status: 0x0101, PORT_CONNECTION, PORT_POWER
    .... .... .... ...1 = PORT_CONNECTION: True
    .... .... .... ..0. = PORT_ENABLE: False
    .... .... .... .0.. = PORT_SUSPEND: False
    .... .... .... 0... = PORT_OVER_CURRENT: False
    .... .... ...0 .... = PORT_RESET: False
    .... ...1 .... .... = PORT_POWER: True
    .... ..0. .... .... = PORT_LOW_SPEED: False
    .... .0.. .... .... = PORT_HIGH_SPEED: False
    .... 0... .... .... = PORT_TEST: False
    ...0 .... .... .... = PORT_INDICATOR: Default colors
Port Change: 0x0001, C_PORT_CONNECTION

      5 0.000216       host                  1.1.0                 USBHUB   64     CLEAR_FEATURE Request  [Port 4: C_PORT_CONNECTION]

Frame 5: 64 bytes on wire (512 bits), 64 bytes captured (512 bits) on interface 0
USB URB
    [Source: host]
    [Destination: 1.1.0]
    URB id: 0xffff8da015e4e0c0
    URB type: URB_SUBMIT ('S')
    URB transfer type: URB_CONTROL (0x02)
    Endpoint: 0x00, Direction: OUT
        0... .... = Direction: OUT (0)
        .... 0000 = Endpoint number: 0
    Device: 1
    URB bus id: 1
    Device setup request: relevant (0)
    Data: present (0)
    URB sec: 1515423774
    URB usec: 347639
    URB status: Operation now in progress (-EINPROGRESS) (-115)
    URB length [bytes]: 0
    Data length [bytes]: 0
    [Response in: 6]
    Interval: 0
    Start frame: 0
    Copy of Transfer Flags: 0x00000000
    Number of ISO descriptors: 0
    [bInterfaceClass: Unknown (0xffff)]
URB setup
    bmRequestType: 0x23
bRequest: CLEAR_FEATURE (0x01)
wValue: 0x0010
wIndex: 4
wLength: 0

      6 0.000227       1.1.0                 host                  USBHUB   64     CLEAR_FEATURE Response [Port 4: C_PORT_CONNECTION]

Frame 6: 64 bytes on wire (512 bits), 64 bytes captured (512 bits) on interface 0
USB URB
    [Source: 1.1.0]
    [Destination: host]
    URB id: 0xffff8da015e4e0c0
    URB type: URB_COMPLETE ('C')
    URB transfer type: URB_CONTROL (0x02)
    Endpoint: 0x00, Direction: OUT
        0... .... = Direction: OUT (0)
        .... 0000 = Endpoint number: 0
    Device: 1
    URB bus id: 1
    Device setup request: not relevant ('-')
    Data: not present ('>')
    URB sec: 1515423774
    URB usec: 347650
    URB status: Success (0)
    URB length [bytes]: 0
    Data length [bytes]: 0
    [Request in: 5]
    [Time from request: 0.000011000 seconds]
    Unused Setup Header
    Interval: 0
    Start frame: 0
    Copy of Transfer Flags: 0x00000000
    Number of ISO descriptors: 0
    [bInterfaceClass: Unknown (0xffff)]

      7 0.000237       host                  1.1.0                 USBHUB   64     GET_STATUS Request     [Port 4]

Frame 7: 64 bytes on wire (512 bits), 64 bytes captured (512 bits) on interface 0
USB URB
    [Source: host]
    [Destination: 1.1.0]
    URB id: 0xffff8da015e4e0c0
    URB type: URB_SUBMIT ('S')
    URB transfer type: URB_CONTROL (0x02)
    Endpoint: 0x80, Direction: IN
        1... .... = Direction: IN (1)
        .... 0000 = Endpoint number: 0
    Device: 1
    URB bus id: 1
    Device setup request: relevant (0)
    Data: not present ('<')
    URB sec: 1515423774
    URB usec: 347660
    URB status: Operation now in progress (-EINPROGRESS) (-115)
    URB length [bytes]: 4
    Data length [bytes]: 0
    [Response in: 8]
    Interval: 0
    Start frame: 0
    Copy of Transfer Flags: 0x00000200
    Number of ISO descriptors: 0
    [bInterfaceClass: Unknown (0xffff)]
URB setup
    bmRequestType: 0xa3
bRequest: GET_STATUS (0x00)
wValue: 0x0000
wIndex: 4
wLength: 4

      8 0.000245       1.1.0                 host                  USBHUB   68     GET_STATUS Response    [Port 4]

Frame 8: 68 bytes on wire (544 bits), 68 bytes captured (544 bits) on interface 0
USB URB
    [Source: 1.1.0]
    [Destination: host]
    URB id: 0xffff8da015e4e0c0
    URB type: URB_COMPLETE ('C')
    URB transfer type: URB_CONTROL (0x02)
    Endpoint: 0x80, Direction: IN
        1... .... = Direction: IN (1)
        .... 0000 = Endpoint number: 0
    Device: 1
    URB bus id: 1
    Device setup request: not relevant ('-')
    Data: present (0)
    URB sec: 1515423774
    URB usec: 347668
    URB status: Success (0)
    URB length [bytes]: 4
    Data length [bytes]: 4
    [Request in: 7]
    [Time from request: 0.000008000 seconds]
    Unused Setup Header
    Interval: 0
    Start frame: 0
    Copy of Transfer Flags: 0x00000200
    Number of ISO descriptors: 0
    [bInterfaceClass: Unknown (0xffff)]
Port Status: 0x0101, PORT_CONNECTION, PORT_POWER
    .... .... .... ...1 = PORT_CONNECTION: True
    .... .... .... ..0. = PORT_ENABLE: False
    .... .... .... .0.. = PORT_SUSPEND: False
    .... .... .... 0... = PORT_OVER_CURRENT: False
    .... .... ...0 .... = PORT_RESET: False
    .... ...1 .... .... = PORT_POWER: True
    .... ..0. .... .... = PORT_LOW_SPEED: False
    .... .0.. .... .... = PORT_HIGH_SPEED: False
    .... 0... .... .... = PORT_TEST: False
    ...0 .... .... .... = PORT_INDICATOR: Default colors
Port Change: 0x0000

      9 0.026725       host                  1.1.0                 USBHUB   64     GET_STATUS Request     [Port 4]

Frame 9: 64 bytes on wire (512 bits), 64 bytes captured (512 bits) on interface 0
USB URB
    [Source: host]
    [Destination: 1.1.0]
    URB id: 0xffff8da015e4e0c0
    URB type: URB_SUBMIT ('S')
    URB transfer type: URB_CONTROL (0x02)
    Endpoint: 0x80, Direction: IN
        1... .... = Direction: IN (1)
        .... 0000 = Endpoint number: 0
    Device: 1
    URB bus id: 1
    Device setup request: relevant (0)
    Data: not present ('<')
    URB sec: 1515423774
    URB usec: 374148
    URB status: Operation now in progress (-EINPROGRESS) (-115)
    URB length [bytes]: 4
    Data length [bytes]: 0
    [Response in: 10]
    Interval: 0
    Start frame: 0
    Copy of Transfer Flags: 0x00000200
    Number of ISO descriptors: 0
    [bInterfaceClass: Unknown (0xffff)]
URB setup
    bmRequestType: 0xa3
bRequest: GET_STATUS (0x00)
wValue: 0x0000
wIndex: 4
wLength: 4

     10 0.026761       1.1.0                 host                  USBHUB   68     GET_STATUS Response    [Port 4]

Frame 10: 68 bytes on wire (544 bits), 68 bytes captured (544 bits) on interface 0
USB URB
    [Source: 1.1.0]
    [Destination: host]
    URB id: 0xffff8da015e4e0c0
    URB type: URB_COMPLETE ('C')
    URB transfer type: URB_CONTROL (0x02)
    Endpoint: 0x80, Direction: IN
        1... .... = Direction: IN (1)
        .... 0000 = Endpoint number: 0
    Device: 1
    URB bus id: 1
    Device setup request: not relevant ('-')
    Data: present (0)
    URB sec: 1515423774
    URB usec: 374184
    URB status: Success (0)
    URB length [bytes]: 4
    Data length [bytes]: 4
    [Request in: 9]
    [Time from request: 0.000036000 seconds]
    Unused Setup Header
    Interval: 0
    Start frame: 0
    Copy of Transfer Flags: 0x00000200
    Number of ISO descriptors: 0
    [bInterfaceClass: Unknown (0xffff)]
Port Status: 0x0101, PORT_CONNECTION, PORT_POWER
    .... .... .... ...1 = PORT_CONNECTION: True
    .... .... .... ..0. = PORT_ENABLE: False
    .... .... .... .0.. = PORT_SUSPEND: False
    .... .... .... 0... = PORT_OVER_CURRENT: False
    .... .... ...0 .... = PORT_RESET: False
    .... ...1 .... .... = PORT_POWER: True
    .... ..0. .... .... = PORT_LOW_SPEED: False
    .... .0.. .... .... = PORT_HIGH_SPEED: False
    .... 0... .... .... = PORT_TEST: False
    ...0 .... .... .... = PORT_INDICATOR: Default colors
Port Change: 0x0000

     11 0.053572       host                  1.1.0                 USBHUB   64     GET_STATUS Request     [Port 4]

Frame 11: 64 bytes on wire (512 bits), 64 bytes captured (512 bits) on interface 0
USB URB
    [Source: host]
    [Destination: 1.1.0]
    URB id: 0xffff8da015e4e0c0
    URB type: URB_SUBMIT ('S')
    URB transfer type: URB_CONTROL (0x02)
    Endpoint: 0x80, Direction: IN
        1... .... = Direction: IN (1)
        .... 0000 = Endpoint number: 0
    Device: 1
    URB bus id: 1
    Device setup request: relevant (0)
    Data: not present ('<')
    URB sec: 1515423774
    URB usec: 400995
    URB status: Operation now in progress (-EINPROGRESS) (-115)
    URB length [bytes]: 4
    Data length [bytes]: 0
    [Response in: 12]
    Interval: 0
    Start frame: 0
    Copy of Transfer Flags: 0x00000200
    Number of ISO descriptors: 0
    [bInterfaceClass: Unknown (0xffff)]
URB setup
    bmRequestType: 0xa3
bRequest: GET_STATUS (0x00)
wValue: 0x0000
wIndex: 4
wLength: 4

     12 0.053611       1.1.0                 host                  USBHUB   68     GET_STATUS Response    [Port 4]

Frame 12: 68 bytes on wire (544 bits), 68 bytes captured (544 bits) on interface 0
USB URB
    [Source: 1.1.0]
    [Destination: host]
    URB id: 0xffff8da015e4e0c0
    URB type: URB_COMPLETE ('C')
    URB transfer type: URB_CONTROL (0x02)
    Endpoint: 0x80, Direction: IN
        1... .... = Direction: IN (1)
        .... 0000 = Endpoint number: 0
    Device: 1
    URB bus id: 1
    Device setup request: not relevant ('-')
    Data: present (0)
    URB sec: 1515423774
    URB usec: 401034
    URB status: Success (0)
    URB length [bytes]: 4
    Data length [bytes]: 4
    [Request in: 11]
    [Time from request: 0.000039000 seconds]
    Unused Setup Header
    Interval: 0
    Start frame: 0
    Copy of Transfer Flags: 0x00000200
    Number of ISO descriptors: 0
    [bInterfaceClass: Unknown (0xffff)]
Port Status: 0x0101, PORT_CONNECTION, PORT_POWER
    .... .... .... ...1 = PORT_CONNECTION: True
    .... .... .... ..0. = PORT_ENABLE: False
    .... .... .... .0.. = PORT_SUSPEND: False
    .... .... .... 0... = PORT_OVER_CURRENT: False
    .... .... ...0 .... = PORT_RESET: False
    .... ...1 .... .... = PORT_POWER: True
    .... ..0. .... .... = PORT_LOW_SPEED: False
    .... .0.. .... .... = PORT_HIGH_SPEED: False
    .... 0... .... .... = PORT_TEST: False
    ...0 .... .... .... = PORT_INDICATOR: Default colors
Port Change: 0x0000

     13 0.080616       host                  1.1.0                 USBHUB   64     GET_STATUS Request     [Port 4]

Frame 13: 64 bytes on wire (512 bits), 64 bytes captured (512 bits) on interface 0
USB URB
    [Source: host]
    [Destination: 1.1.0]
    URB id: 0xffff8da015e4e0c0
    URB type: URB_SUBMIT ('S')
    URB transfer type: URB_CONTROL (0x02)
    Endpoint: 0x80, Direction: IN
        1... .... = Direction: IN (1)
        .... 0000 = Endpoint number: 0
    Device: 1
    URB bus id: 1
    Device setup request: relevant (0)
    Data: not present ('<')
    URB sec: 1515423774
    URB usec: 428039
    URB status: Operation now in progress (-EINPROGRESS) (-115)
    URB length [bytes]: 4
    Data length [bytes]: 0
    [Response in: 14]
    Interval: 0
    Start frame: 0
    Copy of Transfer Flags: 0x00000200
    Number of ISO descriptors: 0
    [bInterfaceClass: Unknown (0xffff)]
URB setup
    bmRequestType: 0xa3
bRequest: GET_STATUS (0x00)
wValue: 0x0000
wIndex: 4
wLength: 4

     14 0.080655       1.1.0                 host                  USBHUB   68     GET_STATUS Response    [Port 4]

Frame 14: 68 bytes on wire (544 bits), 68 bytes captured (544 bits) on interface 0
USB URB
    [Source: 1.1.0]
    [Destination: host]
    URB id: 0xffff8da015e4e0c0
    URB type: URB_COMPLETE ('C')
    URB transfer type: URB_CONTROL (0x02)
    Endpoint: 0x80, Direction: IN
        1... .... = Direction: IN (1)
        .... 0000 = Endpoint number: 0
    Device: 1
    URB bus id: 1
    Device setup request: not relevant ('-')
    Data: present (0)
    URB sec: 1515423774
    URB usec: 428078
    URB status: Success (0)
    URB length [bytes]: 4
    Data length [bytes]: 4
    [Request in: 13]
    [Time from request: 0.000039000 seconds]
    Unused Setup Header
    Interval: 0
    Start frame: 0
    Copy of Transfer Flags: 0x00000200
    Number of ISO descriptors: 0
    [bInterfaceClass: Unknown (0xffff)]
Port Status: 0x0101, PORT_CONNECTION, PORT_POWER
    .... .... .... ...1 = PORT_CONNECTION: True
    .... .... .... ..0. = PORT_ENABLE: False
    .... .... .... .0.. = PORT_SUSPEND: False
    .... .... .... 0... = PORT_OVER_CURRENT: False
    .... .... ...0 .... = PORT_RESET: False
    .... ...1 .... .... = PORT_POWER: True
    .... ..0. .... .... = PORT_LOW_SPEED: False
    .... .0.. .... .... = PORT_HIGH_SPEED: False
    .... 0... .... .... = PORT_TEST: False
    ...0 .... .... .... = PORT_INDICATOR: Default colors
Port Change: 0x0000

     15 0.107607       host                  1.1.0                 USBHUB   64     GET_STATUS Request     [Port 4]

Frame 15: 64 bytes on wire (512 bits), 64 bytes captured (512 bits) on interface 0
USB URB
    [Source: host]
    [Destination: 1.1.0]
    URB id: 0xffff8da015e4e0c0
    URB type: URB_SUBMIT ('S')
    URB transfer type: URB_CONTROL (0x02)
    Endpoint: 0x80, Direction: IN
        1... .... = Direction: IN (1)
        .... 0000 = Endpoint number: 0
    Device: 1
    URB bus id: 1
    Device setup request: relevant (0)
    Data: not present ('<')
    URB sec: 1515423774
    URB usec: 455030
    URB status: Operation now in progress (-EINPROGRESS) (-115)
    URB length [bytes]: 4
    Data length [bytes]: 0
    [Response in: 16]
    Interval: 0
    Start frame: 0
    Copy of Transfer Flags: 0x00000200
    Number of ISO descriptors: 0
    [bInterfaceClass: Unknown (0xffff)]
URB setup
    bmRequestType: 0xa3
bRequest: GET_STATUS (0x00)
wValue: 0x0000
wIndex: 4
wLength: 4

     16 0.107644       1.1.0                 host                  USBHUB   68     GET_STATUS Response    [Port 4]

Frame 16: 68 bytes on wire (544 bits), 68 bytes captured (544 bits) on interface 0
USB URB
    [Source: 1.1.0]
    [Destination: host]
    URB id: 0xffff8da015e4e0c0
    URB type: URB_COMPLETE ('C')
    URB transfer type: URB_CONTROL (0x02)
    Endpoint: 0x80, Direction: IN
        1... .... = Direction: IN (1)
        .... 0000 = Endpoint number: 0
    Device: 1
    URB bus id: 1
    Device setup request: not relevant ('-')
    Data: present (0)
    URB sec: 1515423774
    URB usec: 455067
    URB status: Success (0)
    URB length [bytes]: 4
    Data length [bytes]: 4
    [Request in: 15]
    [Time from request: 0.000037000 seconds]
    Unused Setup Header
    Interval: 0
    Start frame: 0
    Copy of Transfer Flags: 0x00000200
    Number of ISO descriptors: 0
    [bInterfaceClass: Unknown (0xffff)]
Port Status: 0x0101, PORT_CONNECTION, PORT_POWER
    .... .... .... ...1 = PORT_CONNECTION: True
    .... .... .... ..0. = PORT_ENABLE: False
    .... .... .... .0.. = PORT_SUSPEND: False
    .... .... .... 0... = PORT_OVER_CURRENT: False
    .... .... ...0 .... = PORT_RESET: False
    .... ...1 .... .... = PORT_POWER: True
    .... ..0. .... .... = PORT_LOW_SPEED: False
    .... .0.. .... .... = PORT_HIGH_SPEED: False
    .... 0... .... .... = PORT_TEST: False
    ...0 .... .... .... = PORT_INDICATOR: Default colors
Port Change: 0x0000

     17 0.107744       host                  1.1.0                 USBHUB   64     SET_FEATURE Request    [Port 4: PORT_RESET]

Frame 17: 64 bytes on wire (512 bits), 64 bytes captured (512 bits) on interface 0
USB URB
    [Source: host]
    [Destination: 1.1.0]
    URB id: 0xffff8da015e4e0c0
    URB type: URB_SUBMIT ('S')
    URB transfer type: URB_CONTROL (0x02)
    Endpoint: 0x00, Direction: OUT
        0... .... = Direction: OUT (0)
        .... 0000 = Endpoint number: 0
    Device: 1
    URB bus id: 1
    Device setup request: relevant (0)
    Data: present (0)
    URB sec: 1515423774
    URB usec: 455167
    URB status: Operation now in progress (-EINPROGRESS) (-115)
    URB length [bytes]: 0
    Data length [bytes]: 0
    [Response in: 18]
    Interval: 0
    Start frame: 0
    Copy of Transfer Flags: 0x00000000
    Number of ISO descriptors: 0
    [bInterfaceClass: Unknown (0xffff)]
URB setup
    bmRequestType: 0x23
bRequest: SET_FEATURE (0x03)
wValue: 0x0004
wIndex: 4
wLength: 0

     18 0.107763       1.1.0                 host                  USBHUB   64     SET_FEATURE Response   [Port 4: PORT_RESET]

Frame 18: 64 bytes on wire (512 bits), 64 bytes captured (512 bits) on interface 0
USB URB
    [Source: 1.1.0]
    [Destination: host]
    URB id: 0xffff8da015e4e0c0
    URB type: URB_COMPLETE ('C')
    URB transfer type: URB_CONTROL (0x02)
    Endpoint: 0x00, Direction: OUT
        0... .... = Direction: OUT (0)
        .... 0000 = Endpoint number: 0
    Device: 1
    URB bus id: 1
    Device setup request: not relevant ('-')
    Data: not present ('>')
    URB sec: 1515423774
    URB usec: 455186
    URB status: Success (0)
    URB length [bytes]: 0
    Data length [bytes]: 0
    [Request in: 17]
    [Time from request: 0.000019000 seconds]
    Unused Setup Header
    Interval: 0
    Start frame: 0
    Copy of Transfer Flags: 0x00000000
    Number of ISO descriptors: 0
    [bInterfaceClass: Unknown (0xffff)]

     19 0.169563       host                  1.1.0                 USBHUB   64     GET_STATUS Request     [Port 4]

Frame 19: 64 bytes on wire (512 bits), 64 bytes captured (512 bits) on interface 0
USB URB
    [Source: host]
    [Destination: 1.1.0]
    URB id: 0xffff8da015e4e0c0
    URB type: URB_SUBMIT ('S')
    URB transfer type: URB_CONTROL (0x02)
    Endpoint: 0x80, Direction: IN
        1... .... = Direction: IN (1)
        .... 0000 = Endpoint number: 0
    Device: 1
    URB bus id: 1
    Device setup request: relevant (0)
    Data: not present ('<')
    URB sec: 1515423774
    URB usec: 516986
    URB status: Operation now in progress (-EINPROGRESS) (-115)
    URB length [bytes]: 4
    Data length [bytes]: 0
    [Response in: 20]
    Interval: 0
    Start frame: 0
    Copy of Transfer Flags: 0x00000200
    Number of ISO descriptors: 0
    [bInterfaceClass: Unknown (0xffff)]
URB setup
    bmRequestType: 0xa3
bRequest: GET_STATUS (0x00)
wValue: 0x0000
wIndex: 4
wLength: 4

     20 0.169602       1.1.0                 host                  USBHUB   68     GET_STATUS Response    [Port 4]

Frame 20: 68 bytes on wire (544 bits), 68 bytes captured (544 bits) on interface 0
USB URB
    [Source: 1.1.0]
    [Destination: host]
    URB id: 0xffff8da015e4e0c0
    URB type: URB_COMPLETE ('C')
    URB transfer type: URB_CONTROL (0x02)
    Endpoint: 0x80, Direction: IN
        1... .... = Direction: IN (1)
        .... 0000 = Endpoint number: 0
    Device: 1
    URB bus id: 1
    Device setup request: not relevant ('-')
    Data: present (0)
    URB sec: 1515423774
    URB usec: 517025
    URB status: Success (0)
    URB length [bytes]: 4
    Data length [bytes]: 4
    [Request in: 19]
    [Time from request: 0.000039000 seconds]
    Unused Setup Header
    Interval: 0
    Start frame: 0
    Copy of Transfer Flags: 0x00000200
    Number of ISO descriptors: 0
    [bInterfaceClass: Unknown (0xffff)]
Port Status: 0x0103, PORT_CONNECTION, PORT_ENABLE, PORT_POWER
    .... .... .... ...1 = PORT_CONNECTION: True
    .... .... .... ..1. = PORT_ENABLE: True
    .... .... .... .0.. = PORT_SUSPEND: False
    .... .... .... 0... = PORT_OVER_CURRENT: False
    .... .... ...0 .... = PORT_RESET: False
    .... ...1 .... .... = PORT_POWER: True
    .... ..0. .... .... = PORT_LOW_SPEED: False
    .... .0.. .... .... = PORT_HIGH_SPEED: False
    .... 0... .... .... = PORT_TEST: False
    ...0 .... .... .... = PORT_INDICATOR: Default colors
Port Change: 0x0010, C_PORT_RESET

     21 0.169624       host                  1.1.0                 USBHUB   64     CLEAR_FEATURE Request  [Port 4: C_PORT_RESET]

Frame 21: 64 bytes on wire (512 bits), 64 bytes captured (512 bits) on interface 0
USB URB
    [Source: host]
    [Destination: 1.1.0]
    URB id: 0xffff8da015e4e0c0
    URB type: URB_SUBMIT ('S')
    URB transfer type: URB_CONTROL (0x02)
    Endpoint: 0x00, Direction: OUT
        0... .... = Direction: OUT (0)
        .... 0000 = Endpoint number: 0
    Device: 1
    URB bus id: 1
    Device setup request: relevant (0)
    Data: present (0)
    URB sec: 1515423774
    URB usec: 517047
    URB status: Operation now in progress (-EINPROGRESS) (-115)
    URB length [bytes]: 0
    Data length [bytes]: 0
    [Response in: 22]
    Interval: 0
    Start frame: 0
    Copy of Transfer Flags: 0x00000000
    Number of ISO descriptors: 0
    [bInterfaceClass: Unknown (0xffff)]
URB setup
    bmRequestType: 0x23
bRequest: CLEAR_FEATURE (0x01)
wValue: 0x0014
wIndex: 4
wLength: 0

     22 0.169636       1.1.0                 host                  USBHUB   64     CLEAR_FEATURE Response [Port 4: C_PORT_RESET]

Frame 22: 64 bytes on wire (512 bits), 64 bytes captured (512 bits) on interface 0
USB URB
    [Source: 1.1.0]
    [Destination: host]
    URB id: 0xffff8da015e4e0c0
    URB type: URB_COMPLETE ('C')
    URB transfer type: URB_CONTROL (0x02)
    Endpoint: 0x00, Direction: OUT
        0... .... = Direction: OUT (0)
        .... 0000 = Endpoint number: 0
    Device: 1
    URB bus id: 1
    Device setup request: not relevant ('-')
    Data: not present ('>')
    URB sec: 1515423774
    URB usec: 517059
    URB status: Success (0)
    URB length [bytes]: 0
    Data length [bytes]: 0
    [Request in: 21]
    [Time from request: 0.000012000 seconds]
    Unused Setup Header
    Interval: 0
    Start frame: 0
    Copy of Transfer Flags: 0x00000000
    Number of ISO descriptors: 0
    [bInterfaceClass: Unknown (0xffff)]

     23 0.221671       host                  1.0.0                 USB      64     GET DESCRIPTOR Request DEVICE

Frame 23: 64 bytes on wire (512 bits), 64 bytes captured (512 bits) on interface 0
USB URB
    [Source: host]
    [Destination: 1.0.0]
    URB id: 0xffff8da015e4e0c0
    URB type: URB_SUBMIT ('S')
    URB transfer type: URB_CONTROL (0x02)
    Endpoint: 0x80, Direction: IN
        1... .... = Direction: IN (1)
        .... 0000 = Endpoint number: 0
    Device: 0
    URB bus id: 1
    Device setup request: relevant (0)
    Data: not present ('<')
    URB sec: 1515423774
    URB usec: 569094
    URB status: Operation now in progress (-EINPROGRESS) (-115)
    URB length [bytes]: 64
    Data length [bytes]: 0
    [Response in: 24]
    Interval: 0
    Start frame: 0
    Copy of Transfer Flags: 0x00000200
    Number of ISO descriptors: 0
URB setup
    bmRequestType: 0x80
    bRequest: GET DESCRIPTOR (6)
    Descriptor Index: 0x00
    bDescriptorType: 0x01
    Language Id: no language specified (0x0000)
    wLength: 64

     24 0.221808       1.0.0                 host                  USB      82     GET DESCRIPTOR Response DEVICE

Frame 24: 82 bytes on wire (656 bits), 82 bytes captured (656 bits) on interface 0
USB URB
    [Source: 1.0.0]
    [Destination: host]
    URB id: 0xffff8da015e4e0c0
    URB type: URB_COMPLETE ('C')
    URB transfer type: URB_CONTROL (0x02)
    Endpoint: 0x80, Direction: IN
        1... .... = Direction: IN (1)
        .... 0000 = Endpoint number: 0
    Device: 0
    URB bus id: 1
    Device setup request: not relevant ('-')
    Data: present (0)
    URB sec: 1515423774
    URB usec: 569231
    URB status: Success (0)
    URB length [bytes]: 18
    Data length [bytes]: 18
    [Request in: 23]
    [Time from request: 0.000137000 seconds]
    Unused Setup Header
    Interval: 0
    Start frame: 0
    Copy of Transfer Flags: 0x00000200
    Number of ISO descriptors: 0
DEVICE DESCRIPTOR
    bLength: 18
    bDescriptorType: 0x01 (DEVICE)
    bcdUSB: 0x0110
    bDeviceClass: Device (0x00)
    bDeviceSubClass: 0
    bDeviceProtocol: 0 (Use class code info from Interface Descriptors)
    bMaxPacketSize0: 8
    idVendor: Dell Computer Corp. (0x413c)
    idProduct: Unknown (0x2107)
    bcdDevice: 0x0178
    iManufacturer: 1
    iProduct: 2
    iSerialNumber: 0
    bNumConfigurations: 1

     25 0.221986       host                  1.1.0                 USBHUB   64     SET_FEATURE Request    [Port 4: PORT_RESET]

Frame 25: 64 bytes on wire (512 bits), 64 bytes captured (512 bits) on interface 0
USB URB
    [Source: host]
    [Destination: 1.1.0]
    URB id: 0xffff8da015e4e0c0
    URB type: URB_SUBMIT ('S')
    URB transfer type: URB_CONTROL (0x02)
    Endpoint: 0x00, Direction: OUT
        0... .... = Direction: OUT (0)
        .... 0000 = Endpoint number: 0
    Device: 1
    URB bus id: 1
    Device setup request: relevant (0)
    Data: present (0)
    URB sec: 1515423774
    URB usec: 569409
    URB status: Operation now in progress (-EINPROGRESS) (-115)
    URB length [bytes]: 0
    Data length [bytes]: 0
    [Response in: 26]
    Interval: 0
    Start frame: 0
    Copy of Transfer Flags: 0x00000000
    Number of ISO descriptors: 0
    [bInterfaceClass: Unknown (0xffff)]
URB setup
    bmRequestType: 0x23
bRequest: SET_FEATURE (0x03)
wValue: 0x0004
wIndex: 4
wLength: 0

     26 0.222013       1.1.0                 host                  USBHUB   64     SET_FEATURE Response   [Port 4: PORT_RESET]

Frame 26: 64 bytes on wire (512 bits), 64 bytes captured (512 bits) on interface 0
USB URB
    [Source: 1.1.0]
    [Destination: host]
    URB id: 0xffff8da015e4e0c0
    URB type: URB_COMPLETE ('C')
    URB transfer type: URB_CONTROL (0x02)
    Endpoint: 0x00, Direction: OUT
        0... .... = Direction: OUT (0)
        .... 0000 = Endpoint number: 0
    Device: 1
    URB bus id: 1
    Device setup request: not relevant ('-')
    Data: not present ('>')
    URB sec: 1515423774
    URB usec: 569436
    URB status: Success (0)
    URB length [bytes]: 0
    Data length [bytes]: 0
    [Request in: 25]
    [Time from request: 0.000027000 seconds]
    Unused Setup Header
    Interval: 0
    Start frame: 0
    Copy of Transfer Flags: 0x00000000
    Number of ISO descriptors: 0
    [bInterfaceClass: Unknown (0xffff)]

     27 0.283514       host                  1.1.0                 USBHUB   64     GET_STATUS Request     [Port 4]

Frame 27: 64 bytes on wire (512 bits), 64 bytes captured (512 bits) on interface 0
USB URB
    [Source: host]
    [Destination: 1.1.0]
    URB id: 0xffff8da015e4e0c0
    URB type: URB_SUBMIT ('S')
    URB transfer type: URB_CONTROL (0x02)
    Endpoint: 0x80, Direction: IN
        1... .... = Direction: IN (1)
        .... 0000 = Endpoint number: 0
    Device: 1
    URB bus id: 1
    Device setup request: relevant (0)
    Data: not present ('<')
    URB sec: 1515423774
    URB usec: 630937
    URB status: Operation now in progress (-EINPROGRESS) (-115)
    URB length [bytes]: 4
    Data length [bytes]: 0
    [Response in: 28]
    Interval: 0
    Start frame: 0
    Copy of Transfer Flags: 0x00000200
    Number of ISO descriptors: 0
    [bInterfaceClass: Unknown (0xffff)]
URB setup
    bmRequestType: 0xa3
bRequest: GET_STATUS (0x00)
wValue: 0x0000
wIndex: 4
wLength: 4

     28 0.283526       1.1.0                 host                  USBHUB   68     GET_STATUS Response    [Port 4]

Frame 28: 68 bytes on wire (544 bits), 68 bytes captured (544 bits) on interface 0
USB URB
    [Source: 1.1.0]
    [Destination: host]
    URB id: 0xffff8da015e4e0c0
    URB type: URB_COMPLETE ('C')
    URB transfer type: URB_CONTROL (0x02)
    Endpoint: 0x80, Direction: IN
        1... .... = Direction: IN (1)
        .... 0000 = Endpoint number: 0
    Device: 1
    URB bus id: 1
    Device setup request: not relevant ('-')
    Data: present (0)
    URB sec: 1515423774
    URB usec: 630949
    URB status: Success (0)
    URB length [bytes]: 4
    Data length [bytes]: 4
    [Request in: 27]
    [Time from request: 0.000012000 seconds]
    Unused Setup Header
    Interval: 0
    Start frame: 0
    Copy of Transfer Flags: 0x00000200
    Number of ISO descriptors: 0
    [bInterfaceClass: Unknown (0xffff)]
Port Status: 0x0103, PORT_CONNECTION, PORT_ENABLE, PORT_POWER
    .... .... .... ...1 = PORT_CONNECTION: True
    .... .... .... ..1. = PORT_ENABLE: True
    .... .... .... .0.. = PORT_SUSPEND: False
    .... .... .... 0... = PORT_OVER_CURRENT: False
    .... .... ...0 .... = PORT_RESET: False
    .... ...1 .... .... = PORT_POWER: True
    .... ..0. .... .... = PORT_LOW_SPEED: False
    .... .0.. .... .... = PORT_HIGH_SPEED: False
    .... 0... .... .... = PORT_TEST: False
    ...0 .... .... .... = PORT_INDICATOR: Default colors
Port Change: 0x0010, C_PORT_RESET

     29 0.283530       host                  1.1.0                 USBHUB   64     CLEAR_FEATURE Request  [Port 4: C_PORT_RESET]

Frame 29: 64 bytes on wire (512 bits), 64 bytes captured (512 bits) on interface 0
USB URB
    [Source: host]
    [Destination: 1.1.0]
    URB id: 0xffff8da015e4e0c0
    URB type: URB_SUBMIT ('S')
    URB transfer type: URB_CONTROL (0x02)
    Endpoint: 0x00, Direction: OUT
        0... .... = Direction: OUT (0)
        .... 0000 = Endpoint number: 0
    Device: 1
    URB bus id: 1
    Device setup request: relevant (0)
    Data: present (0)
    URB sec: 1515423774
    URB usec: 630953
    URB status: Operation now in progress (-EINPROGRESS) (-115)
    URB length [bytes]: 0
    Data length [bytes]: 0
    [Response in: 30]
    Interval: 0
    Start frame: 0
    Copy of Transfer Flags: 0x00000000
    Number of ISO descriptors: 0
    [bInterfaceClass: Unknown (0xffff)]
URB setup
    bmRequestType: 0x23
bRequest: CLEAR_FEATURE (0x01)
wValue: 0x0014
wIndex: 4
wLength: 0

     30 0.283534       1.1.0                 host                  USBHUB   64     CLEAR_FEATURE Response [Port 4: C_PORT_RESET]

Frame 30: 64 bytes on wire (512 bits), 64 bytes captured (512 bits) on interface 0
USB URB
    [Source: 1.1.0]
    [Destination: host]
    URB id: 0xffff8da015e4e0c0
    URB type: URB_COMPLETE ('C')
    URB transfer type: URB_CONTROL (0x02)
    Endpoint: 0x00, Direction: OUT
        0... .... = Direction: OUT (0)
        .... 0000 = Endpoint number: 0
    Device: 1
    URB bus id: 1
    Device setup request: not relevant ('-')
    Data: not present ('>')
    URB sec: 1515423774
    URB usec: 630957
    URB status: Success (0)
    URB length [bytes]: 0
    Data length [bytes]: 0
    [Request in: 29]
    [Time from request: 0.000004000 seconds]
    Unused Setup Header
    Interval: 0
    Start frame: 0
    Copy of Transfer Flags: 0x00000000
    Number of ISO descriptors: 0
    [bInterfaceClass: Unknown (0xffff)]

     31 0.347554       host                  1.88.0                USB      64     GET DESCRIPTOR Request DEVICE

Frame 31: 64 bytes on wire (512 bits), 64 bytes captured (512 bits) on interface 0
USB URB
    [Source: host]
    [Destination: 1.88.0]
    URB id: 0xffff8da015e4e0c0
    URB type: URB_SUBMIT ('S')
    URB transfer type: URB_CONTROL (0x02)
    Endpoint: 0x80, Direction: IN
        1... .... = Direction: IN (1)
        .... 0000 = Endpoint number: 0
    Device: 88
    URB bus id: 1
    Device setup request: relevant (0)
    Data: not present ('<')
    URB sec: 1515423774
    URB usec: 694977
    URB status: Operation now in progress (-EINPROGRESS) (-115)
    URB length [bytes]: 18
    Data length [bytes]: 0
    [Response in: 32]
    Interval: 0
    Start frame: 0
    Copy of Transfer Flags: 0x00000200
    Number of ISO descriptors: 0
URB setup
    bmRequestType: 0x80
    bRequest: GET DESCRIPTOR (6)
    Descriptor Index: 0x00
    bDescriptorType: 0x01
    Language Id: no language specified (0x0000)
    wLength: 18

     32 0.347711       1.88.0                host                  USB      64     GET DESCRIPTOR Response

Frame 32: 64 bytes on wire (512 bits), 64 bytes captured (512 bits) on interface 0
USB URB
    [Source: 1.88.0]
    [Destination: host]
    URB id: 0xffff8da015e4e0c0
    URB type: URB_COMPLETE ('C')
    URB transfer type: URB_CONTROL (0x02)
    Endpoint: 0x80, Direction: IN
        1... .... = Direction: IN (1)
        .... 0000 = Endpoint number: 0
    Device: 88
    URB bus id: 1
    Device setup request: not relevant ('-')
    Data: present (0)
    URB sec: 1515423774
    URB usec: 695134
    URB status: Value too large for defined data type (-EOVERFLOW) (-75)
    URB length [bytes]: 0
    Data length [bytes]: 0
    [Request in: 31]
    [Time from request: 0.000157000 seconds]
    Unused Setup Header
    Interval: 0
    Start frame: 0
    Copy of Transfer Flags: 0x00000200
    Number of ISO descriptors: 0

     33 0.347742       host                  1.88.0                USB      64     GET DESCRIPTOR Request DEVICE

Frame 33: 64 bytes on wire (512 bits), 64 bytes captured (512 bits) on interface 0
USB URB
    [Source: host]
    [Destination: 1.88.0]
    URB id: 0xffff8da015e4e0c0
    URB type: URB_SUBMIT ('S')
    URB transfer type: URB_CONTROL (0x02)
    Endpoint: 0x80, Direction: IN
        1... .... = Direction: IN (1)
        .... 0000 = Endpoint number: 0
    Device: 88
    URB bus id: 1
    Device setup request: relevant (0)
    Data: not present ('<')
    URB sec: 1515423774
    URB usec: 695165
    URB status: Operation now in progress (-EINPROGRESS) (-115)
    URB length [bytes]: 18
    Data length [bytes]: 0
    [Response in: 34]
    Interval: 0
    Start frame: 0
    Copy of Transfer Flags: 0x00000200
    Number of ISO descriptors: 0
URB setup
    bmRequestType: 0x80
    bRequest: GET DESCRIPTOR (6)
    Descriptor Index: 0x00
    bDescriptorType: 0x01
    Language Id: no language specified (0x0000)
    wLength: 18

     34 5.536609       1.88.0                host                  USB      64     GET DESCRIPTOR Response

Frame 34: 64 bytes on wire (512 bits), 64 bytes captured (512 bits) on interface 0
USB URB
    [Source: 1.88.0]
    [Destination: host]
    URB id: 0xffff8da015e4e0c0
    URB type: URB_COMPLETE ('C')
    URB transfer type: URB_CONTROL (0x02)
    Endpoint: 0x80, Direction: IN
        1... .... = Direction: IN (1)
        .... 0000 = Endpoint number: 0
    Device: 88
    URB bus id: 1
    Device setup request: not relevant ('-')
    Data: present (0)
    URB sec: 1515423779
    URB usec: 884032
    URB status: No such file or directory (-ENOENT) (-2)
    URB length [bytes]: 0
    Data length [bytes]: 0
    [Request in: 33]
    [Time from request: 5.188867000 seconds]
    Unused Setup Header
    Interval: 0
    Start frame: 0
    Copy of Transfer Flags: 0x00000200
    Number of ISO descriptors: 0

     35 5.536836       host                  1.1.0                 USBHUB   64     CLEAR_FEATURE Request  [Port 4: PORT_ENABLE]

Frame 35: 64 bytes on wire (512 bits), 64 bytes captured (512 bits) on interface 0
USB URB
    [Source: host]
    [Destination: 1.1.0]
    URB id: 0xffff8da015e4e0c0
    URB type: URB_SUBMIT ('S')
    URB transfer type: URB_CONTROL (0x02)
    Endpoint: 0x00, Direction: OUT
        0... .... = Direction: OUT (0)
        .... 0000 = Endpoint number: 0
    Device: 1
    URB bus id: 1
    Device setup request: relevant (0)
    Data: present (0)
    URB sec: 1515423779
    URB usec: 884259
    URB status: Operation now in progress (-EINPROGRESS) (-115)
    URB length [bytes]: 0
    Data length [bytes]: 0
    [Response in: 36]
    Interval: 0
    Start frame: 0
    Copy of Transfer Flags: 0x00000000
    Number of ISO descriptors: 0
    [bInterfaceClass: Unknown (0xffff)]
URB setup
    bmRequestType: 0x23
bRequest: CLEAR_FEATURE (0x01)
wValue: 0x0001
wIndex: 4
wLength: 0

     36 5.536866       1.1.0                 host                  USBHUB   64     CLEAR_FEATURE Response [Port 4: PORT_ENABLE]

Frame 36: 64 bytes on wire (512 bits), 64 bytes captured (512 bits) on interface 0
USB URB
    [Source: 1.1.0]
    [Destination: host]
    URB id: 0xffff8da015e4e0c0
    URB type: URB_COMPLETE ('C')
    URB transfer type: URB_CONTROL (0x02)
    Endpoint: 0x00, Direction: OUT
        0... .... = Direction: OUT (0)
        .... 0000 = Endpoint number: 0
    Device: 1
    URB bus id: 1
    Device setup request: not relevant ('-')
    Data: not present ('>')
    URB sec: 1515423779
    URB usec: 884289
    URB status: Success (0)
    URB length [bytes]: 0
    Data length [bytes]: 0
    [Request in: 35]
    [Time from request: 0.000030000 seconds]
    Unused Setup Header
    Interval: 0
    Start frame: 0
    Copy of Transfer Flags: 0x00000000
    Number of ISO descriptors: 0
    [bInterfaceClass: Unknown (0xffff)]

     37 5.537029       host                  1.1.0                 USBHUB   64     SET_FEATURE Request    [Port 4: PORT_RESET]

Frame 37: 64 bytes on wire (512 bits), 64 bytes captured (512 bits) on interface 0
USB URB
    [Source: host]
    [Destination: 1.1.0]
    URB id: 0xffff8da015e4e0c0
    URB type: URB_SUBMIT ('S')
    URB transfer type: URB_CONTROL (0x02)
    Endpoint: 0x00, Direction: OUT
        0... .... = Direction: OUT (0)
        .... 0000 = Endpoint number: 0
    Device: 1
    URB bus id: 1
    Device setup request: relevant (0)
    Data: present (0)
    URB sec: 1515423779
    URB usec: 884452
    URB status: Operation now in progress (-EINPROGRESS) (-115)
    URB length [bytes]: 0
    Data length [bytes]: 0
    [Response in: 38]
    Interval: 0
    Start frame: 0
    Copy of Transfer Flags: 0x00000000
    Number of ISO descriptors: 0
    [bInterfaceClass: Unknown (0xffff)]
URB setup
    bmRequestType: 0x23
bRequest: SET_FEATURE (0x03)
wValue: 0x0004
wIndex: 4
wLength: 0

     38 5.537052       1.1.0                 host                  USBHUB   64     SET_FEATURE Response   [Port 4: PORT_RESET]

Frame 38: 64 bytes on wire (512 bits), 64 bytes captured (512 bits) on interface 0
USB URB
    [Source: 1.1.0]
    [Destination: host]
    URB id: 0xffff8da015e4e0c0
    URB type: URB_COMPLETE ('C')
    URB transfer type: URB_CONTROL (0x02)
    Endpoint: 0x00, Direction: OUT
        0... .... = Direction: OUT (0)
        .... 0000 = Endpoint number: 0
    Device: 1
    URB bus id: 1
    Device setup request: not relevant ('-')
    Data: not present ('>')
    URB sec: 1515423779
    URB usec: 884475
    URB status: Success (0)
    URB length [bytes]: 0
    Data length [bytes]: 0
    [Request in: 37]
    [Time from request: 0.000023000 seconds]
    Unused Setup Header
    Interval: 0
    Start frame: 0
    Copy of Transfer Flags: 0x00000000
    Number of ISO descriptors: 0
    [bInterfaceClass: Unknown (0xffff)]

     39 5.598637       host                  1.1.0                 USBHUB   64     GET_STATUS Request     [Port 4]

Frame 39: 64 bytes on wire (512 bits), 64 bytes captured (512 bits) on interface 0
USB URB
    [Source: host]
    [Destination: 1.1.0]
    URB id: 0xffff8da015e4e0c0
    URB type: URB_SUBMIT ('S')
    URB transfer type: URB_CONTROL (0x02)
    Endpoint: 0x80, Direction: IN
        1... .... = Direction: IN (1)
        .... 0000 = Endpoint number: 0
    Device: 1
    URB bus id: 1
    Device setup request: relevant (0)
    Data: not present ('<')
    URB sec: 1515423779
    URB usec: 946060
    URB status: Operation now in progress (-EINPROGRESS) (-115)
    URB length [bytes]: 4
    Data length [bytes]: 0
    [Response in: 40]
    Interval: 0
    Start frame: 0
    Copy of Transfer Flags: 0x00000200
    Number of ISO descriptors: 0
    [bInterfaceClass: Unknown (0xffff)]
URB setup
    bmRequestType: 0xa3
bRequest: GET_STATUS (0x00)
wValue: 0x0000
wIndex: 4
wLength: 4

     40 5.598655       1.1.0                 host                  USBHUB   68     GET_STATUS Response    [Port 4]

Frame 40: 68 bytes on wire (544 bits), 68 bytes captured (544 bits) on interface 0
USB URB
    [Source: 1.1.0]
    [Destination: host]
    URB id: 0xffff8da015e4e0c0
    URB type: URB_COMPLETE ('C')
    URB transfer type: URB_CONTROL (0x02)
    Endpoint: 0x80, Direction: IN
        1... .... = Direction: IN (1)
        .... 0000 = Endpoint number: 0
    Device: 1
    URB bus id: 1
    Device setup request: not relevant ('-')
    Data: present (0)
    URB sec: 1515423779
    URB usec: 946078
    URB status: Success (0)
    URB length [bytes]: 4
    Data length [bytes]: 4
    [Request in: 39]
    [Time from request: 0.000018000 seconds]
    Unused Setup Header
    Interval: 0
    Start frame: 0
    Copy of Transfer Flags: 0x00000200
    Number of ISO descriptors: 0
    [bInterfaceClass: Unknown (0xffff)]
Port Status: 0x0103, PORT_CONNECTION, PORT_ENABLE, PORT_POWER
    .... .... .... ...1 = PORT_CONNECTION: True
    .... .... .... ..1. = PORT_ENABLE: True
    .... .... .... .0.. = PORT_SUSPEND: False
    .... .... .... 0... = PORT_OVER_CURRENT: False
    .... .... ...0 .... = PORT_RESET: False
    .... ...1 .... .... = PORT_POWER: True
    .... ..0. .... .... = PORT_LOW_SPEED: False
    .... .0.. .... .... = PORT_HIGH_SPEED: False
    .... 0... .... .... = PORT_TEST: False
    ...0 .... .... .... = PORT_INDICATOR: Default colors
Port Change: 0x0010, C_PORT_RESET

     41 5.598662       host                  1.1.0                 USBHUB   64     CLEAR_FEATURE Request  [Port 4: C_PORT_RESET]

Frame 41: 64 bytes on wire (512 bits), 64 bytes captured (512 bits) on interface 0
USB URB
    [Source: host]
    [Destination: 1.1.0]
    URB id: 0xffff8da015e4e0c0
    URB type: URB_SUBMIT ('S')
    URB transfer type: URB_CONTROL (0x02)
    Endpoint: 0x00, Direction: OUT
        0... .... = Direction: OUT (0)
        .... 0000 = Endpoint number: 0
    Device: 1
    URB bus id: 1
    Device setup request: relevant (0)
    Data: present (0)
    URB sec: 1515423779
    URB usec: 946085
    URB status: Operation now in progress (-EINPROGRESS) (-115)
    URB length [bytes]: 0
    Data length [bytes]: 0
    [Response in: 42]
    Interval: 0
    Start frame: 0
    Copy of Transfer Flags: 0x00000000
    Number of ISO descriptors: 0
    [bInterfaceClass: Unknown (0xffff)]
URB setup
    bmRequestType: 0x23
bRequest: CLEAR_FEATURE (0x01)
wValue: 0x0014
wIndex: 4
wLength: 0

     42 5.598667       1.1.0                 host                  USBHUB   64     CLEAR_FEATURE Response [Port 4: C_PORT_RESET]

Frame 42: 64 bytes on wire (512 bits), 64 bytes captured (512 bits) on interface 0
USB URB
    [Source: 1.1.0]
    [Destination: host]
    URB id: 0xffff8da015e4e0c0
    URB type: URB_COMPLETE ('C')
    URB transfer type: URB_CONTROL (0x02)
    Endpoint: 0x00, Direction: OUT
        0... .... = Direction: OUT (0)
        .... 0000 = Endpoint number: 0
    Device: 1
    URB bus id: 1
    Device setup request: not relevant ('-')
    Data: not present ('>')
    URB sec: 1515423779
    URB usec: 946090
    URB status: Success (0)
    URB length [bytes]: 0
    Data length [bytes]: 0
    [Request in: 41]
    [Time from request: 0.000005000 seconds]
    Unused Setup Header
    Interval: 0
    Start frame: 0
    Copy of Transfer Flags: 0x00000000
    Number of ISO descriptors: 0
    [bInterfaceClass: Unknown (0xffff)]

     43 5.650604       host                  1.0.0                 USB      64     GET DESCRIPTOR Request DEVICE

Frame 43: 64 bytes on wire (512 bits), 64 bytes captured (512 bits) on interface 0
USB URB
    [Source: host]
    [Destination: 1.0.0]
    URB id: 0xffff8da015e4e0c0
    URB type: URB_SUBMIT ('S')
    URB transfer type: URB_CONTROL (0x02)
    Endpoint: 0x80, Direction: IN
        1... .... = Direction: IN (1)
        .... 0000 = Endpoint number: 0
    Device: 0
    URB bus id: 1
    Device setup request: relevant (0)
    Data: not present ('<')
    URB sec: 1515423779
    URB usec: 998027
    URB status: Operation now in progress (-EINPROGRESS) (-115)
    URB length [bytes]: 64
    Data length [bytes]: 0
    [Response in: 44]
    Interval: 0
    Start frame: 0
    Copy of Transfer Flags: 0x00000200
    Number of ISO descriptors: 0
URB setup
    bmRequestType: 0x80
    bRequest: GET DESCRIPTOR (6)
    Descriptor Index: 0x00
    bDescriptorType: 0x01
    Language Id: no language specified (0x0000)
    wLength: 64

     44 10.656595      1.0.0                 host                  USB      64     GET DESCRIPTOR Response

Frame 44: 64 bytes on wire (512 bits), 64 bytes captured (512 bits) on interface 0
USB URB
    [Source: 1.0.0]
    [Destination: host]
    URB id: 0xffff8da015e4e0c0
    URB type: URB_COMPLETE ('C')
    URB transfer type: URB_CONTROL (0x02)
    Endpoint: 0x80, Direction: IN
        1... .... = Direction: IN (1)
        .... 0000 = Endpoint number: 0
    Device: 0
    URB bus id: 1
    Device setup request: not relevant ('-')
    Data: present (0)
    URB sec: 1515423785
    URB usec: 4018
    URB status: No such file or directory (-ENOENT) (-2)
    URB length [bytes]: 0
    Data length [bytes]: 0
    [Request in: 43]
    [Time from request: 5.005991000 seconds]
    Unused Setup Header
    Interval: 0
    Start frame: 0
    Copy of Transfer Flags: 0x00000200
    Number of ISO descriptors: 0

     45 10.656640      host                  1.1.0                 USBHUB   64     SET_FEATURE Request    [Port 4: PORT_RESET]

Frame 45: 64 bytes on wire (512 bits), 64 bytes captured (512 bits) on interface 0
USB URB
    [Source: host]
    [Destination: 1.1.0]
    URB id: 0xffff8da015e4e0c0
    URB type: URB_SUBMIT ('S')
    URB transfer type: URB_CONTROL (0x02)
    Endpoint: 0x00, Direction: OUT
        0... .... = Direction: OUT (0)
        .... 0000 = Endpoint number: 0
    Device: 1
    URB bus id: 1
    Device setup request: relevant (0)
    Data: present (0)
    URB sec: 1515423785
    URB usec: 4063
    URB status: Operation now in progress (-EINPROGRESS) (-115)
    URB length [bytes]: 0
    Data length [bytes]: 0
    [Response in: 46]
    Interval: 0
    Start frame: 0
    Copy of Transfer Flags: 0x00000000
    Number of ISO descriptors: 0
    [bInterfaceClass: Unknown (0xffff)]
URB setup
    bmRequestType: 0x23
bRequest: SET_FEATURE (0x03)
wValue: 0x0004
wIndex: 4
wLength: 0

     46 10.656687      1.1.0                 host                  USBHUB   64     SET_FEATURE Response   [Port 4: PORT_RESET]

Frame 46: 64 bytes on wire (512 bits), 64 bytes captured (512 bits) on interface 0
USB URB
    [Source: 1.1.0]
    [Destination: host]
    URB id: 0xffff8da015e4e0c0
    URB type: URB_COMPLETE ('C')
    URB transfer type: URB_CONTROL (0x02)
    Endpoint: 0x00, Direction: OUT
        0... .... = Direction: OUT (0)
        .... 0000 = Endpoint number: 0
    Device: 1
    URB bus id: 1
    Device setup request: not relevant ('-')
    Data: not present ('>')
    URB sec: 1515423785
    URB usec: 4110
    URB status: Success (0)
    URB length [bytes]: 0
    Data length [bytes]: 0
    [Request in: 45]
    [Time from request: 0.000047000 seconds]
    Unused Setup Header
    Interval: 0
    Start frame: 0
    Copy of Transfer Flags: 0x00000000
    Number of ISO descriptors: 0
    [bInterfaceClass: Unknown (0xffff)]

     47 10.718550      host                  1.1.0                 USBHUB   64     GET_STATUS Request     [Port 4]

Frame 47: 64 bytes on wire (512 bits), 64 bytes captured (512 bits) on interface 0
USB URB
    [Source: host]
    [Destination: 1.1.0]
    URB id: 0xffff8da015e4e0c0
    URB type: URB_SUBMIT ('S')
    URB transfer type: URB_CONTROL (0x02)
    Endpoint: 0x80, Direction: IN
        1... .... = Direction: IN (1)
        .... 0000 = Endpoint number: 0
    Device: 1
    URB bus id: 1
    Device setup request: relevant (0)
    Data: not present ('<')
    URB sec: 1515423785
    URB usec: 65973
    URB status: Operation now in progress (-EINPROGRESS) (-115)
    URB length [bytes]: 4
    Data length [bytes]: 0
    [Response in: 48]
    Interval: 0
    Start frame: 0
    Copy of Transfer Flags: 0x00000200
    Number of ISO descriptors: 0
    [bInterfaceClass: Unknown (0xffff)]
URB setup
    bmRequestType: 0xa3
bRequest: GET_STATUS (0x00)
wValue: 0x0000
wIndex: 4
wLength: 4

     48 10.718577      1.1.0                 host                  USBHUB   68     GET_STATUS Response    [Port 4]

Frame 48: 68 bytes on wire (544 bits), 68 bytes captured (544 bits) on interface 0
USB URB
    [Source: 1.1.0]
    [Destination: host]
    URB id: 0xffff8da015e4e0c0
    URB type: URB_COMPLETE ('C')
    URB transfer type: URB_CONTROL (0x02)
    Endpoint: 0x80, Direction: IN
        1... .... = Direction: IN (1)
        .... 0000 = Endpoint number: 0
    Device: 1
    URB bus id: 1
    Device setup request: not relevant ('-')
    Data: present (0)
    URB sec: 1515423785
    URB usec: 66000
    URB status: Success (0)
    URB length [bytes]: 4
    Data length [bytes]: 4
    [Request in: 47]
    [Time from request: 0.000027000 seconds]
    Unused Setup Header
    Interval: 0
    Start frame: 0
    Copy of Transfer Flags: 0x00000200
    Number of ISO descriptors: 0
    [bInterfaceClass: Unknown (0xffff)]
Port Status: 0x0103, PORT_CONNECTION, PORT_ENABLE, PORT_POWER
    .... .... .... ...1 = PORT_CONNECTION: True
    .... .... .... ..1. = PORT_ENABLE: True
    .... .... .... .0.. = PORT_SUSPEND: False
    .... .... .... 0... = PORT_OVER_CURRENT: False
    .... .... ...0 .... = PORT_RESET: False
    .... ...1 .... .... = PORT_POWER: True
    .... ..0. .... .... = PORT_LOW_SPEED: False
    .... .0.. .... .... = PORT_HIGH_SPEED: False
    .... 0... .... .... = PORT_TEST: False
    ...0 .... .... .... = PORT_INDICATOR: Default colors
Port Change: 0x0010, C_PORT_RESET

     49 10.718591      host                  1.1.0                 USBHUB   64     CLEAR_FEATURE Request  [Port 4: C_PORT_RESET]

Frame 49: 64 bytes on wire (512 bits), 64 bytes captured (512 bits) on interface 0
USB URB
    [Source: host]
    [Destination: 1.1.0]
    URB id: 0xffff8da015e4e0c0
    URB type: URB_SUBMIT ('S')
    URB transfer type: URB_CONTROL (0x02)
    Endpoint: 0x00, Direction: OUT
        0... .... = Direction: OUT (0)
        .... 0000 = Endpoint number: 0
    Device: 1
    URB bus id: 1
    Device setup request: relevant (0)
    Data: present (0)
    URB sec: 1515423785
    URB usec: 66014
    URB status: Operation now in progress (-EINPROGRESS) (-115)
    URB length [bytes]: 0
    Data length [bytes]: 0
    [Response in: 50]
    Interval: 0
    Start frame: 0
    Copy of Transfer Flags: 0x00000000
    Number of ISO descriptors: 0
    [bInterfaceClass: Unknown (0xffff)]
URB setup
    bmRequestType: 0x23
bRequest: CLEAR_FEATURE (0x01)
wValue: 0x0014
wIndex: 4
wLength: 0

     50 10.718601      1.1.0                 host                  USBHUB   64     CLEAR_FEATURE Response [Port 4: C_PORT_RESET]

Frame 50: 64 bytes on wire (512 bits), 64 bytes captured (512 bits) on interface 0
USB URB
    [Source: 1.1.0]
    [Destination: host]
    URB id: 0xffff8da015e4e0c0
    URB type: URB_COMPLETE ('C')
    URB transfer type: URB_CONTROL (0x02)
    Endpoint: 0x00, Direction: OUT
        0... .... = Direction: OUT (0)
        .... 0000 = Endpoint number: 0
    Device: 1
    URB bus id: 1
    Device setup request: not relevant ('-')
    Data: not present ('>')
    URB sec: 1515423785
    URB usec: 66024
    URB status: Success (0)
    URB length [bytes]: 0
    Data length [bytes]: 0
    [Request in: 49]
    [Time from request: 0.000010000 seconds]
    Unused Setup Header
    Interval: 0
    Start frame: 0
    Copy of Transfer Flags: 0x00000000
    Number of ISO descriptors: 0
    [bInterfaceClass: Unknown (0xffff)]

     51 10.872544      host                  1.0.0                 USB      64     GET DESCRIPTOR Request DEVICE

Frame 51: 64 bytes on wire (512 bits), 64 bytes captured (512 bits) on interface 0
USB URB
    [Source: host]
    [Destination: 1.0.0]
    URB id: 0xffff8da015e4e0c0
    URB type: URB_SUBMIT ('S')
    URB transfer type: URB_CONTROL (0x02)
    Endpoint: 0x80, Direction: IN
        1... .... = Direction: IN (1)
        .... 0000 = Endpoint number: 0
    Device: 0
    URB bus id: 1
    Device setup request: relevant (0)
    Data: not present ('<')
    URB sec: 1515423785
    URB usec: 219967
    URB status: Operation now in progress (-EINPROGRESS) (-115)
    URB length [bytes]: 64
    Data length [bytes]: 0
    [Response in: 52]
    Interval: 0
    Start frame: 0
    Copy of Transfer Flags: 0x00000200
    Number of ISO descriptors: 0
URB setup
    bmRequestType: 0x80
    bRequest: GET DESCRIPTOR (6)
    Descriptor Index: 0x00
    bDescriptorType: 0x01
    Language Id: no language specified (0x0000)
    wLength: 64

     52 16.288593      1.0.0                 host                  USB      64     GET DESCRIPTOR Response

Frame 52: 64 bytes on wire (512 bits), 64 bytes captured (512 bits) on interface 0
USB URB
    [Source: 1.0.0]
    [Destination: host]
    URB id: 0xffff8da015e4e0c0
    URB type: URB_COMPLETE ('C')
    URB transfer type: URB_CONTROL (0x02)
    Endpoint: 0x80, Direction: IN
        1... .... = Direction: IN (1)
        .... 0000 = Endpoint number: 0
    Device: 0
    URB bus id: 1
    Device setup request: not relevant ('-')
    Data: present (0)
    URB sec: 1515423790
    URB usec: 636016
    URB status: No such file or directory (-ENOENT) (-2)
    URB length [bytes]: 0
    Data length [bytes]: 0
    [Request in: 51]
    [Time from request: 5.416049000 seconds]
    Unused Setup Header
    Interval: 0
    Start frame: 0
    Copy of Transfer Flags: 0x00000200
    Number of ISO descriptors: 0

     53 16.288694      host                  1.0.0                 USB      64     GET DESCRIPTOR Request DEVICE

Frame 53: 64 bytes on wire (512 bits), 64 bytes captured (512 bits) on interface 0
USB URB
    [Source: host]
    [Destination: 1.0.0]
    URB id: 0xffff8da015e4e0c0
    URB type: URB_SUBMIT ('S')
    URB transfer type: URB_CONTROL (0x02)
    Endpoint: 0x80, Direction: IN
        1... .... = Direction: IN (1)
        .... 0000 = Endpoint number: 0
    Device: 0
    URB bus id: 1
    Device setup request: relevant (0)
    Data: not present ('<')
    URB sec: 1515423790
    URB usec: 636117
    URB status: Operation now in progress (-EINPROGRESS) (-115)
    URB length [bytes]: 64
    Data length [bytes]: 0
    [Response in: 54]
    Interval: 0
    Start frame: 0
    Copy of Transfer Flags: 0x00000200
    Number of ISO descriptors: 0
URB setup
    bmRequestType: 0x80
    bRequest: GET DESCRIPTOR (6)
    Descriptor Index: 0x00
    bDescriptorType: 0x01
    Language Id: no language specified (0x0000)
    wLength: 64

     54 21.408600      1.0.0                 host                  USB      64     GET DESCRIPTOR Response

Frame 54: 64 bytes on wire (512 bits), 64 bytes captured (512 bits) on interface 0
USB URB
    [Source: 1.0.0]
    [Destination: host]
    URB id: 0xffff8da015e4e0c0
    URB type: URB_COMPLETE ('C')
    URB transfer type: URB_CONTROL (0x02)
    Endpoint: 0x80, Direction: IN
        1... .... = Direction: IN (1)
        .... 0000 = Endpoint number: 0
    Device: 0
    URB bus id: 1
    Device setup request: not relevant ('-')
    Data: present (0)
    URB sec: 1515423795
    URB usec: 756023
    URB status: No such file or directory (-ENOENT) (-2)
    URB length [bytes]: 0
    Data length [bytes]: 0
    [Request in: 53]
    [Time from request: 5.119906000 seconds]
    Unused Setup Header
    Interval: 0
    Start frame: 0
    Copy of Transfer Flags: 0x00000200
    Number of ISO descriptors: 0

     55 21.408627      host                  1.0.0                 USB      64     GET DESCRIPTOR Request DEVICE

Frame 55: 64 bytes on wire (512 bits), 64 bytes captured (512 bits) on interface 0
USB URB
    [Source: host]
    [Destination: 1.0.0]
    URB id: 0xffff8da015e4e0c0
    URB type: URB_SUBMIT ('S')
    URB transfer type: URB_CONTROL (0x02)
    Endpoint: 0x80, Direction: IN
        1... .... = Direction: IN (1)
        .... 0000 = Endpoint number: 0
    Device: 0
    URB bus id: 1
    Device setup request: relevant (0)
    Data: not present ('<')
    URB sec: 1515423795
    URB usec: 756050
    URB status: Operation now in progress (-EINPROGRESS) (-115)
    URB length [bytes]: 64
    Data length [bytes]: 0
    [Response in: 56]
    Interval: 0
    Start frame: 0
    Copy of Transfer Flags: 0x00000200
    Number of ISO descriptors: 0
URB setup
    bmRequestType: 0x80
    bRequest: GET DESCRIPTOR (6)
    Descriptor Index: 0x00
    bDescriptorType: 0x01
    Language Id: no language specified (0x0000)
    wLength: 64

     56 26.529130      1.0.0                 host                  USB      64     GET DESCRIPTOR Response

Frame 56: 64 bytes on wire (512 bits), 64 bytes captured (512 bits) on interface 0
USB URB
    [Source: 1.0.0]
    [Destination: host]
    URB id: 0xffff8da015e4e0c0
    URB type: URB_COMPLETE ('C')
    URB transfer type: URB_CONTROL (0x02)
    Endpoint: 0x80, Direction: IN
        1... .... = Direction: IN (1)
        .... 0000 = Endpoint number: 0
    Device: 0
    URB bus id: 1
    Device setup request: not relevant ('-')
    Data: present (0)
    URB sec: 1515423800
    URB usec: 876553
    URB status: No such file or directory (-ENOENT) (-2)
    URB length [bytes]: 0
    Data length [bytes]: 0
    [Request in: 55]
    [Time from request: 5.120503000 seconds]
    Unused Setup Header
    Interval: 0
    Start frame: 0
    Copy of Transfer Flags: 0x00000200
    Number of ISO descriptors: 0

     57 26.529219      host                  1.1.0                 USBHUB   64     SET_FEATURE Request    [Port 4: PORT_RESET]

Frame 57: 64 bytes on wire (512 bits), 64 bytes captured (512 bits) on interface 0
USB URB
    [Source: host]
    [Destination: 1.1.0]
    URB id: 0xffff8da015e4e0c0
    URB type: URB_SUBMIT ('S')
    URB transfer type: URB_CONTROL (0x02)
    Endpoint: 0x00, Direction: OUT
        0... .... = Direction: OUT (0)
        .... 0000 = Endpoint number: 0
    Device: 1
    URB bus id: 1
    Device setup request: relevant (0)
    Data: present (0)
    URB sec: 1515423800
    URB usec: 876642
    URB status: Operation now in progress (-EINPROGRESS) (-115)
    URB length [bytes]: 0
    Data length [bytes]: 0
    [Response in: 58]
    Interval: 0
    Start frame: 0
    Copy of Transfer Flags: 0x00000000
    Number of ISO descriptors: 0
    [bInterfaceClass: Unknown (0xffff)]
URB setup
    bmRequestType: 0x23
bRequest: SET_FEATURE (0x03)
wValue: 0x0004
wIndex: 4
wLength: 0

     58 26.529285      1.1.0                 host                  USBHUB   64     SET_FEATURE Response   [Port 4: PORT_RESET]

Frame 58: 64 bytes on wire (512 bits), 64 bytes captured (512 bits) on interface 0
USB URB
    [Source: 1.1.0]
    [Destination: host]
    URB id: 0xffff8da015e4e0c0
    URB type: URB_COMPLETE ('C')
    URB transfer type: URB_CONTROL (0x02)
    Endpoint: 0x00, Direction: OUT
        0... .... = Direction: OUT (0)
        .... 0000 = Endpoint number: 0
    Device: 1
    URB bus id: 1
    Device setup request: not relevant ('-')
    Data: not present ('>')
    URB sec: 1515423800
    URB usec: 876708
    URB status: Success (0)
    URB length [bytes]: 0
    Data length [bytes]: 0
    [Request in: 57]
    [Time from request: 0.000066000 seconds]
    Unused Setup Header
    Interval: 0
    Start frame: 0
    Copy of Transfer Flags: 0x00000000
    Number of ISO descriptors: 0
    [bInterfaceClass: Unknown (0xffff)]

     59 26.590559      host                  1.1.0                 USBHUB   64     GET_STATUS Request     [Port 4]

Frame 59: 64 bytes on wire (512 bits), 64 bytes captured (512 bits) on interface 0
USB URB
    [Source: host]
    [Destination: 1.1.0]
    URB id: 0xffff8da015e4e0c0
    URB type: URB_SUBMIT ('S')
    URB transfer type: URB_CONTROL (0x02)
    Endpoint: 0x80, Direction: IN
        1... .... = Direction: IN (1)
        .... 0000 = Endpoint number: 0
    Device: 1
    URB bus id: 1
    Device setup request: relevant (0)
    Data: not present ('<')
    URB sec: 1515423800
    URB usec: 937982
    URB status: Operation now in progress (-EINPROGRESS) (-115)
    URB length [bytes]: 4
    Data length [bytes]: 0
    [Response in: 60]
    Interval: 0
    Start frame: 0
    Copy of Transfer Flags: 0x00000200
    Number of ISO descriptors: 0
    [bInterfaceClass: Unknown (0xffff)]
URB setup
    bmRequestType: 0xa3
bRequest: GET_STATUS (0x00)
wValue: 0x0000
wIndex: 4
wLength: 4

     60 26.590584      1.1.0                 host                  USBHUB   68     GET_STATUS Response    [Port 4]

Frame 60: 68 bytes on wire (544 bits), 68 bytes captured (544 bits) on interface 0
USB URB
    [Source: 1.1.0]
    [Destination: host]
    URB id: 0xffff8da015e4e0c0
    URB type: URB_COMPLETE ('C')
    URB transfer type: URB_CONTROL (0x02)
    Endpoint: 0x80, Direction: IN
        1... .... = Direction: IN (1)
        .... 0000 = Endpoint number: 0
    Device: 1
    URB bus id: 1
    Device setup request: not relevant ('-')
    Data: present (0)
    URB sec: 1515423800
    URB usec: 938007
    URB status: Success (0)
    URB length [bytes]: 4
    Data length [bytes]: 4
    [Request in: 59]
    [Time from request: 0.000025000 seconds]
    Unused Setup Header
    Interval: 0
    Start frame: 0
    Copy of Transfer Flags: 0x00000200
    Number of ISO descriptors: 0
    [bInterfaceClass: Unknown (0xffff)]
Port Status: 0x0103, PORT_CONNECTION, PORT_ENABLE, PORT_POWER
    .... .... .... ...1 = PORT_CONNECTION: True
    .... .... .... ..1. = PORT_ENABLE: True
    .... .... .... .0.. = PORT_SUSPEND: False
    .... .... .... 0... = PORT_OVER_CURRENT: False
    .... .... ...0 .... = PORT_RESET: False
    .... ...1 .... .... = PORT_POWER: True
    .... ..0. .... .... = PORT_LOW_SPEED: False
    .... .0.. .... .... = PORT_HIGH_SPEED: False
    .... 0... .... .... = PORT_TEST: False
    ...0 .... .... .... = PORT_INDICATOR: Default colors
Port Change: 0x0010, C_PORT_RESET

     61 26.590595      host                  1.1.0                 USBHUB   64     CLEAR_FEATURE Request  [Port 4: C_PORT_RESET]

Frame 61: 64 bytes on wire (512 bits), 64 bytes captured (512 bits) on interface 0
USB URB
    [Source: host]
    [Destination: 1.1.0]
    URB id: 0xffff8da015e4e0c0
    URB type: URB_SUBMIT ('S')
    URB transfer type: URB_CONTROL (0x02)
    Endpoint: 0x00, Direction: OUT
        0... .... = Direction: OUT (0)
        .... 0000 = Endpoint number: 0
    Device: 1
    URB bus id: 1
    Device setup request: relevant (0)
    Data: present (0)
    URB sec: 1515423800
    URB usec: 938018
    URB status: Operation now in progress (-EINPROGRESS) (-115)
    URB length [bytes]: 0
    Data length [bytes]: 0
    [Response in: 62]
    Interval: 0
    Start frame: 0
    Copy of Transfer Flags: 0x00000000
    Number of ISO descriptors: 0
    [bInterfaceClass: Unknown (0xffff)]
URB setup
    bmRequestType: 0x23
bRequest: CLEAR_FEATURE (0x01)
wValue: 0x0014
wIndex: 4
wLength: 0

     62 26.590603      1.1.0                 host                  USBHUB   64     CLEAR_FEATURE Response [Port 4: C_PORT_RESET]

Frame 62: 64 bytes on wire (512 bits), 64 bytes captured (512 bits) on interface 0
USB URB
    [Source: 1.1.0]
    [Destination: host]
    URB id: 0xffff8da015e4e0c0
    URB type: URB_COMPLETE ('C')
    URB transfer type: URB_CONTROL (0x02)
    Endpoint: 0x00, Direction: OUT
        0... .... = Direction: OUT (0)
        .... 0000 = Endpoint number: 0
    Device: 1
    URB bus id: 1
    Device setup request: not relevant ('-')
    Data: not present ('>')
    URB sec: 1515423800
    URB usec: 938026
    URB status: Success (0)
    URB length [bytes]: 0
    Data length [bytes]: 0
    [Request in: 61]
    [Time from request: 0.000008000 seconds]
    Unused Setup Header
    Interval: 0
    Start frame: 0
    Copy of Transfer Flags: 0x00000000
    Number of ISO descriptors: 0
    [bInterfaceClass: Unknown (0xffff)]

     63 26.744542      host                  1.1.0                 USBHUB   64     CLEAR_FEATURE Request  [Port 4: PORT_ENABLE]

Frame 63: 64 bytes on wire (512 bits), 64 bytes captured (512 bits) on interface 0
USB URB
    [Source: host]
    [Destination: 1.1.0]
    URB id: 0xffff8da015e4e0c0
    URB type: URB_SUBMIT ('S')
    URB transfer type: URB_CONTROL (0x02)
    Endpoint: 0x00, Direction: OUT
        0... .... = Direction: OUT (0)
        .... 0000 = Endpoint number: 0
    Device: 1
    URB bus id: 1
    Device setup request: relevant (0)
    Data: present (0)
    URB sec: 1515423801
    URB usec: 91965
    URB status: Operation now in progress (-EINPROGRESS) (-115)
    URB length [bytes]: 0
    Data length [bytes]: 0
    [Response in: 64]
    Interval: 0
    Start frame: 0
    Copy of Transfer Flags: 0x00000000
    Number of ISO descriptors: 0
    [bInterfaceClass: Unknown (0xffff)]
URB setup
    bmRequestType: 0x23
bRequest: CLEAR_FEATURE (0x01)
wValue: 0x0001
wIndex: 4
wLength: 0

     64 26.744569      1.1.0                 host                  USBHUB   64     CLEAR_FEATURE Response [Port 4: PORT_ENABLE]

Frame 64: 64 bytes on wire (512 bits), 64 bytes captured (512 bits) on interface 0
USB URB
    [Source: 1.1.0]
    [Destination: host]
    URB id: 0xffff8da015e4e0c0
    URB type: URB_COMPLETE ('C')
    URB transfer type: URB_CONTROL (0x02)
    Endpoint: 0x00, Direction: OUT
        0... .... = Direction: OUT (0)
        .... 0000 = Endpoint number: 0
    Device: 1
    URB bus id: 1
    Device setup request: not relevant ('-')
    Data: not present ('>')
    URB sec: 1515423801
    URB usec: 91992
    URB status: Success (0)
    URB length [bytes]: 0
    Data length [bytes]: 0
    [Request in: 63]
    [Time from request: 0.000027000 seconds]
    Unused Setup Header
    Interval: 0
    Start frame: 0
    Copy of Transfer Flags: 0x00000000
    Number of ISO descriptors: 0
    [bInterfaceClass: Unknown (0xffff)]

     65 26.744636      host                  1.1.0                 USBHUB   64     CLEAR_FEATURE Request  [Port 4: PORT_POWER]

Frame 65: 64 bytes on wire (512 bits), 64 bytes captured (512 bits) on interface 0
USB URB
    [Source: host]
    [Destination: 1.1.0]
    URB id: 0xffff8da015e4e0c0
    URB type: URB_SUBMIT ('S')
    URB transfer type: URB_CONTROL (0x02)
    Endpoint: 0x00, Direction: OUT
        0... .... = Direction: OUT (0)
        .... 0000 = Endpoint number: 0
    Device: 1
    URB bus id: 1
    Device setup request: relevant (0)
    Data: present (0)
    URB sec: 1515423801
    URB usec: 92059
    URB status: Operation now in progress (-EINPROGRESS) (-115)
    URB length [bytes]: 0
    Data length [bytes]: 0
    [Response in: 66]
    Interval: 0
    Start frame: 0
    Copy of Transfer Flags: 0x00000000
    Number of ISO descriptors: 0
    [bInterfaceClass: Unknown (0xffff)]
URB setup
    bmRequestType: 0x23
bRequest: CLEAR_FEATURE (0x01)
wValue: 0x0008
wIndex: 4
wLength: 0

     66 26.744650      1.1.0                 host                  USBHUB   64     CLEAR_FEATURE Response [Port 4: PORT_POWER]

Frame 66: 64 bytes on wire (512 bits), 64 bytes captured (512 bits) on interface 0
USB URB
    [Source: 1.1.0]
    [Destination: host]
    URB id: 0xffff8da015e4e0c0
    URB type: URB_COMPLETE ('C')
    URB transfer type: URB_CONTROL (0x02)
    Endpoint: 0x00, Direction: OUT
        0... .... = Direction: OUT (0)
        .... 0000 = Endpoint number: 0
    Device: 1
    URB bus id: 1
    Device setup request: not relevant ('-')
    Data: not present ('>')
    URB sec: 1515423801
    URB usec: 92073
    URB status: Success (0)
    URB length [bytes]: 0
    Data length [bytes]: 0
    [Request in: 65]
    [Time from request: 0.000014000 seconds]
    Unused Setup Header
    Interval: 0
    Start frame: 0
    Copy of Transfer Flags: 0x00000000
    Number of ISO descriptors: 0
    [bInterfaceClass: Unknown (0xffff)]

     67 26.952562      host                  1.1.0                 USBHUB   64     SET_FEATURE Request    [Port 4: PORT_POWER]

Frame 67: 64 bytes on wire (512 bits), 64 bytes captured (512 bits) on interface 0
USB URB
    [Source: host]
    [Destination: 1.1.0]
    URB id: 0xffff8da015e4e0c0
    URB type: URB_SUBMIT ('S')
    URB transfer type: URB_CONTROL (0x02)
    Endpoint: 0x00, Direction: OUT
        0... .... = Direction: OUT (0)
        .... 0000 = Endpoint number: 0
    Device: 1
    URB bus id: 1
    Device setup request: relevant (0)
    Data: present (0)
    URB sec: 1515423801
    URB usec: 299985
    URB status: Operation now in progress (-EINPROGRESS) (-115)
    URB length [bytes]: 0
    Data length [bytes]: 0
    [Response in: 68]
    Interval: 0
    Start frame: 0
    Copy of Transfer Flags: 0x00000000
    Number of ISO descriptors: 0
    [bInterfaceClass: Unknown (0xffff)]
URB setup
    bmRequestType: 0x23
bRequest: SET_FEATURE (0x03)
wValue: 0x0008
wIndex: 4
wLength: 0

     68 26.952816      1.1.0                 host                  USBHUB   64     SET_FEATURE Response   [Port 4: PORT_POWER]

Frame 68: 64 bytes on wire (512 bits), 64 bytes captured (512 bits) on interface 0
USB URB
    [Source: 1.1.0]
    [Destination: host]
    URB id: 0xffff8da015e4e0c0
    URB type: URB_COMPLETE ('C')
    URB transfer type: URB_CONTROL (0x02)
    Endpoint: 0x00, Direction: OUT
        0... .... = Direction: OUT (0)
        .... 0000 = Endpoint number: 0
    Device: 1
    URB bus id: 1
    Device setup request: not relevant ('-')
    Data: not present ('>')
    URB sec: 1515423801
    URB usec: 300239
    URB status: Success (0)
    URB length [bytes]: 0
    Data length [bytes]: 0
    [Request in: 67]
    [Time from request: 0.000254000 seconds]
    Unused Setup Header
    Interval: 0
    Start frame: 0
    Copy of Transfer Flags: 0x00000000
    Number of ISO descriptors: 0
    [bInterfaceClass: Unknown (0xffff)]

     69 26.974558      1.1.1                 host                  USB      66     URB_INTERRUPT in

Frame 69: 66 bytes on wire (528 bits), 66 bytes captured (528 bits) on interface 0
USB URB
    [Source: 1.1.1]
    [Destination: host]
    URB id: 0xffff8da1604bc600
    URB type: URB_COMPLETE ('C')
    URB transfer type: URB_INTERRUPT (0x01)
    Endpoint: 0x81, Direction: IN
        1... .... = Direction: IN (1)
        .... 0001 = Endpoint number: 1
    Device: 1
    URB bus id: 1
    Device setup request: not relevant ('-')
    Data: present (0)
    URB sec: 1515423801
    URB usec: 321981
    URB status: Success (0)
    URB length [bytes]: 2
    Data length [bytes]: 2
    [Request in: 2]
    [Time from request: 26.974517000 seconds]
    [bInterfaceClass: Unknown (0xffff)]
    Unused Setup Header
    Interval: 2048
    Start frame: 0
    Copy of Transfer Flags: 0x00000200
    Number of ISO descriptors: 0
Leftover Capture Data: 1000

     70 26.974579      host                  1.1.1                 USB      64     URB_INTERRUPT in

Frame 70: 64 bytes on wire (512 bits), 64 bytes captured (512 bits) on interface 0
USB URB
    [Source: host]
    [Destination: 1.1.1]
    URB id: 0xffff8da1604bc600
    URB type: URB_SUBMIT ('S')
    URB transfer type: URB_INTERRUPT (0x01)
    Endpoint: 0x81, Direction: IN
        1... .... = Direction: IN (1)
        .... 0001 = Endpoint number: 1
    Device: 1
    URB bus id: 1
    Device setup request: not relevant ('-')
    Data: not present ('<')
    URB sec: 1515423801
    URB usec: 322002
    URB status: Operation now in progress (-EINPROGRESS) (-115)
    URB length [bytes]: 4
    Data length [bytes]: 0
    [Response in: 71]
    [bInterfaceClass: Unknown (0xffff)]
    Unused Setup Header
    Interval: 2048
    Start frame: 0
    Copy of Transfer Flags: 0x00000200
    Number of ISO descriptors: 0

     71 26.999581      1.1.1                 host                  USB      66     URB_INTERRUPT in

Frame 71: 66 bytes on wire (528 bits), 66 bytes captured (528 bits) on interface 0
USB URB
    [Source: 1.1.1]
    [Destination: host]
    URB id: 0xffff8da1604bc600
    URB type: URB_COMPLETE ('C')
    URB transfer type: URB_INTERRUPT (0x01)
    Endpoint: 0x81, Direction: IN
        1... .... = Direction: IN (1)
        .... 0001 = Endpoint number: 1
    Device: 1
    URB bus id: 1
    Device setup request: not relevant ('-')
    Data: present (0)
    URB sec: 1515423801
    URB usec: 347004
    URB status: Success (0)
    URB length [bytes]: 2
    Data length [bytes]: 2
    [Request in: 70]
    [Time from request: 0.025002000 seconds]
    [bInterfaceClass: Unknown (0xffff)]
    Unused Setup Header
    Interval: 2048
    Start frame: 0
    Copy of Transfer Flags: 0x00000200
    Number of ISO descriptors: 0
Leftover Capture Data: 1000

     72 26.999590      host                  1.1.1                 USB      64     URB_INTERRUPT in

Frame 72: 64 bytes on wire (512 bits), 64 bytes captured (512 bits) on interface 0
USB URB
    [Source: host]
    [Destination: 1.1.1]
    URB id: 0xffff8da1604bc600
    URB type: URB_SUBMIT ('S')
    URB transfer type: URB_INTERRUPT (0x01)
    Endpoint: 0x81, Direction: IN
        1... .... = Direction: IN (1)
        .... 0001 = Endpoint number: 1
    Device: 1
    URB bus id: 1
    Device setup request: not relevant ('-')
    Data: not present ('<')
    URB sec: 1515423801
    URB usec: 347013
    URB status: Operation now in progress (-EINPROGRESS) (-115)
    URB length [bytes]: 4
    Data length [bytes]: 0
    [bInterfaceClass: Unknown (0xffff)]
    Unused Setup Header
    Interval: 2048
    Start frame: 0
    Copy of Transfer Flags: 0x00000200
    Number of ISO descriptors: 0

     73 27.056669      host                  1.1.0                 USBHUB   64     SET_FEATURE Request    [Port 4: PORT_RESET]

Frame 73: 64 bytes on wire (512 bits), 64 bytes captured (512 bits) on interface 0
USB URB
    [Source: host]
    [Destination: 1.1.0]
    URB id: 0xffff8da015e4e0c0
    URB type: URB_SUBMIT ('S')
    URB transfer type: URB_CONTROL (0x02)
    Endpoint: 0x00, Direction: OUT
        0... .... = Direction: OUT (0)
        .... 0000 = Endpoint number: 0
    Device: 1
    URB bus id: 1
    Device setup request: relevant (0)
    Data: present (0)
    URB sec: 1515423801
    URB usec: 404092
    URB status: Operation now in progress (-EINPROGRESS) (-115)
    URB length [bytes]: 0
    Data length [bytes]: 0
    [Response in: 74]
    Interval: 0
    Start frame: 0
    Copy of Transfer Flags: 0x00000000
    Number of ISO descriptors: 0
    [bInterfaceClass: Unknown (0xffff)]
URB setup
    bmRequestType: 0x23
bRequest: SET_FEATURE (0x03)
wValue: 0x0004
wIndex: 4
wLength: 0

     74 27.056703      1.1.0                 host                  USBHUB   64     SET_FEATURE Response   [Port 4: PORT_RESET]

Frame 74: 64 bytes on wire (512 bits), 64 bytes captured (512 bits) on interface 0
USB URB
    [Source: 1.1.0]
    [Destination: host]
    URB id: 0xffff8da015e4e0c0
    URB type: URB_COMPLETE ('C')
    URB transfer type: URB_CONTROL (0x02)
    Endpoint: 0x00, Direction: OUT
        0... .... = Direction: OUT (0)
        .... 0000 = Endpoint number: 0
    Device: 1
    URB bus id: 1
    Device setup request: not relevant ('-')
    Data: not present ('>')
    URB sec: 1515423801
    URB usec: 404126
    URB status: Success (0)
    URB length [bytes]: 0
    Data length [bytes]: 0
    [Request in: 73]
    [Time from request: 0.000034000 seconds]
    Unused Setup Header
    Interval: 0
    Start frame: 0
    Copy of Transfer Flags: 0x00000000
    Number of ISO descriptors: 0
    [bInterfaceClass: Unknown (0xffff)]

     75 27.118546      host                  1.1.0                 USBHUB   64     GET_STATUS Request     [Port 4]

Frame 75: 64 bytes on wire (512 bits), 64 bytes captured (512 bits) on interface 0
USB URB
    [Source: host]
    [Destination: 1.1.0]
    URB id: 0xffff8da015e4e0c0
    URB type: URB_SUBMIT ('S')
    URB transfer type: URB_CONTROL (0x02)
    Endpoint: 0x80, Direction: IN
        1... .... = Direction: IN (1)
        .... 0000 = Endpoint number: 0
    Device: 1
    URB bus id: 1
    Device setup request: relevant (0)
    Data: not present ('<')
    URB sec: 1515423801
    URB usec: 465969
    URB status: Operation now in progress (-EINPROGRESS) (-115)
    URB length [bytes]: 4
    Data length [bytes]: 0
    [Response in: 76]
    Interval: 0
    Start frame: 0
    Copy of Transfer Flags: 0x00000200
    Number of ISO descriptors: 0
    [bInterfaceClass: Unknown (0xffff)]
URB setup
    bmRequestType: 0xa3
bRequest: GET_STATUS (0x00)
wValue: 0x0000
wIndex: 4
wLength: 4

     76 27.118591      1.1.0                 host                  USBHUB   68     GET_STATUS Response    [Port 4]

Frame 76: 68 bytes on wire (544 bits), 68 bytes captured (544 bits) on interface 0
USB URB
    [Source: 1.1.0]
    [Destination: host]
    URB id: 0xffff8da015e4e0c0
    URB type: URB_COMPLETE ('C')
    URB transfer type: URB_CONTROL (0x02)
    Endpoint: 0x80, Direction: IN
        1... .... = Direction: IN (1)
        .... 0000 = Endpoint number: 0
    Device: 1
    URB bus id: 1
    Device setup request: not relevant ('-')
    Data: present (0)
    URB sec: 1515423801
    URB usec: 466014
    URB status: Success (0)
    URB length [bytes]: 4
    Data length [bytes]: 4
    [Request in: 75]
    [Time from request: 0.000045000 seconds]
    Unused Setup Header
    Interval: 0
    Start frame: 0
    Copy of Transfer Flags: 0x00000200
    Number of ISO descriptors: 0
    [bInterfaceClass: Unknown (0xffff)]
Port Status: 0x0103, PORT_CONNECTION, PORT_ENABLE, PORT_POWER
    .... .... .... ...1 = PORT_CONNECTION: True
    .... .... .... ..1. = PORT_ENABLE: True
    .... .... .... .0.. = PORT_SUSPEND: False
    .... .... .... 0... = PORT_OVER_CURRENT: False
    .... .... ...0 .... = PORT_RESET: False
    .... ...1 .... .... = PORT_POWER: True
    .... ..0. .... .... = PORT_LOW_SPEED: False
    .... .0.. .... .... = PORT_HIGH_SPEED: False
    .... 0... .... .... = PORT_TEST: False
    ...0 .... .... .... = PORT_INDICATOR: Default colors
Port Change: 0x0011, C_PORT_CONNECTION, C_PORT_RESET

     77 27.118606      host                  1.1.0                 USBHUB   64     CLEAR_FEATURE Request  [Port 4: C_PORT_CONNECTION]

Frame 77: 64 bytes on wire (512 bits), 64 bytes captured (512 bits) on interface 0
USB URB
    [Source: host]
    [Destination: 1.1.0]
    URB id: 0xffff8da015e4e0c0
    URB type: URB_SUBMIT ('S')
    URB transfer type: URB_CONTROL (0x02)
    Endpoint: 0x00, Direction: OUT
        0... .... = Direction: OUT (0)
        .... 0000 = Endpoint number: 0
    Device: 1
    URB bus id: 1
    Device setup request: relevant (0)
    Data: present (0)
    URB sec: 1515423801
    URB usec: 466029
    URB status: Operation now in progress (-EINPROGRESS) (-115)
    URB length [bytes]: 0
    Data length [bytes]: 0
    [Response in: 78]
    Interval: 0
    Start frame: 0
    Copy of Transfer Flags: 0x00000000
    Number of ISO descriptors: 0
    [bInterfaceClass: Unknown (0xffff)]
URB setup
    bmRequestType: 0x23
bRequest: CLEAR_FEATURE (0x01)
wValue: 0x0010
wIndex: 4
wLength: 0

     78 27.118616      1.1.0                 host                  USBHUB   64     CLEAR_FEATURE Response [Port 4: C_PORT_CONNECTION]

Frame 78: 64 bytes on wire (512 bits), 64 bytes captured (512 bits) on interface 0
USB URB
    [Source: 1.1.0]
    [Destination: host]
    URB id: 0xffff8da015e4e0c0
    URB type: URB_COMPLETE ('C')
    URB transfer type: URB_CONTROL (0x02)
    Endpoint: 0x00, Direction: OUT
        0... .... = Direction: OUT (0)
        .... 0000 = Endpoint number: 0
    Device: 1
    URB bus id: 1
    Device setup request: not relevant ('-')
    Data: not present ('>')
    URB sec: 1515423801
    URB usec: 466039
    URB status: Success (0)
    URB length [bytes]: 0
    Data length [bytes]: 0
    [Request in: 77]
    [Time from request: 0.000010000 seconds]
    Unused Setup Header
    Interval: 0
    Start frame: 0
    Copy of Transfer Flags: 0x00000000
    Number of ISO descriptors: 0
    [bInterfaceClass: Unknown (0xffff)]

     79 27.118623      host                  1.1.0                 USBHUB   64     SET_FEATURE Request    [Port 4: PORT_RESET]

Frame 79: 64 bytes on wire (512 bits), 64 bytes captured (512 bits) on interface 0
USB URB
    [Source: host]
    [Destination: 1.1.0]
    URB id: 0xffff8da015e4e0c0
    URB type: URB_SUBMIT ('S')
    URB transfer type: URB_CONTROL (0x02)
    Endpoint: 0x00, Direction: OUT
        0... .... = Direction: OUT (0)
        .... 0000 = Endpoint number: 0
    Device: 1
    URB bus id: 1
    Device setup request: relevant (0)
    Data: present (0)
    URB sec: 1515423801
    URB usec: 466046
    URB status: Operation now in progress (-EINPROGRESS) (-115)
    URB length [bytes]: 0
    Data length [bytes]: 0
    [Response in: 80]
    Interval: 0
    Start frame: 0
    Copy of Transfer Flags: 0x00000000
    Number of ISO descriptors: 0
    [bInterfaceClass: Unknown (0xffff)]
URB setup
    bmRequestType: 0x23
bRequest: SET_FEATURE (0x03)
wValue: 0x0004
wIndex: 4
wLength: 0

     80 27.118634      1.1.0                 host                  USBHUB   64     SET_FEATURE Response   [Port 4: PORT_RESET]

Frame 80: 64 bytes on wire (512 bits), 64 bytes captured (512 bits) on interface 0
USB URB
    [Source: 1.1.0]
    [Destination: host]
    URB id: 0xffff8da015e4e0c0
    URB type: URB_COMPLETE ('C')
    URB transfer type: URB_CONTROL (0x02)
    Endpoint: 0x00, Direction: OUT
        0... .... = Direction: OUT (0)
        .... 0000 = Endpoint number: 0
    Device: 1
    URB bus id: 1
    Device setup request: not relevant ('-')
    Data: not present ('>')
    URB sec: 1515423801
    URB usec: 466057
    URB status: Success (0)
    URB length [bytes]: 0
    Data length [bytes]: 0
    [Request in: 79]
    [Time from request: 0.000011000 seconds]
    Unused Setup Header
    Interval: 0
    Start frame: 0
    Copy of Transfer Flags: 0x00000000
    Number of ISO descriptors: 0
    [bInterfaceClass: Unknown (0xffff)]

     81 27.320565      host                  1.1.0                 USBHUB   64     GET_STATUS Request     [Port 4]

Frame 81: 64 bytes on wire (512 bits), 64 bytes captured (512 bits) on interface 0
USB URB
    [Source: host]
    [Destination: 1.1.0]
    URB id: 0xffff8da015e4e0c0
    URB type: URB_SUBMIT ('S')
    URB transfer type: URB_CONTROL (0x02)
    Endpoint: 0x80, Direction: IN
        1... .... = Direction: IN (1)
        .... 0000 = Endpoint number: 0
    Device: 1
    URB bus id: 1
    Device setup request: relevant (0)
    Data: not present ('<')
    URB sec: 1515423801
    URB usec: 667988
    URB status: Operation now in progress (-EINPROGRESS) (-115)
    URB length [bytes]: 4
    Data length [bytes]: 0
    [Response in: 82]
    Interval: 0
    Start frame: 0
    Copy of Transfer Flags: 0x00000200
    Number of ISO descriptors: 0
    [bInterfaceClass: Unknown (0xffff)]
URB setup
    bmRequestType: 0xa3
bRequest: GET_STATUS (0x00)
wValue: 0x0000
wIndex: 4
wLength: 4

     82 27.320619      1.1.0                 host                  USBHUB   68     GET_STATUS Response    [Port 4]

Frame 82: 68 bytes on wire (544 bits), 68 bytes captured (544 bits) on interface 0
USB URB
    [Source: 1.1.0]
    [Destination: host]
    URB id: 0xffff8da015e4e0c0
    URB type: URB_COMPLETE ('C')
    URB transfer type: URB_CONTROL (0x02)
    Endpoint: 0x80, Direction: IN
        1... .... = Direction: IN (1)
        .... 0000 = Endpoint number: 0
    Device: 1
    URB bus id: 1
    Device setup request: not relevant ('-')
    Data: present (0)
    URB sec: 1515423801
    URB usec: 668042
    URB status: Success (0)
    URB length [bytes]: 4
    Data length [bytes]: 4
    [Request in: 81]
    [Time from request: 0.000054000 seconds]
    Unused Setup Header
    Interval: 0
    Start frame: 0
    Copy of Transfer Flags: 0x00000200
    Number of ISO descriptors: 0
    [bInterfaceClass: Unknown (0xffff)]
Port Status: 0x0103, PORT_CONNECTION, PORT_ENABLE, PORT_POWER
    .... .... .... ...1 = PORT_CONNECTION: True
    .... .... .... ..1. = PORT_ENABLE: True
    .... .... .... .0.. = PORT_SUSPEND: False
    .... .... .... 0... = PORT_OVER_CURRENT: False
    .... .... ...0 .... = PORT_RESET: False
    .... ...1 .... .... = PORT_POWER: True
    .... ..0. .... .... = PORT_LOW_SPEED: False
    .... .0.. .... .... = PORT_HIGH_SPEED: False
    .... 0... .... .... = PORT_TEST: False
    ...0 .... .... .... = PORT_INDICATOR: Default colors
Port Change: 0x0010, C_PORT_RESET

     83 27.320634      host                  1.1.0                 USBHUB   64     CLEAR_FEATURE Request  [Port 4: C_PORT_RESET]

Frame 83: 64 bytes on wire (512 bits), 64 bytes captured (512 bits) on interface 0
USB URB
    [Source: host]
    [Destination: 1.1.0]
    URB id: 0xffff8da015e4e0c0
    URB type: URB_SUBMIT ('S')
    URB transfer type: URB_CONTROL (0x02)
    Endpoint: 0x00, Direction: OUT
        0... .... = Direction: OUT (0)
        .... 0000 = Endpoint number: 0
    Device: 1
    URB bus id: 1
    Device setup request: relevant (0)
    Data: present (0)
    URB sec: 1515423801
    URB usec: 668057
    URB status: Operation now in progress (-EINPROGRESS) (-115)
    URB length [bytes]: 0
    Data length [bytes]: 0
    [Response in: 84]
    Interval: 0
    Start frame: 0
    Copy of Transfer Flags: 0x00000000
    Number of ISO descriptors: 0
    [bInterfaceClass: Unknown (0xffff)]
URB setup
    bmRequestType: 0x23
bRequest: CLEAR_FEATURE (0x01)
wValue: 0x0014
wIndex: 4
wLength: 0

     84 27.320645      1.1.0                 host                  USBHUB   64     CLEAR_FEATURE Response [Port 4: C_PORT_RESET]

Frame 84: 64 bytes on wire (512 bits), 64 bytes captured (512 bits) on interface 0
USB URB
    [Source: 1.1.0]
    [Destination: host]
    URB id: 0xffff8da015e4e0c0
    URB type: URB_COMPLETE ('C')
    URB transfer type: URB_CONTROL (0x02)
    Endpoint: 0x00, Direction: OUT
        0... .... = Direction: OUT (0)
        .... 0000 = Endpoint number: 0
    Device: 1
    URB bus id: 1
    Device setup request: not relevant ('-')
    Data: not present ('>')
    URB sec: 1515423801
    URB usec: 668068
    URB status: Success (0)
    URB length [bytes]: 0
    Data length [bytes]: 0
    [Request in: 83]
    [Time from request: 0.000011000 seconds]
    Unused Setup Header
    Interval: 0
    Start frame: 0
    Copy of Transfer Flags: 0x00000000
    Number of ISO descriptors: 0
    [bInterfaceClass: Unknown (0xffff)]

     85 33.088618      host                  1.1.0                 USBHUB   64     CLEAR_FEATURE Request  [Port 4: PORT_ENABLE]

Frame 85: 64 bytes on wire (512 bits), 64 bytes captured (512 bits) on interface 0
USB URB
    [Source: host]
    [Destination: 1.1.0]
    URB id: 0xffff8da015e4ee40
    URB type: URB_SUBMIT ('S')
    URB transfer type: URB_CONTROL (0x02)
    Endpoint: 0x00, Direction: OUT
        0... .... = Direction: OUT (0)
        .... 0000 = Endpoint number: 0
    Device: 1
    URB bus id: 1
    Device setup request: relevant (0)
    Data: present (0)
    URB sec: 1515423807
    URB usec: 436041
    URB status: Operation now in progress (-EINPROGRESS) (-115)
    URB length [bytes]: 0
    Data length [bytes]: 0
    [Response in: 86]
    Interval: 0
    Start frame: 0
    Copy of Transfer Flags: 0x00000000
    Number of ISO descriptors: 0
    [bInterfaceClass: Unknown (0xffff)]
URB setup
    bmRequestType: 0x23
bRequest: CLEAR_FEATURE (0x01)
wValue: 0x0001
wIndex: 4
wLength: 0

     86 33.088687      1.1.0                 host                  USBHUB   64     CLEAR_FEATURE Response [Port 4: PORT_ENABLE]

Frame 86: 64 bytes on wire (512 bits), 64 bytes captured (512 bits) on interface 0
USB URB
    [Source: 1.1.0]
    [Destination: host]
    URB id: 0xffff8da015e4ee40
    URB type: URB_COMPLETE ('C')
    URB transfer type: URB_CONTROL (0x02)
    Endpoint: 0x00, Direction: OUT
        0... .... = Direction: OUT (0)
        .... 0000 = Endpoint number: 0
    Device: 1
    URB bus id: 1
    Device setup request: not relevant ('-')
    Data: not present ('>')
    URB sec: 1515423807
    URB usec: 436110
    URB status: Success (0)
    URB length [bytes]: 0
    Data length [bytes]: 0
    [Request in: 85]
    [Time from request: 0.000069000 seconds]
    Unused Setup Header
    Interval: 0
    Start frame: 0
    Copy of Transfer Flags: 0x00000000
    Number of ISO descriptors: 0
    [bInterfaceClass: Unknown (0xffff)]

     87 33.088904      host                  1.1.0                 USBHUB   64     SET_FEATURE Request    [Port 4: PORT_RESET]

Frame 87: 64 bytes on wire (512 bits), 64 bytes captured (512 bits) on interface 0
USB URB
    [Source: host]
    [Destination: 1.1.0]
    URB id: 0xffff8da015e4ee40
    URB type: URB_SUBMIT ('S')
    URB transfer type: URB_CONTROL (0x02)
    Endpoint: 0x00, Direction: OUT
        0... .... = Direction: OUT (0)
        .... 0000 = Endpoint number: 0
    Device: 1
    URB bus id: 1
    Device setup request: relevant (0)
    Data: present (0)
    URB sec: 1515423807
    URB usec: 436327
    URB status: Operation now in progress (-EINPROGRESS) (-115)
    URB length [bytes]: 0
    Data length [bytes]: 0
    [Response in: 88]
    Interval: 0
    Start frame: 0
    Copy of Transfer Flags: 0x00000000
    Number of ISO descriptors: 0
    [bInterfaceClass: Unknown (0xffff)]
URB setup
    bmRequestType: 0x23
bRequest: SET_FEATURE (0x03)
wValue: 0x0004
wIndex: 4
wLength: 0

     88 33.088974      1.1.0                 host                  USBHUB   64     SET_FEATURE Response   [Port 4: PORT_RESET]

Frame 88: 64 bytes on wire (512 bits), 64 bytes captured (512 bits) on interface 0
USB URB
    [Source: 1.1.0]
    [Destination: host]
    URB id: 0xffff8da015e4ee40
    URB type: URB_COMPLETE ('C')
    URB transfer type: URB_CONTROL (0x02)
    Endpoint: 0x00, Direction: OUT
        0... .... = Direction: OUT (0)
        .... 0000 = Endpoint number: 0
    Device: 1
    URB bus id: 1
    Device setup request: not relevant ('-')
    Data: not present ('>')
    URB sec: 1515423807
    URB usec: 436397
    URB status: Success (0)
    URB length [bytes]: 0
    Data length [bytes]: 0
    [Request in: 87]
    [Time from request: 0.000070000 seconds]
    Unused Setup Header
    Interval: 0
    Start frame: 0
    Copy of Transfer Flags: 0x00000000
    Number of ISO descriptors: 0
    [bInterfaceClass: Unknown (0xffff)]

     89 33.150554      host                  1.1.0                 USBHUB   64     GET_STATUS Request     [Port 4]

Frame 89: 64 bytes on wire (512 bits), 64 bytes captured (512 bits) on interface 0
USB URB
    [Source: host]
    [Destination: 1.1.0]
    URB id: 0xffff8da015e4ee40
    URB type: URB_SUBMIT ('S')
    URB transfer type: URB_CONTROL (0x02)
    Endpoint: 0x80, Direction: IN
        1... .... = Direction: IN (1)
        .... 0000 = Endpoint number: 0
    Device: 1
    URB bus id: 1
    Device setup request: relevant (0)
    Data: not present ('<')
    URB sec: 1515423807
    URB usec: 497977
    URB status: Operation now in progress (-EINPROGRESS) (-115)
    URB length [bytes]: 4
    Data length [bytes]: 0
    [Response in: 90]
    Interval: 0
    Start frame: 0
    Copy of Transfer Flags: 0x00000200
    Number of ISO descriptors: 0
    [bInterfaceClass: Unknown (0xffff)]
URB setup
    bmRequestType: 0xa3
bRequest: GET_STATUS (0x00)
wValue: 0x0000
wIndex: 4
wLength: 4

     90 33.150581      1.1.0                 host                  USBHUB   68     GET_STATUS Response    [Port 4]

Frame 90: 68 bytes on wire (544 bits), 68 bytes captured (544 bits) on interface 0
USB URB
    [Source: 1.1.0]
    [Destination: host]
    URB id: 0xffff8da015e4ee40
    URB type: URB_COMPLETE ('C')
    URB transfer type: URB_CONTROL (0x02)
    Endpoint: 0x80, Direction: IN
        1... .... = Direction: IN (1)
        .... 0000 = Endpoint number: 0
    Device: 1
    URB bus id: 1
    Device setup request: not relevant ('-')
    Data: present (0)
    URB sec: 1515423807
    URB usec: 498004
    URB status: Success (0)
    URB length [bytes]: 4
    Data length [bytes]: 4
    [Request in: 89]
    [Time from request: 0.000027000 seconds]
    Unused Setup Header
    Interval: 0
    Start frame: 0
    Copy of Transfer Flags: 0x00000200
    Number of ISO descriptors: 0
    [bInterfaceClass: Unknown (0xffff)]
Port Status: 0x0103, PORT_CONNECTION, PORT_ENABLE, PORT_POWER
    .... .... .... ...1 = PORT_CONNECTION: True
    .... .... .... ..1. = PORT_ENABLE: True
    .... .... .... .0.. = PORT_SUSPEND: False
    .... .... .... 0... = PORT_OVER_CURRENT: False
    .... .... ...0 .... = PORT_RESET: False
    .... ...1 .... .... = PORT_POWER: True
    .... ..0. .... .... = PORT_LOW_SPEED: False
    .... .0.. .... .... = PORT_HIGH_SPEED: False
    .... 0... .... .... = PORT_TEST: False
    ...0 .... .... .... = PORT_INDICATOR: Default colors
Port Change: 0x0010, C_PORT_RESET

     91 33.150592      host                  1.1.0                 USBHUB   64     CLEAR_FEATURE Request  [Port 4: C_PORT_RESET]

Frame 91: 64 bytes on wire (512 bits), 64 bytes captured (512 bits) on interface 0
USB URB
    [Source: host]
    [Destination: 1.1.0]
    URB id: 0xffff8da015e4ee40
    URB type: URB_SUBMIT ('S')
    URB transfer type: URB_CONTROL (0x02)
    Endpoint: 0x00, Direction: OUT
        0... .... = Direction: OUT (0)
        .... 0000 = Endpoint number: 0
    Device: 1
    URB bus id: 1
    Device setup request: relevant (0)
    Data: present (0)
    URB sec: 1515423807
    URB usec: 498015
    URB status: Operation now in progress (-EINPROGRESS) (-115)
    URB length [bytes]: 0
    Data length [bytes]: 0
    [Response in: 92]
    Interval: 0
    Start frame: 0
    Copy of Transfer Flags: 0x00000000
    Number of ISO descriptors: 0
    [bInterfaceClass: Unknown (0xffff)]
URB setup
    bmRequestType: 0x23
bRequest: CLEAR_FEATURE (0x01)
wValue: 0x0014
wIndex: 4
wLength: 0

     92 33.150600      1.1.0                 host                  USBHUB   64     CLEAR_FEATURE Response [Port 4: C_PORT_RESET]

Frame 92: 64 bytes on wire (512 bits), 64 bytes captured (512 bits) on interface 0
USB URB
    [Source: 1.1.0]
    [Destination: host]
    URB id: 0xffff8da015e4ee40
    URB type: URB_COMPLETE ('C')
    URB transfer type: URB_CONTROL (0x02)
    Endpoint: 0x00, Direction: OUT
        0... .... = Direction: OUT (0)
        .... 0000 = Endpoint number: 0
    Device: 1
    URB bus id: 1
    Device setup request: not relevant ('-')
    Data: not present ('>')
    URB sec: 1515423807
    URB usec: 498023
    URB status: Success (0)
    URB length [bytes]: 0
    Data length [bytes]: 0
    [Request in: 91]
    [Time from request: 0.000008000 seconds]
    Unused Setup Header
    Interval: 0
    Start frame: 0
    Copy of Transfer Flags: 0x00000000
    Number of ISO descriptors: 0
    [bInterfaceClass: Unknown (0xffff)]

     93 38.720576      host                  1.1.0                 USBHUB   64     CLEAR_FEATURE Request  [Port 4: PORT_ENABLE]

Frame 93: 64 bytes on wire (512 bits), 64 bytes captured (512 bits) on interface 0
USB URB
    [Source: host]
    [Destination: 1.1.0]
    URB id: 0xffff8da015e4e480
    URB type: URB_SUBMIT ('S')
    URB transfer type: URB_CONTROL (0x02)
    Endpoint: 0x00, Direction: OUT
        0... .... = Direction: OUT (0)
        .... 0000 = Endpoint number: 0
    Device: 1
    URB bus id: 1
    Device setup request: relevant (0)
    Data: present (0)
    URB sec: 1515423813
    URB usec: 67999
    URB status: Operation now in progress (-EINPROGRESS) (-115)
    URB length [bytes]: 0
    Data length [bytes]: 0
    [Response in: 94]
    Interval: 0
    Start frame: 0
    Copy of Transfer Flags: 0x00000000
    Number of ISO descriptors: 0
    [bInterfaceClass: Unknown (0xffff)]
URB setup
    bmRequestType: 0x23
bRequest: CLEAR_FEATURE (0x01)
wValue: 0x0001
wIndex: 4
wLength: 0

     94 38.720614      1.1.0                 host                  USBHUB   64     CLEAR_FEATURE Response [Port 4: PORT_ENABLE]

Frame 94: 64 bytes on wire (512 bits), 64 bytes captured (512 bits) on interface 0
USB URB
    [Source: 1.1.0]
    [Destination: host]
    URB id: 0xffff8da015e4e480
    URB type: URB_COMPLETE ('C')
    URB transfer type: URB_CONTROL (0x02)
    Endpoint: 0x00, Direction: OUT
        0... .... = Direction: OUT (0)
        .... 0000 = Endpoint number: 0
    Device: 1
    URB bus id: 1
    Device setup request: not relevant ('-')
    Data: not present ('>')
    URB sec: 1515423813
    URB usec: 68037
    URB status: Success (0)
    URB length [bytes]: 0
    Data length [bytes]: 0
    [Request in: 93]
    [Time from request: 0.000038000 seconds]
    Unused Setup Header
    Interval: 0
    Start frame: 0
    Copy of Transfer Flags: 0x00000000
    Number of ISO descriptors: 0
    [bInterfaceClass: Unknown (0xffff)]

     95 38.720695      host                  1.1.0                 USBHUB   64     CLEAR_FEATURE Request  [Port 4: PORT_ENABLE]

Frame 95: 64 bytes on wire (512 bits), 64 bytes captured (512 bits) on interface 0
USB URB
    [Source: host]
    [Destination: 1.1.0]
    URB id: 0xffff8da015e4e480
    URB type: URB_SUBMIT ('S')
    URB transfer type: URB_CONTROL (0x02)
    Endpoint: 0x00, Direction: OUT
        0... .... = Direction: OUT (0)
        .... 0000 = Endpoint number: 0
    Device: 1
    URB bus id: 1
    Device setup request: relevant (0)
    Data: present (0)
    URB sec: 1515423813
    URB usec: 68118
    URB status: Operation now in progress (-EINPROGRESS) (-115)
    URB length [bytes]: 0
    Data length [bytes]: 0
    [Response in: 96]
    Interval: 0
    Start frame: 0
    Copy of Transfer Flags: 0x00000000
    Number of ISO descriptors: 0
    [bInterfaceClass: Unknown (0xffff)]
URB setup
    bmRequestType: 0x23
bRequest: CLEAR_FEATURE (0x01)
wValue: 0x0001
wIndex: 4
wLength: 0

     96 38.720712      1.1.0                 host                  USBHUB   64     CLEAR_FEATURE Response [Port 4: PORT_ENABLE]

Frame 96: 64 bytes on wire (512 bits), 64 bytes captured (512 bits) on interface 0
USB URB
    [Source: 1.1.0]
    [Destination: host]
    URB id: 0xffff8da015e4e480
    URB type: URB_COMPLETE ('C')
    URB transfer type: URB_CONTROL (0x02)
    Endpoint: 0x00, Direction: OUT
        0... .... = Direction: OUT (0)
        .... 0000 = Endpoint number: 0
    Device: 1
    URB bus id: 1
    Device setup request: not relevant ('-')
    Data: not present ('>')
    URB sec: 1515423813
    URB usec: 68135
    URB status: Success (0)
    URB length [bytes]: 0
    Data length [bytes]: 0
    [Request in: 95]
    [Time from request: 0.000017000 seconds]
    Unused Setup Header
    Interval: 0
    Start frame: 0
    Copy of Transfer Flags: 0x00000000
    Number of ISO descriptors: 0
    [bInterfaceClass: Unknown (0xffff)]

     97 38.720736      host                  1.1.0                 USBHUB   64     GET_STATUS Request     [Port 4]

Frame 97: 64 bytes on wire (512 bits), 64 bytes captured (512 bits) on interface 0
USB URB
    [Source: host]
    [Destination: 1.1.0]
    URB id: 0xffff8da015e4e480
    URB type: URB_SUBMIT ('S')
    URB transfer type: URB_CONTROL (0x02)
    Endpoint: 0x80, Direction: IN
        1... .... = Direction: IN (1)
        .... 0000 = Endpoint number: 0
    Device: 1
    URB bus id: 1
    Device setup request: relevant (0)
    Data: not present ('<')
    URB sec: 1515423813
    URB usec: 68159
    URB status: Operation now in progress (-EINPROGRESS) (-115)
    URB length [bytes]: 4
    Data length [bytes]: 0
    [Response in: 98]
    Interval: 0
    Start frame: 0
    Copy of Transfer Flags: 0x00000200
    Number of ISO descriptors: 0
    [bInterfaceClass: Unknown (0xffff)]
URB setup
    bmRequestType: 0xa3
bRequest: GET_STATUS (0x00)
wValue: 0x0000
wIndex: 4
wLength: 4

     98 38.720759      1.1.0                 host                  USBHUB   68     GET_STATUS Response    [Port 4]

Frame 98: 68 bytes on wire (544 bits), 68 bytes captured (544 bits) on interface 0
USB URB
    [Source: 1.1.0]
    [Destination: host]
    URB id: 0xffff8da015e4e480
    URB type: URB_COMPLETE ('C')
    URB transfer type: URB_CONTROL (0x02)
    Endpoint: 0x80, Direction: IN
        1... .... = Direction: IN (1)
        .... 0000 = Endpoint number: 0
    Device: 1
    URB bus id: 1
    Device setup request: not relevant ('-')
    Data: present (0)
    URB sec: 1515423813
    URB usec: 68182
    URB status: Success (0)
    URB length [bytes]: 4
    Data length [bytes]: 4
    [Request in: 97]
    [Time from request: 0.000023000 seconds]
    Unused Setup Header
    Interval: 0
    Start frame: 0
    Copy of Transfer Flags: 0x00000200
    Number of ISO descriptors: 0
    [bInterfaceClass: Unknown (0xffff)]
Port Status: 0x0101, PORT_CONNECTION, PORT_POWER
    .... .... .... ...1 = PORT_CONNECTION: True
    .... .... .... ..0. = PORT_ENABLE: False
    .... .... .... .0.. = PORT_SUSPEND: False
    .... .... .... 0... = PORT_OVER_CURRENT: False
    .... .... ...0 .... = PORT_RESET: False
    .... ...1 .... .... = PORT_POWER: True
    .... ..0. .... .... = PORT_LOW_SPEED: False
    .... .0.. .... .... = PORT_HIGH_SPEED: False
    .... 0... .... .... = PORT_TEST: False
    ...0 .... .... .... = PORT_INDICATOR: Default colors
Port Change: 0x0000
